tuned_gemm_csv/afo_tune_device_2_full.csv
Validator,PT_VERSION,2.5.1
Validator,ROCM_VERSION,6.3.1.0-40-ce2be3b
Validator,HIPBLASLT_VERSION,1000-b4e5042b
Validator,GCN_ARCH_NAME,gfx942:sramecc+:xnack-
Validator,ROCBLAS_VERSION,4.3.0-8ebd6c11
GemmTunableOp_Half_TN,tn_3584_88_18944,Gemm_Hipblaslt_TN_85427,0.0790678
GemmTunableOp_Half_TN,tn_3584_56_18944,Gemm_Hipblaslt_TN_71770,0.0666788
GemmTunableOp_Half_TN,tn_3584_40_3584,Gemm_Hipblaslt_TN_71715,0.0202906
GemmTunableOp_Half_TN,tn_37888_131072_3584,Gemm_Hipblaslt_TN_87709,119.254
GemmTunableOp_Half_TN,tn_3584_256_3584,Gemm_Rocblas_621282647,0.0395906
GemmTunableOp_Half_TN,tn_3584_200_18944,Gemm_Hipblaslt_TN_74087,0.139277
GemmTunableOp_Half_TN,tn_3584_176_18944,Gemm_Hipblaslt_TN_72879,0.122572
GemmTunableOp_Half_TN,tn_3584_240_3584,Gemm_Rocblas_621288856,0.0406689
GemmTunableOp_Half_TN,tn_3584_24_18944,Gemm_Hipblaslt_TN_71663,0.0488798
GemmTunableOp_Half_TN,tn_3584_152_18944,Gemm_Hipblaslt_TN_72122,0.105797
GemmTunableOp_Half_TN,tn_3584_144_3584,Gemm_Rocblas_621289097,0.0339667
GemmTunableOp_Half_TN,tn_3584_136_3584,Gemm_Rocblas_621289097,0.0336863
GemmTunableOp_Half_TN,tn_3584_104_18944,Gemm_Hipblaslt_TN_72046,0.08959
GemmTunableOp_Half_TN,tn_4608_64_3584,Gemm_Rocblas_621288818,0.0211831
GemmTunableOp_Half_TN,tn_4608_88_3584,Gemm_Hipblaslt_TN_74513,0.0280412
GemmTunableOp_Half_TN,tn_4608_240_3584,Gemm_Rocblas_621282649,0.0517176
GemmTunableOp_Half_TN,tn_37888_96_3584,Gemm_Hipblaslt_TN_72490,0.19026
GemmTunableOp_Half_TN,tn_4608_200_3584,Gemm_Rocblas_621282649,0.0482801
GemmTunableOp_Half_TN,tn_3584_216_3584,Gemm_Rocblas_621288856,0.0409049
GemmTunableOp_Half_TN,tn_37888_248_3584,Gemm_Hipblaslt_TN_74844,0.35474
GemmTunableOp_Half_TN,tn_3584_80_3584,Gemm_Hipblaslt_TN_71899,0.0257174
GemmTunableOp_Half_TN,tn_152064_256_3584,Gemm_Rocblas_621282426,1.44041
GemmTunableOp_Half_TN,tn_3584_232_18944,Gemm_Hipblaslt_TN_72369,0.150828
GemmTunableOp_Half_TN,tn_3584_32_18944,Gemm_Hipblaslt_TN_71663,0.0502166
GemmTunableOp_Half_TN,tn_3584_72_3584,Gemm_Hipblaslt_TN_71899,0.0256224
GemmTunableOp_Half_TN,tn_3584_48_18944,Gemm_Hipblaslt_TN_74656,0.057581
GemmTunableOp_Half_TN,tn_3584_8_3584,Gemm_Rocblas_621288681,0.0134682
GemmTunableOp_Half_TN,tn_3584_96_3584,Gemm_Hipblaslt_TN_71899,0.0254334
GemmTunableOp_Half_TN,tn_37888_160_3584,Gemm_Rocblas_621282746,0.258211
GemmTunableOp_Half_TN,tn_37888_104_3584,Gemm_Hipblaslt_TN_72438,0.240722
GemmTunableOp_Half_TN,tn_37888_184_3584,Gemm_Hipblaslt_TN_88281,0.285858
GemmTunableOp_Half_TN,tn_37888_24_3584,Gemm_Rocblas_621288658,0.101488
GemmTunableOp_Half_TN,tn_4608_248_3584,Gemm_Rocblas_621282649,0.0517673
GemmTunableOp_Half_TN,tn_4608_96_3584,Gemm_Hipblaslt_TN_87821,0.0274247
GemmTunableOp_Half_TN,tn_4608_24_3584,Gemm_Rocblas_621282493,0.0154058
GemmTunableOp_Half_TN,tn_4608_176_3584,Gemm_Hipblaslt_TN_72494,0.040536
GemmTunableOp_Half_TN,tn_3584_120_18944,Gemm_Hipblaslt_TN_72046,0.0889964
GemmTunableOp_Half_TN,tn_4608_56_3584,Gemm_Rocblas_621288818,0.0214435
GemmTunableOp_Half_TN,tn_37888_224_3584,Gemm_Hipblaslt_TN_88262,0.324726
GemmTunableOp_Half_TN,tn_37888_32_3584,Gemm_Rocblas_621288715,0.100291
GemmTunableOp_Half_TN,tn_4608_144_3584,Gemm_Hipblaslt_TN_72273,0.039216
GemmTunableOp_Half_TN,tn_37888_48_3584,Gemm_Hipblaslt_TN_74812,0.130847
GemmTunableOp_Half_TN,tn_4608_168_3584,Gemm_Hipblaslt_TN_72494,0.0405424
GemmTunableOp_Half_TN,tn_37888_64_3584,Gemm_Rocblas_621288842,0.142076
GemmTunableOp_Half_TN,tn_4608_8_3584,Gemm_Rocblas_621282482,0.0139265
GemmTunableOp_Half_TN,tn_4608_208_3584,Gemm_Hipblaslt_TN_107336,0.0492552
GemmTunableOp_Half_TN,tn_37888_8_3584,Gemm_Rocblas_621282455,0.0812254
GemmTunableOp_Half_TN,tn_4608_104_3584,Gemm_Rocblas_621282641,0.0289337
GemmTunableOp_Half_TN,tn_4608_120_3584,Gemm_Rocblas_621282665,0.0291965
GemmTunableOp_Half_TN,tn_3584_131072_3584,Gemm_Rocblas_621282559,12.8306
GemmTunableOp_Half_TN,tn_4608_128_3584,Gemm_Rocblas_621282641,0.0288616
GemmTunableOp_Half_TN,tn_4608_136_3584,Gemm_Hipblaslt_TN_74372,0.03892
GemmTunableOp_Half_TN,tn_4608_16_3584,Gemm_Rocblas_621288701,0.0139325
GemmTunableOp_Half_TN,tn_4608_72_3584,Gemm_Hipblaslt_TN_74370,0.0264441
GemmTunableOp_Half_TN,tn_4608_48_3584,Gemm_Rocblas_621288818,0.0211815
GemmTunableOp_Half_TN,tn_4608_32_3584,Gemm_Rocblas_621282493,0.0152412
GemmTunableOp_Half_TN,tn_4608_232_3584,Gemm_Rocblas_621288858,0.0512545
GemmTunableOp_Half_TN,tn_4608_152_3584,Gemm_Hipblaslt_TN_74372,0.0391107
GemmTunableOp_Half_TN,tn_37888_72_3584,Gemm_Hipblaslt_TN_72273,0.172073
GemmTunableOp_Half_TN,tn_37888_232_3584,Gemm_Hipblaslt_TN_74844,0.353597
GemmTunableOp_Half_TN,tn_37888_192_3584,Gemm_Hipblaslt_TN_88281,0.285262
GemmTunableOp_Half_TN,tn_4608_184_3584,Gemm_Hipblaslt_TN_71916,0.0405203
GemmTunableOp_Half_TN,tn_37888_144_3584,Gemm_Hipblaslt_TN_88196,0.260282
GemmTunableOp_Half_TN,tn_3584_88_3584,Gemm_Hipblaslt_TN_71899,0.0256917
GemmTunableOp_Half_TN,tn_3584_144_18944,Gemm_Hipblaslt_TN_72122,0.102344
GemmTunableOp_Half_TN,tn_3584_200_3584,Gemm_Rocblas_621282647,0.0410479
GemmTunableOp_Half_TN,tn_3584_128_18944,Gemm_Hipblaslt_TN_72046,0.0884964
GemmTunableOp_Half_TN,tn_3584_64_3584,Gemm_Rocblas_621288818,0.0207813
GemmTunableOp_Half_TN,tn_3584_16_18944,Gemm_Hipblaslt_TN_74643,0.0436485
GemmTunableOp_Half_TN,tn_3584_248_18944,Gemm_Hipblaslt_TN_72369,0.151217
GemmTunableOp_Half_TN,tn_3584_168_18944,Gemm_Hipblaslt_TN_72488,0.121755
GemmTunableOp_Half_TN,tn_3584_216_18944,Gemm_Hipblaslt_TN_72277,0.140305
GemmTunableOp_Half_TN,tn_3584_112_3584,Gemm_Rocblas_621282641,0.0287543
GemmTunableOp_Half_TN,tn_3584_8_18944,Gemm_Hipblaslt_TN_74643,0.0436493
GemmTunableOp_Half_TN,tn_3584_192_3584,Gemm_Hipblaslt_TN_73879,0.0345568
GemmTunableOp_Half_TN,tn_37888_120_3584,Gemm_Hipblaslt_TN_88096,0.228809
GemmTunableOp_Half_TN,tn_4608_80_3584,Gemm_Hipblaslt_TN_74520,0.026011
GemmTunableOp_Half_TN,tn_4608_224_3584,Gemm_Hipblaslt_TN_107336,0.0508768
GemmTunableOp_Half_TN,tn_37888_56_3584,Gemm_Rocblas_621288842,0.14233
GemmTunableOp_Half_TN,tn_37888_40_3584,Gemm_Hipblaslt_TN_74812,0.130452
GemmTunableOp_Half_TN,tn_37888_88_3584,Gemm_Hipblaslt_TN_72198,0.187016
GemmTunableOp_Half_TN,tn_37888_216_3584,Gemm_Hipblaslt_TN_88233,0.333233
GemmTunableOp_Half_TN,tn_37888_176_3584,Gemm_Hipblaslt_TN_72539,0.287644
GemmTunableOp_Half_TN,tn_37888_16_3584,Gemm_Rocblas_621282565,0.0831954
GemmTunableOp_Half_TN,tn_4608_192_3584,Gemm_Hipblaslt_TN_71916,0.0396863
GemmTunableOp_Half_TN,tn_3584_112_18944,Gemm_Hipblaslt_TN_72046,0.0887187
GemmTunableOp_Half_TN,tn_3584_224_3584,Gemm_Rocblas_621282647,0.0408328
GemmTunableOp_Half_TN,tn_3584_136_18944,Gemm_Hipblaslt_TN_72122,0.10016
GemmTunableOp_Half_TN,tn_3584_80_18944,Gemm_Hipblaslt_TN_85427,0.0779974
GemmTunableOp_Half_TN,tn_37888_128_3584,Gemm_Rocblas_621282819,0.227101
GemmTunableOp_Half_TN,tn_3584_152_3584,Gemm_Rocblas_621289097,0.033873
GemmTunableOp_Half_TN,tn_3584_184_18944,Gemm_Hipblaslt_TN_72195,0.121409
GemmTunableOp_Half_TN,tn_3584_160_18944,Gemm_Hipblaslt_TN_72122,0.101658
GemmTunableOp_Half_TN,tn_3584_208_3584,Gemm_Rocblas_621288856,0.0408725
GemmTunableOp_Half_TN,tn_3584_232_3584,Gemm_Rocblas_621282647,0.040824
GemmTunableOp_Half_TN,tn_4608_256_3584,Gemm_Rocblas_621282951,0.0506837
GemmTunableOp_Half_TN,tn_3584_32_3584,Gemm_Rocblas_621288715,0.0151779
GemmTunableOp_Half_TN,tn_3584_248_3584,Gemm_Rocblas_621288856,0.0408737
GemmTunableOp_Half_TN,tn_3584_40_18944,Gemm_Hipblaslt_TN_74656,0.0566024
GemmTunableOp_Half_TN,tn_4608_131072_3584,Gemm_Rocblas_621282559,16.4549
GemmTunableOp_Half_TN,tn_152064_128_3584,Gemm_Rocblas_621282701,0.915312
GemmTunableOp_Half_TN,tn_3584_208_18944,Gemm_Hipblaslt_TN_74087,0.139348
GemmTunableOp_Half_TN,tn_3584_24_3584,Gemm_Rocblas_621288715,0.0152925
GemmTunableOp_Half_TN,tn_37888_208_3584,Gemm_Hipblaslt_TN_88233,0.325369
GemmTunableOp_Half_TN,tn_37888_256_3584,Gemm_Hipblaslt_TN_74844,0.350606
GemmTunableOp_Half_TN,tn_3584_48_3584,Gemm_Hipblaslt_TN_71830,0.0196909
GemmTunableOp_Half_TN,tn_3584_56_3584,Gemm_Rocblas_621288821,0.0212004
GemmTunableOp_Half_TN,tn_3584_64_18944,Gemm_Hipblaslt_TN_71764,0.0673514
GemmTunableOp_Half_TN,tn_3584_96_18944,Gemm_Hipblaslt_TN_85427,0.0802183
GemmTunableOp_Half_TN,tn_3584_240_18944,Gemm_Hipblaslt_TN_72369,0.15129
GemmTunableOp_Half_TN,tn_4608_112_3584,Gemm_Rocblas_621282641,0.0291232
GemmTunableOp_Half_TN,tn_37888_136_3584,Gemm_Hipblaslt_TN_88124,0.25718
GemmTunableOp_Half_TN,tn_37888_168_3584,Gemm_Hipblaslt_TN_88142,0.284653
GemmTunableOp_Half_TN,tn_4608_40_3584,Gemm_Rocblas_621282600,0.0212056
GemmTunableOp_Half_TN,tn_4608_160_3584,Gemm_Hipblaslt_TN_74372,0.0383399
GemmTunableOp_Half_TN,tn_37888_240_3584,Gemm_Hipblaslt_TN_74844,0.356273
GemmTunableOp_Half_TN,tn_152064_64_3584,Gemm_Rocblas_621282636,0.5791
GemmTunableOp_Half_TN,tn_37888_80_3584,Gemm_Hipblaslt_TN_72273,0.17093
GemmTunableOp_Half_TN,tn_37888_152_3584,Gemm_Hipblaslt_TN_72429,0.26346
GemmTunableOp_Half_TN,tn_3584_16_3584,Gemm_Rocblas_621288681,0.0135511
GemmTunableOp_Half_TN,tn_3584_168_3584,Gemm_Rocblas_621289097,0.0343389
GemmTunableOp_Half_TN,tn_3584_176_3584,Gemm_Rocblas_621289097,0.0343685
GemmTunableOp_Half_TN,tn_3584_160_3584,Gemm_Rocblas_621289097,0.0342583
GemmTunableOp_Half_TN,tn_3584_184_3584,Gemm_Rocblas_621282893,0.0348492
GemmTunableOp_Half_TN,tn_3584_72_18944,Gemm_Hipblaslt_TN_85427,0.0779393
GemmTunableOp_Half_TN,tn_3584_192_18944,Gemm_Hipblaslt_TN_72879,0.122003
GemmTunableOp_Half_TN,tn_4608_216_3584,Gemm_Rocblas_621288858,0.0506264
GemmTunableOp_Half_TN,tn_3584_224_18944,Gemm_Hipblaslt_TN_72277,0.140005
GemmTunableOp_Half_TN,tn_37888_200_3584,Gemm_Hipblaslt_TN_88172,0.321643
GemmTunableOp_Half_TN,tn_3584_256_18944,Gemm_Hipblaslt_TN_72369,0.150422
GemmTunableOp_Half_TN,tn_37888_112_3584,Gemm_Hipblaslt_TN_72069,0.237338
GemmTunableOp_Half_TN,tn_3584_131072_18944,Gemm_Hipblaslt_TN_74279,71.8382
GemmTunableOp_Half_TN,tn_3584_128_3584,Gemm_Rocblas_621288850,0.0286128
GemmTunableOp_Half_TN,tn_3584_120_3584,Gemm_Rocblas_621288850,0.0288071
GemmTunableOp_Half_TN,tn_3584_104_3584,Gemm_Rocblas_621282641,0.0287807
GemmTunableOp_Half_TN,tn_18944_106444_3584,Gemm_Hipblaslt_TN_107347,57.0286
GemmTunableOp_Half_TN,tn_3584_131072_9472,Gemm_Rocblas_621282466,34.8026
GemmTunableOp_Half_TN,tn_3584_104_1792,Gemm_Rocblas_621288872,0.0184348
GemmTunableOp_Half_TN,tn_2304_88_3584,Gemm_Rocblas_621282600,0.020969
GemmTunableOp_Half_TN,tn_2304_72_3584,Gemm_Hipblaslt_TN_71715,0.0201017
GemmTunableOp_Half_TN,tn_2304_40_3584,Gemm_Rocblas_621282493,0.0152152
GemmTunableOp_Half_TN,tn_2304_32_3584,Gemm_Rocblas_621288653,0.0126882
GemmTunableOp_Half_TN,tn_2304_240_3584,Gemm_Rocblas_621288848,0.0293215
GemmTunableOp_Half_TN,tn_2304_168_3584,Gemm_Hipblaslt_TN_74605,0.0275853
GemmTunableOp_Half_TN,tn_3584_106444_1792,Gemm_Rocblas_621282559,5.41937
GemmTunableOp_Half_TN,tn_18944_184_3584,Gemm_Hipblaslt_TN_9238,0.113666
GemmTunableOp_Half_TN,tn_18944_144_3584,Gemm_Hipblaslt_TN_72928,0.097711
GemmTunableOp_Half_TN,tn_2304_208_3584,Gemm_Rocblas_621288848,0.029009
GemmTunableOp_Half_TN,tn_18944_232_3584,Gemm_Rocblas_621288675,0.158179
GemmTunableOp_Half_TN,tn_2304_136_3584,Gemm_Hipblaslt_TN_74520,0.0261684
GemmTunableOp_Half_TN,tn_2304_56_3584,Gemm_Rocblas_621282493,0.0151283
GemmTunableOp_Half_TN,tn_18944_64_3584,Gemm_Rocblas_621288872,0.0539548
GemmTunableOp_Half_TN,tn_18944_72_3584,Gemm_Hipblaslt_TN_72273,0.0739258
GemmTunableOp_Half_TN,tn_2304_184_3584,Gemm_Hipblaslt_TN_87454,0.0276057
GemmTunableOp_Half_TN,tn_2304_112_3584,Gemm_Rocblas_621288818,0.0210719
GemmTunableOp_Half_TN,tn_2304_16_3584,Gemm_Rocblas_621282453,0.0104116
GemmTunableOp_Half_TN,tn_18944_128_3584,Gemm_Rocblas_621282731,0.0826513
GemmTunableOp_Half_TN,tn_2304_224_3584,Gemm_Rocblas_621288848,0.0291244
GemmTunableOp_Half_TN,tn_3584_106444_9472,Gemm_Rocblas_621282447,28.3453
GemmTunableOp_Half_TN,tn_3584_104_9472,Gemm_Hipblaslt_TN_72046,0.0537717
GemmTunableOp_Half_TN,tn_2304_80_3584,Gemm_Hipblaslt_TN_72469,0.0204951
GemmTunableOp_Half_TN,tn_2304_64_3584,Gemm_Rocblas_621288715,0.0152188
GemmTunableOp_Half_TN,tn_2304_256_3584,Gemm_Rocblas_621288848,0.0290299
GemmTunableOp_Half_TN,tn_2304_248_3584,Gemm_Rocblas_621282639,0.0291681
GemmTunableOp_Half_TN,tn_2304_232_3584,Gemm_Rocblas_621282639,0.0291969
GemmTunableOp_Half_TN,tn_2304_24_3584,Gemm_Rocblas_621282456,0.0126678
GemmTunableOp_Half_TN,tn_18944_136_3584,Gemm_Hipblaslt_TN_72928,0.0975588
GemmTunableOp_Half_TN,tn_18944_168_3584,Gemm_Hipblaslt_TN_72540,0.111847
GemmTunableOp_Half_TN,tn_2304_176_3584,Gemm_Hipblaslt_TN_87821,0.02755
GemmTunableOp_Half_TN,tn_2304_8_3584,Gemm_Rocblas_621288646,0.0104396
GemmTunableOp_Half_TN,tn_2304_48_3584,Gemm_Rocblas_621282493,0.0151122
GemmTunableOp_Half_TN,tn_18944_96_3584,Gemm_Hipblaslt_TN_71916,0.0749622
GemmTunableOp_Half_TN,tn_2304_128_3584,Gemm_Rocblas_621282600,0.0208769
GemmTunableOp_Half_TN,tn_18944_248_3584,Gemm_Rocblas_621282463,0.157523
GemmTunableOp_Half_TN,tn_2304_192_3584,Gemm_Hipblaslt_TN_74605,0.0271627
GemmTunableOp_Half_TN,tn_2304_200_3584,Gemm_Rocblas_621282639,0.0289173
GemmTunableOp_Half_TN,tn_2304_144_3584,Gemm_Hipblaslt_TN_87820,0.026069
GemmTunableOp_Half_TN,tn_76032_52_3584,Gemm_Rocblas_621282633,0.29357
GemmTunableOp_Half_TN,tn_18944_208_3584,Gemm_Rocblas_621282462,0.127994
GemmTunableOp_Half_TN,tn_2304_152_3584,Gemm_Hipblaslt_TN_74520,0.0261255
GemmTunableOp_Half_TN,tn_2304_160_3584,Gemm_Hipblaslt_TN_74443,0.0258647
GemmTunableOp_Half_TN,tn_2304_96_3584,Gemm_Rocblas_621282600,0.0209061
GemmTunableOp_Half_TN,tn_2304_216_3584,Gemm_Rocblas_621282639,0.0290062
GemmTunableOp_Half_TN,tn_18944_131072_3584,Gemm_Hipblaslt_TN_9240,70.9799
GemmTunableOp_Half_TN,tn_76032_244_3584,Gemm_Rocblas_621282441,0.766357
GemmTunableOp_Half_TN,tn_3584_88_9472,Gemm_Hipblaslt_TN_71899,0.0459045
GemmTunableOp_Half_TN,tn_3584_88_1792,Gemm_Hipblaslt_TN_87821,0.0178528
GemmTunableOp_Half_TN,tn_3584_72_9472,Gemm_Hipblaslt_TN_71899,0.0455339
GemmTunableOp_Half_TN,tn_3584_72_1792,Default,0.0173625
GemmTunableOp_Half_TN,tn_3584_64_9472,Gemm_Hipblaslt_TN_71770,0.0390542
GemmTunableOp_Half_TN,tn_3584_56_1792,Gemm_Rocblas_621288839,0.0137595
GemmTunableOp_Half_TN,tn_3584_136_9472,Gemm_Hipblaslt_TN_72122,0.0603822
GemmTunableOp_Half_TN,tn_3584_96_1792,Gemm_Hipblaslt_TN_72181,0.0175792
GemmTunableOp_Half_TN,tn_3584_256_9472,Gemm_Hipblaslt_TN_72631,0.0859915
GemmTunableOp_Half_TN,tn_2304_131072_3584,Gemm_Rocblas_621289105,8.34993
GemmTunableOp_Half_TN,tn_3584_168_9472,Gemm_Hipblaslt_TN_72195,0.0699161
GemmTunableOp_Half_TN,tn_3584_152_9472,Gemm_Hipblaslt_TN_72121,0.061945
GemmTunableOp_Half_TN,tn_2304_120_3584,Gemm_Rocblas_621282600,0.0209237
GemmTunableOp_Half_TN,tn_18944_200_3584,Gemm_Rocblas_621288659,0.126133
GemmTunableOp_Half_TN,tn_3584_184_9472,Gemm_Hipblaslt_TN_72488,0.0702751
GemmTunableOp_Half_TN,tn_3584_48_9472,Gemm_Hipblaslt_TN_74656,0.0368906
GemmTunableOp_Half_TN,tn_3584_224_1792,Gemm_Rocblas_621282647,0.0253817
GemmTunableOp_Half_TN,tn_3584_131008_1792,Gemm_Rocblas_621282559,6.85921
GemmTunableOp_Half_TN,tn_3584_160_9472,Gemm_Hipblaslt_TN_72122,0.0601218
GemmTunableOp_Half_TN,tn_18944_80_3584,Gemm_Hipblaslt_TN_74372,0.0727569
GemmTunableOp_Half_TN,tn_3584_136_1792,Gemm_Rocblas_621289097,0.0214142
GemmTunableOp_Half_TN,tn_3584_240_9472,Gemm_Hipblaslt_TN_74120,0.0869281
GemmTunableOp_Half_TN,tn_18944_152_3584,Gemm_Hipblaslt_TN_72796,0.099962
GemmTunableOp_Half_TN,tn_3584_184_1792,Gemm_Rocblas_621289097,0.0219906
GemmTunableOp_Half_TN,tn_3584_256_1792,Gemm_Rocblas_621282647,0.0242364
GemmTunableOp_Half_TN,tn_3584_200_1792,Gemm_Rocblas_621282647,0.0255083
GemmTunableOp_Half_TN,tn_3584_80_1792,Gemm_Hipblaslt_TN_71837,0.016921
GemmTunableOp_Half_TN,tn_3584_152_1792,Gemm_Rocblas_621282893,0.0216409
GemmTunableOp_Half_TN,tn_18944_24_3584,Gemm_Rocblas_621288838,0.0450594
GemmTunableOp_Half_TN,tn_18944_120_3584,Gemm_Rocblas_621283194,0.0852604
GemmTunableOp_Half_TN,tn_3584_208_1792,Gemm_Rocblas_621288856,0.0254009
GemmTunableOp_Half_TN,tn_3584_24_1792,Gemm_Rocblas_621282461,0.0108539
GemmTunableOp_Half_TN,tn_3584_208_9472,Gemm_Hipblaslt_TN_74087,0.0796303
GemmTunableOp_Half_TN,tn_3584_64_1792,Gemm_Rocblas_621282600,0.013439
GemmTunableOp_Half_TN,tn_18944_240_3584,Gemm_Rocblas_621282463,0.155788
GemmTunableOp_Half_TN,tn_3584_224_9472,Gemm_Hipblaslt_TN_74087,0.0792934
GemmTunableOp_Half_TN,tn_3584_24_9472,Gemm_Rocblas_621288715,0.0289843
GemmTunableOp_Half_TN,tn_3584_240_1792,Gemm_Rocblas_621288856,0.0254117
GemmTunableOp_Half_TN,tn_76032_64_3584,Gemm_Rocblas_621288845,0.290944
GemmTunableOp_Half_TN,tn_3584_48_1792,Default,0.0144713
GemmTunableOp_Half_TN,tn_3584_40_1792,Gemm_Rocblas_621282630,0.013612
GemmTunableOp_Half_TN,tn_76032_256_3584,Gemm_Rocblas_621282442,0.733777
GemmTunableOp_Half_TN,tn_3584_96_9472,Gemm_Hipblaslt_TN_71899,0.0464385
GemmTunableOp_Half_TN,tn_3584_80_9472,Gemm_Hipblaslt_TN_72866,0.0472505
GemmTunableOp_Half_TN,tn_3584_8_9472,Gemm_Rocblas_621288647,0.0253436
GemmTunableOp_Half_TN,tn_3584_8_1792,Gemm_Rocblas_621282454,0.00957677
GemmTunableOp_Half_TN,tn_3584_40_9472,Default,0.0374911
GemmTunableOp_Half_TN,tn_3584_32_9472,Gemm_Rocblas_621288657,0.0288052
GemmTunableOp_Half_TN,tn_3584_32_1792,Gemm_Rocblas_621282493,0.0107133
GemmTunableOp_Half_TN,tn_3584_128_9472,Gemm_Hipblaslt_TN_72046,0.0533845
GemmTunableOp_Half_TN,tn_3584_112_9472,Gemm_Hipblaslt_TN_73234,0.0554059
GemmTunableOp_Half_TN,tn_2304_106444_3584,Gemm_Rocblas_621289105,6.8121
GemmTunableOp_Half_TN,tn_3584_232_1792,Gemm_Rocblas_621282647,0.0254157
GemmTunableOp_Half_TN,tn_2304_104_3584,Gemm_Rocblas_621282600,0.0210495
GemmTunableOp_Half_TN,tn_18944_256_3584,Gemm_Rocblas_621288666,0.15471
GemmTunableOp_Half_TN,tn_3584_144_1792,Gemm_Rocblas_621282893,0.0215151
GemmTunableOp_Half_TN,tn_3584_216_9472,Gemm_Hipblaslt_TN_72277,0.0799985
GemmTunableOp_Half_TN,tn_18944_176_3584,Gemm_Hipblaslt_TN_72805,0.112139
GemmTunableOp_Half_TN,tn_3584_248_1792,Gemm_Rocblas_621282647,0.0256421
GemmTunableOp_Half_TN,tn_3584_128_1792,Gemm_Rocblas_621288847,0.0182089
GemmTunableOp_Half_TN,tn_18944_216_3584,Gemm_Rocblas_621288659,0.128446
GemmTunableOp_Half_TN,tn_3584_120_9472,Gemm_Hipblaslt_TN_72046,0.0544172
GemmTunableOp_Half_TN,tn_3584_168_1792,Gemm_Rocblas_621289097,0.0218756
GemmTunableOp_Half_TN,tn_18944_16_3584,Gemm_Rocblas_621288685,0.0393493
GemmTunableOp_Half_TN,tn_3584_160_1792,Gemm_Rocblas_621289097,0.0215219
GemmTunableOp_Half_TN,tn_3584_120_1792,Gemm_Rocblas_621282639,0.0184128
GemmTunableOp_Half_TN,tn_18944_112_3584,Gemm_Rocblas_621283194,0.0854367
GemmTunableOp_Half_TN,tn_3584_131072_1792,Gemm_Rocblas_621282559,6.64786
GemmTunableOp_Half_TN,tn_3584_248_9472,Gemm_Hipblaslt_TN_72631,0.0882056
GemmTunableOp_Half_TN,tn_3584_112_1792,Gemm_Rocblas_621282641,0.0182642
GemmTunableOp_Half_TN,tn_3584_144_9472,Gemm_Hipblaslt_TN_85574,0.0619498
GemmTunableOp_Half_TN,tn_3584_16_1792,Gemm_Rocblas_621282454,0.00955755
GemmTunableOp_Half_TN,tn_3584_192_9472,Gemm_Hipblaslt_TN_72195,0.0702911
GemmTunableOp_Half_TN,tn_3584_16_9472,Gemm_Rocblas_621288693,0.0256886
GemmTunableOp_Half_TN,tn_3584_176_1792,Gemm_Rocblas_621289097,0.0219201
GemmTunableOp_Half_TN,tn_3584_176_9472,Gemm_Hipblaslt_TN_72488,0.0709629
GemmTunableOp_Half_TN,tn_3584_192_1792,Gemm_Rocblas_621289097,0.0211718
GemmTunableOp_Half_TN,tn_3584_200_9472,Gemm_Hipblaslt_TN_72277,0.0796327
GemmTunableOp_Half_TN,tn_3584_56_9472,Gemm_Hipblaslt_TN_71770,0.0404355
GemmTunableOp_Half_TN,tn_3584_216_1792,Gemm_Rocblas_621282647,0.0256084
GemmTunableOp_Half_TN,tn_3584_232_9472,Gemm_Hipblaslt_TN_72369,0.0865839
GemmTunableOp_Half_TN,tn_18944_88_3584,Gemm_Hipblaslt_TN_74606,0.0773313
GemmTunableOp_Half_TN,tn_3584_131008_9472,Gemm_Rocblas_621282466,34.5258
GemmTunableOp_Half_TN,tn_18944_8_3584,Gemm_Rocblas_621282480,0.0390004
GemmTunableOp_Half_TN,tn_2304_131008_3584,Gemm_Rocblas_621282559,8.36796
GemmTunableOp_Half_TN,tn_18944_56_3584,Gemm_Rocblas_621282665,0.0559914
GemmTunableOp_Half_TN,tn_18944_48_3584,Gemm_Hipblaslt_TN_74377,0.0525651
GemmTunableOp_Half_TN,tn_18944_32_3584,Gemm_Rocblas_621282627,0.0451376
GemmTunableOp_Half_TN,tn_18944_40_3584,Gemm_Hipblaslt_TN_87478,0.0527518
GemmTunableOp_Half_TN,tn_18944_192_3584,Gemm_Rocblas_621289105,0.106057
GemmTunableOp_Half_TN,tn_18944_160_3584,Gemm_Rocblas_621282746,0.0973509
GemmTunableOp_Half_TN,tn_18944_224_3584,Gemm_Rocblas_621288659,0.12699
GemmTunableOp_Half_TN,tn_18944_104_3584,Gemm_Rocblas_621283194,0.085274
GemmTunableOp_Half_TN,tn_18944_131008_3584,Gemm_Hipblaslt_TN_107347,70.0184
GemmTunableOp_Half_TN,tn_8192_88_4096,Gemm_Hipblaslt_TN_72494,0.0445648
GemmTunableOp_Half_TN,tn_8192_80_4096,Gemm_Hipblaslt_TN_74372,0.0421624
GemmTunableOp_Half_TN,tn_76032_108_8192,Gemm_Hipblaslt_TN_74174,1.01333
GemmTunableOp_Half_TN,tn_5120_6514_8192,Gemm_Rocblas_621288793,1.88914
GemmTunableOp_Half_TN,tn_76032_176_8192,Gemm_Hipblaslt_TN_87984,1.3059
GemmTunableOp_Half_TN,tn_5120_64_8192,Gemm_Hipblaslt_TN_71968,0.0416889
GemmTunableOp_Half_TN,tn_5120_48_8192,Gemm_Hipblaslt_TN_71715,0.0391579
GemmTunableOp_Half_TN,tn_5120_40_8192,Gemm_Hipblaslt_TN_87799,0.0394964
GemmTunableOp_Half_TN,tn_5120_248_8192,Gemm_Hipblaslt_TN_72641,0.0923536
GemmTunableOp_Half_TN,tn_76032_168_8192,Gemm_Hipblaslt_TN_72216,1.31192
GemmTunableOp_Half_TN,tn_5120_56_8192,Gemm_Rocblas_621288839,0.0418984
GemmTunableOp_Half_TN,tn_5120_240_8192,Gemm_Hipblaslt_TN_72641,0.0920183
GemmTunableOp_Half_TN,tn_5120_24_8192,Gemm_Rocblas_621288715,0.0347829
GemmTunableOp_Half_TN,tn_5120_232_8192,Gemm_Hipblaslt_TN_72641,0.0923868
GemmTunableOp_Half_TN,tn_29568_96_8192,Gemm_Hipblaslt_TN_72494,0.317167
GemmTunableOp_Half_TN,tn_5120_2068_8192,Gemm_Hipblaslt_TN_73828,0.711493
GemmTunableOp_Half_TN,tn_5120_192_8192,Gemm_Hipblaslt_TN_74662,0.0765223
GemmTunableOp_Half_TN,tn_8192_96_4096,Gemm_Hipblaslt_TN_71916,0.0436819
GemmTunableOp_Half_TN,tn_5120_168_8192,Gemm_Hipblaslt_TN_74055,0.0767727
GemmTunableOp_Half_TN,tn_29568_168_8192,Gemm_Hipblaslt_TN_87579,0.571254
GemmTunableOp_Half_TN,tn_29568_72_8192,Gemm_Hipblaslt_TN_71857,0.295372
GemmTunableOp_Half_TN,tn_76032_81_8192,Gemm_Hipblaslt_TN_72494,0.819726
GemmTunableOp_Half_TN,tn_5120_32036_8192,Gemm_Hipblaslt_TN_74817,10.2578
GemmTunableOp_Half_TN,tn_29568_112_8192,Gemm_Rocblas_621282930,0.408011
GemmTunableOp_Half_TN,tn_29568_32036_8192,Gemm_Hipblaslt_TN_74818,63.7128
GemmTunableOp_Half_TN,tn_8192_32498_14784,Gemm_Hipblaslt_TN_73188,29.1317
GemmTunableOp_Half_TN,tn_29568_208_8192,Gemm_Hipblaslt_TN_87685,0.647206
GemmTunableOp_Half_TN,tn_29568_2268_8192,Gemm_Hipblaslt_TN_107366,4.93078
GemmTunableOp_Half_TN,tn_29568_40_8192,Gemm_Hipblaslt_TN_74661,0.239456
GemmTunableOp_Half_TN,tn_29568_48_8192,Gemm_Hipblaslt_TN_71726,0.240093
GemmTunableOp_Half_TN,tn_29568_64_8192,Gemm_Rocblas_621282636,0.254824
GemmTunableOp_Half_TN,tn_76032_184_8192,Gemm_Hipblaslt_TN_72216,1.32066
GemmTunableOp_Half_TN,tn_8192_208_4096,Gemm_Hipblaslt_TN_72992,0.08513
GemmTunableOp_Half_TN,tn_76032_103_8192,Gemm_Hipblaslt_TN_88096,1.04491
GemmTunableOp_Half_TN,tn_5120_152_8192,Gemm_Hipblaslt_TN_72371,0.0691236
GemmTunableOp_Half_TN,tn_29568_30494_8192,Gemm_Hipblaslt_TN_88157,61.5098
GemmTunableOp_Half_TN,tn_5120_30736_8192,Gemm_Rocblas_621282462,9.55679
GemmTunableOp_Half_TN,tn_8192_10235_4096,Gemm_Rocblas_621282559,2.77195
GemmTunableOp_Half_TN,tn_8192_2318_4096,Gemm_Hipblaslt_TN_107365,0.659291
GemmTunableOp_Half_TN,tn_76032_160_8192,Gemm_Rocblas_621288954,1.13213
GemmTunableOp_Half_TN,tn_76032_192_8192,Gemm_Hipblaslt_TN_72216,1.31855
GemmTunableOp_Half_TN,tn_76032_216_8192,Gemm_Hipblaslt_TN_88172,1.48671
GemmTunableOp_Half_TN,tn_8192_176_4096,Gemm_Hipblaslt_TN_72912,0.0713237
GemmTunableOp_Half_TN,tn_76032_234_8192,Gemm_Rocblas_621289004,1.66615
GemmTunableOp_Half_TN,tn_76032_208_8192,Gemm_Hipblaslt_TN_88172,1.47114
GemmTunableOp_Half_TN,tn_76032_243_8192,Gemm_Rocblas_621283143,1.67639
GemmTunableOp_Half_TN,tn_8192_48_14784,Gemm_Hipblaslt_TN_87817,0.0898134
GemmTunableOp_Half_TN,tn_76032_255_8192,Gemm_Rocblas_621289361,1.67553
GemmTunableOp_Half_TN,tn_76032_90_8192,Gemm_Hipblaslt_TN_71907,0.832728
GemmTunableOp_Half_TN,tn_8192_6141_4096,Gemm_Rocblas_621282559,1.59197
GemmTunableOp_Half_TN,tn_8192_8_4096,Gemm_Rocblas_621288696,0.0240877
GemmTunableOp_Half_TN,tn_76032_200_8192,Gemm_Hipblaslt_TN_88172,1.47694
GemmTunableOp_Half_TN,tn_76032_75_8192,Gemm_Hipblaslt_TN_71861,0.773284
GemmTunableOp_Half_TN,tn_8192_200_4096,Gemm_Hipblaslt_TN_72529,0.0849926
GemmTunableOp_Half_TN,tn_29568_80_8192,Gemm_Hipblaslt_TN_71857,0.294398
GemmTunableOp_Half_TN,tn_8192_2128_4096,Gemm_Hipblaslt_TN_72537,0.59033
GemmTunableOp_Half_TN,tn_76032_67_8192,Gemm_Hipblaslt_TN_71850,0.765218
GemmTunableOp_Half_TN,tn_76032_154_8192,Gemm_Hipblaslt_TN_72530,1.14319
GemmTunableOp_Half_TN,tn_8192_24564_14784,Gemm_Hipblaslt_TN_88022,21.9854
GemmTunableOp_Half_TN,tn_8192_30992_14784,Gemm_Rocblas_621282470,27.6342
GemmTunableOp_Half_TN,tn_76032_225_8192,Gemm_Rocblas_621289002,1.65725
GemmTunableOp_Half_TN,tn_8192_48_4096,Gemm_Hipblaslt_TN_74349,0.0307164
GemmTunableOp_Half_TN,tn_8192_56_14784,Gemm_Rocblas_621282641,0.0980257
GemmTunableOp_Half_TN,tn_8192_31412_14784,Gemm_Hipblaslt_TN_87517,28.0998
GemmTunableOp_Half_TN,tn_8192_30494_14784,Gemm_Rocblas_621282447,27.2491
GemmTunableOp_Half_TN,tn_8192_24_14784,Gemm_Hipblaslt_TN_85794,0.0774081
GemmTunableOp_Half_TN,tn_8192_2268_4096,Gemm_Hipblaslt_TN_9238,0.597886
GemmTunableOp_Half_TN,tn_8192_2128_14784,Gemm_Hipblaslt_TN_74389,1.99639
GemmTunableOp_Half_TN,tn_8192_168_4096,Gemm_Hipblaslt_TN_73277,0.0738355
GemmTunableOp_Half_TN,tn_8192_240_14784,Gemm_Hipblaslt_TN_72911,0.255683
GemmTunableOp_Half_TN,tn_8192_136_4096,Gemm_Hipblaslt_TN_73880,0.0658062
GemmTunableOp_Half_TN,tn_76032_158_8192,Gemm_Hipblaslt_TN_72143,1.17913
GemmTunableOp_Half_TN,tn_76032_206_8192,Gemm_Hipblaslt_TN_88172,1.46944
GemmTunableOp_Half_TN,tn_5120_24564_8192,Gemm_Hipblaslt_TN_74209,7.71419
GemmTunableOp_Half_TN,tn_29568_30746_8192,Gemm_Hipblaslt_TN_107366,62.4717
GemmTunableOp_Half_TN,tn_8192_192_14784,Gemm_Hipblaslt_TN_72989,0.195511
GemmTunableOp_Half_TN,tn_29568_6141_8192,Gemm_Rocblas_621282830,12.3597
GemmTunableOp_Half_TN,tn_76032_110_8192,Gemm_Hipblaslt_TN_88096,1.0495
GemmTunableOp_Half_TN,tn_76032_248_8192,Gemm_Rocblas_621289346,1.67465
GemmTunableOp_Half_TN,tn_29568_2368_8192,Gemm_Hipblaslt_TN_88112,5.33936
GemmTunableOp_Half_TN,tn_8192_16_4096,Gemm_Rocblas_621288696,0.024175
GemmTunableOp_Half_TN,tn_29568_16_8192,Gemm_Rocblas_621288703,0.17223
GemmTunableOp_Half_TN,tn_76032_190_8192,Gemm_Hipblaslt_TN_72216,1.31273
GemmTunableOp_Half_TN,tn_29568_152_8192,Gemm_Hipblaslt_TN_72137,0.449529
GemmTunableOp_Half_TN,tn_76032_166_8192,Gemm_Hipblaslt_TN_88020,1.28494
GemmTunableOp_Half_TN,tn_29568_2047_8192,Gemm_Hipblaslt_TN_107362,4.12753
GemmTunableOp_Half_TN,tn_76032_174_8192,Gemm_Hipblaslt_TN_72223,1.30547
GemmTunableOp_Half_TN,tn_76032_104_8192,Gemm_Hipblaslt_TN_88096,1.04122
GemmTunableOp_Half_TN,tn_76032_198_8192,Gemm_Hipblaslt_TN_88172,1.46567
GemmTunableOp_Half_TN,tn_76032_182_8192,Gemm_Hipblaslt_TN_72216,1.31471
GemmTunableOp_Half_TN,tn_8192_256_4096,Gemm_Rocblas_621289352,0.0869948
GemmTunableOp_Half_TN,tn_76032_214_8192,Gemm_Hipblaslt_TN_88172,1.47405
GemmTunableOp_Half_TN,tn_8192_144_4096,Gemm_Hipblaslt_TN_72903,0.0626643
GemmTunableOp_Half_TN,tn_76032_222_8192,Gemm_Hipblaslt_TN_88172,1.48057
GemmTunableOp_Half_TN,tn_8192_32710_14784,Gemm_Rocblas_621282447,29.2896
GemmTunableOp_Half_TN,tn_76032_231_8192,Gemm_Rocblas_621283143,1.66542
GemmTunableOp_Half_TN,tn_76032_240_8192,Gemm_Rocblas_621289221,1.66313
GemmTunableOp_Half_TN,tn_5120_31080_8192,Gemm_Rocblas_621282462,9.64278
GemmTunableOp_Half_TN,tn_76032_59_8192,Gemm_Rocblas_621288845,0.608359
GemmTunableOp_Half_TN,tn_29568_32498_8192,Gemm_Hipblaslt_TN_107366,65.7877
GemmTunableOp_Half_TN,tn_76032_63_8192,Gemm_Hipblaslt_TN_74354,0.635513
GemmTunableOp_Half_TN,tn_5120_32710_8192,Gemm_Hipblaslt_TN_72996,10.1465
GemmTunableOp_Half_TN,tn_76032_87_8192,Gemm_Hipblaslt_TN_72494,0.823592
GemmTunableOp_Half_TN,tn_76032_99_8192,Gemm_Hipblaslt_TN_72423,1.02061
GemmTunableOp_Half_TN,tn_76032_71_8192,Gemm_Hipblaslt_TN_71861,0.765008
GemmTunableOp_Half_TN,tn_76032_79_8192,Gemm_Hipblaslt_TN_71861,0.769455
GemmTunableOp_Half_TN,tn_8192_88_14784,Gemm_Hipblaslt_TN_86867,0.117139
GemmTunableOp_Half_TN,tn_8192_6514_4096,Gemm_Rocblas_621282852,1.71029
GemmTunableOp_Half_TN,tn_8192_64_4096,Gemm_Rocblas_621288872,0.0320448
GemmTunableOp_Half_TN,tn_8192_32359_14784,Gemm_Rocblas_621282447,28.3255
GemmTunableOp_Half_TN,tn_8192_2318_14784,Gemm_Hipblaslt_TN_72792,2.1837
GemmTunableOp_Half_TN,tn_8192_184_4096,Gemm_Hipblaslt_TN_74063,0.0721662
GemmTunableOp_Half_TN,tn_8192_104_14784,Gemm_Hipblaslt_TN_73145,0.132859
GemmTunableOp_Half_TN,tn_76032_91_8192,Gemm_Hipblaslt_TN_71912,0.817676
GemmTunableOp_Half_TN,tn_76032_82_8192,Gemm_Hipblaslt_TN_71912,0.846774
GemmTunableOp_Half_TN,tn_76032_11_8192,Gemm_Rocblas_621282656,0.426081
GemmTunableOp_Half_TN,tn_29568_32359_8192,Gemm_Hipblaslt_TN_107366,64.7949
GemmTunableOp_Half_TN,tn_29568_6514_8192,Gemm_Hipblaslt_TN_107366,13.2563
GemmTunableOp_Half_TN,tn_8192_2478_14784,Gemm_Hipblaslt_TN_87547,2.22629
GemmTunableOp_Half_TN,tn_8192_152_14784,Gemm_Hipblaslt_TN_74157,0.173613
GemmTunableOp_Half_TN,tn_76032_186_8192,Gemm_Hipblaslt_TN_72216,1.30127
GemmTunableOp_Half_TN,tn_8192_32768_4096,Gemm_Rocblas_621288659,8.31723
GemmTunableOp_Half_TN,tn_5120_32054_8192,Gemm_Hipblaslt_TN_74209,9.49874
GemmTunableOp_Half_TN,tn_29568_30736_8192,Gemm_Hipblaslt_TN_107366,61.574
GemmTunableOp_Half_TN,tn_5120_256_8192,Gemm_Rocblas_621289153,0.0940974
GemmTunableOp_Half_TN,tn_29568_56_8192,Gemm_Rocblas_621288842,0.249469
GemmTunableOp_Half_TN,tn_8192_200_14784,Gemm_Hipblaslt_TN_72911,0.239984
GemmTunableOp_Half_TN,tn_29568_2318_8192,Gemm_Hipblaslt_TN_88112,5.25634
GemmTunableOp_Half_TN,tn_76032_178_8192,Gemm_Hipblaslt_TN_72216,1.29891
GemmTunableOp_Half_TN,tn_76032_210_8192,Gemm_Hipblaslt_TN_88172,1.45672
GemmTunableOp_Half_TN,tn_76032_14_8192,Gemm_Rocblas_621282656,0.430643
GemmTunableOp_Half_TN,tn_76032_244_8192,Gemm_Rocblas_621288938,1.65576
GemmTunableOp_Half_TN,tn_8192_216_14784,Gemm_Hipblaslt_TN_72292,0.238814
GemmTunableOp_Half_TN,tn_29568_216_8192,Gemm_Hipblaslt_TN_87580,0.645253
GemmTunableOp_Half_TN,tn_8192_31412_4096,Gemm_Hipblaslt_TN_107347,8.05477
GemmTunableOp_Half_TN,tn_29568_192_8192,Gemm_Hipblaslt_TN_87579,0.58257
GemmTunableOp_Half_TN,tn_76032_155_8192,Gemm_Hipblaslt_TN_72143,1.16117
GemmTunableOp_Half_TN,tn_29568_136_8192,Gemm_Hipblaslt_TN_72398,0.4739
GemmTunableOp_Half_TN,tn_76032_162_8192,Gemm_Hipblaslt_TN_72216,1.28694
GemmTunableOp_Half_TN,tn_76032_202_8192,Gemm_Hipblaslt_TN_88172,1.45143
GemmTunableOp_Half_TN,tn_76032_194_8192,Gemm_Hipblaslt_TN_88172,1.45044
GemmTunableOp_Half_TN,tn_5120_30746_8192,Gemm_Hipblaslt_TN_74719,9.24843
GemmTunableOp_Half_TN,tn_76032_170_8192,Gemm_Hipblaslt_TN_72216,1.29818
GemmTunableOp_Half_TN,tn_5120_32768_8192,Gemm_Rocblas_621288659,9.62015
GemmTunableOp_Half_TN,tn_76032_218_8192,Gemm_Hipblaslt_TN_88172,1.46247
GemmTunableOp_Half_TN,tn_8192_120_14784,Gemm_Hipblaslt_TN_73145,0.136958
GemmTunableOp_Half_TN,tn_76032_235_8192,Gemm_Rocblas_621283159,1.64973
GemmTunableOp_Half_TN,tn_76032_226_8192,Gemm_Rocblas_621282798,1.64688
GemmTunableOp_Half_TN,tn_76032_253_8192,Gemm_Rocblas_621283159,1.65594
GemmTunableOp_Half_TN,tn_8192_30736_14784,Gemm_Rocblas_621282462,26.9347
GemmTunableOp_Half_TN,tn_76032_66_8192,Gemm_Hipblaslt_TN_71850,0.781632
GemmTunableOp_Half_TN,tn_76032_74_8192,Gemm_Hipblaslt_TN_73975,0.779319
GemmTunableOp_Half_TN,tn_8192_32768_14784,Gemm_Rocblas_621282462,29.0717
GemmTunableOp_Half_TN,tn_8192_32054_14784,Gemm_Rocblas_621282450,28.7892
GemmTunableOp_Half_TN,tn_8192_31080_4096,Gemm_Rocblas_621282462,8.54561
GemmTunableOp_Half_TN,tn_8192_30476_14784,Gemm_Rocblas_621282447,27.1609
GemmTunableOp_Half_TN,tn_8192_248_4096,Gemm_Hipblaslt_TN_74098,0.0889542
GemmTunableOp_Half_TN,tn_8192_2368_4096,Gemm_Rocblas_621296657,0.648221
GemmTunableOp_Half_TN,tn_8192_224_14784,Gemm_Hipblaslt_TN_72292,0.24138
GemmTunableOp_Half_TN,tn_8192_160_4096,Gemm_Hipblaslt_TN_72903,0.0622942
GemmTunableOp_Half_TN,tn_8192_152_4096,Gemm_Hipblaslt_TN_72903,0.0628342
GemmTunableOp_Half_TN,tn_8192_112_4096,Gemm_Hipblaslt_TN_72639,0.0562543
GemmTunableOp_Half_TN,tn_76032_96_8192,Gemm_Hipblaslt_TN_74606,0.829106
GemmTunableOp_Half_TN,tn_76032_85_8192,Gemm_Hipblaslt_TN_72494,0.817736
GemmTunableOp_Half_TN,tn_76032_69_8192,Gemm_Hipblaslt_TN_71861,0.76474
GemmTunableOp_Half_TN,tn_76032_61_8192,Gemm_Rocblas_621282633,0.647656
GemmTunableOp_Half_TN,tn_76032_5_8192,Gemm_Hipblaslt_TN_74551,0.429279
GemmTunableOp_Half_TN,tn_76032_77_8192,Gemm_Hipblaslt_TN_71850,0.774881
GemmTunableOp_Half_TN,tn_76032_246_8192,Gemm_Rocblas_621289214,1.66601
GemmTunableOp_Half_TN,tn_76032_238_8192,Gemm_Rocblas_621283017,1.66223
GemmTunableOp_Half_TN,tn_76032_220_8192,Gemm_Hipblaslt_TN_88172,1.47413
GemmTunableOp_Half_TN,tn_5120_16_8192,Gemm_Rocblas_621288731,0.0333027
GemmTunableOp_Half_TN,tn_29568_88_8192,Gemm_Hipblaslt_TN_71916,0.321991
GemmTunableOp_Half_TN,tn_8192_184_14784,Gemm_Hipblaslt_TN_74063,0.201807
GemmTunableOp_Half_TN,tn_76032_15_8192,Gemm_Rocblas_621288703,0.438919
GemmTunableOp_Half_TN,tn_29568_160_8192,Gemm_Hipblaslt_TN_72137,0.444927
GemmTunableOp_Half_TN,tn_76032_204_8192,Gemm_Hipblaslt_TN_88172,1.46495
GemmTunableOp_Half_TN,tn_29568_256_8192,Gemm_Rocblas_621289185,0.605501
GemmTunableOp_Half_TN,tn_29568_30908_8192,Gemm_Rocblas_621282559,61.6295
GemmTunableOp_Half_TN,tn_76032_188_8192,Gemm_Hipblaslt_TN_72216,1.31576
GemmTunableOp_Half_TN,tn_5120_136_8192,Gemm_Hipblaslt_TN_72373,0.0681073
GemmTunableOp_Half_TN,tn_5120_32498_8192,Gemm_Hipblaslt_TN_74209,9.96599
GemmTunableOp_Half_TN,tn_76032_157_8192,Gemm_Hipblaslt_TN_72143,1.17547
GemmTunableOp_Half_TN,tn_29568_2068_8192,Gemm_Hipblaslt_TN_88281,4.6459
GemmTunableOp_Half_TN,tn_76032_228_8192,Gemm_Rocblas_621289361,1.66187
GemmTunableOp_Half_TN,tn_29568_24_8192,Gemm_Rocblas_621282585,0.21302
GemmTunableOp_Half_TN,tn_76032_212_8192,Gemm_Hipblaslt_TN_88172,1.47526
GemmTunableOp_Half_TN,tn_29568_8_8192,Gemm_Rocblas_621282656,0.170786
GemmTunableOp_Half_TN,tn_76032_172_8192,Gemm_Hipblaslt_TN_72216,1.30932
GemmTunableOp_Half_TN,tn_8192_128_4096,Gemm_Hipblaslt_TN_74663,0.0559278
GemmTunableOp_Half_TN,tn_29568_128_8192,Gemm_Rocblas_621282646,0.409953
GemmTunableOp_Half_TN,tn_29568_32622_8192,Gemm_Rocblas_621282723,65.7176
GemmTunableOp_Half_TN,tn_29568_248_8192,Gemm_Rocblas_621282655,0.617533
GemmTunableOp_Half_TN,tn_5120_200_8192,Gemm_Hipblaslt_TN_85682,0.0865253
GemmTunableOp_Half_TN,tn_5120_120_8192,Gemm_Rocblas_621288850,0.0564466
GemmTunableOp_Half_TN,tn_5120_2128_8192,Gemm_Hipblaslt_TN_73645,0.744098
GemmTunableOp_Half_TN,tn_76032_106_8192,Gemm_Hipblaslt_TN_88096,1.04852
GemmTunableOp_Half_TN,tn_5120_30908_8192,Gemm_Hipblaslt_TN_9240,10.0497
GemmTunableOp_Half_TN,tn_8192_208_14784,Gemm_Hipblaslt_TN_72292,0.239446
GemmTunableOp_Half_TN,tn_5120_2368_8192,Gemm_Rocblas_621289120,0.78622
GemmTunableOp_Half_TN,tn_5120_6141_8192,Gemm_Hipblaslt_TN_9238,1.86038
GemmTunableOp_Half_TN,tn_5120_176_8192,Gemm_Hipblaslt_TN_74055,0.076346
GemmTunableOp_Half_TN,tn_76032_101_8192,Gemm_Hipblaslt_TN_88097,1.04428
GemmTunableOp_Half_TN,tn_76032_180_8192,Gemm_Hipblaslt_TN_72216,1.31388
GemmTunableOp_Half_TN,tn_76032_164_8192,Gemm_Hipblaslt_TN_72216,1.30424
GemmTunableOp_Half_TN,tn_76032_196_8192,Gemm_Hipblaslt_TN_88172,1.46547
GemmTunableOp_Half_TN,tn_8192_6514_14784,Gemm_Rocblas_621282428,5.80715
GemmTunableOp_Half_TN,tn_8192_32622_14784,Gemm_Rocblas_621282852,28.6038
GemmTunableOp_Half_TN,tn_8192_31080_14784,Gemm_Rocblas_621282470,26.4798
GemmTunableOp_Half_TN,tn_8192_256_14784,Gemm_Hipblaslt_TN_73280,0.254353
GemmTunableOp_Half_TN,tn_8192_2368_14784,Gemm_Hipblaslt_TN_72076,2.18851
GemmTunableOp_Half_TN,tn_8192_2218_14784,Gemm_Hipblaslt_TN_74621,1.99279
GemmTunableOp_Half_TN,tn_8192_30908_4096,Gemm_Hipblaslt_TN_107347,7.95645
GemmTunableOp_Half_TN,tn_8192_30736_4096,Gemm_Rocblas_621282462,7.88533
GemmTunableOp_Half_TN,tn_76032_185_8192,Gemm_Hipblaslt_TN_72216,1.30447
GemmTunableOp_Half_TN,tn_29568_24564_8192,Gemm_Hipblaslt_TN_107362,47.5501
GemmTunableOp_Half_TN,tn_76032_224_8192,Gemm_Hipblaslt_TN_72307,1.42182
GemmTunableOp_Half_TN,tn_76032_177_8192,Gemm_Hipblaslt_TN_72216,1.29758
GemmTunableOp_Half_TN,tn_29568_144_8192,Gemm_Hipblaslt_TN_87578,0.500717
GemmTunableOp_Half_TN,tn_76032_169_8192,Gemm_Hipblaslt_TN_72216,1.30335
GemmTunableOp_Half_TN,tn_76032_12_8192,Gemm_Rocblas_621282656,0.432531
GemmTunableOp_Half_TN,tn_76032_153_8192,Gemm_Hipblaslt_TN_72143,1.16867
GemmTunableOp_Half_TN,tn_29568_32768_8192,Gemm_Rocblas_621282723,65.3251
GemmTunableOp_Half_TN,tn_29568_31412_8192,Gemm_Hipblaslt_TN_107366,62.677
GemmTunableOp_Half_TN,tn_76032_209_8192,Gemm_Hipblaslt_TN_88172,1.46534
GemmTunableOp_Half_TN,tn_29568_232_8192,Gemm_Rocblas_621289361,0.664627
GemmTunableOp_Half_TN,tn_76032_217_8192,Gemm_Hipblaslt_TN_88172,1.46613
GemmTunableOp_Half_TN,tn_29568_200_8192,Gemm_Hipblaslt_TN_87580,0.64118
GemmTunableOp_Half_TN,tn_76032_242_8192,Gemm_Rocblas_621283143,1.65314
GemmTunableOp_Half_TN,tn_76032_233_8192,Gemm_Rocblas_621283159,1.65711
GemmTunableOp_Half_TN,tn_76032_72_8192,Gemm_Hipblaslt_TN_71857,0.781358
GemmTunableOp_Half_TN,tn_76032_193_8192,Gemm_Hipblaslt_TN_88172,1.45165
GemmTunableOp_Half_TN,tn_76032_201_8192,Gemm_Hipblaslt_TN_88172,1.45702
GemmTunableOp_Half_TN,tn_76032_64_8192,Gemm_Hipblaslt_TN_74353,0.629907
GemmTunableOp_Half_TN,tn_29568_224_8192,Gemm_Hipblaslt_TN_87580,0.636218
GemmTunableOp_Half_TN,tn_76032_251_8192,Gemm_Rocblas_621283159,1.66182
GemmTunableOp_Half_TN,tn_8192_2068_4096,Gemm_Hipblaslt_TN_74450,0.563025
GemmTunableOp_Half_TN,tn_8192_192_4096,Gemm_Hipblaslt_TN_72912,0.0711082
GemmTunableOp_Half_TN,tn_76032_161_8192,Gemm_Hipblaslt_TN_72216,1.29418
GemmTunableOp_Half_TN,tn_76032_8_8192,Gemm_Rocblas_621282656,0.429922
GemmTunableOp_Half_TN,tn_76032_83_8192,Gemm_Hipblaslt_TN_71907,0.851729
GemmTunableOp_Half_TN,tn_8192_160_14784,Gemm_Hipblaslt_TN_74157,0.17472
GemmTunableOp_Half_TN,tn_76032_94_8192,Gemm_Hipblaslt_TN_71907,0.848055
GemmTunableOp_Half_TN,tn_8192_112_14784,Gemm_Hipblaslt_TN_73979,0.14008
GemmTunableOp_Half_TN,tn_8192_136_14784,Gemm_Hipblaslt_TN_73883,0.167823
GemmTunableOp_Half_TN,tn_8192_32752_14784,Gemm_Rocblas_621282466,28.7458
GemmTunableOp_Half_TN,tn_8192_30746_14784,Gemm_Rocblas_621289071,27.2529
GemmTunableOp_Half_TN,tn_8192_24564_4096,Default,6.43956
GemmTunableOp_Half_TN,tn_8192_216_4096,Gemm_Hipblaslt_TN_73513,0.0850146
GemmTunableOp_Half_TN,tn_8192_2047_4096,Gemm_Rocblas_621282830,0.55019
GemmTunableOp_Half_TN,tn_8192_176_14784,Gemm_Hipblaslt_TN_72989,0.187891
GemmTunableOp_Half_TN,tn_8192_104_4096,Gemm_Hipblaslt_TN_72639,0.0559807
GemmTunableOp_Half_TN,tn_76032_95_8192,Gemm_Hipblaslt_TN_71916,0.818135
GemmTunableOp_Half_TN,tn_76032_84_8192,Gemm_Hipblaslt_TN_71907,0.850165
GemmTunableOp_Half_TN,tn_76032_76_8192,Gemm_Hipblaslt_TN_71850,0.790389
GemmTunableOp_Half_TN,tn_5120_30476_8192,Gemm_Hipblaslt_TN_74481,9.52084
GemmTunableOp_Half_TN,tn_5120_104_8192,Gemm_Rocblas_621288850,0.0549447
GemmTunableOp_Half_TN,tn_8192_120_4096,Gemm_Hipblaslt_TN_107350,0.0566597
GemmTunableOp_Half_TN,tn_29568_32752_8192,Gemm_Rocblas_621282723,65.9128
GemmTunableOp_Half_TN,tn_5120_160_8192,Gemm_Hipblaslt_TN_72371,0.0672828
GemmTunableOp_Half_TN,tn_5120_144_8192,Gemm_Hipblaslt_TN_72371,0.0672179
GemmTunableOp_Half_TN,tn_5120_112_8192,Gemm_Rocblas_621288850,0.0546807
GemmTunableOp_Half_TN,tn_5120_2047_8192,Gemm_Hipblaslt_TN_74638,0.62941
GemmTunableOp_Half_TN,tn_8192_24_4096,Gemm_Rocblas_621288838,0.026845
GemmTunableOp_Half_TN,tn_5120_184_8192,Gemm_Hipblaslt_TN_74055,0.0782529
GemmTunableOp_Half_TN,tn_76032_187_8192,Gemm_Hipblaslt_TN_72223,1.30907
GemmTunableOp_Half_TN,tn_5120_128_8192,Gemm_Rocblas_621288850,0.0538964
GemmTunableOp_Half_TN,tn_76032_68_8192,Gemm_Hipblaslt_TN_71850,0.78525
GemmTunableOp_Half_TN,tn_5120_2268_8192,Gemm_Rocblas_621282852,0.740806
GemmTunableOp_Half_TN,tn_5120_31412_8192,Gemm_Hipblaslt_TN_72996,9.90681
GemmTunableOp_Half_TN,tn_76032_211_8192,Gemm_Hipblaslt_TN_88172,1.46292
GemmTunableOp_Half_TN,tn_29568_10235_8192,Gemm_Hipblaslt_TN_107366,20.6225
GemmTunableOp_Half_TN,tn_5120_32752_8192,Gemm_Hipblaslt_TN_72996,10.1711
GemmTunableOp_Half_TN,tn_8192_32036_14784,Gemm_Rocblas_621282447,28.2512
GemmTunableOp_Half_TN,tn_8192_2268_14784,Gemm_Hipblaslt_TN_74492,1.96626
GemmTunableOp_Half_TN,tn_8192_144_14784,Gemm_Hipblaslt_TN_73883,0.165895
GemmTunableOp_Half_TN,tn_76032_171_8192,Gemm_Hipblaslt_TN_72216,1.29775
GemmTunableOp_Half_TN,tn_76032_203_8192,Gemm_Hipblaslt_TN_88172,1.45421
GemmTunableOp_Half_TN,tn_76032_219_8192,Gemm_Hipblaslt_TN_88172,1.46536
GemmTunableOp_Half_TN,tn_76032_163_8192,Gemm_Hipblaslt_TN_72216,1.28792
GemmTunableOp_Half_TN,tn_76032_179_8192,Gemm_Hipblaslt_TN_72216,1.29974
GemmTunableOp_Half_TN,tn_29568_31080_8192,Gemm_Hipblaslt_TN_107366,62.6881
GemmTunableOp_Half_TN,tn_76032_109_8192,Gemm_Hipblaslt_TN_88096,1.04218
GemmTunableOp_Half_TN,tn_76032_195_8192,Gemm_Hipblaslt_TN_88172,1.45317
GemmTunableOp_Half_TN,tn_76032_156_8192,Gemm_Hipblaslt_TN_72143,1.16618
GemmTunableOp_Half_TN,tn_76032_227_8192,Gemm_Rocblas_621283017,1.6456
GemmTunableOp_Half_TN,tn_76032_256_8192,Gemm_Rocblas_621283159,1.64071
GemmTunableOp_Half_TN,tn_76032_236_8192,Gemm_Rocblas_621289361,1.64364
GemmTunableOp_Half_TN,tn_76032_245_8192,Gemm_Rocblas_621289221,1.65749
GemmTunableOp_Half_TN,tn_8192_6141_14784,Gemm_Rocblas_621282926,5.50263
GemmTunableOp_Half_TN,tn_8192_56_4096,Gemm_Rocblas_621282641,0.0323529
GemmTunableOp_Half_TN,tn_8192_4094_4096,Gemm_Rocblas_621282852,1.0794
GemmTunableOp_Half_TN,tn_8192_32036_4096,Gemm_Hipblaslt_TN_72545,8.22525
GemmTunableOp_Half_TN,tn_8192_32_14784,Gemm_Rocblas_621282499,0.0788013
GemmTunableOp_Half_TN,tn_8192_30746_4096,Gemm_Hipblaslt_TN_107347,8.0815
GemmTunableOp_Half_TN,tn_8192_2478_4096,Gemm_Hipblaslt_TN_72545,0.656996
GemmTunableOp_Half_TN,tn_8192_224_4096,Gemm_Hipblaslt_TN_73514,0.0839198
GemmTunableOp_Half_TN,tn_8192_232_14784,Gemm_Hipblaslt_TN_74098,0.24961
GemmTunableOp_Half_TN,tn_8192_10235_14784,Gemm_Rocblas_621289071,8.3776
GemmTunableOp_Half_TN,tn_76032_9_8192,Gemm_Rocblas_621282656,0.435784
GemmTunableOp_Half_TN,tn_76032_65_8192,Gemm_Hipblaslt_TN_71861,0.783341
GemmTunableOp_Half_TN,tn_76032_73_8192,Gemm_Hipblaslt_TN_71861,0.768252
GemmTunableOp_Half_TN,tn_76032_250_8192,Gemm_Rocblas_621283143,1.67603
GemmTunableOp_Half_TN,tn_76032_241_8192,Gemm_Rocblas_621283159,1.67508
GemmTunableOp_Half_TN,tn_5120_224_8192,Gemm_Hipblaslt_TN_87905,0.0940365
GemmTunableOp_Half_TN,tn_5120_2318_8192,Gemm_Rocblas_621289056,0.756606
GemmTunableOp_Half_TN,tn_5120_216_8192,Gemm_Hipblaslt_TN_72986,0.0942384
GemmTunableOp_Half_TN,tn_29568_176_8192,Gemm_Hipblaslt_TN_87579,0.583778
GemmTunableOp_Half_TN,tn_8192_32359_4096,Gemm_Hipblaslt_TN_107347,8.31881
GemmTunableOp_Half_TN,tn_5120_30494_8192,Gemm_Hipblaslt_TN_74498,9.84904
GemmTunableOp_Half_TN,tn_76032_111_8192,Gemm_Hipblaslt_TN_88097,1.05027
GemmTunableOp_Half_TN,tn_29568_4094_8192,Gemm_Hipblaslt_TN_107362,7.86849
GemmTunableOp_Half_TN,tn_29568_32054_8192,Gemm_Hipblaslt_TN_107366,64.9721
GemmTunableOp_Half_TN,tn_8192_30992_4096,Gemm_Rocblas_621282462,7.9982
GemmTunableOp_Half_TN,tn_5120_208_8192,Gemm_Hipblaslt_TN_85682,0.0889878
GemmTunableOp_Half_TN,tn_5120_32_8192,Gemm_Rocblas_621282460,0.0350485
GemmTunableOp_Half_TN,tn_5120_4094_8192,Gemm_Rocblas_621289056,1.26929
GemmTunableOp_Half_TN,tn_76032_232_8192,Gemm_Rocblas_621283143,1.67175
GemmTunableOp_Half_TN,tn_8192_32752_4096,Gemm_Rocblas_621282462,8.33007
GemmTunableOp_Half_TN,tn_29568_32_8192,Gemm_Rocblas_621288806,0.209064
GemmTunableOp_Half_TN,tn_76032_159_8192,Gemm_Hipblaslt_TN_72143,1.17812
GemmTunableOp_Half_TN,tn_76032_199_8192,Gemm_Hipblaslt_TN_88172,1.46672
GemmTunableOp_Half_TN,tn_8192_2068_14784,Gemm_Hipblaslt_TN_74834,1.91475
GemmTunableOp_Half_TN,tn_29568_30476_8192,Gemm_Hipblaslt_TN_88157,61.0575
GemmTunableOp_Half_TN,tn_29568_240_8192,Gemm_Rocblas_621283017,0.668124
GemmTunableOp_Half_TN,tn_29568_2128_8192,Gemm_Hipblaslt_TN_107366,4.84464
GemmTunableOp_Half_TN,tn_29568_104_8192,Gemm_Hipblaslt_TN_72059,0.426688
GemmTunableOp_Half_TN,tn_76032_215_8192,Gemm_Hipblaslt_TN_88172,1.47512
GemmTunableOp_Half_TN,tn_5120_32359_8192,Gemm_Hipblaslt_TN_74518,9.96572
GemmTunableOp_Half_TN,tn_76032_100_8192,Gemm_Hipblaslt_TN_88096,1.04711
GemmTunableOp_Half_TN,tn_76032_105_8192,Gemm_Hipblaslt_TN_88096,1.04602
GemmTunableOp_Half_TN,tn_76032_223_8192,Gemm_Hipblaslt_TN_88172,1.48375
GemmTunableOp_Half_TN,tn_8192_32622_4096,Gemm_Hipblaslt_TN_107347,8.34107
GemmTunableOp_Half_TN,tn_76032_60_8192,Gemm_Hipblaslt_TN_74353,0.654262
GemmTunableOp_Half_TN,tn_76032_167_8192,Gemm_Hipblaslt_TN_72216,1.30928
GemmTunableOp_Half_TN,tn_76032_207_8192,Gemm_Hipblaslt_TN_88172,1.47281
GemmTunableOp_Half_TN,tn_76032_191_8192,Default,1.31026
GemmTunableOp_Half_TN,tn_8192_32_4096,Gemm_Rocblas_621282629,0.0269204
GemmTunableOp_Half_TN,tn_8192_30476_4096,Gemm_Hipblaslt_TN_107347,7.94885
GemmTunableOp_Half_TN,tn_76032_80_8192,Gemm_Hipblaslt_TN_71850,0.763088
GemmTunableOp_Half_TN,tn_76032_175_8192,Gemm_Hipblaslt_TN_72216,1.30554
GemmTunableOp_Half_TN,tn_76032_183_8192,Gemm_Hipblaslt_TN_72216,1.31609
GemmTunableOp_Half_TN,tn_8192_96_14784,Gemm_Hipblaslt_TN_86867,0.118535
GemmTunableOp_Half_TN,tn_76032_197_8192,Gemm_Hipblaslt_TN_88172,1.46466
GemmTunableOp_Half_TN,tn_76032_173_8192,Gemm_Hipblaslt_TN_72223,1.31322
GemmTunableOp_Half_TN,tn_8192_40_14784,Gemm_Hipblaslt_TN_74553,0.0890663
GemmTunableOp_Half_TN,tn_5120_8_8192,Gemm_Rocblas_621288731,0.0331409
GemmTunableOp_Half_TN,tn_76032_70_8192,Gemm_Hipblaslt_TN_71850,0.771879
GemmTunableOp_Half_TN,tn_76032_152_8192,Gemm_Hipblaslt_TN_72143,1.17752
GemmTunableOp_Half_TN,tn_29568_32710_8192,Gemm_Hipblaslt_TN_107366,66.3175
GemmTunableOp_Half_TN,tn_8192_16_14784,Gemm_Hipblaslt_TN_87199,0.0637736
GemmTunableOp_Half_TN,tn_76032_10_8192,Gemm_Rocblas_621282656,0.430629
GemmTunableOp_Half_TN,tn_8192_40_4096,Gemm_Hipblaslt_TN_87479,0.0318874
GemmTunableOp_Half_TN,tn_5120_80_8192,Gemm_Hipblaslt_TN_74585,0.0470737
GemmTunableOp_Half_TN,tn_29568_120_8192,Gemm_Hipblaslt_TN_72059,0.430003
GemmTunableOp_Half_TN,tn_76032_16_8192,Gemm_Rocblas_621282656,0.440262
GemmTunableOp_Half_TN,tn_76032_221_8192,Gemm_Hipblaslt_TN_88172,1.48479
GemmTunableOp_Half_TN,tn_29568_184_8192,Gemm_Hipblaslt_TN_87579,0.58267
GemmTunableOp_Half_TN,tn_8192_64_14784,Gemm_Rocblas_621282641,0.0983927
GemmTunableOp_Half_TN,tn_29568_2218_8192,Gemm_Hipblaslt_TN_107366,4.86102
GemmTunableOp_Half_TN,tn_8192_2047_14784,Gemm_Rocblas_621289114,1.86848
GemmTunableOp_Half_TN,tn_5120_72_8192,Gemm_Hipblaslt_TN_73129,0.0475789
GemmTunableOp_Half_TN,tn_8192_80_14784,Gemm_Hipblaslt_TN_86867,0.114567
GemmTunableOp_Half_TN,tn_76032_62_8192,Gemm_Rocblas_621288849,0.654942
GemmTunableOp_Half_TN,tn_29568_2478_8192,Gemm_Hipblaslt_TN_107366,5.44343
GemmTunableOp_Half_TN,tn_8192_72_4096,Gemm_Hipblaslt_TN_74372,0.042944
GemmTunableOp_Half_TN,tn_8192_8_14784,Gemm_Hipblaslt_TN_86979,0.0629435
GemmTunableOp_Half_TN,tn_5120_10235_8192,Gemm_Hipblaslt_TN_74447,3.41763
GemmTunableOp_Half_TN,tn_29568_30992_8192,Gemm_Rocblas_621282559,62.8668
GemmTunableOp_Half_TN,tn_76032_181_8192,Gemm_Hipblaslt_TN_72216,1.31784
GemmTunableOp_Half_TN,tn_5120_96_8192,Gemm_Hipblaslt_TN_74513,0.0503162
GemmTunableOp_Half_TN,tn_5120_88_8192,Gemm_Hipblaslt_TN_72188,0.049944
GemmTunableOp_Half_TN,tn_76032_102_8192,Gemm_Rocblas_621288636,1.0496
GemmTunableOp_Half_TN,tn_5120_2218_8192,Gemm_Hipblaslt_TN_73645,0.752344
GemmTunableOp_Half_TN,tn_5120_30992_8192,Gemm_Rocblas_621288659,10.0507
GemmTunableOp_Half_TN,tn_5120_2478_8192,Gemm_Rocblas_621289130,0.794959
GemmTunableOp_Half_TN,tn_76032_205_8192,Gemm_Hipblaslt_TN_88172,1.47212
GemmTunableOp_Half_TN,tn_5120_32622_8192,Gemm_Hipblaslt_TN_74518,9.99175
GemmTunableOp_Half_TN,tn_76032_229_8192,Gemm_Rocblas_621289221,1.66515
GemmTunableOp_Half_TN,tn_76032_247_8192,Gemm_Rocblas_621283017,1.67648
GemmTunableOp_Half_TN,tn_76032_58_8192,Gemm_Rocblas_621288845,0.642285
GemmTunableOp_Half_TN,tn_76032_86_8192,Gemm_Hipblaslt_TN_72494,0.821355
GemmTunableOp_Half_TN,tn_76032_98_8192,Gemm_Hipblaslt_TN_88096,1.04064
GemmTunableOp_Half_TN,tn_76032_165_8192,Gemm_Hipblaslt_TN_72216,1.30562
GemmTunableOp_Half_TN,tn_8192_72_14784,Gemm_Hipblaslt_TN_86679,0.115113
GemmTunableOp_Half_TN,tn_8192_128_14784,Gemm_Hipblaslt_TN_73145,0.138472
GemmTunableOp_Half_TN,tn_76032_239_8192,Gemm_Rocblas_621289361,1.67921
GemmTunableOp_Half_TN,tn_8192_168_14784,Gemm_Hipblaslt_TN_72989,0.196503
GemmTunableOp_Half_TN,tn_8192_32054_4096,Gemm_Hipblaslt_TN_107347,8.32052
GemmTunableOp_Half_TN,tn_8192_2218_4096,Gemm_Hipblaslt_TN_72537,0.591643
GemmTunableOp_Half_TN,tn_76032_107_8192,Gemm_Hipblaslt_TN_88097,1.04775
GemmTunableOp_Half_TN,tn_8192_232_4096,Gemm_Hipblaslt_TN_74098,0.0874924
GemmTunableOp_Half_TN,tn_76032_78_8192,Gemm_Hipblaslt_TN_71861,0.772598
GemmTunableOp_Half_TN,tn_8192_240_4096,Gemm_Hipblaslt_TN_74098,0.087552
GemmTunableOp_Half_TN,tn_8192_248_14784,Gemm_Hipblaslt_TN_74098,0.256781
GemmTunableOp_Half_TN,tn_76032_189_8192,Gemm_Hipblaslt_TN_72216,1.31757
GemmTunableOp_Half_TN,tn_8192_30494_4096,Gemm_Hipblaslt_TN_107347,7.94196
GemmTunableOp_Half_TN,tn_76032_213_8192,Gemm_Hipblaslt_TN_87509,1.43015
GemmTunableOp_Half_TN,tn_8192_30908_14784,Gemm_Rocblas_621282852,27.5195
GemmTunableOp_Half_TN,tn_8192_32498_4096,Gemm_Hipblaslt_TN_9240,8.472
GemmTunableOp_Half_TN,tn_8192_32710_4096,Gemm_Hipblaslt_TN_107347,8.45209
GemmTunableOp_Half_TN,tn_8192_4094_14784,Gemm_Rocblas_621288916,3.63042
GemmTunableOp_Half_TN,tn_8192_88_7392,Gemm_Hipblaslt_TN_86867,0.0716253
GemmTunableOp_Half_TN,tn_8192_32768_2048,Gemm_Rocblas_621282462,4.48688
GemmTunableOp_Half_TN,tn_8192_32_7392,Gemm_Rocblas_621282499,0.045451
GemmTunableOp_Half_TN,tn_8192_200_2048,Gemm_Hipblaslt_TN_87685,0.0497871
GemmTunableOp_Half_TN,tn_8192_184_2048,Gemm_Hipblaslt_TN_87579,0.0452475
GemmTunableOp_Half_TN,tn_8192_32_2048,Gemm_Rocblas_621288838,0.0176998
GemmTunableOp_Half_TN,tn_8192_168_2048,Gemm_Hipblaslt_TN_87579,0.0451409
GemmTunableOp_Half_TN,tn_8192_248_2048,Gemm_Rocblas_621282817,0.0530135
GemmTunableOp_Half_TN,tn_8192_16_2048,Gemm_Rocblas_621288696,0.015891
GemmTunableOp_Half_TN,tn_8192_136_2048,Gemm_Hipblaslt_TN_87578,0.0415047
GemmTunableOp_Half_TN,tn_8192_128_2048,Gemm_Hipblaslt_TN_87681,0.0321362
GemmTunableOp_Half_TN,tn_8192_104_7392,Gemm_Rocblas_621288859,0.084919
GemmTunableOp_Half_TN,tn_2560_168_8192,Gemm_Hipblaslt_TN_72979,0.0455519
GemmTunableOp_Half_TN,tn_14784_200_8192,Gemm_Hipblaslt_TN_88118,0.207884
GemmTunableOp_Half_TN,tn_2560_16_8192,Gemm_Rocblas_621282453,0.0167479
GemmTunableOp_Half_TN,tn_2560_8_8192,Gemm_Rocblas_621288684,0.0169098
GemmTunableOp_Half_TN,tn_14784_256_8192,Gemm_Rocblas_621282934,0.219215
GemmTunableOp_Half_TN,tn_8192_16_7392,Gemm_Hipblaslt_TN_74647,0.0398974
GemmTunableOp_Half_TN,tn_2560_208_8192,Gemm_Hipblaslt_TN_87634,0.0537134
GemmTunableOp_Half_TN,tn_8192_216_7392,Gemm_Hipblaslt_TN_74600,0.134611
GemmTunableOp_Half_TN,tn_14784_152_8192,Gemm_Hipblaslt_TN_72794,0.156492
GemmTunableOp_Half_TN,tn_14784_96_8192,Gemm_Rocblas_621282952,0.121073
GemmTunableOp_Half_TN,tn_2560_8188_8192,Gemm_Rocblas_621282852,1.27525
GemmTunableOp_Half_TN,tn_8192_104_2048,Gemm_Hipblaslt_TN_87577,0.0335355
GemmTunableOp_Half_TN,tn_2560_40_8192,Gemm_Hipblaslt_TN_87766,0.025068
GemmTunableOp_Half_TN,tn_2560_240_8192,Gemm_Rocblas_621288872,0.0548563
GemmTunableOp_Half_TN,tn_2560_64_8192,Gemm_Rocblas_621282583,0.0263011
GemmTunableOp_Half_TN,tn_8192_8188_7392,Gemm_Hipblaslt_TN_74108,3.89161
GemmTunableOp_Half_TN,tn_8192_80_7392,Gemm_Hipblaslt_TN_74372,0.0723253
GemmTunableOp_Half_TN,tn_8192_64_7392,Gemm_Rocblas_621288850,0.0561033
GemmTunableOp_Half_TN,tn_8192_64_2048,Gemm_Rocblas_621288850,0.021058
GemmTunableOp_Half_TN,tn_14784_40_8192,Gemm_Hipblaslt_TN_71718,0.0910574
GemmTunableOp_Half_TN,tn_8192_120_2048,Gemm_Hipblaslt_TN_87577,0.0336385
GemmTunableOp_Half_TN,tn_14784_16_8192,Gemm_Rocblas_621282486,0.0682096
GemmTunableOp_Half_TN,tn_8192_128_7392,Gemm_Rocblas_621282948,0.0829709
GemmTunableOp_Half_TN,tn_14784_160_8192,Gemm_Hipblaslt_TN_72917,0.15298
GemmTunableOp_Half_TN,tn_14784_224_8192,Gemm_Rocblas_621289125,0.20366
GemmTunableOp_Half_TN,tn_8192_48_2048,Gemm_Hipblaslt_TN_74655,0.0208368
GemmTunableOp_Half_TN,tn_14784_8188_8192,Gemm_Hipblaslt_TN_74482,6.9292
GemmTunableOp_Half_TN,tn_8192_72_7392,Gemm_Hipblaslt_TN_72598,0.0702586
GemmTunableOp_Half_TN,tn_8192_256_7392,Gemm_Hipblaslt_TN_74837,0.142418
GemmTunableOp_Half_TN,tn_14784_56_8192,Gemm_Hipblaslt_TN_72350,0.0974218
GemmTunableOp_Half_TN,tn_8192_152_2048,Gemm_Hipblaslt_TN_87578,0.0416477
GemmTunableOp_Half_TN,tn_8192_224_7392,Gemm_Hipblaslt_TN_73485,0.141438
GemmTunableOp_Half_TN,tn_8192_48_7392,Gemm_Hipblaslt_TN_74655,0.0525492
GemmTunableOp_Half_TN,tn_8192_160_7392,Gemm_Hipblaslt_TN_72903,0.104045
GemmTunableOp_Half_TN,tn_8192_192_7392,Gemm_Hipblaslt_TN_74522,0.113594
GemmTunableOp_Half_TN,tn_8192_96_7392,Gemm_Hipblaslt_TN_87677,0.071822
GemmTunableOp_Half_TN,tn_8192_96_2048,Gemm_Hipblaslt_TN_74606,0.0309504
GemmTunableOp_Half_TN,tn_8192_88_2048,Gemm_Hipblaslt_TN_71916,0.0284747
GemmTunableOp_Half_TN,tn_8192_32752_2048,Gemm_Rocblas_621282462,4.43613
GemmTunableOp_Half_TN,tn_8192_256_2048,Gemm_Rocblas_621282536,0.0470261
GemmTunableOp_Half_TN,tn_8192_240_2048,Gemm_Hipblaslt_TN_87581,0.0527543
GemmTunableOp_Half_TN,tn_14784_168_8192,Gemm_Hipblaslt_TN_88013,0.182127
GemmTunableOp_Half_TN,tn_8192_24_2048,Gemm_Rocblas_621288838,0.0177454
GemmTunableOp_Half_TN,tn_14784_240_8192,Gemm_Hipblaslt_TN_74818,0.222433
GemmTunableOp_Half_TN,tn_14784_8_8192,Gemm_Rocblas_621288701,0.0677585
GemmTunableOp_Half_TN,tn_14784_88_8192,Gemm_Rocblas_621282952,0.120852
GemmTunableOp_Half_TN,tn_8192_232_2048,Gemm_Hipblaslt_TN_87581,0.0527107
GemmTunableOp_Half_TN,tn_2560_192_8192,Gemm_Hipblaslt_TN_87691,0.0473454
GemmTunableOp_Half_TN,tn_8192_176_7392,Gemm_Hipblaslt_TN_74522,0.109546
GemmTunableOp_Half_TN,tn_2560_232_8192,Gemm_Rocblas_621282640,0.0545054
GemmTunableOp_Half_TN,tn_2560_32752_8192,Gemm_Hipblaslt_TN_74387,5.27009
GemmTunableOp_Half_TN,tn_14784_128_8192,Gemm_Rocblas_621289166,0.130022
GemmTunableOp_Half_TN,tn_2560_160_8192,Gemm_Hipblaslt_TN_72872,0.0421905
GemmTunableOp_Half_TN,tn_8192_216_2048,Gemm_Hipblaslt_TN_87685,0.0496517
GemmTunableOp_Half_TN,tn_8192_144_7392,Gemm_Hipblaslt_TN_73880,0.0969935
GemmTunableOp_Half_TN,tn_14784_32752_8192,Gemm_Rocblas_621296657,28.1028
GemmTunableOp_Half_TN,tn_14784_24_8192,Gemm_Hipblaslt_TN_86084,0.0810644
GemmTunableOp_Half_TN,tn_14784_192_8192,Gemm_Rocblas_621288944,0.177474
GemmTunableOp_Half_TN,tn_14784_104_8192,Gemm_Rocblas_621288862,0.132099
GemmTunableOp_Half_TN,tn_14784_208_8192,Gemm_Hipblaslt_TN_88118,0.208442
GemmTunableOp_Half_TN,tn_14784_32768_8192,Gemm_Rocblas_621296657,27.9205
GemmTunableOp_Half_TN,tn_14784_144_8192,Gemm_Hipblaslt_TN_72923,0.156616
GemmTunableOp_Half_TN,tn_8192_32768_7392,Gemm_Rocblas_621282472,14.6462
GemmTunableOp_Half_TN,tn_8192_200_7392,Gemm_Hipblaslt_TN_74600,0.134146
GemmTunableOp_Half_TN,tn_8192_136_7392,Gemm_Hipblaslt_TN_74202,0.105056
GemmTunableOp_Half_TN,tn_8192_192_2048,Gemm_Hipblaslt_TN_87579,0.0436599
GemmTunableOp_Half_TN,tn_8192_112_7392,Gemm_Rocblas_621288859,0.0842764
GemmTunableOp_Half_TN,tn_8192_112_2048,Gemm_Hipblaslt_TN_87681,0.0330992
GemmTunableOp_Half_TN,tn_8192_176_2048,Gemm_Hipblaslt_TN_87579,0.0452939
GemmTunableOp_Half_TN,tn_2560_128_8192,Gemm_Hipblaslt_TN_72350,0.0372042
GemmTunableOp_Half_TN,tn_14784_112_8192,Gemm_Rocblas_621288862,0.131458
GemmTunableOp_Half_TN,tn_14784_248_8192,Gemm_Hipblaslt_TN_73003,0.22404
GemmTunableOp_Half_TN,tn_14784_184_8192,Gemm_Hipblaslt_TN_88013,0.182509
GemmTunableOp_Half_TN,tn_14784_80_8192,Gemm_Rocblas_621289156,0.119896
GemmTunableOp_Half_TN,tn_2560_200_8192,Gemm_Hipblaslt_TN_73236,0.0528661
GemmTunableOp_Half_TN,tn_8192_240_7392,Gemm_Hipblaslt_TN_74837,0.137379
GemmTunableOp_Half_TN,tn_2560_152_8192,Gemm_Hipblaslt_TN_72872,0.0429012
GemmTunableOp_Half_TN,tn_38016_244_8192,Gemm_Rocblas_621288661,0.860022
GemmTunableOp_Half_TN,tn_2560_256_8192,Gemm_Rocblas_621282640,0.0543908
GemmTunableOp_Half_TN,tn_2560_24_8192,Gemm_Rocblas_621288712,0.019718
GemmTunableOp_Half_TN,tn_2560_56_8192,Gemm_Rocblas_621288802,0.026521
GemmTunableOp_Half_TN,tn_2560_96_8192,Gemm_Hipblaslt_TN_85405,0.0327608
GemmTunableOp_Half_TN,tn_2560_80_8192,Gemm_Hipblaslt_TN_72469,0.0327908
GemmTunableOp_Half_TN,tn_8192_80_2048,Gemm_Hipblaslt_TN_71860,0.0268122
GemmTunableOp_Half_TN,tn_8192_8_7392,Gemm_Hipblaslt_TN_74647,0.0395285
GemmTunableOp_Half_TN,tn_8192_8_2048,Gemm_Rocblas_621288696,0.0159299
GemmTunableOp_Half_TN,tn_8192_72_2048,Gemm_Hipblaslt_TN_74662,0.0283605
GemmTunableOp_Half_TN,tn_8192_56_7392,Gemm_Rocblas_621282641,0.05603
GemmTunableOp_Half_TN,tn_8192_40_2048,Gemm_Hipblaslt_TN_74349,0.0210716
GemmTunableOp_Half_TN,tn_8192_56_2048,Gemm_Rocblas_621282641,0.0213196
GemmTunableOp_Half_TN,tn_8192_24_7392,Gemm_Hipblaslt_TN_74552,0.0450928
GemmTunableOp_Half_TN,tn_14784_120_8192,Gemm_Rocblas_621282653,0.131017
GemmTunableOp_Half_TN,tn_14784_232_8192,Gemm_Hipblaslt_TN_74818,0.224152
GemmTunableOp_Half_TN,tn_14784_72_8192,Gemm_Rocblas_621282952,0.121445
GemmTunableOp_Half_TN,tn_14784_176_8192,Gemm_Hipblaslt_TN_88013,0.182191
GemmTunableOp_Half_TN,tn_8192_8188_2048,Gemm_Hipblaslt_TN_88152,1.10257
GemmTunableOp_Half_TN,tn_2560_120_8192,Gemm_Hipblaslt_TN_72350,0.037195
GemmTunableOp_Half_TN,tn_2560_32768_8192,Gemm_Hipblaslt_TN_74702,5.24011
GemmTunableOp_Half_TN,tn_8192_40_7392,Gemm_Hipblaslt_TN_74821,0.0528453
GemmTunableOp_Half_TN,tn_2560_184_8192,Gemm_Hipblaslt_TN_72979,0.0463892
GemmTunableOp_Half_TN,tn_2560_144_8192,Gemm_Hipblaslt_TN_87631,0.0428295
GemmTunableOp_Half_TN,tn_8192_152_7392,Gemm_Hipblaslt_TN_72903,0.106381
GemmTunableOp_Half_TN,tn_2560_224_8192,Gemm_Hipblaslt_TN_73236,0.0532307
GemmTunableOp_Half_TN,tn_8192_248_7392,Gemm_Hipblaslt_TN_74600,0.132594
GemmTunableOp_Half_TN,tn_2560_32_8192,Gemm_Rocblas_621288712,0.0197885
GemmTunableOp_Half_TN,tn_8192_208_7392,Gemm_Hipblaslt_TN_74600,0.132375
GemmTunableOp_Half_TN,tn_8192_184_7392,Gemm_Hipblaslt_TN_74522,0.109631
GemmTunableOp_Half_TN,tn_8192_32752_7392,Gemm_Rocblas_621282444,14.6181
GemmTunableOp_Half_TN,tn_8192_232_7392,Gemm_Hipblaslt_TN_74837,0.138195
GemmTunableOp_Half_TN,tn_8192_208_2048,Gemm_Hipblaslt_TN_87580,0.0495792
GemmTunableOp_Half_TN,tn_8192_120_7392,Gemm_Rocblas_621288858,0.0860058
GemmTunableOp_Half_TN,tn_8192_168_7392,Gemm_Hipblaslt_TN_74456,0.11244
GemmTunableOp_Half_TN,tn_38016_256_8192,Gemm_Rocblas_621282730,0.849003
GemmTunableOp_Half_TN,tn_8192_160_2048,Gemm_Hipblaslt_TN_87578,0.0402256
GemmTunableOp_Half_TN,tn_38016_16_8192,Gemm_Rocblas_621288703,0.218868
GemmTunableOp_Half_TN,tn_8192_224_2048,Gemm_Hipblaslt_TN_87580,0.0476331
GemmTunableOp_Half_TN,tn_2560_104_8192,Gemm_Hipblaslt_TN_72350,0.0366914
GemmTunableOp_Half_TN,tn_2560_88_8192,Gemm_Hipblaslt_TN_71895,0.0321294
GemmTunableOp_Half_TN,tn_14784_216_8192,Gemm_Hipblaslt_TN_88118,0.208926
GemmTunableOp_Half_TN,tn_8192_144_2048,Gemm_Hipblaslt_TN_87578,0.0415479
GemmTunableOp_Half_TN,tn_2560_48_8192,Gemm_Hipblaslt_TN_74435,0.0247996
GemmTunableOp_Half_TN,tn_14784_136_8192,Gemm_Hipblaslt_TN_72923,0.156889
GemmTunableOp_Half_TN,tn_14784_32_8192,Gemm_Hipblaslt_TN_86224,0.0818721
GemmTunableOp_Half_TN,tn_14784_48_8192,Gemm_Hipblaslt_TN_71718,0.0916852
GemmTunableOp_Half_TN,tn_2560_72_8192,Gemm_Hipblaslt_TN_85405,0.0325596
GemmTunableOp_Half_TN,tn_14784_64_8192,Gemm_Hipblaslt_TN_72377,0.103082
GemmTunableOp_Half_TN,tn_2560_248_8192,Gemm_Rocblas_621288850,0.0546844
GemmTunableOp_Half_TN,tn_2560_112_8192,Gemm_Hipblaslt_TN_72481,0.0374282
GemmTunableOp_Half_TN,tn_2560_136_8192,Gemm_Hipblaslt_TN_87630,0.0426796
GemmTunableOp_Half_TN,tn_2560_176_8192,Gemm_Hipblaslt_TN_72979,0.0460984
GemmTunableOp_Half_TN,tn_2560_216_8192,Gemm_Hipblaslt_TN_74085,0.0538804
GemmTunableOp_Half_TN,tn_8192_8188_1024,Gemm_Hipblaslt_TN_74303,0.613415
GemmTunableOp_Half_TN,tn_8192_80_1024,Gemm_Hipblaslt_TN_86714,0.0198149
GemmTunableOp_Half_TN,tn_8192_64_3696,Gemm_Rocblas_621282641,0.0377593
GemmTunableOp_Half_TN,tn_8192_64_1024,Gemm_Rocblas_621282806,0.014684
GemmTunableOp_Half_TN,tn_8192_56_1024,Gemm_Hipblaslt_TN_74586,0.0166133
GemmTunableOp_Half_TN,tn_1280_112_8192,Gemm_Hipblaslt_TN_72593,0.0258222
GemmTunableOp_Half_TN,tn_8192_248_3696,Gemm_Hipblaslt_TN_74600,0.0805602
GemmTunableOp_Half_TN,tn_8192_72_3696,Gemm_Hipblaslt_TN_87677,0.0429287
GemmTunableOp_Half_TN,tn_1280_184_8192,Gemm_Hipblaslt_TN_71895,0.0308205
GemmTunableOp_Half_TN,tn_8192_40_3696,Gemm_Rocblas_621283136,0.035544
GemmTunableOp_Half_TN,tn_7392_56_8192,Gemm_Rocblas_621282632,0.0536836
GemmTunableOp_Half_TN,tn_1280_8_8192,Gemm_Rocblas_621288645,0.0129702
GemmTunableOp_Half_TN,tn_1280_88_8192,Gemm_Hipblaslt_TN_87757,0.0231767
GemmTunableOp_Half_TN,tn_7392_152_8192,Gemm_Hipblaslt_TN_72133,0.0937675
GemmTunableOp_Half_TN,tn_7392_128_8192,Gemm_Rocblas_621288851,0.0785684
GemmTunableOp_Half_TN,tn_7392_224_8192,Gemm_Hipblaslt_TN_74094,0.126636
GemmTunableOp_Half_TN,tn_7392_104_8192,Gemm_Rocblas_621282642,0.0788576
GemmTunableOp_Half_TN,tn_7392_176_8192,Gemm_Hipblaslt_TN_72987,0.107275
GemmTunableOp_Half_TN,tn_1280_240_8192,Gemm_Hipblaslt_TN_72481,0.0358861
GemmTunableOp_Half_TN,tn_7392_8188_8192,Gemm_Hipblaslt_TN_9238,3.41623
GemmTunableOp_Half_TN,tn_8192_32768_3696,Gemm_Rocblas_621282984,7.18769
GemmTunableOp_Half_TN,tn_8192_240_3696,Gemm_Hipblaslt_TN_74524,0.0797249
GemmTunableOp_Half_TN,tn_8192_232_1024,Gemm_Rocblas_621282756,0.0330619
GemmTunableOp_Half_TN,tn_8192_224_1024,Gemm_Hipblaslt_TN_87461,0.029698
GemmTunableOp_Half_TN,tn_8192_208_1024,Gemm_Hipblaslt_TN_74617,0.0315681
GemmTunableOp_Half_TN,tn_1280_136_8192,Gemm_Hipblaslt_TN_72469,0.0288964
GemmTunableOp_Half_TN,tn_8192_176_3696,Gemm_Hipblaslt_TN_74595,0.0648314
GemmTunableOp_Half_TN,tn_1280_208_8192,Gemm_Hipblaslt_TN_72481,0.0349355
GemmTunableOp_Half_TN,tn_1280_32_8192,Gemm_Rocblas_621288646,0.0156751
GemmTunableOp_Half_TN,tn_1280_40_8192,Gemm_Rocblas_621288710,0.0191106
GemmTunableOp_Half_TN,tn_7392_24_8192,Gemm_Hipblaslt_TN_86084,0.0437238
GemmTunableOp_Half_TN,tn_1280_80_8192,Gemm_Hipblaslt_TN_71827,0.0229912
GemmTunableOp_Half_TN,tn_19008_256_8192,Gemm_Rocblas_621282427,0.394704
GemmTunableOp_Half_TN,tn_7392_184_8192,Gemm_Hipblaslt_TN_72987,0.108361
GemmTunableOp_Half_TN,tn_7392_240_8192,Gemm_Hipblaslt_TN_74126,0.134379
GemmTunableOp_Half_TN,tn_7392_8_8192,Gemm_Rocblas_621282487,0.0372245
GemmTunableOp_Half_TN,tn_8192_144_3696,Gemm_Hipblaslt_TN_87578,0.06037
GemmTunableOp_Half_TN,tn_7392_96_8192,Gemm_Hipblaslt_TN_72193,0.0637218
GemmTunableOp_Half_TN,tn_8192_120_3696,Gemm_Rocblas_621288859,0.0484649
GemmTunableOp_Half_TN,tn_7392_200_8192,Gemm_Hipblaslt_TN_74095,0.121735
GemmTunableOp_Half_TN,tn_1280_8188_8192,Gemm_Hipblaslt_TN_74365,0.65562
GemmTunableOp_Half_TN,tn_1280_48_8192,Gemm_Rocblas_621282490,0.0190737
GemmTunableOp_Half_TN,tn_1280_224_8192,Gemm_Hipblaslt_TN_87625,0.0352808
GemmTunableOp_Half_TN,tn_7392_32_8192,Gemm_Hipblaslt_TN_86084,0.0431494
GemmTunableOp_Half_TN,tn_1280_160_8192,Gemm_Hipblaslt_TN_72469,0.0286613
GemmTunableOp_Half_TN,tn_7392_32752_8192,Gemm_Hipblaslt_TN_74719,13.992
GemmTunableOp_Half_TN,tn_1280_16_8192,Gemm_Rocblas_621288644,0.0138075
GemmTunableOp_Half_TN,tn_8192_8_1024,Gemm_Hipblaslt_TN_87743,0.0133945
GemmTunableOp_Half_TN,tn_8192_48_3696,Gemm_Rocblas_621283136,0.0351666
GemmTunableOp_Half_TN,tn_8192_40_1024,Gemm_Rocblas_621288850,0.0145878
GemmTunableOp_Half_TN,tn_8192_8188_3696,Gemm_Hipblaslt_TN_72437,2.0807
GemmTunableOp_Half_TN,tn_8192_56_3696,Gemm_Rocblas_621282641,0.0377501
GemmTunableOp_Half_TN,tn_1280_152_8192,Gemm_Hipblaslt_TN_72469,0.0290114
GemmTunableOp_Half_TN,tn_8192_168_3696,Gemm_Hipblaslt_TN_74522,0.0646283
GemmTunableOp_Half_TN,tn_8192_72_1024,Gemm_Rocblas_621282649,0.0203829
GemmTunableOp_Half_TN,tn_1280_216_8192,Gemm_Hipblaslt_TN_72481,0.0350737
GemmTunableOp_Half_TN,tn_8192_80_3696,Gemm_Hipblaslt_TN_87457,0.042456
GemmTunableOp_Half_TN,tn_8192_152_1024,Gemm_Hipblaslt_TN_72905,0.0265073
GemmTunableOp_Half_TN,tn_8192_48_1024,Gemm_Hipblaslt_TN_87468,0.0145109
GemmTunableOp_Half_TN,tn_8192_224_3696,Gemm_Hipblaslt_TN_87461,0.0783749
GemmTunableOp_Half_TN,tn_1280_32752_8192,Gemm_Rocblas_621282440,2.75804
GemmTunableOp_Half_TN,tn_8192_256_3696,Gemm_Hipblaslt_TN_74524,0.0792246
GemmTunableOp_Half_TN,tn_7392_248_8192,Gemm_Hipblaslt_TN_72901,0.140393
GemmTunableOp_Half_TN,tn_8192_120_1024,Gemm_Rocblas_621288858,0.021942
GemmTunableOp_Half_TN,tn_8192_136_1024,Gemm_Hipblaslt_TN_73398,0.0256296
GemmTunableOp_Half_TN,tn_7392_88_8192,Gemm_Rocblas_621289097,0.0676172
GemmTunableOp_Half_TN,tn_8192_160_1024,Gemm_Hipblaslt_TN_72905,0.0252586
GemmTunableOp_Half_TN,tn_8192_216_1024,Gemm_Hipblaslt_TN_73514,0.0315312
GemmTunableOp_Half_TN,tn_8192_8_3696,Gemm_Hipblaslt_TN_107357,0.0268818
GemmTunableOp_Half_TN,tn_8192_200_1024,Gemm_Hipblaslt_TN_73514,0.0313457
GemmTunableOp_Half_TN,tn_7392_208_8192,Gemm_Hipblaslt_TN_74094,0.123013
GemmTunableOp_Half_TN,tn_7392_16_8192,Gemm_Rocblas_621288680,0.0390288
GemmTunableOp_Half_TN,tn_7392_32768_8192,Gemm_Hipblaslt_TN_74719,14.0787
GemmTunableOp_Half_TN,tn_1280_96_8192,Gemm_Hipblaslt_TN_87757,0.0232712
GemmTunableOp_Half_TN,tn_7392_136_8192,Gemm_Hipblaslt_TN_72133,0.0915943
GemmTunableOp_Half_TN,tn_1280_56_8192,Gemm_Rocblas_621288710,0.0191731
GemmTunableOp_Half_TN,tn_7392_112_8192,Gemm_Rocblas_621288856,0.0785876
GemmTunableOp_Half_TN,tn_1280_256_8192,Gemm_Hipblaslt_TN_72751,0.0363684
GemmTunableOp_Half_TN,tn_1280_200_8192,Gemm_Hipblaslt_TN_87687,0.0354955
GemmTunableOp_Half_TN,tn_7392_160_8192,Gemm_Hipblaslt_TN_72133,0.0935825
GemmTunableOp_Half_TN,tn_1280_144_8192,Gemm_Hipblaslt_TN_72469,0.0291805
GemmTunableOp_Half_TN,tn_8192_248_1024,Gemm_Rocblas_621283194,0.0320267
GemmTunableOp_Half_TN,tn_8192_216_3696,Gemm_Hipblaslt_TN_74524,0.0786233
GemmTunableOp_Half_TN,tn_8192_32752_3696,Gemm_Rocblas_621282984,7.18744
GemmTunableOp_Half_TN,tn_8192_192_3696,Gemm_Hipblaslt_TN_74595,0.0636332
GemmTunableOp_Half_TN,tn_8192_184_1024,Gemm_Hipblaslt_TN_72786,0.0287671
GemmTunableOp_Half_TN,tn_8192_168_1024,Gemm_Hipblaslt_TN_74061,0.0285007
GemmTunableOp_Half_TN,tn_8192_128_1024,Gemm_Rocblas_621289153,0.0195172
GemmTunableOp_Half_TN,tn_7392_168_8192,Gemm_Hipblaslt_TN_72987,0.106104
GemmTunableOp_Half_TN,tn_8192_104_1024,Gemm_Rocblas_621282650,0.0218467
GemmTunableOp_Half_TN,tn_1280_232_8192,Gemm_Hipblaslt_TN_72350,0.0362574
GemmTunableOp_Half_TN,tn_7392_64_8192,Gemm_Rocblas_621282632,0.0526724
GemmTunableOp_Half_TN,tn_1280_168_8192,Gemm_Hipblaslt_TN_85405,0.0322727
GemmTunableOp_Half_TN,tn_1280_64_8192,Gemm_Rocblas_621288710,0.0192812
GemmTunableOp_Half_TN,tn_19008_16_8192,Gemm_Rocblas_621282486,0.107492
GemmTunableOp_Half_TN,tn_1280_104_8192,Gemm_Hipblaslt_TN_72969,0.0257381
GemmTunableOp_Half_TN,tn_7392_120_8192,Gemm_Rocblas_621282642,0.0796548
GemmTunableOp_Half_TN,tn_7392_144_8192,Gemm_Hipblaslt_TN_72133,0.0934627
GemmTunableOp_Half_TN,tn_8192_32_1024,Gemm_Rocblas_621288838,0.0122764
GemmTunableOp_Half_TN,tn_7392_216_8192,Gemm_Hipblaslt_TN_74095,0.123435
GemmTunableOp_Half_TN,tn_7392_40_8192,Gemm_Hipblaslt_TN_74349,0.0519474
GemmTunableOp_Half_TN,tn_8192_136_3696,Gemm_Hipblaslt_TN_87682,0.0598007
GemmTunableOp_Half_TN,tn_8192_112_1024,Gemm_Rocblas_621282892,0.0217189
GemmTunableOp_Half_TN,tn_8192_96_1024,Gemm_Rocblas_621282649,0.0213772
GemmTunableOp_Half_TN,tn_8192_88_1024,Gemm_Rocblas_621288858,0.0211196
GemmTunableOp_Half_TN,tn_8192_232_3696,Gemm_Hipblaslt_TN_72438,0.0799397
GemmTunableOp_Half_TN,tn_8192_192_1024,Gemm_Hipblaslt_TN_87912,0.0273874
GemmTunableOp_Half_TN,tn_1280_128_8192,Gemm_Rocblas_621282661,0.0257782
GemmTunableOp_Half_TN,tn_8192_200_3696,Gemm_Hipblaslt_TN_74524,0.0783597
GemmTunableOp_Half_TN,tn_19008_244_8192,Gemm_Rocblas_621288665,0.405758
GemmTunableOp_Half_TN,tn_8192_32752_1024,Gemm_Rocblas_621282440,2.27628
GemmTunableOp_Half_TN,tn_7392_232_8192,Gemm_Hipblaslt_TN_74125,0.134495
GemmTunableOp_Half_TN,tn_8192_104_3696,Gemm_Rocblas_621288858,0.0479313
GemmTunableOp_Half_TN,tn_1280_176_8192,Gemm_Hipblaslt_TN_71895,0.0310525
GemmTunableOp_Half_TN,tn_7392_192_8192,Gemm_Hipblaslt_TN_72987,0.105056
GemmTunableOp_Half_TN,tn_8192_96_3696,Gemm_Hipblaslt_TN_72283,0.043387
GemmTunableOp_Half_TN,tn_8192_128_3696,Gemm_Rocblas_621282949,0.0473168
GemmTunableOp_Half_TN,tn_1280_248_8192,Gemm_Hipblaslt_TN_72751,0.0360744
GemmTunableOp_Half_TN,tn_8192_152_3696,Gemm_Hipblaslt_TN_87682,0.0605294
GemmTunableOp_Half_TN,tn_1280_72_8192,Gemm_Hipblaslt_TN_71827,0.0231314
GemmTunableOp_Half_TN,tn_7392_48_8192,Gemm_Hipblaslt_TN_87478,0.0518432
GemmTunableOp_Half_TN,tn_7392_72_8192,Gemm_Rocblas_621282893,0.0646031
GemmTunableOp_Half_TN,tn_8192_176_1024,Gemm_Hipblaslt_TN_72786,0.0284041
GemmTunableOp_Half_TN,tn_8192_88_3696,Gemm_Hipblaslt_TN_87677,0.0434523
GemmTunableOp_Half_TN,tn_8192_32_3696,Gemm_Rocblas_621288805,0.0299773
GemmTunableOp_Half_TN,tn_8192_256_1024,Gemm_Rocblas_621282536,0.0283605
GemmTunableOp_Half_TN,tn_8192_240_1024,Gemm_Rocblas_621288858,0.0325043
GemmTunableOp_Half_TN,tn_8192_24_3696,Gemm_Rocblas_621288805,0.029825
GemmTunableOp_Half_TN,tn_8192_24_1024,Gemm_Rocblas_621282993,0.013658
GemmTunableOp_Half_TN,tn_1280_192_8192,Gemm_Hipblaslt_TN_71895,0.0308057
GemmTunableOp_Half_TN,tn_7392_256_8192,Gemm_Hipblaslt_TN_74125,0.138994
GemmTunableOp_Half_TN,tn_1280_24_8192,Gemm_Rocblas_621288646,0.0156807
GemmTunableOp_Half_TN,tn_8192_16_3696,Gemm_Rocblas_621288691,0.0273149
GemmTunableOp_Half_TN,tn_1280_32768_8192,Gemm_Rocblas_621282440,2.75564
GemmTunableOp_Half_TN,tn_7392_80_8192,Gemm_Rocblas_621289097,0.0663802
GemmTunableOp_Half_TN,tn_1280_120_8192,Gemm_Hipblaslt_TN_72969,0.0258202
GemmTunableOp_Half_TN,tn_8192_208_3696,Gemm_Hipblaslt_TN_74703,0.07911
GemmTunableOp_Half_TN,tn_8192_112_3696,Gemm_Rocblas_621288858,0.047965
GemmTunableOp_Half_TN,tn_8192_32768_1024,Gemm_Rocblas_621282462,2.36386
GemmTunableOp_Half_TN,tn_8192_16_1024,Gemm_Rocblas_621288696,0.011198
GemmTunableOp_Half_TN,tn_8192_144_1024,Gemm_Hipblaslt_TN_73268,0.0260919
GemmTunableOp_Half_TN,tn_8192_160_3696,Gemm_Hipblaslt_TN_87682,0.0598051
GemmTunableOp_Half_TN,tn_8192_184_3696,Gemm_Hipblaslt_TN_72913,0.0654087
GemmTunableOp_Half_TN,tn_6144_192_4096,Gemm_Rocblas_621288850,0.0583714
GemmTunableOp_Half_TN,tn_6144_32_4096,Gemm_Hipblaslt_TN_86084,0.0251569
GemmTunableOp_Half_TN,tn_6144_224_4096,Gemm_Hipblaslt_TN_87906,0.0651484
GemmTunableOp_Half_TN,tn_6144_160_4096,Gemm_Hipblaslt_TN_72127,0.050335
GemmTunableOp_Half_TN,tn_6144_136_4096,Gemm_Hipblaslt_TN_72127,0.0503098
GemmTunableOp_Half_TN,tn_28672_8188_4096,Gemm_Hipblaslt_TN_9237,7.79636
GemmTunableOp_Half_TN,tn_28672_56_4096,Gemm_Rocblas_621282633,0.089698
GemmTunableOp_Half_TN,tn_28672_208_4096,Gemm_Rocblas_621282921,0.234234
GemmTunableOp_Half_TN,tn_6144_56_4096,Gemm_Rocblas_621282632,0.0311619
GemmTunableOp_Half_TN,tn_6144_120_4096,Gemm_Rocblas_621288856,0.044296
GemmTunableOp_Half_TN,tn_128256_256_4096,Gemm_Rocblas_621282980,1.38413
GemmTunableOp_Half_TN,tn_6144_40_4096,Gemm_Hipblaslt_TN_74349,0.0305498
GemmTunableOp_Half_TN,tn_6144_216_4096,Gemm_Hipblaslt_TN_72508,0.0662128
GemmTunableOp_Half_TN,tn_28672_136_4096,Gemm_Hipblaslt_TN_72146,0.170118
GemmTunableOp_Half_TN,tn_28672_248_4096,Gemm_Rocblas_621288865,0.250989
GemmTunableOp_Half_TN,tn_4096_192_14336,Gemm_Hipblaslt_TN_74670,0.105402
GemmTunableOp_Half_TN,tn_28672_184_4096,Gemm_Hipblaslt_TN_74072,0.203331
GemmTunableOp_Half_TN,tn_4096_104_14336,Gemm_Hipblaslt_TN_72767,0.0794731
GemmTunableOp_Half_TN,tn_4096_48_4096,Gemm_Hipblaslt_TN_71830,0.0219945
GemmTunableOp_Half_TN,tn_4096_136_14336,Gemm_Hipblaslt_TN_72881,0.0907271
GemmTunableOp_Half_TN,tn_4096_160_14336,Gemm_Hipblaslt_TN_74668,0.090504
GemmTunableOp_Half_TN,tn_6144_72_4096,Gemm_Rocblas_621289097,0.0373303
GemmTunableOp_Half_TN,tn_4096_216_4096,Gemm_Hipblaslt_TN_85710,0.0509387
GemmTunableOp_Half_TN,tn_4096_24_14336,Gemm_Rocblas_621288657,0.0403621
GemmTunableOp_Half_TN,tn_4096_8_14336,Gemm_Hipblaslt_TN_74643,0.0350597
GemmTunableOp_Half_TN,tn_4096_240_14336,Gemm_Hipblaslt_TN_73138,0.140311
GemmTunableOp_Half_TN,tn_4096_8188_4096,Gemm_Rocblas_621282852,1.08759
GemmTunableOp_Half_TN,tn_4096_8192_14336,Gemm_Hipblaslt_TN_74534,3.78521
GemmTunableOp_Half_TN,tn_28672_160_4096,Gemm_Rocblas_621289099,0.173613
GemmTunableOp_Half_TN,tn_28672_40_4096,Gemm_Hipblaslt_TN_87478,0.083584
GemmTunableOp_Half_TN,tn_4096_200_4096,Gemm_Hipblaslt_TN_85683,0.0500245
GemmTunableOp_Half_TN,tn_4096_224_14336,Gemm_Hipblaslt_TN_72774,0.122623
GemmTunableOp_Half_TN,tn_28672_8_4096,Gemm_Rocblas_621282484,0.0629299
GemmTunableOp_Half_TN,tn_4096_176_14336,Gemm_Hipblaslt_TN_72889,0.10279
GemmTunableOp_Half_TN,tn_28672_88_4096,Gemm_Hipblaslt_TN_73380,0.121304
GemmTunableOp_Half_TN,tn_28672_120_4096,Gemm_Rocblas_621288862,0.142127
GemmTunableOp_Half_TN,tn_4096_256_14336,Gemm_Hipblaslt_TN_73244,0.139661
GemmTunableOp_Half_TN,tn_4096_16_14336,Gemm_Rocblas_621282482,0.0357103
GemmTunableOp_Half_TN,tn_4096_128_14336,Gemm_Hipblaslt_TN_72767,0.080753
GemmTunableOp_Half_TN,tn_28672_200_4096,Gemm_Rocblas_621282921,0.228615
GemmTunableOp_Half_TN,tn_4096_72_4096,Gemm_Hipblaslt_TN_87820,0.0285344
GemmTunableOp_Half_TN,tn_4096_8188_14336,Gemm_Hipblaslt_TN_74518,3.80518
GemmTunableOp_Half_TN,tn_4096_8_4096,Gemm_Rocblas_621288651,0.0154992
GemmTunableOp_Half_TN,tn_4096_64_4096,Gemm_Rocblas_621288823,0.0234423
GemmTunableOp_Half_TN,tn_4096_56_4096,Gemm_Rocblas_621288818,0.0234988
GemmTunableOp_Half_TN,tn_4096_248_14336,Gemm_Hipblaslt_TN_73368,0.141403
GemmTunableOp_Half_TN,tn_28672_104_4096,Gemm_Rocblas_621288862,0.140689
GemmTunableOp_Half_TN,tn_28672_16_4096,Gemm_Rocblas_621288696,0.0633986
GemmTunableOp_Half_TN,tn_4096_24_4096,Gemm_Rocblas_621288715,0.0166766
GemmTunableOp_Half_TN,tn_28672_176_4096,Gemm_Hipblaslt_TN_88013,0.202346
GemmTunableOp_Half_TN,tn_28672_24_4096,Gemm_Rocblas_621282629,0.0728255
GemmTunableOp_Half_TN,tn_28672_256_4096,Gemm_Hipblaslt_TN_107343,0.249467
GemmTunableOp_Half_TN,tn_4096_104_4096,Gemm_Rocblas_621282641,0.0315481
GemmTunableOp_Half_TN,tn_4096_120_14336,Gemm_Hipblaslt_TN_72767,0.0807217
GemmTunableOp_Half_TN,tn_4096_176_4096,Gemm_Rocblas_621282943,0.0436867
GemmTunableOp_Half_TN,tn_6144_96_4096,Gemm_Rocblas_621289097,0.0371805
GemmTunableOp_Half_TN,tn_4096_192_4096,Gemm_Hipblaslt_TN_74662,0.043502
GemmTunableOp_Half_TN,tn_4096_208_4096,Gemm_Hipblaslt_TN_85710,0.0504047
GemmTunableOp_Half_TN,tn_4096_152_14336,Gemm_Hipblaslt_TN_72881,0.0908361
GemmTunableOp_Half_TN,tn_4096_224_4096,Gemm_Hipblaslt_TN_74671,0.0496392
GemmTunableOp_Half_TN,tn_6144_48_4096,Gemm_Hipblaslt_TN_74821,0.0304608
GemmTunableOp_Half_TN,tn_6144_184_4096,Gemm_Hipblaslt_TN_72500,0.0585778
GemmTunableOp_Half_TN,tn_6144_112_4096,Gemm_Rocblas_621282647,0.0442483
GemmTunableOp_Half_TN,tn_4096_56_14336,Gemm_Hipblaslt_TN_72350,0.0556157
GemmTunableOp_Half_TN,tn_128256_244_4096,Gemm_Rocblas_621282655,1.41115
GemmTunableOp_Half_TN,tn_4096_96_4096,Gemm_Hipblaslt_TN_74605,0.0292366
GemmTunableOp_Half_TN,tn_28672_216_4096,Gemm_Rocblas_621289125,0.2253
GemmTunableOp_Half_TN,tn_4096_248_4096,Gemm_Hipblaslt_TN_72641,0.0547588
GemmTunableOp_Half_TN,tn_28672_48_4096,Gemm_Hipblaslt_TN_87479,0.083685
GemmTunableOp_Half_TN,tn_6144_152_4096,Gemm_Hipblaslt_TN_87347,0.0515576
GemmTunableOp_Half_TN,tn_28672_80_4096,Gemm_Hipblaslt_TN_71860,0.115038
GemmTunableOp_Half_TN,tn_4096_152_4096,Gemm_Hipblaslt_TN_72370,0.0397199
GemmTunableOp_Half_TN,tn_6144_232_4096,Gemm_Rocblas_621289019,0.0693912
GemmTunableOp_Half_TN,tn_4096_80_14336,Gemm_Hipblaslt_TN_86454,0.0704391
GemmTunableOp_Half_TN,tn_4096_208_14336,Gemm_Hipblaslt_TN_85683,0.121025
GemmTunableOp_Half_TN,tn_6144_88_4096,Gemm_Rocblas_621289097,0.0376168
GemmTunableOp_Half_TN,tn_4096_88_14336,Gemm_Hipblaslt_TN_86454,0.0710228
GemmTunableOp_Half_TN,tn_4096_112_14336,Gemm_Hipblaslt_TN_73973,0.0792087
GemmTunableOp_Half_TN,tn_6144_8_4096,Gemm_Rocblas_621282473,0.0212582
GemmTunableOp_Half_TN,tn_4096_136_4096,Gemm_Hipblaslt_TN_72370,0.0394471
GemmTunableOp_Half_TN,tn_4096_168_4096,Gemm_Hipblaslt_TN_72890,0.0437003
GemmTunableOp_Half_TN,tn_4096_184_4096,Gemm_Hipblaslt_TN_72889,0.0442395
GemmTunableOp_Half_TN,tn_4096_40_14336,Gemm_Hipblaslt_TN_71830,0.0520808
GemmTunableOp_Half_TN,tn_4096_232_4096,Gemm_Hipblaslt_TN_72641,0.0546675
GemmTunableOp_Half_TN,tn_4096_32_4096,Gemm_Rocblas_621282460,0.0168785
GemmTunableOp_Half_TN,tn_6144_80_4096,Gemm_Rocblas_621282893,0.0375627
GemmTunableOp_Half_TN,tn_6144_256_4096,Gemm_Rocblas_621282814,0.0675764
GemmTunableOp_Half_TN,tn_6144_208_4096,Gemm_Hipblaslt_TN_74158,0.0640844
GemmTunableOp_Half_TN,tn_6144_16_4096,Gemm_Rocblas_621288680,0.022291
GemmTunableOp_Half_TN,tn_6144_128_4096,Gemm_Hipblaslt_TN_72629,0.042984
GemmTunableOp_Half_TN,tn_4096_96_14336,Gemm_Hipblaslt_TN_72614,0.0747127
GemmTunableOp_Half_TN,tn_28672_144_4096,Gemm_Hipblaslt_TN_72794,0.174405
GemmTunableOp_Half_TN,tn_28672_192_4096,Gemm_Rocblas_621288944,0.195173
GemmTunableOp_Half_TN,tn_28672_240_4096,Gemm_Rocblas_621288865,0.247952
GemmTunableOp_Half_TN,tn_4096_88_4096,Gemm_Hipblaslt_TN_74605,0.0295743
GemmTunableOp_Half_TN,tn_28672_96_4096,Gemm_Hipblaslt_TN_73380,0.11955
GemmTunableOp_Half_TN,tn_4096_168_14336,Gemm_Hipblaslt_TN_74669,0.103563
GemmTunableOp_Half_TN,tn_4096_144_14336,Gemm_Hipblaslt_TN_72881,0.0899347
GemmTunableOp_Half_TN,tn_4096_200_14336,Gemm_Hipblaslt_TN_85683,0.120852
GemmTunableOp_Half_TN,tn_4096_64_14336,Gemm_Hipblaslt_TN_71772,0.055157
GemmTunableOp_Half_TN,tn_4096_232_14336,Gemm_Hipblaslt_TN_74672,0.141124
GemmTunableOp_Half_TN,tn_6144_168_4096,Gemm_Hipblaslt_TN_74057,0.0578366
GemmTunableOp_Half_TN,tn_4096_80_4096,Gemm_Hipblaslt_TN_74520,0.0281402
GemmTunableOp_Half_TN,tn_4096_32_14336,Gemm_Rocblas_621282493,0.0406761
GemmTunableOp_Half_TN,tn_4096_40_4096,Gemm_Hipblaslt_TN_71715,0.0226515
GemmTunableOp_Half_TN,tn_6144_64_4096,Gemm_Rocblas_621282632,0.0302189
GemmTunableOp_Half_TN,tn_6144_200_4096,Gemm_Hipblaslt_TN_74158,0.064489
GemmTunableOp_Half_TN,tn_6144_176_4096,Gemm_Hipblaslt_TN_74057,0.0577489
GemmTunableOp_Half_TN,tn_6144_144_4096,Gemm_Hipblaslt_TN_87347,0.0510817
GemmTunableOp_Half_TN,tn_28672_8192_4096,Gemm_Hipblaslt_TN_9238,7.13815
GemmTunableOp_Half_TN,tn_28672_64_4096,Gemm_Rocblas_621282641,0.0863273
GemmTunableOp_Half_TN,tn_6144_104_4096,Gemm_Rocblas_621282647,0.0444606
GemmTunableOp_Half_TN,tn_28672_32_4096,Gemm_Rocblas_621282629,0.072364
GemmTunableOp_Half_TN,tn_6144_8188_4096,Gemm_Rocblas_621282924,1.63844
GemmTunableOp_Half_TN,tn_28672_224_4096,Gemm_Rocblas_621289103,0.216003
GemmTunableOp_Half_TN,tn_6144_240_4096,Gemm_Rocblas_621289019,0.0702969
GemmTunableOp_Half_TN,tn_28672_152_4096,Gemm_Hipblaslt_TN_74130,0.177869
GemmTunableOp_Half_TN,tn_28672_128_4096,Gemm_Rocblas_621288862,0.139969
GemmTunableOp_Half_TN,tn_6144_248_4096,Gemm_Rocblas_621282814,0.0707155
GemmTunableOp_Half_TN,tn_6144_24_4096,Gemm_Rocblas_621288723,0.0255927
GemmTunableOp_Half_TN,tn_4096_8192_4096,Gemm_Rocblas_621282852,1.08401
GemmTunableOp_Half_TN,tn_4096_256_4096,Gemm_Rocblas_621282947,0.0534333
GemmTunableOp_Half_TN,tn_4096_48_14336,Gemm_Hipblaslt_TN_71830,0.0517135
GemmTunableOp_Half_TN,tn_4096_184_14336,Gemm_Hipblaslt_TN_72890,0.105006
GemmTunableOp_Half_TN,tn_4096_240_4096,Gemm_Hipblaslt_TN_73138,0.054732
GemmTunableOp_Half_TN,tn_28672_168_4096,Gemm_Rocblas_621288944,0.201566
GemmTunableOp_Half_TN,tn_4096_112_4096,Gemm_Rocblas_621288850,0.0318197
GemmTunableOp_Half_TN,tn_28672_112_4096,Gemm_Rocblas_621282653,0.141466
GemmTunableOp_Half_TN,tn_28672_232_4096,Gemm_Rocblas_621282655,0.242009
GemmTunableOp_Half_TN,tn_4096_16_4096,Gemm_Rocblas_621288648,0.0164691
GemmTunableOp_Half_TN,tn_28672_72_4096,Gemm_Hipblaslt_TN_72273,0.11758
GemmTunableOp_Half_TN,tn_4096_120_4096,Gemm_Rocblas_621288850,0.0320016
GemmTunableOp_Half_TN,tn_4096_128_4096,Gemm_Rocblas_621282641,0.0318
GemmTunableOp_Half_TN,tn_6144_8192_4096,Gemm_Rocblas_621288659,1.51676
GemmTunableOp_Half_TN,tn_4096_160_4096,Gemm_Hipblaslt_TN_74668,0.0388742
GemmTunableOp_Half_TN,tn_4096_144_4096,Gemm_Hipblaslt_TN_72370,0.0394968
GemmTunableOp_Half_TN,tn_4096_72_14336,Gemm_Hipblaslt_TN_86454,0.0700201
GemmTunableOp_Half_TN,tn_4096_216_14336,Gemm_Hipblaslt_TN_72774,0.124123
GemmTunableOp_Half_TN,tn_4096_56_7168,Gemm_Hipblaslt_TN_72350,0.0344769
GemmTunableOp_Half_TN,tn_4096_32_2048,Gemm_Rocblas_621288715,0.0131337
GemmTunableOp_Half_TN,tn_4096_8192_7168,Gemm_Rocblas_621282901,1.76463
GemmTunableOp_Half_TN,tn_3072_40_4096,Gemm_Hipblaslt_TN_71716,0.0199006
GemmTunableOp_Half_TN,tn_4096_208_7168,Gemm_Hipblaslt_TN_72774,0.0732406
GemmTunableOp_Half_TN,tn_3072_136_4096,Gemm_Hipblaslt_TN_87478,0.0307573
GemmTunableOp_Half_TN,tn_3072_232_4096,Gemm_Hipblaslt_TN_74372,0.0427081
GemmTunableOp_Half_TN,tn_3072_104_4096,Gemm_Hipblaslt_TN_73219,0.029719
GemmTunableOp_Half_TN,tn_3072_8188_4096,Gemm_Rocblas_621282852,0.811291
GemmTunableOp_Half_TN,tn_14336_240_4096,Gemm_Rocblas_621282655,0.12808
GemmTunableOp_Half_TN,tn_14336_176_4096,Gemm_Rocblas_621282738,0.103071
GemmTunableOp_Half_TN,tn_3072_176_4096,Gemm_Rocblas_621288850,0.0319495
GemmTunableOp_Half_TN,tn_14336_120_4096,Gemm_Rocblas_621282653,0.0727771
GemmTunableOp_Half_TN,tn_64128_244_4096,Gemm_Rocblas_621289283,0.746217
GemmTunableOp_Half_TN,tn_4096_24_7168,Gemm_Rocblas_621282493,0.0236262
GemmTunableOp_Half_TN,tn_4096_224_2048,Gemm_Hipblaslt_TN_87681,0.0322852
GemmTunableOp_Half_TN,tn_14336_8192_4096,Gemm_Hipblaslt_TN_107347,3.58605
GemmTunableOp_Half_TN,tn_4096_72_2048,Gemm_Hipblaslt_TN_87820,0.0194592
GemmTunableOp_Half_TN,tn_14336_8_4096,Gemm_Rocblas_621288701,0.0385518
GemmTunableOp_Half_TN,tn_4096_80_7168,Gemm_Hipblaslt_TN_73129,0.0424965
GemmTunableOp_Half_TN,tn_4096_240_7168,Gemm_Hipblaslt_TN_73368,0.0816528
GemmTunableOp_Half_TN,tn_14336_40_4096,Gemm_Hipblaslt_TN_71847,0.054434
GemmTunableOp_Half_TN,tn_14336_200_4096,Gemm_Rocblas_621289109,0.118556
GemmTunableOp_Half_TN,tn_14336_152_4096,Gemm_Hipblaslt_TN_73165,0.0898876
GemmTunableOp_Half_TN,tn_4096_8188_2048,Gemm_Hipblaslt_TN_107367,0.564644
GemmTunableOp_Half_TN,tn_4096_64_7168,Gemm_Hipblaslt_TN_71772,0.0340086
GemmTunableOp_Half_TN,tn_4096_224_7168,Gemm_Hipblaslt_TN_74671,0.0720224
GemmTunableOp_Half_TN,tn_4096_184_7168,Gemm_Hipblaslt_TN_72890,0.0620054
GemmTunableOp_Half_TN,tn_14336_144_4096,Gemm_Hipblaslt_TN_74031,0.0892919
GemmTunableOp_Half_TN,tn_14336_72_4096,Gemm_Rocblas_621282952,0.0670497
GemmTunableOp_Half_TN,tn_4096_120_7168,Gemm_Hipblaslt_TN_73973,0.0491365
GemmTunableOp_Half_TN,tn_4096_176_2048,Gemm_Hipblaslt_TN_73380,0.0278393
GemmTunableOp_Half_TN,tn_3072_112_4096,Gemm_Hipblaslt_TN_73219,0.0299818
GemmTunableOp_Half_TN,tn_3072_200_4096,Gemm_Hipblaslt_TN_72275,0.0405704
GemmTunableOp_Half_TN,tn_3072_144_4096,Gemm_Hipblaslt_TN_74377,0.0305883
GemmTunableOp_Half_TN,tn_14336_48_4096,Gemm_Hipblaslt_TN_71847,0.0528973
GemmTunableOp_Half_TN,tn_3072_48_4096,Gemm_Hipblaslt_TN_86387,0.0199896
GemmTunableOp_Half_TN,tn_4096_56_2048,Gemm_Rocblas_621282986,0.01625
GemmTunableOp_Half_TN,tn_4096_32_7168,Gemm_Rocblas_621282493,0.0235581
GemmTunableOp_Half_TN,tn_14336_208_4096,Gemm_Rocblas_621289125,0.117828
GemmTunableOp_Half_TN,tn_3072_88_4096,Gemm_Hipblaslt_TN_71897,0.0257146
GemmTunableOp_Half_TN,tn_4096_112_2048,Gemm_Rocblas_621288850,0.0203113
GemmTunableOp_Half_TN,tn_4096_152_7168,Gemm_Hipblaslt_TN_72881,0.055327
GemmTunableOp_Half_TN,tn_4096_256_7168,Gemm_Hipblaslt_TN_73368,0.0793209
GemmTunableOp_Half_TN,tn_4096_216_7168,Gemm_Hipblaslt_TN_74671,0.0728584
GemmTunableOp_Half_TN,tn_4096_16_7168,Gemm_Rocblas_621282482,0.0210456
GemmTunableOp_Half_TN,tn_4096_176_7168,Gemm_Hipblaslt_TN_72889,0.0610227
GemmTunableOp_Half_TN,tn_4096_128_7168,Gemm_Rocblas_621288850,0.0497634
GemmTunableOp_Half_TN,tn_14336_16_4096,Gemm_Rocblas_621288700,0.0397352
GemmTunableOp_Half_TN,tn_14336_160_4096,Gemm_Rocblas_621289099,0.0905434
GemmTunableOp_Half_TN,tn_14336_224_4096,Gemm_Rocblas_621289109,0.118299
GemmTunableOp_Half_TN,tn_3072_128_4096,Gemm_Hipblaslt_TN_72044,0.0294189
GemmTunableOp_Half_TN,tn_4096_16_2048,Gemm_Rocblas_621288689,0.0126273
GemmTunableOp_Half_TN,tn_14336_80_4096,Gemm_Rocblas_621289156,0.068558
GemmTunableOp_Half_TN,tn_4096_200_2048,Gemm_Hipblaslt_TN_107336,0.0320889
GemmTunableOp_Half_TN,tn_3072_16_4096,Gemm_Rocblas_621288651,0.0150065
GemmTunableOp_Half_TN,tn_4096_88_7168,Gemm_Hipblaslt_TN_86454,0.044145
GemmTunableOp_Half_TN,tn_4096_168_2048,Gemm_Hipblaslt_TN_73380,0.0279447
GemmTunableOp_Half_TN,tn_4096_144_2048,Gemm_Hipblaslt_TN_87494,0.0293721
GemmTunableOp_Half_TN,tn_3072_72_4096,Gemm_Hipblaslt_TN_71839,0.0249294
GemmTunableOp_Half_TN,tn_3072_32_4096,Gemm_Rocblas_621282585,0.0164026
GemmTunableOp_Half_TN,tn_14336_64_4096,Gemm_Rocblas_621288841,0.0556234
GemmTunableOp_Half_TN,tn_3072_224_4096,Gemm_Hipblaslt_TN_72275,0.041086
GemmTunableOp_Half_TN,tn_3072_184_4096,Gemm_Rocblas_621282641,0.0320889
GemmTunableOp_Half_TN,tn_4096_104_7168,Gemm_Hipblaslt_TN_73972,0.0485861
GemmTunableOp_Half_TN,tn_3072_56_4096,Gemm_Hipblaslt_TN_71769,0.0222413
GemmTunableOp_Half_TN,tn_4096_8188_7168,Gemm_Hipblaslt_TN_74192,1.82364
GemmTunableOp_Half_TN,tn_4096_40_7168,Gemm_Hipblaslt_TN_71830,0.0309312
GemmTunableOp_Half_TN,tn_4096_232_7168,Gemm_Hipblaslt_TN_74672,0.0807639
GemmTunableOp_Half_TN,tn_14336_56_4096,Gemm_Rocblas_621288841,0.0570912
GemmTunableOp_Half_TN,tn_14336_32_4096,Gemm_Rocblas_621288715,0.0410051
GemmTunableOp_Half_TN,tn_4096_208_2048,Gemm_Hipblaslt_TN_87485,0.0325316
GemmTunableOp_Half_TN,tn_14336_8188_4096,Gemm_Hipblaslt_TN_88152,3.51452
GemmTunableOp_Half_TN,tn_14336_216_4096,Gemm_Rocblas_621282921,0.115418
GemmTunableOp_Half_TN,tn_4096_8_2048,Gemm_Rocblas_621288689,0.0124134
GemmTunableOp_Half_TN,tn_14336_136_4096,Gemm_Hipblaslt_TN_72917,0.0893304
GemmTunableOp_Half_TN,tn_4096_96_7168,Gemm_Hipblaslt_TN_71902,0.0447395
GemmTunableOp_Half_TN,tn_4096_80_2048,Gemm_Hipblaslt_TN_87820,0.0192068
GemmTunableOp_Half_TN,tn_4096_48_7168,Gemm_Hipblaslt_TN_71715,0.0304577
GemmTunableOp_Half_TN,tn_4096_40_2048,Gemm_Rocblas_621289191,0.0162395
GemmTunableOp_Half_TN,tn_4096_248_2048,Gemm_Rocblas_621282939,0.0326558
GemmTunableOp_Half_TN,tn_4096_192_2048,Gemm_Hipblaslt_TN_72490,0.0273194
GemmTunableOp_Half_TN,tn_4096_128_2048,Gemm_Rocblas_621282641,0.0202131
GemmTunableOp_Half_TN,tn_14336_184_4096,Gemm_Rocblas_621288944,0.103122
GemmTunableOp_Half_TN,tn_4096_200_7168,Gemm_Hipblaslt_TN_72774,0.0716811
GemmTunableOp_Half_TN,tn_14336_112_4096,Gemm_Rocblas_621288862,0.0727311
GemmTunableOp_Half_TN,tn_14336_248_4096,Gemm_Rocblas_621288865,0.127783
GemmTunableOp_Half_TN,tn_14336_96_4096,Gemm_Rocblas_621282952,0.0663579
GemmTunableOp_Half_TN,tn_3072_216_4096,Gemm_Hipblaslt_TN_72274,0.0415423
GemmTunableOp_Half_TN,tn_3072_256_4096,Gemm_Rocblas_621282647,0.0429592
GemmTunableOp_Half_TN,tn_4096_88_2048,Gemm_Rocblas_621288850,0.0203032
GemmTunableOp_Half_TN,tn_3072_168_4096,Gemm_Rocblas_621282641,0.0318602
GemmTunableOp_Half_TN,tn_3072_8_4096,Gemm_Rocblas_621288651,0.0151619
GemmTunableOp_Half_TN,tn_4096_160_7168,Gemm_Hipblaslt_TN_74668,0.0552817
GemmTunableOp_Half_TN,tn_4096_120_2048,Gemm_Rocblas_621282641,0.020407
GemmTunableOp_Half_TN,tn_4096_184_2048,Gemm_Hipblaslt_TN_72198,0.0280044
GemmTunableOp_Half_TN,tn_3072_96_4096,Gemm_Hipblaslt_TN_71899,0.0268314
GemmTunableOp_Half_TN,tn_4096_152_2048,Gemm_Hipblaslt_TN_74372,0.0271327
GemmTunableOp_Half_TN,tn_4096_136_7168,Gemm_Hipblaslt_TN_72881,0.0545069
GemmTunableOp_Half_TN,tn_4096_8_7168,Gemm_Rocblas_621288693,0.0210864
GemmTunableOp_Half_TN,tn_4096_192_7168,Gemm_Hipblaslt_TN_72890,0.0639763
GemmTunableOp_Half_TN,tn_4096_168_7168,Gemm_Hipblaslt_TN_72889,0.0614401
GemmTunableOp_Half_TN,tn_14336_104_4096,Gemm_Rocblas_621288862,0.0729698
GemmTunableOp_Half_TN,tn_4096_112_7168,Gemm_Hipblaslt_TN_72767,0.0489618
GemmTunableOp_Half_TN,tn_14336_192_4096,Gemm_Rocblas_621288944,0.10234
GemmTunableOp_Half_TN,tn_3072_192_4096,Gemm_Rocblas_621282641,0.0315842
GemmTunableOp_Half_TN,tn_14336_24_4096,Gemm_Rocblas_621282587,0.0415295
GemmTunableOp_Half_TN,tn_4096_8192_2048,Gemm_Hipblaslt_TN_107367,0.568688
GemmTunableOp_Half_TN,tn_4096_232_2048,Gemm_Hipblaslt_TN_87681,0.0324967
GemmTunableOp_Half_TN,tn_3072_120_4096,Gemm_Hipblaslt_TN_73219,0.029997
GemmTunableOp_Half_TN,tn_4096_248_7168,Gemm_Hipblaslt_TN_74672,0.0819701
GemmTunableOp_Half_TN,tn_4096_160_2048,Gemm_Hipblaslt_TN_74372,0.0259133
GemmTunableOp_Half_TN,tn_3072_152_4096,Gemm_Rocblas_621288850,0.0316939
GemmTunableOp_Half_TN,tn_3072_80_4096,Gemm_Hipblaslt_TN_71839,0.0248533
GemmTunableOp_Half_TN,tn_3072_24_4096,Gemm_Rocblas_621288715,0.0164587
GemmTunableOp_Half_TN,tn_3072_240_4096,Gemm_Hipblaslt_TN_74372,0.0416681
GemmTunableOp_Half_TN,tn_4096_144_7168,Gemm_Hipblaslt_TN_72881,0.0549019
GemmTunableOp_Half_TN,tn_14336_256_4096,Gemm_Rocblas_621289138,0.128353
GemmTunableOp_Half_TN,tn_3072_64_4096,Gemm_Hipblaslt_TN_71769,0.0221993
GemmTunableOp_Half_TN,tn_4096_136_2048,Gemm_Hipblaslt_TN_74372,0.026956
GemmTunableOp_Half_TN,tn_4096_104_2048,Gemm_Rocblas_621282641,0.0203129
GemmTunableOp_Half_TN,tn_64128_256_4096,Gemm_Rocblas_621289272,0.733528
GemmTunableOp_Half_TN,tn_4096_96_2048,Gemm_Hipblaslt_TN_72181,0.0201358
GemmTunableOp_Half_TN,tn_4096_64_2048,Gemm_Rocblas_621282600,0.0160801
GemmTunableOp_Half_TN,tn_14336_168_4096,Gemm_Rocblas_621282738,0.103103
GemmTunableOp_Half_TN,tn_4096_256_2048,Gemm_Rocblas_621289148,0.0308258
GemmTunableOp_Half_TN,tn_4096_72_7168,Default,0.0432032
GemmTunableOp_Half_TN,tn_14336_128_4096,Gemm_Rocblas_621282653,0.0722283
GemmTunableOp_Half_TN,tn_14336_88_4096,Gemm_Rocblas_621282952,0.0676855
GemmTunableOp_Half_TN,tn_3072_160_4096,Gemm_Rocblas_621282641,0.0316298
GemmTunableOp_Half_TN,tn_14336_232_4096,Gemm_Rocblas_621288865,0.124355
GemmTunableOp_Half_TN,tn_3072_208_4096,Gemm_Hipblaslt_TN_72274,0.0413784
GemmTunableOp_Half_TN,tn_3072_248_4096,Gemm_Hipblaslt_TN_72490,0.0438638
GemmTunableOp_Half_TN,tn_4096_48_2048,Gemm_Rocblas_621289194,0.0161442
GemmTunableOp_Half_TN,tn_3072_8192_4096,Gemm_Rocblas_621282852,0.812138
GemmTunableOp_Half_TN,tn_4096_240_2048,Gemm_Rocblas_621289140,0.0325668
GemmTunableOp_Half_TN,tn_4096_216_2048,Gemm_Hipblaslt_TN_87681,0.0324222
GemmTunableOp_Half_TN,tn_4096_24_2048,Gemm_Rocblas_621282587,0.01307
GemmTunableOp_Half_TN,tn_8192_8177_14336,Gemm_Hipblaslt_TN_88055,8.25248
GemmTunableOp_Half_TN,tn_8192_8058_4096,Gemm_Rocblas_621282559,2.18602
GemmTunableOp_Half_TN,tn_8192_7868_14336,Gemm_Hipblaslt_TN_74638,7.99764
GemmTunableOp_Half_TN,tn_8192_7757_4096,Gemm_Rocblas_621282559,2.06736
GemmTunableOp_Half_TN,tn_8192_7508_4096,Gemm_Rocblas_621282559,2.04122
GemmTunableOp_Half_TN,tn_8192_7277_14336,Gemm_Hipblaslt_TN_74360,6.84123
GemmTunableOp_Half_TN,tn_8192_7118_4096,Gemm_Hipblaslt_TN_9240,1.86689
GemmTunableOp_Half_TN,tn_8192_6668_4096,Gemm_Hipblaslt_TN_107367,1.74062
GemmTunableOp_Half_TN,tn_8192_2639_4096,Gemm_Hipblaslt_TN_72545,0.675139
GemmTunableOp_Half_TN,tn_5120_6248_8192,Gemm_Rocblas_621282462,1.98753
GemmTunableOp_Half_TN,tn_5120_2639_8192,Gemm_Hipblaslt_TN_73828,0.884569
GemmTunableOp_Half_TN,tn_5120_24_8192,Gemm_Rocblas_621282585,0.0349576
GemmTunableOp_Half_TN,tn_64128_216_8192,Gemm_Hipblaslt_TN_87394,1.40857
GemmTunableOp_Half_TN,tn_5120_232_8192,Gemm_Hipblaslt_TN_72504,0.0970838
GemmTunableOp_Half_TN,tn_64128_176_8192,Gemm_Hipblaslt_TN_72226,1.22446
GemmTunableOp_Half_TN,tn_28672_2399_8192,Gemm_Hipblaslt_TN_88112,5.18972
GemmTunableOp_Half_TN,tn_8192_184_14336,Gemm_Hipblaslt_TN_74063,0.203265
GemmTunableOp_Half_TN,tn_5120_6598_8192,Gemm_Hipblaslt_TN_88078,2.16009
GemmTunableOp_Half_TN,tn_28672_6828_8192,Gemm_Hipblaslt_TN_88152,13.2595
GemmTunableOp_Half_TN,tn_8192_112_4096,Gemm_Rocblas_621289096,0.0560331
GemmTunableOp_Half_TN,tn_8192_5798_4096,Gemm_Rocblas_621288968,1.49819
GemmTunableOp_Half_TN,tn_8192_64_14336,Gemm_Rocblas_621288849,0.0969228
GemmTunableOp_Half_TN,tn_5120_5658_8192,Gemm_Hipblaslt_TN_73656,1.79263
GemmTunableOp_Half_TN,tn_28672_6144_8192,Gemm_Rocblas_621289004,11.6903
GemmTunableOp_Half_TN,tn_8192_6828_14336,Gemm_Hipblaslt_TN_88063,6.87949
GemmTunableOp_Half_TN,tn_64128_65_8192,Gemm_Hipblaslt_TN_71857,0.674834
GemmTunableOp_Half_TN,tn_8192_5608_14336,Gemm_Hipblaslt_TN_74360,5.52749
GemmTunableOp_Half_TN,tn_28672_112_8192,Gemm_Rocblas_621288855,0.403558
GemmTunableOp_Half_TN,tn_64128_168_8192,Gemm_Hipblaslt_TN_72226,1.22331
GemmTunableOp_Half_TN,tn_5120_216_8192,Gemm_Hipblaslt_TN_72986,0.0934276
GemmTunableOp_Half_TN,tn_28672_64_8192,Gemm_Hipblaslt_TN_74657,0.253898
GemmTunableOp_Half_TN,tn_64128_208_8192,Gemm_Hipblaslt_TN_87394,1.40353
GemmTunableOp_Half_TN,tn_5120_8192_8192,Gemm_Hipblaslt_TN_88198,2.70548
GemmTunableOp_Half_TN,tn_28672_5538_8192,Gemm_Hipblaslt_TN_107366,11.1555
GemmTunableOp_Half_TN,tn_64128_224_8192,Gemm_Hipblaslt_TN_87394,1.38392
GemmTunableOp_Half_TN,tn_28672_5828_8192,Gemm_Hipblaslt_TN_107366,11.6227
GemmTunableOp_Half_TN,tn_64128_192_8192,Gemm_Hipblaslt_TN_72226,1.21035
GemmTunableOp_Half_TN,tn_8192_5518_4096,Gemm_Rocblas_621282762,1.46948
GemmTunableOp_Half_TN,tn_5120_7497_8192,Gemm_Hipblaslt_TN_73656,2.3254
GemmTunableOp_Half_TN,tn_5120_6018_8192,Gemm_Hipblaslt_TN_73736,1.94886
GemmTunableOp_Half_TN,tn_28672_6478_8192,Gemm_Hipblaslt_TN_88166,12.5894
GemmTunableOp_Half_TN,tn_28672_7277_8192,Gemm_Hipblaslt_TN_107366,14.4705
GemmTunableOp_Half_TN,tn_28672_7757_8192,Gemm_Hipblaslt_TN_87446,15.2982
GemmTunableOp_Half_TN,tn_64128_200_8192,Gemm_Hipblaslt_TN_87394,1.39933
GemmTunableOp_Half_TN,tn_64128_232_8192,Gemm_Rocblas_621283068,1.42148
GemmTunableOp_Half_TN,tn_64128_240_8192,Gemm_Rocblas_621283075,1.42066
GemmTunableOp_Half_TN,tn_8192_6058_4096,Gemm_Rocblas_621282559,1.59304
GemmTunableOp_Half_TN,tn_64128_248_8192,Gemm_Rocblas_621283075,1.42104
GemmTunableOp_Half_TN,tn_64128_256_8192,Gemm_Rocblas_621283066,1.4012
GemmTunableOp_Half_TN,tn_64128_184_8192,Gemm_Hipblaslt_TN_73827,1.22413
GemmTunableOp_Half_TN,tn_64128_73_8192,Gemm_Hipblaslt_TN_71861,0.689792
GemmTunableOp_Half_TN,tn_5120_248_8192,Gemm_Hipblaslt_TN_72641,0.0961697
GemmTunableOp_Half_TN,tn_64128_81_8192,Gemm_Hipblaslt_TN_72120,0.731155
GemmTunableOp_Half_TN,tn_8192_104_4096,Gemm_Hipblaslt_TN_107350,0.0559346
GemmTunableOp_Half_TN,tn_8192_144_14336,Gemm_Hipblaslt_TN_74157,0.167286
GemmTunableOp_Half_TN,tn_8192_208_14336,Gemm_Hipblaslt_TN_74098,0.245241
GemmTunableOp_Half_TN,tn_28672_8058_8192,Gemm_Hipblaslt_TN_87446,15.6265
GemmTunableOp_Half_TN,tn_8192_56_4096,Gemm_Rocblas_621282641,0.0321045
GemmTunableOp_Half_TN,tn_8192_2239_4096,Gemm_Hipblaslt_TN_72537,0.59445
GemmTunableOp_Half_TN,tn_8192_2459_4096,Gemm_Hipblaslt_TN_107367,0.667343
GemmTunableOp_Half_TN,tn_8192_5898_4096,Gemm_Hipblaslt_TN_9238,1.56228
GemmTunableOp_Half_TN,tn_28672_192_8192,Gemm_Hipblaslt_TN_72220,0.526891
GemmTunableOp_Half_TN,tn_5120_7877_8192,Gemm_Hipblaslt_TN_74638,2.49157
GemmTunableOp_Half_TN,tn_8192_6144_14336,Gemm_Hipblaslt_TN_74360,5.93089
GemmTunableOp_Half_TN,tn_8192_6278_4096,Gemm_Hipblaslt_TN_74192,1.68037
GemmTunableOp_Half_TN,tn_5120_7017_8192,Gemm_Hipblaslt_TN_74638,2.24755
GemmTunableOp_Half_TN,tn_8192_6408_4096,Gemm_Rocblas_621288659,1.7165
GemmTunableOp_Half_TN,tn_8192_6587_4096,Gemm_Hipblaslt_TN_107367,1.74038
GemmTunableOp_Half_TN,tn_8192_8148_4096,Gemm_Rocblas_621282559,2.19746
GemmTunableOp_Half_TN,tn_8192_96_4096,Gemm_Hipblaslt_TN_71916,0.043814
GemmTunableOp_Half_TN,tn_8192_80_14336,Gemm_Hipblaslt_TN_71860,0.129791
GemmTunableOp_Half_TN,tn_8192_8_4096,Gemm_Rocblas_621288696,0.0240689
GemmTunableOp_Half_TN,tn_64128_204_8192,Gemm_Hipblaslt_TN_87394,1.4032
GemmTunableOp_Half_TN,tn_8192_5898_14336,Gemm_Hipblaslt_TN_74498,5.9413
GemmTunableOp_Half_TN,tn_64128_188_8192,Gemm_Hipblaslt_TN_73827,1.22865
GemmTunableOp_Half_TN,tn_64128_172_8192,Gemm_Hipblaslt_TN_72226,1.22122
GemmTunableOp_Half_TN,tn_5120_7277_8192,Gemm_Hipblaslt_TN_73828,2.26934
GemmTunableOp_Half_TN,tn_5120_2399_8192,Gemm_Rocblas_621289128,0.771724
GemmTunableOp_Half_TN,tn_8192_168_14336,Gemm_Hipblaslt_TN_73371,0.235713
GemmTunableOp_Half_TN,tn_5120_7757_8192,Gemm_Hipblaslt_TN_74492,2.47194
GemmTunableOp_Half_TN,tn_5120_6188_8192,Gemm_Rocblas_621282559,1.99049
GemmTunableOp_Half_TN,tn_64128_212_8192,Gemm_Hipblaslt_TN_87394,1.40401
GemmTunableOp_Half_TN,tn_8192_6598_4096,Gemm_Hipblaslt_TN_107367,1.7446
GemmTunableOp_Half_TN,tn_5120_5858_8192,Gemm_Rocblas_621282872,1.86614
GemmTunableOp_Half_TN,tn_28672_200_8192,Gemm_Hipblaslt_TN_72297,0.569835
GemmTunableOp_Half_TN,tn_28672_5858_8192,Gemm_Hipblaslt_TN_74854,11.6831
GemmTunableOp_Half_TN,tn_8192_88_14336,Gemm_Hipblaslt_TN_86867,0.135731
GemmTunableOp_Half_TN,tn_28672_120_8192,Gemm_Rocblas_621282646,0.407072
GemmTunableOp_Half_TN,tn_64128_180_8192,Gemm_Hipblaslt_TN_72226,1.22474
GemmTunableOp_Half_TN,tn_5120_6828_8192,Gemm_Hipblaslt_TN_73828,2.23101
GemmTunableOp_Half_TN,tn_28672_7278_8192,Gemm_Hipblaslt_TN_87446,14.4289
GemmTunableOp_Half_TN,tn_64128_236_8192,Gemm_Rocblas_621283080,1.42444
GemmTunableOp_Half_TN,tn_64128_196_8192,Gemm_Hipblaslt_TN_87394,1.39505
GemmTunableOp_Half_TN,tn_5120_5548_8192,Gemm_Hipblaslt_TN_74494,1.77959
GemmTunableOp_Half_TN,tn_64128_164_8192,Gemm_Hipblaslt_TN_72226,1.21771
GemmTunableOp_Half_TN,tn_8192_8037_4096,Gemm_Rocblas_621282559,2.16044
GemmTunableOp_Half_TN,tn_8192_136_14336,Gemm_Hipblaslt_TN_74014,0.172034
GemmTunableOp_Half_TN,tn_28672_5548_8192,Gemm_Hipblaslt_TN_107366,11.0661
GemmTunableOp_Half_TN,tn_28672_2239_8192,Gemm_Hipblaslt_TN_107366,4.71248
GemmTunableOp_Half_TN,tn_28672_6188_8192,Gemm_Hipblaslt_TN_107366,11.6765
GemmTunableOp_Half_TN,tn_64128_228_8192,Gemm_Rocblas_621289279,1.41235
GemmTunableOp_Half_TN,tn_28672_6807_8192,Gemm_Hipblaslt_TN_88152,12.2954
GemmTunableOp_Half_TN,tn_5120_6478_8192,Gemm_Hipblaslt_TN_73828,2.02907
GemmTunableOp_Half_TN,tn_28672_8077_8192,Gemm_Hipblaslt_TN_107362,15.7282
GemmTunableOp_Half_TN,tn_8192_7497_4096,Gemm_Rocblas_621282559,2.03992
GemmTunableOp_Half_TN,tn_64128_220_8192,Gemm_Hipblaslt_TN_87394,1.4071
GemmTunableOp_Half_TN,tn_8192_2149_14336,Gemm_Hipblaslt_TN_74360,2.1615
GemmTunableOp_Half_TN,tn_8192_48_14336,Gemm_Hipblaslt_TN_87479,0.086867
GemmTunableOp_Half_TN,tn_64128_244_8192,Gemm_Rocblas_621289279,1.42371
GemmTunableOp_Half_TN,tn_5120_224_8192,Gemm_Hipblaslt_TN_72986,0.0907543
GemmTunableOp_Half_TN,tn_28672_6408_8192,Gemm_Hipblaslt_TN_107366,12.1479
GemmTunableOp_Half_TN,tn_64128_51_8192,Gemm_Rocblas_621282636,0.553255
GemmTunableOp_Half_TN,tn_64128_76_8192,Gemm_Hipblaslt_TN_71850,0.689061
GemmTunableOp_Half_TN,tn_64128_60_8192,Gemm_Hipblaslt_TN_74657,0.56607
GemmTunableOp_Half_TN,tn_8192_6118_14336,Gemm_Hipblaslt_TN_74360,5.97652
GemmTunableOp_Half_TN,tn_64128_86_8192,Gemm_Hipblaslt_TN_74589,0.733516
GemmTunableOp_Half_TN,tn_28672_72_8192,Gemm_Hipblaslt_TN_71850,0.300736
GemmTunableOp_Half_TN,tn_8192_2399_4096,Gemm_Hipblaslt_TN_107365,0.665067
GemmTunableOp_Half_TN,tn_28672_7787_8192,Gemm_Hipblaslt_TN_87446,15.228
GemmTunableOp_Half_TN,tn_8192_2539_4096,Gemm_Hipblaslt_TN_72545,0.672856
GemmTunableOp_Half_TN,tn_8192_48_4096,Gemm_Hipblaslt_TN_74655,0.030706
GemmTunableOp_Half_TN,tn_8192_5538_14336,Gemm_Hipblaslt_TN_88009,5.62359
GemmTunableOp_Half_TN,tn_28672_48_8192,Gemm_Hipblaslt_TN_71830,0.228882
GemmTunableOp_Half_TN,tn_8192_5708_14336,Gemm_Hipblaslt_TN_72310,5.74321
GemmTunableOp_Half_TN,tn_5120_8058_8192,Gemm_Hipblaslt_TN_74638,2.59865
GemmTunableOp_Half_TN,tn_8192_6248_4096,Gemm_Rocblas_621282462,1.57824
GemmTunableOp_Half_TN,tn_8192_7877_4096,Gemm_Rocblas_621282559,2.16601
GemmTunableOp_Half_TN,tn_64128_252_8192,Gemm_Rocblas_621289270,1.41878
GemmTunableOp_Half_TN,tn_64128_68_8192,Gemm_Hipblaslt_TN_71861,0.686446
GemmTunableOp_Half_TN,tn_8192_6397_14336,Gemm_Hipblaslt_TN_88057,6.62351
GemmTunableOp_Half_TN,tn_8192_6748_14336,Gemm_Hipblaslt_TN_72310,6.80145
GemmTunableOp_Half_TN,tn_8192_7017_4096,Gemm_Rocblas_621282559,1.84153
GemmTunableOp_Half_TN,tn_8192_7178_14336,Gemm_Hipblaslt_TN_74360,6.84022
GemmTunableOp_Half_TN,tn_8192_7688_14336,Gemm_Hipblaslt_TN_88138,7.90897
GemmTunableOp_Half_TN,tn_8192_96_14336,Gemm_Hipblaslt_TN_86867,0.133398
GemmTunableOp_Half_TN,tn_8192_88_4096,Gemm_Hipblaslt_TN_72198,0.044842
GemmTunableOp_Half_TN,tn_8192_7967_4096,Gemm_Rocblas_621282559,2.13173
GemmTunableOp_Half_TN,tn_8192_7438_14336,Gemm_Hipblaslt_TN_74360,7.21254
GemmTunableOp_Half_TN,tn_8192_6958_4096,Gemm_Rocblas_621282559,1.80579
GemmTunableOp_Half_TN,tn_8192_6668_14336,Gemm_Hipblaslt_TN_74360,6.2997
GemmTunableOp_Half_TN,tn_8192_6478_14336,Gemm_Hipblaslt_TN_88057,6.51703
GemmTunableOp_Half_TN,tn_8192_6348_4096,Gemm_Hipblaslt_TN_107367,1.69103
GemmTunableOp_Half_TN,tn_8192_6110_4096,Gemm_Rocblas_621282559,1.57837
GemmTunableOp_Half_TN,tn_5120_96_8192,Gemm_Hipblaslt_TN_72188,0.0500374
GemmTunableOp_Half_TN,tn_8192_7757_14336,Gemm_Hipblaslt_TN_74360,7.82053
GemmTunableOp_Half_TN,tn_64128_185_8192,Gemm_Hipblaslt_TN_72226,1.21412
GemmTunableOp_Half_TN,tn_5120_7118_8192,Gemm_Hipblaslt_TN_74209,2.21118
GemmTunableOp_Half_TN,tn_28672_80_8192,Gemm_Hipblaslt_TN_71861,0.301626
GemmTunableOp_Half_TN,tn_8192_192_14336,Gemm_Hipblaslt_TN_74063,0.199966
GemmTunableOp_Half_TN,tn_5120_6668_8192,Gemm_Rocblas_621289056,2.08
GemmTunableOp_Half_TN,tn_5120_5738_8192,Gemm_Rocblas_621289056,1.73318
GemmTunableOp_Half_TN,tn_5120_32_8192,Gemm_Rocblas_621288657,0.0349976
GemmTunableOp_Half_TN,tn_5120_208_8192,Gemm_Hipblaslt_TN_85682,0.0868341
GemmTunableOp_Half_TN,tn_5120_2239_8192,Gemm_Hipblaslt_TN_73187,0.726348
GemmTunableOp_Half_TN,tn_5120_7968_8192,Gemm_Hipblaslt_TN_74367,2.53375
GemmTunableOp_Half_TN,tn_28672_144_8192,Gemm_Hipblaslt_TN_72137,0.459674
GemmTunableOp_Half_TN,tn_28672_5798_8192,Gemm_Hipblaslt_TN_107366,11.4311
GemmTunableOp_Half_TN,tn_64128_209_8192,Gemm_Hipblaslt_TN_87394,1.3894
GemmTunableOp_Half_TN,tn_5120_4628_8192,Gemm_Rocblas_621282852,1.46975
GemmTunableOp_Half_TN,tn_8192_5708_4096,Gemm_Hipblaslt_TN_107365,1.46407
GemmTunableOp_Half_TN,tn_28672_6118_8192,Gemm_Rocblas_621282796,11.7409
GemmTunableOp_Half_TN,tn_28672_32_8192,Gemm_Rocblas_621282460,0.190929
GemmTunableOp_Half_TN,tn_28672_40_8192,Gemm_Hipblaslt_TN_71830,0.233561
GemmTunableOp_Half_TN,tn_28672_5518_8192,Gemm_Hipblaslt_TN_107366,10.9596
GemmTunableOp_Half_TN,tn_5120_7598_8192,Gemm_Hipblaslt_TN_74447,2.27016
GemmTunableOp_Half_TN,tn_28672_8037_8192,Gemm_Hipblaslt_TN_87446,15.3333
GemmTunableOp_Half_TN,tn_28672_6748_8192,Gemm_Hipblaslt_TN_88152,12.1876
GemmTunableOp_Half_TN,tn_64128_161_8192,Gemm_Hipblaslt_TN_73827,1.21054
GemmTunableOp_Half_TN,tn_28672_6397_8192,Gemm_Hipblaslt_TN_107366,11.5936
GemmTunableOp_Half_TN,tn_28672_24_8192,Gemm_Rocblas_621282585,0.194055
GemmTunableOp_Half_TN,tn_28672_7178_8192,Gemm_Hipblaslt_TN_88152,14.2884
GemmTunableOp_Half_TN,tn_8192_7118_14336,Gemm_Hipblaslt_TN_74360,6.94228
GemmTunableOp_Half_TN,tn_64128_169_8192,Gemm_Hipblaslt_TN_72226,1.21201
GemmTunableOp_Half_TN,tn_64128_193_8192,Gemm_Rocblas_621283075,1.38888
GemmTunableOp_Half_TN,tn_8192_160_4096,Gemm_Hipblaslt_TN_72903,0.0624267
GemmTunableOp_Half_TN,tn_28672_7688_8192,Gemm_Hipblaslt_TN_87446,15.0643
GemmTunableOp_Half_TN,tn_28672_208_8192,Gemm_Hipblaslt_TN_72304,0.570365
GemmTunableOp_Half_TN,tn_64128_54_8192,Gemm_Rocblas_621288872,0.552366
GemmTunableOp_Half_TN,tn_8192_6188_14336,Gemm_Hipblaslt_TN_74360,6.05187
GemmTunableOp_Half_TN,tn_64128_177_8192,Gemm_Hipblaslt_TN_72226,1.21339
GemmTunableOp_Half_TN,tn_8192_128_4096,Gemm_Hipblaslt_TN_107350,0.0546991
GemmTunableOp_Half_TN,tn_64128_46_8192,Gemm_Hipblaslt_TN_71715,0.515111
GemmTunableOp_Half_TN,tn_64128_201_8192,Gemm_Hipblaslt_TN_87981,1.3847
GemmTunableOp_Half_TN,tn_64128_217_8192,Gemm_Hipblaslt_TN_87394,1.39252
GemmTunableOp_Half_TN,tn_64128_233_8192,Gemm_Rocblas_621289279,1.40745
GemmTunableOp_Half_TN,tn_8192_8058_14336,Gemm_Hipblaslt_TN_74360,7.83191
GemmTunableOp_Half_TN,tn_5120_6348_8192,Gemm_Rocblas_621289056,1.96986
GemmTunableOp_Half_TN,tn_64128_225_8192,Gemm_Rocblas_621289270,1.39756
GemmTunableOp_Half_TN,tn_8192_5608_4096,Gemm_Rocblas_621282462,1.44873
GemmTunableOp_Half_TN,tn_64128_241_8192,Gemm_Rocblas_621289283,1.40873
GemmTunableOp_Half_TN,tn_64128_249_8192,Gemm_Rocblas_621289272,1.40531
GemmTunableOp_Half_TN,tn_64128_62_8192,Gemm_Hipblaslt_TN_74657,0.561316
GemmTunableOp_Half_TN,tn_8192_4628_14336,Gemm_Hipblaslt_TN_74360,4.61526
GemmTunableOp_Half_TN,tn_64128_85_8192,Gemm_Hipblaslt_TN_71907,0.737407
GemmTunableOp_Half_TN,tn_8192_256_14336,Gemm_Hipblaslt_TN_73280,0.256689
GemmTunableOp_Half_TN,tn_64128_77_8192,Gemm_Hipblaslt_TN_71861,0.686032
GemmTunableOp_Half_TN,tn_8192_152_4096,Gemm_Hipblaslt_TN_72903,0.0628397
GemmTunableOp_Half_TN,tn_5120_6110_8192,Gemm_Rocblas_621282559,1.94735
GemmTunableOp_Half_TN,tn_8192_2149_4096,Gemm_Hipblaslt_TN_72537,0.584805
GemmTunableOp_Half_TN,tn_28672_240_8192,Gemm_Rocblas_621288865,0.603918
GemmTunableOp_Half_TN,tn_8192_232_14336,Gemm_Hipblaslt_TN_74098,0.265875
GemmTunableOp_Half_TN,tn_8192_5958_4096,Gemm_Hipblaslt_TN_107367,1.58246
GemmTunableOp_Half_TN,tn_64128_70_8192,Gemm_Hipblaslt_TN_71850,0.681541
GemmTunableOp_Half_TN,tn_8192_248_4096,Gemm_Rocblas_621289371,0.0890646
GemmTunableOp_Half_TN,tn_28672_8_8192,Gemm_Rocblas_621282656,0.160385
GemmTunableOp_Half_TN,tn_8192_5828_4096,Gemm_Hipblaslt_TN_74192,1.5361
GemmTunableOp_Half_TN,tn_8192_8192_14336,Gemm_Hipblaslt_TN_88055,8.23275
GemmTunableOp_Half_TN,tn_8192_7968_4096,Gemm_Rocblas_621282867,2.17115
GemmTunableOp_Half_TN,tn_8192_7787_14336,Gemm_Hipblaslt_TN_88078,7.98129
GemmTunableOp_Half_TN,tn_8192_7598_4096,Gemm_Hipblaslt_TN_9237,2.11689
GemmTunableOp_Half_TN,tn_8192_7278_14336,Gemm_Hipblaslt_TN_74725,7.04063
GemmTunableOp_Half_TN,tn_8192_72_14336,Gemm_Hipblaslt_TN_73975,0.127153
GemmTunableOp_Half_TN,tn_64128_203_8192,Gemm_Hipblaslt_TN_87394,1.39715
GemmTunableOp_Half_TN,tn_8192_7028_4096,Default,1.88101
GemmTunableOp_Half_TN,tn_8192_16_14336,Gemm_Hipblaslt_TN_74643,0.0674771
GemmTunableOp_Half_TN,tn_64128_195_8192,Gemm_Hipblaslt_TN_87394,1.39594
GemmTunableOp_Half_TN,tn_8192_120_4096,Gemm_Hipblaslt_TN_107350,0.056342
GemmTunableOp_Half_TN,tn_64128_179_8192,Gemm_Hipblaslt_TN_73827,1.22173
GemmTunableOp_Half_TN,tn_64128_163_8192,Gemm_Hipblaslt_TN_72226,1.21676
GemmTunableOp_Half_TN,tn_8192_6408_14336,Gemm_Hipblaslt_TN_107364,6.67276
GemmTunableOp_Half_TN,tn_5120_5518_8192,Gemm_Hipblaslt_TN_73828,1.76847
GemmTunableOp_Half_TN,tn_28672_7877_8192,Gemm_Hipblaslt_TN_107366,15.4602
GemmTunableOp_Half_TN,tn_64128_219_8192,Gemm_Hipblaslt_TN_87394,1.40364
GemmTunableOp_Half_TN,tn_8192_168_4096,Gemm_Hipblaslt_TN_74063,0.0711842
GemmTunableOp_Half_TN,tn_8192_4096_4096,Gemm_Rocblas_621282462,1.08148
GemmTunableOp_Half_TN,tn_5120_7178_8192,Default,2.28075
GemmTunableOp_Half_TN,tn_5120_6748_8192,Gemm_Rocblas_621288968,2.32237
GemmTunableOp_Half_TN,tn_5120_7688_8192,Gemm_Hipblaslt_TN_73828,2.46497
GemmTunableOp_Half_TN,tn_64128_171_8192,Gemm_Hipblaslt_TN_72226,1.22154
GemmTunableOp_Half_TN,tn_28672_16_8192,Gemm_Rocblas_621288703,0.160746
GemmTunableOp_Half_TN,tn_64128_187_8192,Gemm_Hipblaslt_TN_72226,1.22693
GemmTunableOp_Half_TN,tn_8192_192_4096,Gemm_Hipblaslt_TN_74063,0.0721509
GemmTunableOp_Half_TN,tn_5120_6118_8192,Gemm_Rocblas_621289114,1.99597
GemmTunableOp_Half_TN,tn_5120_8_8192,Gemm_Rocblas_621288731,0.0332366
GemmTunableOp_Half_TN,tn_28672_160_8192,Gemm_Hipblaslt_TN_88087,0.468994
GemmTunableOp_Half_TN,tn_64128_235_8192,Gemm_Rocblas_621289279,1.41536
GemmTunableOp_Half_TN,tn_8192_5738_14336,Gemm_Hipblaslt_TN_72306,5.73026
GemmTunableOp_Half_TN,tn_5120_80_8192,Gemm_Hipblaslt_TN_87820,0.0487114
GemmTunableOp_Half_TN,tn_64128_227_8192,Gemm_Rocblas_621283075,1.4092
GemmTunableOp_Half_TN,tn_64128_251_8192,Gemm_Rocblas_621283075,1.42714
GemmTunableOp_Half_TN,tn_64128_211_8192,Gemm_Hipblaslt_TN_87394,1.4
GemmTunableOp_Half_TN,tn_28672_5658_8192,Gemm_Rocblas_621289105,11.3338
GemmTunableOp_Half_TN,tn_28672_2149_8192,Gemm_Hipblaslt_TN_107366,4.68758
GemmTunableOp_Half_TN,tn_5120_8037_8192,Gemm_Rocblas_621282450,2.66424
GemmTunableOp_Half_TN,tn_28672_6018_8192,Gemm_Rocblas_621288661,11.6299
GemmTunableOp_Half_TN,tn_5120_6397_8192,Gemm_Hipblaslt_TN_73828,2.02254
GemmTunableOp_Half_TN,tn_28672_6598_8192,Gemm_Hipblaslt_TN_107366,12.1382
GemmTunableOp_Half_TN,tn_8192_6600_4096,Gemm_Hipblaslt_TN_87980,1.75667
GemmTunableOp_Half_TN,tn_28672_2639_8192,Gemm_Hipblaslt_TN_88172,5.43682
GemmTunableOp_Half_TN,tn_28672_7017_8192,Gemm_Hipblaslt_TN_88152,12.325
GemmTunableOp_Half_TN,tn_28672_8192_8192,Gemm_Hipblaslt_TN_107362,15.5402
GemmTunableOp_Half_TN,tn_5120_5798_8192,Gemm_Hipblaslt_TN_74797,1.83985
GemmTunableOp_Half_TN,tn_64128_243_8192,Gemm_Rocblas_621283066,1.42307
GemmTunableOp_Half_TN,tn_64128_59_8192,Gemm_Rocblas_621288849,0.556607
GemmTunableOp_Half_TN,tn_64128_67_8192,Gemm_Hipblaslt_TN_71857,0.68713
GemmTunableOp_Half_TN,tn_64128_83_8192,Gemm_Hipblaslt_TN_72193,0.730011
GemmTunableOp_Half_TN,tn_8192_144_4096,Gemm_Hipblaslt_TN_72903,0.0625313
GemmTunableOp_Half_TN,tn_8192_2048_14336,Gemm_Hipblaslt_TN_87438,2.10134
GemmTunableOp_Half_TN,tn_8192_256_4096,Gemm_Rocblas_621289371,0.087054
GemmTunableOp_Half_TN,tn_8192_2399_14336,Gemm_Hipblaslt_TN_74255,2.54809
GemmTunableOp_Half_TN,tn_8192_32_4096,Gemm_Rocblas_621282629,0.0266671
GemmTunableOp_Half_TN,tn_28672_6248_8192,Gemm_Hipblaslt_TN_107366,11.6453
GemmTunableOp_Half_TN,tn_64128_49_8192,Gemm_Rocblas_621282641,0.549855
GemmTunableOp_Half_TN,tn_8192_40_4096,Default,0.030825
GemmTunableOp_Half_TN,tn_64128_75_8192,Gemm_Hipblaslt_TN_71857,0.690091
GemmTunableOp_Half_TN,tn_8192_5548_14336,Gemm_Hipblaslt_TN_73828,5.61046
GemmTunableOp_Half_TN,tn_8192_5958_14336,Gemm_Hipblaslt_TN_74494,6.10991
GemmTunableOp_Half_TN,tn_28672_7497_8192,Gemm_Hipblaslt_TN_87446,14.6947
GemmTunableOp_Half_TN,tn_8192_64_4096,Gemm_Rocblas_621282641,0.0319234
GemmTunableOp_Half_TN,tn_8192_6144_4096,Gemm_Rocblas_621282462,1.61912
GemmTunableOp_Half_TN,tn_8192_8077_4096,Default,2.22408
GemmTunableOp_Half_TN,tn_8192_6807_14336,Gemm_Hipblaslt_TN_74255,6.82631
GemmTunableOp_Half_TN,tn_8192_6226_14336,Gemm_Hipblaslt_TN_74492,6.24223
GemmTunableOp_Half_TN,tn_8192_8192_4096,Gemm_Rocblas_621282462,2.07599
GemmTunableOp_Half_TN,tn_8192_7788_14336,Gemm_Hipblaslt_TN_74360,7.73506
GemmTunableOp_Half_TN,tn_8192_7338_14336,Gemm_Hipblaslt_TN_74360,7.12395
GemmTunableOp_Half_TN,tn_8192_7178_4096,Gemm_Rocblas_621282559,1.88877
GemmTunableOp_Half_TN,tn_8192_6748_4096,Gemm_Rocblas_621289056,1.72057
GemmTunableOp_Half_TN,tn_8192_6397_4096,Gemm_Hipblaslt_TN_107367,1.69558
GemmTunableOp_Half_TN,tn_5120_128_8192,Gemm_Rocblas_621288849,0.0553105
GemmTunableOp_Half_TN,tn_5120_160_8192,Gemm_Hipblaslt_TN_72371,0.0684045
GemmTunableOp_Half_TN,tn_8192_6018_4096,Gemm_Hipblaslt_TN_107367,1.57598
GemmTunableOp_Half_TN,tn_5120_2459_8192,Gemm_Rocblas_621289056,0.754314
GemmTunableOp_Half_TN,tn_5120_192_8192,Gemm_Hipblaslt_TN_71916,0.0757956
GemmTunableOp_Half_TN,tn_8192_24_4096,Gemm_Rocblas_621288838,0.0268919
GemmTunableOp_Half_TN,tn_5120_176_8192,Gemm_Hipblaslt_TN_72494,0.0768291
GemmTunableOp_Half_TN,tn_5120_16_8192,Gemm_Rocblas_621288731,0.0333159
GemmTunableOp_Half_TN,tn_8192_80_4096,Gemm_Hipblaslt_TN_74372,0.0420618
GemmTunableOp_Half_TN,tn_28672_2048_8192,Gemm_Hipblaslt_TN_107362,3.95931
GemmTunableOp_Half_TN,tn_64128_198_8192,Gemm_Hipblaslt_TN_87394,1.3882
GemmTunableOp_Half_TN,tn_5120_5898_8192,Gemm_Rocblas_621282762,1.90129
GemmTunableOp_Half_TN,tn_8192_8_14336,Gemm_Hipblaslt_TN_74643,0.0650815
GemmTunableOp_Half_TN,tn_5120_5608_8192,Gemm_Rocblas_621282852,1.72002
GemmTunableOp_Half_TN,tn_28672_7968_8192,Gemm_Hipblaslt_TN_87446,15.3329
GemmTunableOp_Half_TN,tn_8192_7688_4096,Gemm_Rocblas_621282462,2.00725
GemmTunableOp_Half_TN,tn_5120_6538_8192,Gemm_Rocblas_621282852,2.07199
GemmTunableOp_Half_TN,tn_5120_7788_8192,Gemm_Hipblaslt_TN_74492,2.42308
GemmTunableOp_Half_TN,tn_8192_216_14336,Gemm_Hipblaslt_TN_74098,0.245375
GemmTunableOp_Half_TN,tn_5120_8148_8192,Gemm_Hipblaslt_TN_74447,2.60685
GemmTunableOp_Half_TN,tn_28672_4628_8192,Gemm_Hipblaslt_TN_107366,9.49334
GemmTunableOp_Half_TN,tn_5120_144_8192,Gemm_Hipblaslt_TN_72373,0.0679466
GemmTunableOp_Half_TN,tn_28672_136_8192,Gemm_Hipblaslt_TN_72137,0.455658
GemmTunableOp_Half_TN,tn_28672_7598_8192,Gemm_Hipblaslt_TN_87446,14.6633
GemmTunableOp_Half_TN,tn_28672_5738_8192,Gemm_Hipblaslt_TN_107366,11.3713
GemmTunableOp_Half_TN,tn_8192_5658_4096,Gemm_Hipblaslt_TN_107365,1.46328
GemmTunableOp_Half_TN,tn_28672_7118_8192,Gemm_Hipblaslt_TN_88152,12.3171
GemmTunableOp_Half_TN,tn_5120_7338_8192,Gemm_Hipblaslt_TN_74447,2.24918
GemmTunableOp_Half_TN,tn_28672_96_8192,Gemm_Hipblaslt_TN_74589,0.325418
GemmTunableOp_Half_TN,tn_5120_6888_8192,Gemm_Rocblas_621282440,2.18454
GemmTunableOp_Half_TN,tn_8192_6888_14336,Gemm_Hipblaslt_TN_72310,6.78359
GemmTunableOp_Half_TN,tn_64128_64_8192,Gemm_Rocblas_621282636,0.556409
GemmTunableOp_Half_TN,tn_5120_2048_8192,Gemm_Hipblaslt_TN_87464,0.679954
GemmTunableOp_Half_TN,tn_8192_5518_14336,Gemm_Hipblaslt_TN_88009,5.50465
GemmTunableOp_Half_TN,tn_28672_256_8192,Gemm_Rocblas_621282980,0.594229
GemmTunableOp_Half_TN,tn_5120_56_8192,Gemm_Hipblaslt_TN_72350,0.0405027
GemmTunableOp_Half_TN,tn_28672_6668_8192,Gemm_Hipblaslt_TN_88152,12.198
GemmTunableOp_Half_TN,tn_64128_166_8192,Gemm_Hipblaslt_TN_72226,1.21606
GemmTunableOp_Half_TN,tn_8192_6215_14336,Gemm_Hipblaslt_TN_73828,6.12981
GemmTunableOp_Half_TN,tn_64128_72_8192,Gemm_Hipblaslt_TN_71861,0.682877
GemmTunableOp_Half_TN,tn_8192_232_4096,Gemm_Hipblaslt_TN_74098,0.0865296
GemmTunableOp_Half_TN,tn_64128_174_8192,Gemm_Hipblaslt_TN_72226,1.21326
GemmTunableOp_Half_TN,tn_64128_238_8192,Gemm_Rocblas_621283068,1.3999
GemmTunableOp_Half_TN,tn_28672_6348_8192,Gemm_Hipblaslt_TN_107366,11.5264
GemmTunableOp_Half_TN,tn_64128_182_8192,Gemm_Hipblaslt_TN_72226,1.21682
GemmTunableOp_Half_TN,tn_64128_190_8192,Gemm_Hipblaslt_TN_72226,1.21835
GemmTunableOp_Half_TN,tn_28672_6110_8192,Gemm_Hipblaslt_TN_74854,11.7474
GemmTunableOp_Half_TN,tn_64128_206_8192,Gemm_Rocblas_621283080,1.38811
GemmTunableOp_Half_TN,tn_64128_214_8192,Gemm_Hipblaslt_TN_87394,1.39786
GemmTunableOp_Half_TN,tn_64128_222_8192,Gemm_Hipblaslt_TN_87981,1.39446
GemmTunableOp_Half_TN,tn_64128_230_8192,Gemm_Rocblas_621283075,1.40285
GemmTunableOp_Half_TN,tn_8192_6538_14336,Gemm_Hipblaslt_TN_74482,6.55056
GemmTunableOp_Half_TN,tn_64128_246_8192,Gemm_Rocblas_621289270,1.40724
GemmTunableOp_Half_TN,tn_64128_254_8192,Gemm_Rocblas_621283080,1.40335
GemmTunableOp_Half_TN,tn_8192_6118_4096,Gemm_Hipblaslt_TN_107347,1.57413
GemmTunableOp_Half_TN,tn_64128_56_8192,Gemm_Rocblas_621282636,0.552444
GemmTunableOp_Half_TN,tn_64128_80_8192,Gemm_Hipblaslt_TN_71861,0.680282
GemmTunableOp_Half_TN,tn_8192_104_14336,Gemm_Hipblaslt_TN_73979,0.15312
GemmTunableOp_Half_TN,tn_8192_2539_14336,Gemm_Hipblaslt_TN_74360,2.54596
GemmTunableOp_Half_TN,tn_8192_128_14336,Gemm_Hipblaslt_TN_73979,0.155818
GemmTunableOp_Half_TN,tn_8192_160_14336,Gemm_Hipblaslt_TN_74157,0.191681
GemmTunableOp_Half_TN,tn_5120_6215_8192,Gemm_Rocblas_621282559,1.95292
GemmTunableOp_Half_TN,tn_8192_200_4096,Gemm_Hipblaslt_TN_72529,0.0851155
GemmTunableOp_Half_TN,tn_8192_240_4096,Gemm_Rocblas_621283149,0.0893362
GemmTunableOp_Half_TN,tn_8192_8037_14336,Gemm_Hipblaslt_TN_74360,7.65321
GemmTunableOp_Half_TN,tn_8192_5798_14336,Gemm_Hipblaslt_TN_74255,5.67376
GemmTunableOp_Half_TN,tn_64128_215_8192,Gemm_Hipblaslt_TN_87394,1.399
GemmTunableOp_Half_TN,tn_5120_8177_8192,Gemm_Hipblaslt_TN_74447,2.62321
GemmTunableOp_Half_TN,tn_64128_247_8192,Gemm_Rocblas_621289279,1.40851
GemmTunableOp_Half_TN,tn_5120_6958_8192,Gemm_Hipblaslt_TN_74210,2.216
GemmTunableOp_Half_TN,tn_28672_232_8192,Gemm_Rocblas_621282655,0.606188
GemmTunableOp_Half_TN,tn_8192_6058_14336,Gemm_Hipblaslt_TN_74493,6.12151
GemmTunableOp_Half_TN,tn_5120_6226_8192,Gemm_Rocblas_621282559,1.97115
GemmTunableOp_Half_TN,tn_5120_5958_8192,Gemm_Rocblas_621289056,1.89894
GemmTunableOp_Half_TN,tn_64128_74_8192,Gemm_Hipblaslt_TN_71850,0.683797
GemmTunableOp_Half_TN,tn_8192_7788_4096,Gemm_Hipblaslt_TN_107365,2.0445
GemmTunableOp_Half_TN,tn_8192_5828_14336,Gemm_Hipblaslt_TN_73673,5.8515
GemmTunableOp_Half_TN,tn_5120_6587_8192,Gemm_Rocblas_621289056,2.08554
GemmTunableOp_Half_TN,tn_5120_5638_8192,Gemm_Rocblas_621282852,1.74311
GemmTunableOp_Half_TN,tn_64128_239_8192,Gemm_Rocblas_621283066,1.40635
GemmTunableOp_Half_TN,tn_28672_128_8192,Gemm_Rocblas_621288855,0.404599
GemmTunableOp_Half_TN,tn_28672_7338_8192,Gemm_Hipblaslt_TN_107366,14.2823
GemmTunableOp_Half_TN,tn_64128_223_8192,Gemm_Hipblaslt_TN_87394,1.39911
GemmTunableOp_Half_TN,tn_8192_152_14336,Gemm_Hipblaslt_TN_74022,0.199652
GemmTunableOp_Half_TN,tn_64128_191_8192,Gemm_Hipblaslt_TN_72226,1.21824
GemmTunableOp_Half_TN,tn_5120_7438_8192,Gemm_Hipblaslt_TN_74447,2.27465
GemmTunableOp_Half_TN,tn_8192_6888_4096,Gemm_Rocblas_621282462,1.7276
GemmTunableOp_Half_TN,tn_64128_199_8192,Gemm_Hipblaslt_TN_87394,1.39469
GemmTunableOp_Half_TN,tn_28672_6538_8192,Gemm_Hipblaslt_TN_107366,12.1028
GemmTunableOp_Half_TN,tn_64128_175_8192,Gemm_Hipblaslt_TN_72226,1.21303
GemmTunableOp_Half_TN,tn_64128_167_8192,Gemm_Hipblaslt_TN_72226,1.21361
GemmTunableOp_Half_TN,tn_8192_2459_14336,Gemm_Hipblaslt_TN_74360,2.53207
GemmTunableOp_Half_TN,tn_5120_240_8192,Gemm_Hipblaslt_TN_72641,0.0951501
GemmTunableOp_Half_TN,tn_64128_183_8192,Gemm_Hipblaslt_TN_72226,1.2163
GemmTunableOp_Half_TN,tn_28672_2539_8192,Gemm_Hipblaslt_TN_107366,5.25221
GemmTunableOp_Half_TN,tn_64128_66_8192,Gemm_Hipblaslt_TN_71857,0.678985
GemmTunableOp_Half_TN,tn_8192_2048_4096,Gemm_Rocblas_621282723,0.534805
GemmTunableOp_Half_TN,tn_28672_6215_8192,Gemm_Hipblaslt_TN_88172,11.5854
GemmTunableOp_Half_TN,tn_8192_224_14336,Gemm_Hipblaslt_TN_73514,0.275064
GemmTunableOp_Half_TN,tn_28672_5608_8192,Gemm_Rocblas_621289272,11.4605
GemmTunableOp_Half_TN,tn_8192_112_14336,Gemm_Hipblaslt_TN_73979,0.154362
GemmTunableOp_Half_TN,tn_28672_184_8192,Gemm_Hipblaslt_TN_72213,0.525246
GemmTunableOp_Half_TN,tn_5120_7868_8192,Gemm_Hipblaslt_TN_73828,2.45468
GemmTunableOp_Half_TN,tn_28672_5898_8192,Gemm_Rocblas_621282798,11.4962
GemmTunableOp_Half_TN,tn_8192_8148_14336,Gemm_Hipblaslt_TN_73671,8.18478
GemmTunableOp_Half_TN,tn_28672_6888_8192,Gemm_Hipblaslt_TN_88152,12.2692
GemmTunableOp_Half_TN,tn_64128_207_8192,Gemm_Hipblaslt_TN_87394,1.39678
GemmTunableOp_Half_TN,tn_28672_8148_8192,Gemm_Hipblaslt_TN_88165,15.5885
GemmTunableOp_Half_TN,tn_64128_231_8192,Gemm_Rocblas_621289279,1.40787
GemmTunableOp_Half_TN,tn_64128_255_8192,Gemm_Rocblas_621289270,1.41117
GemmTunableOp_Half_TN,tn_64128_58_8192,Gemm_Rocblas_621282633,0.552621
GemmTunableOp_Half_TN,tn_8192_6538_4096,Gemm_Hipblaslt_TN_107367,1.71214
GemmTunableOp_Half_TN,tn_64128_82_8192,Gemm_Hipblaslt_TN_71912,0.731299
GemmTunableOp_Half_TN,tn_5120_2539_8192,Gemm_Rocblas_621288925,0.777401
GemmTunableOp_Half_TN,tn_8192_184_4096,Gemm_Hipblaslt_TN_72912,0.0717908
GemmTunableOp_Half_TN,tn_8192_4096_14336,Gemm_Hipblaslt_TN_74627,4.07528
GemmTunableOp_Half_TN,tn_8192_56_14336,Gemm_Hipblaslt_TN_74353,0.0957046
GemmTunableOp_Half_TN,tn_8192_5638_14336,Gemm_Hipblaslt_TN_74360,5.47353
GemmTunableOp_Half_TN,tn_8192_6215_4096,Gemm_Rocblas_621282559,1.57832
GemmTunableOp_Half_TN,tn_8192_6278_14336,Gemm_Hipblaslt_TN_74367,6.24433
GemmTunableOp_Half_TN,tn_28672_7788_8192,Gemm_Hipblaslt_TN_87446,15.0826
GemmTunableOp_Half_TN,tn_8192_6600_14336,Gemm_Hipblaslt_TN_74360,6.55604
GemmTunableOp_Half_TN,tn_8192_7028_14336,Gemm_Hipblaslt_TN_88152,7.01032
GemmTunableOp_Half_TN,tn_8192_7338_4096,Gemm_Rocblas_621282559,1.89831
GemmTunableOp_Half_TN,tn_8192_7508_14336,Gemm_Hipblaslt_TN_74360,7.31303
GemmTunableOp_Half_TN,tn_8192_7967_14336,Gemm_Hipblaslt_TN_74360,7.93719
GemmTunableOp_Half_TN,tn_8192_8177_4096,Gemm_Rocblas_621288968,2.19238
GemmTunableOp_Half_TN,tn_8192_7968_14336,Gemm_Hipblaslt_TN_74360,7.87854
GemmTunableOp_Half_TN,tn_8192_7598_14336,Gemm_Hipblaslt_TN_74360,7.27091
GemmTunableOp_Half_TN,tn_8192_7438_4096,Gemm_Rocblas_621282559,2.02374
GemmTunableOp_Half_TN,tn_8192_7277_4096,Gemm_Rocblas_621282559,1.90521
GemmTunableOp_Half_TN,tn_64128_165_8192,Gemm_Hipblaslt_TN_73827,1.21618
GemmTunableOp_Half_TN,tn_28672_2459_8192,Gemm_Hipblaslt_TN_107366,5.30487
GemmTunableOp_Half_TN,tn_28672_5958_8192,Gemm_Rocblas_621288661,11.6749
GemmTunableOp_Half_TN,tn_28672_6587_8192,Gemm_Hipblaslt_TN_107366,12.2083
GemmTunableOp_Half_TN,tn_64128_197_8192,Gemm_Hipblaslt_TN_87394,1.40151
GemmTunableOp_Half_TN,tn_8192_120_14336,Gemm_Hipblaslt_TN_74664,0.16902
GemmTunableOp_Half_TN,tn_5120_6144_8192,Gemm_Rocblas_621288631,1.96378
GemmTunableOp_Half_TN,tn_64128_173_8192,Gemm_Hipblaslt_TN_73827,1.21722
GemmTunableOp_Half_TN,tn_64128_213_8192,Gemm_Hipblaslt_TN_87394,1.39675
GemmTunableOp_Half_TN,tn_5120_64_8192,Gemm_Hipblaslt_TN_71968,0.0415591
GemmTunableOp_Half_TN,tn_5120_5828_8192,Gemm_Rocblas_621282726,1.863
GemmTunableOp_Half_TN,tn_28672_7438_8192,Gemm_Hipblaslt_TN_87446,14.7546
GemmTunableOp_Half_TN,tn_5120_5538_8192,Gemm_Rocblas_621282852,1.73598
GemmTunableOp_Half_TN,tn_5120_40_8192,Gemm_Hipblaslt_TN_71718,0.0383859
GemmTunableOp_Half_TN,tn_64128_253_8192,Gemm_Rocblas_621283068,1.42392
GemmTunableOp_Half_TN,tn_8192_7868_4096,Gemm_Rocblas_621282559,2.15109
GemmTunableOp_Half_TN,tn_5120_72_8192,Gemm_Hipblaslt_TN_73129,0.0474675
GemmTunableOp_Half_TN,tn_28672_168_8192,Gemm_Hipblaslt_TN_72213,0.513225
GemmTunableOp_Half_TN,tn_5120_7787_8192,Gemm_Hipblaslt_TN_74236,2.46637
GemmTunableOp_Half_TN,tn_28672_216_8192,Gemm_Hipblaslt_TN_72311,0.579912
GemmTunableOp_Half_TN,tn_64128_229_8192,Gemm_Rocblas_621283066,1.41615
GemmTunableOp_Half_TN,tn_8192_5858_14336,Gemm_Hipblaslt_TN_88008,5.8874
GemmTunableOp_Half_TN,tn_5120_7278_8192,Gemm_Hipblaslt_TN_87514,2.2529
GemmTunableOp_Half_TN,tn_28672_5638_8192,Gemm_Hipblaslt_TN_107366,11.5026
GemmTunableOp_Half_TN,tn_28672_104_8192,Default,0.389367
GemmTunableOp_Half_TN,tn_8192_208_4096,Gemm_Hipblaslt_TN_73514,0.0851275
GemmTunableOp_Half_TN,tn_28672_6226_8192,Gemm_Hipblaslt_TN_107366,11.6158
GemmTunableOp_Half_TN,tn_28672_7868_8192,Gemm_Hipblaslt_TN_107366,15.4741
GemmTunableOp_Half_TN,tn_28672_56_8192,Gemm_Rocblas_621288871,0.249049
GemmTunableOp_Half_TN,tn_28672_8177_8192,Gemm_Hipblaslt_TN_107362,15.7157
GemmTunableOp_Half_TN,tn_8192_6226_4096,Gemm_Rocblas_621282559,1.59568
GemmTunableOp_Half_TN,tn_64128_181_8192,Gemm_Hipblaslt_TN_73827,1.22325
GemmTunableOp_Half_TN,tn_5120_8077_8192,Gemm_Hipblaslt_TN_74447,2.63235
GemmTunableOp_Half_TN,tn_8192_2239_14336,Gemm_Hipblaslt_TN_74360,2.17075
GemmTunableOp_Half_TN,tn_28672_6958_8192,Gemm_Hipblaslt_TN_88152,12.3007
GemmTunableOp_Half_TN,tn_64128_237_8192,Gemm_Rocblas_621283066,1.41555
GemmTunableOp_Half_TN,tn_8192_6110_14336,Gemm_Hipblaslt_TN_74360,5.98175
GemmTunableOp_Half_TN,tn_64128_221_8192,Gemm_Hipblaslt_TN_87394,1.40288
GemmTunableOp_Half_TN,tn_5120_48_8192,Gemm_Hipblaslt_TN_71830,0.0391767
GemmTunableOp_Half_TN,tn_64128_61_8192,Gemm_Rocblas_621282636,0.566619
GemmTunableOp_Half_TN,tn_64128_52_8192,Gemm_Rocblas_621282664,0.554782
GemmTunableOp_Half_TN,tn_64128_69_8192,Gemm_Hipblaslt_TN_71850,0.688069
GemmTunableOp_Half_TN,tn_64128_78_8192,Gemm_Hipblaslt_TN_73975,0.682956
GemmTunableOp_Half_TN,tn_8192_176_14336,Gemm_Hipblaslt_TN_72657,0.236101
GemmTunableOp_Half_TN,tn_64128_84_8192,Gemm_Hipblaslt_TN_72198,0.719014
GemmTunableOp_Half_TN,tn_64128_205_8192,Gemm_Hipblaslt_TN_74607,1.40107
GemmTunableOp_Half_TN,tn_8192_248_14336,Gemm_Hipblaslt_TN_72911,0.259229
GemmTunableOp_Half_TN,tn_8192_4628_4096,Gemm_Rocblas_621282924,1.20367
GemmTunableOp_Half_TN,tn_5120_6408_8192,Gemm_Rocblas_621282852,1.99367
GemmTunableOp_Half_TN,tn_8192_32_14336,Gemm_Rocblas_621288727,0.0764313
GemmTunableOp_Half_TN,tn_8192_40_14336,Gemm_Hipblaslt_TN_87478,0.0872219
GemmTunableOp_Half_TN,tn_8192_6958_14336,Gemm_Hipblaslt_TN_88166,6.99021
GemmTunableOp_Half_TN,tn_8192_5548_4096,Gemm_Hipblaslt_TN_107365,1.47134
GemmTunableOp_Half_TN,tn_8192_72_4096,Gemm_Hipblaslt_TN_74372,0.0430353
GemmTunableOp_Half_TN,tn_8192_6587_14336,Gemm_Hipblaslt_TN_74492,6.63035
GemmTunableOp_Half_TN,tn_5120_6807_8192,Gemm_Hipblaslt_TN_73538,2.25673
GemmTunableOp_Half_TN,tn_8192_5658_14336,Gemm_Hipblaslt_TN_74360,5.63517
GemmTunableOp_Half_TN,tn_64128_189_8192,Gemm_Hipblaslt_TN_73827,1.22786
GemmTunableOp_Half_TN,tn_8192_6348_14336,Gemm_Hipblaslt_TN_107366,6.58806
GemmTunableOp_Half_TN,tn_64128_245_8192,Gemm_Rocblas_621283066,1.41919
GemmTunableOp_Half_TN,tn_8192_6807_4096,Gemm_Rocblas_621282852,1.73487
GemmTunableOp_Half_TN,tn_8192_8077_14336,Gemm_Hipblaslt_TN_73671,8.1635
GemmTunableOp_Half_TN,tn_8192_7877_14336,Gemm_Hipblaslt_TN_74360,7.76482
GemmTunableOp_Half_TN,tn_8192_7278_4096,Gemm_Rocblas_621282559,1.91645
GemmTunableOp_Half_TN,tn_8192_7017_14336,Gemm_Hipblaslt_TN_88152,6.96304
GemmTunableOp_Half_TN,tn_8192_6828_4096,Gemm_Hipblaslt_TN_107365,1.74848
GemmTunableOp_Half_TN,tn_8192_6598_14336,Gemm_Hipblaslt_TN_74360,6.51913
GemmTunableOp_Half_TN,tn_8192_6188_4096,Gemm_Hipblaslt_TN_107347,1.59189
GemmTunableOp_Half_TN,tn_8192_6018_14336,Gemm_Hipblaslt_TN_88063,6.113
GemmTunableOp_Half_TN,tn_8192_5858_4096,Gemm_Hipblaslt_TN_74534,1.61345
GemmTunableOp_Half_TN,tn_8192_5738_4096,Gemm_Rocblas_621289056,1.52023
GemmTunableOp_Half_TN,tn_8192_5638_4096,Gemm_Rocblas_621289056,1.51777
GemmTunableOp_Half_TN,tn_8192_5538_4096,Gemm_Rocblas_621282762,1.51141
GemmTunableOp_Half_TN,tn_5120_7028_8192,Gemm_Rocblas_621282852,2.23811
GemmTunableOp_Half_TN,tn_5120_6058_8192,Gemm_Rocblas_621289259,1.92966
GemmTunableOp_Half_TN,tn_64128_234_8192,Gemm_Rocblas_621289272,1.40986
GemmTunableOp_Half_TN,tn_5120_6278_8192,Gemm_Rocblas_621282852,1.99668
GemmTunableOp_Half_TN,tn_5120_5708_8192,Gemm_Rocblas_621282867,1.75686
GemmTunableOp_Half_TN,tn_5120_168_8192,Gemm_Hipblaslt_TN_74055,0.0750156
GemmTunableOp_Half_TN,tn_5120_184_8192,Gemm_Hipblaslt_TN_71916,0.0765871
GemmTunableOp_Half_TN,tn_5120_152_8192,Gemm_Hipblaslt_TN_72371,0.0677535
GemmTunableOp_Half_TN,tn_5120_256_8192,Gemm_Rocblas_621289151,0.0925647
GemmTunableOp_Half_TN,tn_28672_176_8192,Gemm_Hipblaslt_TN_72220,0.530948
GemmTunableOp_Half_TN,tn_5120_88_8192,Gemm_Hipblaslt_TN_87821,0.0495446
GemmTunableOp_Half_TN,tn_5120_120_8192,Gemm_Rocblas_621282641,0.0562719
GemmTunableOp_Half_TN,tn_64128_218_8192,Gemm_Hipblaslt_TN_87394,1.40672
GemmTunableOp_Half_TN,tn_64128_242_8192,Gemm_Rocblas_621289279,1.41452
GemmTunableOp_Half_TN,tn_64128_202_8192,Gemm_Hipblaslt_TN_87394,1.39423
GemmTunableOp_Half_TN,tn_8192_240_14336,Gemm_Hipblaslt_TN_74098,0.266152
GemmTunableOp_Half_TN,tn_8192_7787_4096,Gemm_Rocblas_621282559,2.05488
GemmTunableOp_Half_TN,tn_28672_7028_8192,Gemm_Hipblaslt_TN_88152,12.4883
GemmTunableOp_Half_TN,tn_28672_152_8192,Gemm_Hipblaslt_TN_72137,0.446347
GemmTunableOp_Half_TN,tn_28672_88_8192,Gemm_Hipblaslt_TN_87373,0.325528
GemmTunableOp_Half_TN,tn_8192_6478_4096,Gemm_Hipblaslt_TN_107367,1.71272
GemmTunableOp_Half_TN,tn_64128_71_8192,Gemm_Hipblaslt_TN_73975,0.687032
GemmTunableOp_Half_TN,tn_5120_4096_8192,Gemm_Rocblas_621282852,1.26269
GemmTunableOp_Half_TN,tn_5120_2149_8192,Gemm_Hipblaslt_TN_73187,0.728972
GemmTunableOp_Half_TN,tn_64128_87_8192,Gemm_Hipblaslt_TN_87693,0.731568
GemmTunableOp_Half_TN,tn_28672_248_8192,Gemm_Rocblas_621282980,0.612369
GemmTunableOp_Half_TN,tn_8192_6248_14336,Gemm_Hipblaslt_TN_72310,6.21626
GemmTunableOp_Half_TN,tn_28672_7967_8192,Gemm_Hipblaslt_TN_87446,15.5371
GemmTunableOp_Half_TN,tn_5120_200_8192,Gemm_Hipblaslt_TN_85682,0.0863834
GemmTunableOp_Half_TN,tn_28672_6600_8192,Gemm_Hipblaslt_TN_107366,12.1732
GemmTunableOp_Half_TN,tn_28672_6058_8192,Gemm_Rocblas_621288661,11.6897
GemmTunableOp_Half_TN,tn_28672_6278_8192,Gemm_Hipblaslt_TN_107366,11.6709
GemmTunableOp_Half_TN,tn_5120_7508_8192,Gemm_Hipblaslt_TN_74447,2.29454
GemmTunableOp_Half_TN,tn_8192_7497_14336,Gemm_Hipblaslt_TN_74492,7.42225
GemmTunableOp_Half_TN,tn_28672_4096_8192,Gemm_Hipblaslt_TN_107362,7.6678
GemmTunableOp_Half_TN,tn_5120_104_8192,Gemm_Rocblas_621282665,0.0559522
GemmTunableOp_Half_TN,tn_28672_5708_8192,Gemm_Hipblaslt_TN_107366,11.4577
GemmTunableOp_Half_TN,tn_28672_7508_8192,Gemm_Hipblaslt_TN_87446,14.7706
GemmTunableOp_Half_TN,tn_8192_16_4096,Gemm_Rocblas_621288695,0.0246794
GemmTunableOp_Half_TN,tn_5120_7967_8192,Gemm_Hipblaslt_TN_74236,2.56574
GemmTunableOp_Half_TN,tn_64128_162_8192,Gemm_Hipblaslt_TN_73827,1.21729
GemmTunableOp_Half_TN,tn_5120_112_8192,Gemm_Rocblas_621288872,0.0560363
GemmTunableOp_Half_TN,tn_64128_250_8192,Gemm_Rocblas_621289270,1.42153
GemmTunableOp_Half_TN,tn_5120_136_8192,Gemm_Hipblaslt_TN_72371,0.0672756
GemmTunableOp_Half_TN,tn_64128_186_8192,Gemm_Hipblaslt_TN_73827,1.22691
GemmTunableOp_Half_TN,tn_8192_136_4096,Gemm_Hipblaslt_TN_74157,0.0631654
GemmTunableOp_Half_TN,tn_64128_194_8192,Gemm_Hipblaslt_TN_87394,1.39262
GemmTunableOp_Half_TN,tn_64128_226_8192,Gemm_Rocblas_621283066,1.41245
GemmTunableOp_Half_TN,tn_28672_224_8192,Gemm_Rocblas_621289125,0.578118
GemmTunableOp_Half_TN,tn_64128_178_8192,Gemm_Hipblaslt_TN_72226,1.22123
GemmTunableOp_Half_TN,tn_64128_79_8192,Gemm_Hipblaslt_TN_73975,0.681349
GemmTunableOp_Half_TN,tn_64128_210_8192,Gemm_Rocblas_621289279,1.40135
GemmTunableOp_Half_TN,tn_64128_48_8192,Gemm_Hipblaslt_TN_71715,0.507303
GemmTunableOp_Half_TN,tn_5120_6600_8192,Gemm_Rocblas_621282852,2.10357
GemmTunableOp_Half_TN,tn_64128_55_8192,Gemm_Rocblas_621288871,0.553222
GemmTunableOp_Half_TN,tn_8192_216_4096,Gemm_Hipblaslt_TN_72529,0.0855373
GemmTunableOp_Half_TN,tn_64128_170_8192,Gemm_Hipblaslt_TN_73827,1.22081
GemmTunableOp_Half_TN,tn_8192_2639_14336,Gemm_Hipblaslt_TN_74360,2.57037
GemmTunableOp_Half_TN,tn_64128_63_8192,Gemm_Rocblas_621288845,0.564715
GemmTunableOp_Half_TN,tn_8192_176_4096,Gemm_Hipblaslt_TN_72912,0.0710765
GemmTunableOp_Half_TN,tn_8192_200_14336,Gemm_Hipblaslt_TN_74098,0.243214
GemmTunableOp_Half_TN,tn_8192_224_4096,Gemm_Hipblaslt_TN_72992,0.0838661
GemmTunableOp_Half_TN,tn_8192_24_14336,Gemm_Rocblas_621282499,0.0775486
GemmTunableOp_Half_TN,tn_8192_8_7168,Gemm_Rocblas_621288685,0.0370419
GemmTunableOp_Half_TN,tn_8192_56_7168,Gemm_Rocblas_621282641,0.0505978
GemmTunableOp_Half_TN,tn_8192_160_7168,Gemm_Hipblaslt_TN_74157,0.0963482
GemmTunableOp_Half_TN,tn_14336_112_8192,Gemm_Rocblas_621282653,0.131378
GemmTunableOp_Half_TN,tn_2560_72_8192,Gemm_Hipblaslt_TN_71835,0.0304267
GemmTunableOp_Half_TN,tn_14336_240_8192,Gemm_Hipblaslt_TN_74818,0.223035
GemmTunableOp_Half_TN,tn_2560_144_8192,Gemm_Hipblaslt_TN_87631,0.0427003
GemmTunableOp_Half_TN,tn_8192_16_2048,Gemm_Rocblas_621282484,0.0159515
GemmTunableOp_Half_TN,tn_14336_192_8192,Gemm_Rocblas_621288944,0.182959
GemmTunableOp_Half_TN,tn_8192_120_2048,Gemm_Hipblaslt_TN_87577,0.0334605
GemmTunableOp_Half_TN,tn_2560_112_8192,Gemm_Hipblaslt_TN_72350,0.0372189
GemmTunableOp_Half_TN,tn_8192_232_7168,Gemm_Hipblaslt_TN_74098,0.130877
GemmTunableOp_Half_TN,tn_2560_240_8192,Gemm_Rocblas_621288850,0.0542721
GemmTunableOp_Half_TN,tn_8192_104_2048,Gemm_Hipblaslt_TN_87681,0.032874
GemmTunableOp_Half_TN,tn_2560_192_8192,Gemm_Hipblaslt_TN_72979,0.0471598
GemmTunableOp_Half_TN,tn_8192_88_2048,Gemm_Hipblaslt_TN_72198,0.0315589
GemmTunableOp_Half_TN,tn_8192_192_7168,Gemm_Hipblaslt_TN_74063,0.107014
GemmTunableOp_Half_TN,tn_8192_128_2048,Gemm_Hipblaslt_TN_87577,0.0321481
GemmTunableOp_Half_TN,tn_8192_136_7168,Gemm_Hipblaslt_TN_74157,0.0954473
GemmTunableOp_Half_TN,tn_8192_8192_2048,Gemm_Rocblas_621282462,1.14141
GemmTunableOp_Half_TN,tn_8192_72_2048,Gemm_Hipblaslt_TN_72273,0.0276454
GemmTunableOp_Half_TN,tn_14336_152_8192,Gemm_Hipblaslt_TN_72793,0.157706
GemmTunableOp_Half_TN,tn_14336_200_8192,Gemm_Hipblaslt_TN_88118,0.211107
GemmTunableOp_Half_TN,tn_32064_244_8192,Gemm_Rocblas_621283075,0.714901
GemmTunableOp_Half_TN,tn_2560_120_8192,Gemm_Hipblaslt_TN_72350,0.0372321
GemmTunableOp_Half_TN,tn_2560_16_8192,Gemm_Rocblas_621282453,0.0167779
GemmTunableOp_Half_TN,tn_2560_168_8192,Gemm_Hipblaslt_TN_87632,0.0471638
GemmTunableOp_Half_TN,tn_8192_192_2048,Gemm_Hipblaslt_TN_87912,0.0457421
GemmTunableOp_Half_TN,tn_2560_224_8192,Gemm_Hipblaslt_TN_87635,0.0532513
GemmTunableOp_Half_TN,tn_2560_56_8192,Gemm_Rocblas_621282583,0.0263671
GemmTunableOp_Half_TN,tn_8192_208_7168,Gemm_Hipblaslt_TN_74098,0.129807
GemmTunableOp_Half_TN,tn_8192_56_2048,Gemm_Rocblas_621288850,0.0211553
GemmTunableOp_Half_TN,tn_14336_256_8192,Gemm_Rocblas_621289138,0.219477
GemmTunableOp_Half_TN,tn_8192_168_2048,Gemm_Hipblaslt_TN_87579,0.0451656
GemmTunableOp_Half_TN,tn_8192_256_2048,Gemm_Rocblas_621288769,0.0473365
GemmTunableOp_Half_TN,tn_8192_96_2048,Gemm_Hipblaslt_TN_72494,0.0278285
GemmTunableOp_Half_TN,tn_14336_144_8192,Gemm_Hipblaslt_TN_73165,0.157739
GemmTunableOp_Half_TN,tn_14336_208_8192,Gemm_Hipblaslt_TN_88118,0.208057
GemmTunableOp_Half_TN,tn_8192_176_7168,Gemm_Hipblaslt_TN_72912,0.107074
GemmTunableOp_Half_TN,tn_8192_24_7168,Gemm_Rocblas_621282499,0.0422248
GemmTunableOp_Half_TN,tn_2560_8192_8192,Gemm_Rocblas_621282462,1.2448
GemmTunableOp_Half_TN,tn_8192_240_7168,Gemm_Hipblaslt_TN_73280,0.139543
GemmTunableOp_Half_TN,tn_14336_72_8192,Gemm_Rocblas_621282952,0.1188
GemmTunableOp_Half_TN,tn_8192_24_2048,Gemm_Rocblas_621282629,0.0177682
GemmTunableOp_Half_TN,tn_14336_40_8192,Gemm_Hipblaslt_TN_71718,0.0904037
GemmTunableOp_Half_TN,tn_2560_128_8192,Gemm_Hipblaslt_TN_72350,0.0369261
GemmTunableOp_Half_TN,tn_2560_200_8192,Gemm_Hipblaslt_TN_73236,0.0528968
GemmTunableOp_Half_TN,tn_2560_32_8192,Gemm_Rocblas_621282574,0.0198381
GemmTunableOp_Half_TN,tn_2560_48_8192,Default,0.0249109
GemmTunableOp_Half_TN,tn_2560_160_8192,Gemm_Hipblaslt_TN_72357,0.0420353
GemmTunableOp_Half_TN,tn_8192_216_2048,Gemm_Hipblaslt_TN_87580,0.0497729
GemmTunableOp_Half_TN,tn_8192_216_7168,Gemm_Hipblaslt_TN_74098,0.130316
GemmTunableOp_Half_TN,tn_8192_200_2048,Gemm_Hipblaslt_TN_87580,0.0496379
GemmTunableOp_Half_TN,tn_14336_104_8192,Gemm_Rocblas_621288862,0.130677
GemmTunableOp_Half_TN,tn_8192_256_7168,Gemm_Hipblaslt_TN_74098,0.13076
GemmTunableOp_Half_TN,tn_14336_184_8192,Gemm_Rocblas_621288944,0.184349
GemmTunableOp_Half_TN,tn_8192_176_2048,Gemm_Hipblaslt_TN_87579,0.0450827
GemmTunableOp_Half_TN,tn_2560_104_8192,Gemm_Hipblaslt_TN_72350,0.0375963
GemmTunableOp_Half_TN,tn_8192_112_7168,Gemm_Hipblaslt_TN_72639,0.0870487
GemmTunableOp_Half_TN,tn_2560_136_8192,Gemm_Hipblaslt_TN_87630,0.0427452
GemmTunableOp_Half_TN,tn_14336_248_8192,Gemm_Hipblaslt_TN_74818,0.225542
GemmTunableOp_Half_TN,tn_2560_176_8192,Gemm_Hipblaslt_TN_72979,0.0467151
GemmTunableOp_Half_TN,tn_8192_136_2048,Gemm_Hipblaslt_TN_87578,0.0413751
GemmTunableOp_Half_TN,tn_2560_232_8192,Gemm_Rocblas_621288849,0.0547007
GemmTunableOp_Half_TN,tn_2560_64_8192,Gemm_Rocblas_621282598,0.026025
GemmTunableOp_Half_TN,tn_8192_144_7168,Gemm_Hipblaslt_TN_74157,0.096702
GemmTunableOp_Half_TN,tn_2560_96_8192,Gemm_Hipblaslt_TN_85405,0.0325968
GemmTunableOp_Half_TN,tn_8192_96_7168,Gemm_Hipblaslt_TN_74662,0.0715099
GemmTunableOp_Half_TN,tn_8192_248_7168,Gemm_Hipblaslt_TN_74098,0.131696
GemmTunableOp_Half_TN,tn_8192_224_2048,Gemm_Hipblaslt_TN_87580,0.04754
GemmTunableOp_Half_TN,tn_32064_256_8192,Gemm_Rocblas_621289272,0.701123
GemmTunableOp_Half_TN,tn_8192_184_7168,Gemm_Hipblaslt_TN_72912,0.108285
GemmTunableOp_Half_TN,tn_8192_160_2048,Gemm_Hipblaslt_TN_87578,0.0401749
GemmTunableOp_Half_TN,tn_2560_8_8192,Gemm_Rocblas_621288684,0.0170471
GemmTunableOp_Half_TN,tn_14336_96_8192,Gemm_Rocblas_621282952,0.119264
GemmTunableOp_Half_TN,tn_14336_232_8192,Gemm_Hipblaslt_TN_74818,0.222638
GemmTunableOp_Half_TN,tn_14336_168_8192,Gemm_Rocblas_621282738,0.183825
GemmTunableOp_Half_TN,tn_2560_40_8192,Default,0.0250531
GemmTunableOp_Half_TN,tn_2560_216_8192,Gemm_Hipblaslt_TN_74085,0.0537256
GemmTunableOp_Half_TN,tn_14336_128_8192,Gemm_Rocblas_621288862,0.12995
GemmTunableOp_Half_TN,tn_8192_72_7168,Gemm_Hipblaslt_TN_72273,0.0691876
GemmTunableOp_Half_TN,tn_8192_48_2048,Gemm_Hipblaslt_TN_74349,0.0207591
GemmTunableOp_Half_TN,tn_8192_224_7168,Gemm_Hipblaslt_TN_72911,0.138827
GemmTunableOp_Half_TN,tn_14336_8192_8192,Gemm_Hipblaslt_TN_74236,6.63226
GemmTunableOp_Half_TN,tn_14336_24_8192,Gemm_Rocblas_621288713,0.0807277
GemmTunableOp_Half_TN,tn_8192_88_7168,Gemm_Hipblaslt_TN_73380,0.0716585
GemmTunableOp_Half_TN,tn_8192_64_2048,Gemm_Rocblas_621288850,0.0208616
GemmTunableOp_Half_TN,tn_8192_40_2048,Gemm_Rocblas_621288850,0.0209329
GemmTunableOp_Half_TN,tn_14336_8_8192,Gemm_Rocblas_621288693,0.0611936
GemmTunableOp_Half_TN,tn_14336_176_8192,Gemm_Rocblas_621288944,0.184059
GemmTunableOp_Half_TN,tn_14336_48_8192,Gemm_Hipblaslt_TN_71718,0.0909894
GemmTunableOp_Half_TN,tn_14336_120_8192,Gemm_Rocblas_621282653,0.130931
GemmTunableOp_Half_TN,tn_8192_64_7168,Gemm_Rocblas_621282641,0.050597
GemmTunableOp_Half_TN,tn_8192_40_7168,Gemm_Hipblaslt_TN_74349,0.0479975
GemmTunableOp_Half_TN,tn_8192_248_2048,Gemm_Hipblaslt_TN_87581,0.0531123
GemmTunableOp_Half_TN,tn_14336_136_8192,Gemm_Hipblaslt_TN_72793,0.158282
GemmTunableOp_Half_TN,tn_14336_216_8192,Gemm_Hipblaslt_TN_88118,0.209747
GemmTunableOp_Half_TN,tn_14336_32_8192,Gemm_Hipblaslt_TN_86084,0.0800142
GemmTunableOp_Half_TN,tn_8192_200_7168,Gemm_Hipblaslt_TN_74098,0.129775
GemmTunableOp_Half_TN,tn_14336_64_8192,Gemm_Hipblaslt_TN_72350,0.0966294
GemmTunableOp_Half_TN,tn_2560_88_8192,Gemm_Hipblaslt_TN_71895,0.0321293
GemmTunableOp_Half_TN,tn_8192_112_2048,Gemm_Hipblaslt_TN_87681,0.0330875
GemmTunableOp_Half_TN,tn_8192_80_7168,Gemm_Hipblaslt_TN_73975,0.0679373
GemmTunableOp_Half_TN,tn_14336_88_8192,Gemm_Rocblas_621289156,0.122008
GemmTunableOp_Half_TN,tn_8192_120_7168,Gemm_Hipblaslt_TN_73979,0.0883799
GemmTunableOp_Half_TN,tn_2560_208_8192,Gemm_Hipblaslt_TN_73236,0.0536752
GemmTunableOp_Half_TN,tn_8192_144_2048,Gemm_Hipblaslt_TN_87578,0.0415298
GemmTunableOp_Half_TN,tn_8192_152_7168,Gemm_Hipblaslt_TN_74157,0.0969151
GemmTunableOp_Half_TN,tn_2560_256_8192,Gemm_Rocblas_621282641,0.0549022
GemmTunableOp_Half_TN,tn_8192_184_2048,Gemm_Hipblaslt_TN_87579,0.0453195
GemmTunableOp_Half_TN,tn_8192_8192_7168,Gemm_Hipblaslt_TN_74719,3.73946
GemmTunableOp_Half_TN,tn_8192_80_2048,Gemm_Hipblaslt_TN_74372,0.0263775
GemmTunableOp_Half_TN,tn_8192_48_7168,Gemm_Hipblaslt_TN_74821,0.0472944
GemmTunableOp_Half_TN,tn_8192_8_2048,Gemm_Rocblas_621282618,0.0171288
GemmTunableOp_Half_TN,tn_8192_240_2048,Gemm_Hipblaslt_TN_87581,0.0529268
GemmTunableOp_Half_TN,tn_8192_232_2048,Gemm_Hipblaslt_TN_87581,0.0528315
GemmTunableOp_Half_TN,tn_8192_208_2048,Gemm_Hipblaslt_TN_87580,0.0495991
GemmTunableOp_Half_TN,tn_8192_168_7168,Gemm_Hipblaslt_TN_74063,0.108835
GemmTunableOp_Half_TN,tn_8192_32_2048,Gemm_Rocblas_621282629,0.0176027
GemmTunableOp_Half_TN,tn_14336_16_8192,Gemm_Rocblas_621282483,0.0607113
GemmTunableOp_Half_TN,tn_2560_152_8192,Gemm_Hipblaslt_TN_72357,0.0429595
GemmTunableOp_Half_TN,tn_14336_160_8192,Gemm_Rocblas_621282895,0.156182
GemmTunableOp_Half_TN,tn_8192_104_7168,Gemm_Hipblaslt_TN_72639,0.0868893
GemmTunableOp_Half_TN,tn_8192_152_2048,Gemm_Hipblaslt_TN_87578,0.0415502
GemmTunableOp_Half_TN,tn_8192_16_7168,Gemm_Rocblas_621282482,0.0369597
GemmTunableOp_Half_TN,tn_14336_224_8192,Gemm_Hipblaslt_TN_88118,0.205988
GemmTunableOp_Half_TN,tn_14336_80_8192,Gemm_Rocblas_621289156,0.117961
GemmTunableOp_Half_TN,tn_2560_24_8192,Gemm_Rocblas_621282572,0.0197159
GemmTunableOp_Half_TN,tn_2560_184_8192,Gemm_Hipblaslt_TN_87826,0.0476449
GemmTunableOp_Half_TN,tn_8192_32_7168,Gemm_Rocblas_621288836,0.0423158
GemmTunableOp_Half_TN,tn_2560_248_8192,Gemm_Rocblas_621282665,0.055979
GemmTunableOp_Half_TN,tn_2560_80_8192,Gemm_Hipblaslt_TN_71835,0.0306731
GemmTunableOp_Half_TN,tn_14336_56_8192,Gemm_Hipblaslt_TN_72350,0.0964893
GemmTunableOp_Half_TN,tn_8192_128_7168,Gemm_Hipblaslt_TN_72639,0.0873969
GemmTunableOp_Half_TN,tn_8192_8192_3584,Gemm_Hipblaslt_TN_107367,1.92221
GemmTunableOp_Half_TN,tn_8192_248_3584,Gemm_Hipblaslt_TN_74098,0.0821537
GemmTunableOp_Half_TN,tn_1280_136_8192,Gemm_Hipblaslt_TN_72469,0.0288882
GemmTunableOp_Half_TN,tn_7168_64_8192,Gemm_Rocblas_621288841,0.0530656
GemmTunableOp_Half_TN,tn_8192_216_3584,Gemm_Hipblaslt_TN_72992,0.0781793
GemmTunableOp_Half_TN,tn_1280_208_8192,Gemm_Hipblaslt_TN_87628,0.0352245
GemmTunableOp_Half_TN,tn_16032_256_8192,Gemm_Hipblaslt_TN_72698,0.307978
GemmTunableOp_Half_TN,tn_1280_64_8192,Gemm_Rocblas_621282490,0.0192289
GemmTunableOp_Half_TN,tn_8192_168_1024,Gemm_Hipblaslt_TN_72896,0.0283866
GemmTunableOp_Half_TN,tn_7168_96_8192,Gemm_Rocblas_621289097,0.063861
GemmTunableOp_Half_TN,tn_7168_232_8192,Gemm_Hipblaslt_TN_74126,0.127015
GemmTunableOp_Half_TN,tn_8192_120_3584,Gemm_Rocblas_621282649,0.0525224
GemmTunableOp_Half_TN,tn_8192_152_1024,Gemm_Hipblaslt_TN_73151,0.0265306
GemmTunableOp_Half_TN,tn_1280_32_8192,Gemm_Rocblas_621288646,0.015603
GemmTunableOp_Half_TN,tn_8192_184_3584,Gemm_Hipblaslt_TN_72912,0.0663231
GemmTunableOp_Half_TN,tn_8192_64_1024,Gemm_Rocblas_621282994,0.0142558
GemmTunableOp_Half_TN,tn_7168_8192_8192,Gemm_Rocblas_621296657,3.53754
GemmTunableOp_Half_TN,tn_7168_56_8192,Gemm_Rocblas_621288841,0.0534839
GemmTunableOp_Half_TN,tn_7168_224_8192,Gemm_Hipblaslt_TN_74094,0.119993
GemmTunableOp_Half_TN,tn_8192_8_1024,Gemm_Rocblas_621282454,0.0142454
GemmTunableOp_Half_TN,tn_1280_256_8192,Gemm_Hipblaslt_TN_72481,0.0359908
GemmTunableOp_Half_TN,tn_16032_244_8192,Gemm_Hipblaslt_TN_88049,0.307269
GemmTunableOp_Half_TN,tn_1280_200_8192,Gemm_Hipblaslt_TN_72481,0.0348107
GemmTunableOp_Half_TN,tn_8192_8192_1024,Gemm_Hipblaslt_TN_74303,0.606213
GemmTunableOp_Half_TN,tn_1280_152_8192,Gemm_Hipblaslt_TN_72469,0.0291053
GemmTunableOp_Half_TN,tn_8192_256_3584,Gemm_Rocblas_621289371,0.0798402
GemmTunableOp_Half_TN,tn_8192_240_1024,Gemm_Rocblas_621283194,0.031881
GemmTunableOp_Half_TN,tn_8192_176_1024,Gemm_Hipblaslt_TN_73405,0.0285809
GemmTunableOp_Half_TN,tn_1280_144_8192,Gemm_Hipblaslt_TN_72469,0.0289018
GemmTunableOp_Half_TN,tn_7168_8_8192,Gemm_Rocblas_621288680,0.0365745
GemmTunableOp_Half_TN,tn_8192_200_3584,Gemm_Hipblaslt_TN_73073,0.0769935
GemmTunableOp_Half_TN,tn_8192_192_1024,Gemm_Hipblaslt_TN_87590,0.0274728
GemmTunableOp_Half_TN,tn_8192_16_3584,Gemm_Rocblas_621282484,0.0219802
GemmTunableOp_Half_TN,tn_1280_216_8192,Gemm_Hipblaslt_TN_72481,0.0352217
GemmTunableOp_Half_TN,tn_1280_40_8192,Gemm_Rocblas_621282490,0.0190462
GemmTunableOp_Half_TN,tn_1280_72_8192,Gemm_Hipblaslt_TN_71827,0.0229344
GemmTunableOp_Half_TN,tn_7168_112_8192,Gemm_Rocblas_621282642,0.0778881
GemmTunableOp_Half_TN,tn_7168_152_8192,Gemm_Hipblaslt_TN_74157,0.0997742
GemmTunableOp_Half_TN,tn_7168_200_8192,Gemm_Hipblaslt_TN_74095,0.120847
GemmTunableOp_Half_TN,tn_8192_136_3584,Gemm_Hipblaslt_TN_74022,0.0583944
GemmTunableOp_Half_TN,tn_7168_32_8192,Gemm_Hipblaslt_TN_86084,0.0430442
GemmTunableOp_Half_TN,tn_7168_40_8192,Gemm_Hipblaslt_TN_74349,0.0507778
GemmTunableOp_Half_TN,tn_7168_88_8192,Gemm_Rocblas_621289097,0.0649158
GemmTunableOp_Half_TN,tn_8192_128_1024,Gemm_Rocblas_621289153,0.0195485
GemmTunableOp_Half_TN,tn_8192_96_1024,Gemm_Rocblas_621282649,0.0213701
GemmTunableOp_Half_TN,tn_8192_256_1024,Gemm_Rocblas_621282532,0.0285681
GemmTunableOp_Half_TN,tn_1280_160_8192,Gemm_Hipblaslt_TN_72469,0.0287215
GemmTunableOp_Half_TN,tn_1280_56_8192,Gemm_Rocblas_621282490,0.0190702
GemmTunableOp_Half_TN,tn_1280_96_8192,Gemm_Hipblaslt_TN_87757,0.0233951
GemmTunableOp_Half_TN,tn_7168_176_8192,Gemm_Hipblaslt_TN_72987,0.10759
GemmTunableOp_Half_TN,tn_1280_224_8192,Gemm_Hipblaslt_TN_87625,0.0352433
GemmTunableOp_Half_TN,tn_8192_232_1024,Gemm_Rocblas_621282756,0.0329254
GemmTunableOp_Half_TN,tn_7168_216_8192,Gemm_Hipblaslt_TN_74094,0.123645
GemmTunableOp_Half_TN,tn_7168_72_8192,Gemm_Hipblaslt_TN_72120,0.0662074
GemmTunableOp_Half_TN,tn_8192_168_3584,Gemm_Hipblaslt_TN_72912,0.0654086
GemmTunableOp_Half_TN,tn_1280_16_8192,Gemm_Rocblas_621282452,0.0137691
GemmTunableOp_Half_TN,tn_7168_136_8192,Gemm_Hipblaslt_TN_72133,0.0921904
GemmTunableOp_Half_TN,tn_8192_112_3584,Gemm_Rocblas_621282892,0.0516367
GemmTunableOp_Half_TN,tn_8192_96_3584,Gemm_Hipblaslt_TN_73380,0.0403714
GemmTunableOp_Half_TN,tn_8192_88_1024,Gemm_Hipblaslt_TN_73380,0.0192701
GemmTunableOp_Half_TN,tn_8192_40_3584,Gemm_Hipblaslt_TN_74655,0.0287227
GemmTunableOp_Half_TN,tn_8192_248_1024,Gemm_Rocblas_621283194,0.03201
GemmTunableOp_Half_TN,tn_8192_208_3584,Gemm_Hipblaslt_TN_73514,0.0775604
GemmTunableOp_Half_TN,tn_8192_176_3584,Gemm_Hipblaslt_TN_72912,0.0656149
GemmTunableOp_Half_TN,tn_8192_160_1024,Gemm_Hipblaslt_TN_72905,0.0252391
GemmTunableOp_Half_TN,tn_1280_120_8192,Gemm_Hipblaslt_TN_72593,0.0258909
GemmTunableOp_Half_TN,tn_7168_48_8192,Gemm_Hipblaslt_TN_87479,0.0505611
GemmTunableOp_Half_TN,tn_1280_176_8192,Gemm_Hipblaslt_TN_71895,0.0309525
GemmTunableOp_Half_TN,tn_1280_240_8192,Gemm_Hipblaslt_TN_72751,0.0357525
GemmTunableOp_Half_TN,tn_7168_168_8192,Gemm_Hipblaslt_TN_72780,0.107493
GemmTunableOp_Half_TN,tn_8192_120_1024,Gemm_Rocblas_621282649,0.0219638
GemmTunableOp_Half_TN,tn_8192_8_3584,Gemm_Rocblas_621282484,0.0219161
GemmTunableOp_Half_TN,tn_1280_88_8192,Gemm_Hipblaslt_TN_87757,0.0233086
GemmTunableOp_Half_TN,tn_8192_64_3584,Gemm_Rocblas_621282641,0.0292455
GemmTunableOp_Half_TN,tn_7168_208_8192,Gemm_Hipblaslt_TN_74095,0.121091
GemmTunableOp_Half_TN,tn_7168_128_8192,Gemm_Rocblas_621282647,0.077564
GemmTunableOp_Half_TN,tn_8192_56_1024,Gemm_Rocblas_621288842,0.0150574
GemmTunableOp_Half_TN,tn_7168_80_8192,Gemm_Rocblas_621289097,0.0647872
GemmTunableOp_Half_TN,tn_7168_16_8192,Gemm_Rocblas_621288680,0.0382795
GemmTunableOp_Half_TN,tn_8192_16_1024,Gemm_Rocblas_621282454,0.013699
GemmTunableOp_Half_TN,tn_8192_144_1024,Gemm_Hipblaslt_TN_72905,0.0260948
GemmTunableOp_Half_TN,tn_8192_88_3584,Gemm_Hipblaslt_TN_73380,0.0412695
GemmTunableOp_Half_TN,tn_8192_56_3584,Gemm_Rocblas_621288850,0.0296313
GemmTunableOp_Half_TN,tn_8192_40_1024,Gemm_Rocblas_621288842,0.015041
GemmTunableOp_Half_TN,tn_1280_112_8192,Gemm_Hipblaslt_TN_72593,0.0258156
GemmTunableOp_Half_TN,tn_8192_224_3584,Gemm_Hipblaslt_TN_73514,0.0771193
GemmTunableOp_Half_TN,tn_1280_248_8192,Gemm_Hipblaslt_TN_72350,0.0362532
GemmTunableOp_Half_TN,tn_8192_48_1024,Gemm_Hipblaslt_TN_87468,0.0144341
GemmTunableOp_Half_TN,tn_7168_240_8192,Gemm_Hipblaslt_TN_72901,0.131567
GemmTunableOp_Half_TN,tn_1280_192_8192,Gemm_Hipblaslt_TN_71895,0.0311576
GemmTunableOp_Half_TN,tn_8192_112_1024,Gemm_Rocblas_621289096,0.0214358
GemmTunableOp_Half_TN,tn_8192_104_1024,Gemm_Rocblas_621288858,0.0216549
GemmTunableOp_Half_TN,tn_8192_72_3584,Gemm_Hipblaslt_TN_73975,0.0397769
GemmTunableOp_Half_TN,tn_1280_8192_8192,Gemm_Rocblas_621282440,0.652958
GemmTunableOp_Half_TN,tn_8192_128_3584,Gemm_Rocblas_621282947,0.0512437
GemmTunableOp_Half_TN,tn_8192_184_1024,Gemm_Hipblaslt_TN_72896,0.0287299
GemmTunableOp_Half_TN,tn_8192_144_3584,Gemm_Hipblaslt_TN_74157,0.0592429
GemmTunableOp_Half_TN,tn_8192_200_1024,Gemm_Hipblaslt_TN_73073,0.0314168
GemmTunableOp_Half_TN,tn_8192_32_1024,Gemm_Rocblas_621283164,0.0119347
GemmTunableOp_Half_TN,tn_8192_216_1024,Gemm_Hipblaslt_TN_73514,0.0315409
GemmTunableOp_Half_TN,tn_8192_80_1024,Gemm_Rocblas_621288858,0.0208749
GemmTunableOp_Half_TN,tn_8192_72_1024,Gemm_Rocblas_621282649,0.0205188
GemmTunableOp_Half_TN,tn_1280_104_8192,Gemm_Hipblaslt_TN_72593,0.0256048
GemmTunableOp_Half_TN,tn_8192_48_3584,Gemm_Hipblaslt_TN_74349,0.0286482
GemmTunableOp_Half_TN,tn_1280_184_8192,Gemm_Hipblaslt_TN_71895,0.0309597
GemmTunableOp_Half_TN,tn_1280_24_8192,Gemm_Rocblas_621288646,0.0156162
GemmTunableOp_Half_TN,tn_7168_248_8192,Gemm_Hipblaslt_TN_74126,0.133166
GemmTunableOp_Half_TN,tn_8192_32_3584,Gemm_Rocblas_621282629,0.024661
GemmTunableOp_Half_TN,tn_1280_80_8192,Gemm_Hipblaslt_TN_71827,0.0231127
GemmTunableOp_Half_TN,tn_1280_48_8192,Gemm_Rocblas_621288710,0.0191491
GemmTunableOp_Half_TN,tn_8192_160_3584,Gemm_Hipblaslt_TN_74022,0.0584842
GemmTunableOp_Half_TN,tn_7168_160_8192,Gemm_Hipblaslt_TN_72133,0.0933742
GemmTunableOp_Half_TN,tn_8192_232_3584,Gemm_Hipblaslt_TN_74098,0.0800441
GemmTunableOp_Half_TN,tn_7168_192_8192,Gemm_Hipblaslt_TN_72987,0.10467
GemmTunableOp_Half_TN,tn_8192_208_1024,Gemm_Hipblaslt_TN_73514,0.031452
GemmTunableOp_Half_TN,tn_7168_120_8192,Gemm_Rocblas_621282647,0.0792738
GemmTunableOp_Half_TN,tn_8192_104_3584,Gemm_Rocblas_621288859,0.0520489
GemmTunableOp_Half_TN,tn_8192_80_3584,Gemm_Hipblaslt_TN_74372,0.0385583
GemmTunableOp_Half_TN,tn_8192_240_3584,Gemm_Hipblaslt_TN_74098,0.0804087
GemmTunableOp_Half_TN,tn_8192_24_1024,Gemm_Hipblaslt_TN_87261,0.013983
GemmTunableOp_Half_TN,tn_1280_128_8192,Gemm_Rocblas_621282661,0.0256729
GemmTunableOp_Half_TN,tn_1280_168_8192,Gemm_Hipblaslt_TN_71895,0.0303792
GemmTunableOp_Half_TN,tn_7168_256_8192,Gemm_Hipblaslt_TN_72901,0.132428
GemmTunableOp_Half_TN,tn_8192_152_3584,Gemm_Hipblaslt_TN_74022,0.059144
GemmTunableOp_Half_TN,tn_1280_232_8192,Gemm_Hipblaslt_TN_72481,0.0357569
GemmTunableOp_Half_TN,tn_8192_136_1024,Gemm_Hipblaslt_TN_74091,0.0257234
GemmTunableOp_Half_TN,tn_1280_8_8192,Gemm_Rocblas_621282452,0.0129771
GemmTunableOp_Half_TN,tn_7168_144_8192,Gemm_Hipblaslt_TN_72133,0.0922789
GemmTunableOp_Half_TN,tn_8192_24_3584,Gemm_Rocblas_621282629,0.0248016
GemmTunableOp_Half_TN,tn_7168_104_8192,Gemm_Rocblas_621288856,0.078165
GemmTunableOp_Half_TN,tn_7168_184_8192,Gemm_Hipblaslt_TN_72780,0.108265
GemmTunableOp_Half_TN,tn_7168_24_8192,Gemm_Hipblaslt_TN_86084,0.043283
GemmTunableOp_Half_TN,tn_8192_192_3584,Gemm_Hipblaslt_TN_72912,0.0656157
GemmTunableOp_Half_TN,tn_8192_224_1024,Gemm_Hipblaslt_TN_87593,0.0296313
GemmTunableOp_Half_TN,tn_8_64_4096,Gemm_Rocblas_621282577,0.0103848
GemmTunableOp_Half_TN,tn_8_32700_4096,Gemm_Hipblaslt_TN_74271,0.0795819
GemmTunableOp_Half_TN,tn_8_30970_4096,Default,0.0785556
GemmTunableOp_Half_TN,tn_8_30580_4096,Default,0.0769023
GemmTunableOp_Half_TN,tn_8_232_4096,Gemm_Rocblas_621282594,0.0125155
GemmTunableOp_Half_TN,tn_8_208_4096,Gemm_Rocblas_621288813,0.0128536
GemmTunableOp_Half_TN,tn_8_176_4096,Gemm_Hipblaslt_TN_87708,0.0141352
GemmTunableOp_Half_TN,tn_8_16_4096,Gemm_Rocblas_621288645,0.00866738
GemmTunableOp_Half_TN,tn_8_136_4096,Gemm_Hipblaslt_TN_87755,0.0147276
GemmTunableOp_Half_TN,tn_8_32_4096,Gemm_Rocblas_621288645,0.00869742
GemmTunableOp_Half_TN,tn_8_104_4096,Gemm_Rocblas_621288654,0.0163264
GemmTunableOp_Half_TN,tn_6144_32560_4096,Gemm_Rocblas_621282559,6.32649
GemmTunableOp_Half_TN,tn_6144_2400_4096,Gemm_Rocblas_621282746,0.503974
GemmTunableOp_Half_TN,tn_32000_250_4096,Gemm_Hipblaslt_TN_107366,0.334773
GemmTunableOp_Half_TN,tn_6144_30950_4096,Gemm_Rocblas_621282559,5.59785
GemmTunableOp_Half_TN,tn_4096_128_4096,Gemm_Rocblas_621288850,0.0315737
GemmTunableOp_Half_TN,tn_6144_232_4096,Gemm_Rocblas_621282814,0.0695401
GemmTunableOp_Half_TN,tn_32000_234_4096,Gemm_Hipblaslt_TN_107366,0.324308
GemmTunableOp_Half_TN,tn_32000_226_4096,Gemm_Hipblaslt_TN_107366,0.330753
GemmTunableOp_Half_TN,tn_32000_218_4096,Gemm_Hipblaslt_TN_88215,0.308847
GemmTunableOp_Half_TN,tn_4096_248_4096,Gemm_Hipblaslt_TN_72641,0.0549419
GemmTunableOp_Half_TN,tn_32000_192_4096,Gemm_Hipblaslt_TN_74829,0.272597
GemmTunableOp_Half_TN,tn_32000_168_4096,Gemm_Hipblaslt_TN_9238,0.24477
GemmTunableOp_Half_TN,tn_32000_159_4096,Gemm_Hipblaslt_TN_72563,0.211327
GemmTunableOp_Half_TN,tn_4096_2110_4096,Gemm_Rocblas_621282746,0.306184
GemmTunableOp_Half_TN,tn_32000_184_4096,Gemm_Hipblaslt_TN_74829,0.265138
GemmTunableOp_Half_TN,tn_32000_101_4096,Gemm_Hipblaslt_TN_87995,0.178735
GemmTunableOp_Half_TN,tn_6144_152_4096,Gemm_Hipblaslt_TN_72127,0.0518957
GemmTunableOp_Half_TN,tn_32000_58_4096,Gemm_Rocblas_621282641,0.123399
GemmTunableOp_Half_TN,tn_32000_66_4096,Gemm_Hipblaslt_TN_74372,0.158076
GemmTunableOp_Half_TN,tn_32000_96_4096,Gemm_Hipblaslt_TN_74589,0.171149
GemmTunableOp_Half_TN,tn_32000_242_4096,Gemm_Hipblaslt_TN_107366,0.331903
GemmTunableOp_Half_TN,tn_4096_26637_4096,Gemm_Hipblaslt_TN_9240,3.38698
GemmTunableOp_Half_TN,tn_32000_200_4096,Gemm_Hipblaslt_TN_88223,0.305082
GemmTunableOp_Half_TN,tn_32000_78_4096,Gemm_Hipblaslt_TN_72273,0.165483
GemmTunableOp_Half_TN,tn_32000_176_4096,Gemm_Hipblaslt_TN_9238,0.252117
GemmTunableOp_Half_TN,tn_6144_24_4096,Gemm_Rocblas_621282498,0.0256204
GemmTunableOp_Half_TN,tn_6144_200_4096,Gemm_Hipblaslt_TN_74158,0.064156
GemmTunableOp_Half_TN,tn_32000_88_4096,Gemm_Hipblaslt_TN_74297,0.178468
GemmTunableOp_Half_TN,tn_4096_31166_4096,Gemm_Rocblas_621282559,4.11894
GemmTunableOp_Half_TN,tn_4096_40_4096,Gemm_Rocblas_621282603,0.0235573
GemmTunableOp_Half_TN,tn_32000_210_4096,Gemm_Hipblaslt_TN_88223,0.299605
GemmTunableOp_Half_TN,tn_4096_4098_4096,Gemm_Rocblas_621282762,0.55165
GemmTunableOp_Half_TN,tn_8_72_4096,Gemm_Hipblaslt_TN_74612,0.0137314
GemmTunableOp_Half_TN,tn_8_31940_4096,Gemm_Hipblaslt_TN_87741,0.0855825
GemmTunableOp_Half_TN,tn_8_26637_4096,Gemm_Hipblaslt_TN_74271,0.0647277
GemmTunableOp_Half_TN,tn_8_184_4096,Gemm_Hipblaslt_TN_71620,0.0137622
GemmTunableOp_Half_TN,tn_8_152_4096,Gemm_Rocblas_621282595,0.0127683
GemmTunableOp_Half_TN,tn_6144_88_4096,Gemm_Rocblas_621289097,0.0377213
GemmTunableOp_Half_TN,tn_6144_80_4096,Gemm_Rocblas_621289097,0.0376047
GemmTunableOp_Half_TN,tn_6144_64_4096,Gemm_Rocblas_621288841,0.0304131
GemmTunableOp_Half_TN,tn_6144_224_4096,Gemm_Hipblaslt_TN_87906,0.0649765
GemmTunableOp_Half_TN,tn_8_160_4096,Gemm_Rocblas_621288812,0.0124907
GemmTunableOp_Half_TN,tn_4096_32130_4096,Gemm_Hipblaslt_TN_107347,4.22758
GemmTunableOp_Half_TN,tn_4096_30867_4096,Gemm_Hipblaslt_TN_107347,4.03169
GemmTunableOp_Half_TN,tn_32000_213_4096,Gemm_Hipblaslt_TN_74447,0.272751
GemmTunableOp_Half_TN,tn_4096_168_4096,Gemm_Hipblaslt_TN_74669,0.044437
GemmTunableOp_Half_TN,tn_6144_32130_4096,Gemm_Rocblas_621282559,5.85038
GemmTunableOp_Half_TN,tn_32000_206_4096,Gemm_Hipblaslt_TN_9237,0.271511
GemmTunableOp_Half_TN,tn_8_128_4096,Gemm_Hipblaslt_TN_74641,0.0135427
GemmTunableOp_Half_TN,tn_6144_168_4096,Gemm_Hipblaslt_TN_74057,0.0582772
GemmTunableOp_Half_TN,tn_32000_203_4096,Gemm_Hipblaslt_TN_9237,0.271887
GemmTunableOp_Half_TN,tn_32000_196_4096,Gemm_Hipblaslt_TN_9237,0.271388
GemmTunableOp_Half_TN,tn_32000_61_4096,Gemm_Hipblaslt_TN_87839,0.117649
GemmTunableOp_Half_TN,tn_32000_94_4096,Gemm_Hipblaslt_TN_71929,0.169111
GemmTunableOp_Half_TN,tn_32000_172_4096,Gemm_Hipblaslt_TN_9238,0.234033
GemmTunableOp_Half_TN,tn_32000_163_4096,Gemm_Hipblaslt_TN_9238,0.235605
GemmTunableOp_Half_TN,tn_32000_229_4096,Gemm_Hipblaslt_TN_107366,0.292882
GemmTunableOp_Half_TN,tn_4096_2340_4096,Gemm_Hipblaslt_TN_74387,0.334613
GemmTunableOp_Half_TN,tn_32000_69_4096,Gemm_Hipblaslt_TN_73975,0.160902
GemmTunableOp_Half_TN,tn_32000_188_4096,Gemm_Hipblaslt_TN_9238,0.235948
GemmTunableOp_Half_TN,tn_4096_144_4096,Gemm_Hipblaslt_TN_72881,0.0401053
GemmTunableOp_Half_TN,tn_6144_2340_4096,Gemm_Rocblas_621288952,0.502859
GemmTunableOp_Half_TN,tn_32000_14_4096,Gemm_Rocblas_621282473,0.0790409
GemmTunableOp_Half_TN,tn_32000_13_4096,Gemm_Rocblas_621282565,0.0781507
GemmTunableOp_Half_TN,tn_4096_224_4096,Gemm_Hipblaslt_TN_85710,0.0504668
GemmTunableOp_Half_TN,tn_32000_155_4096,Gemm_Hipblaslt_TN_72429,0.21201
GemmTunableOp_Half_TN,tn_6144_8_4096,Gemm_Rocblas_621282473,0.0212254
GemmTunableOp_Half_TN,tn_32000_180_4096,Gemm_Hipblaslt_TN_9238,0.235952
GemmTunableOp_Half_TN,tn_32000_10_4096,Gemm_Rocblas_621282473,0.0745233
GemmTunableOp_Half_TN,tn_32000_237_4096,Gemm_Hipblaslt_TN_72698,0.29525
GemmTunableOp_Half_TN,tn_32000_245_4096,Gemm_Hipblaslt_TN_107366,0.295327
GemmTunableOp_Half_TN,tn_32000_254_4096,Gemm_Hipblaslt_TN_72698,0.297955
GemmTunableOp_Half_TN,tn_6144_30867_4096,Gemm_Rocblas_621282559,5.58539
GemmTunableOp_Half_TN,tn_32000_85_4096,Gemm_Hipblaslt_TN_74299,0.169746
GemmTunableOp_Half_TN,tn_8_120_4096,Gemm_Hipblaslt_TN_107348,0.0137358
GemmTunableOp_Half_TN,tn_32000_76_4096,Gemm_Hipblaslt_TN_72273,0.160581
GemmTunableOp_Half_TN,tn_4096_88_4096,Gemm_Hipblaslt_TN_87478,0.0316554
GemmTunableOp_Half_TN,tn_4096_120_4096,Gemm_Rocblas_621288850,0.0317123
GemmTunableOp_Half_TN,tn_8_2400_4096,Gemm_Rocblas_621288748,0.0166505
GemmTunableOp_Half_TN,tn_4096_16_4096,Gemm_Rocblas_621282455,0.0164094
GemmTunableOp_Half_TN,tn_8_2049_4096,Gemm_Hipblaslt_TN_72007,0.0138207
GemmTunableOp_Half_TN,tn_32000_221_4096,Gemm_Hipblaslt_TN_74601,0.27287
GemmTunableOp_Half_TN,tn_4096_200_4096,Gemm_Hipblaslt_TN_85683,0.050311
GemmTunableOp_Half_TN,tn_8_2240_4096,Gemm_Hipblaslt_TN_71744,0.0140987
GemmTunableOp_Half_TN,tn_6144_120_4096,Gemm_Rocblas_621282647,0.0445335
GemmTunableOp_Half_TN,tn_4096_232_4096,Gemm_Hipblaslt_TN_73138,0.054601
GemmTunableOp_Half_TN,tn_8_40_4096,Gemm_Hipblaslt_TN_124974,0.015208
GemmTunableOp_Half_TN,tn_8_31166_4096,Gemm_Hipblaslt_TN_74271,0.0787419
GemmTunableOp_Half_TN,tn_8_2590_4096,Gemm_Hipblaslt_TN_71563,0.0226659
GemmTunableOp_Half_TN,tn_8_240_4096,Gemm_Rocblas_621288812,0.0125151
GemmTunableOp_Half_TN,tn_8_224_4096,Gemm_Rocblas_621288812,0.0125035
GemmTunableOp_Half_TN,tn_8_192_4096,Gemm_Rocblas_621282595,0.0134814
GemmTunableOp_Half_TN,tn_6144_31470_4096,Gemm_Hipblaslt_TN_88152,5.66799
GemmTunableOp_Half_TN,tn_32000_239_4096,Gemm_Hipblaslt_TN_107366,0.336052
GemmTunableOp_Half_TN,tn_32000_223_4096,Gemm_Hipblaslt_TN_88239,0.311971
GemmTunableOp_Half_TN,tn_8_216_4096,Gemm_Rocblas_621282594,0.0128224
GemmTunableOp_Half_TN,tn_32000_231_4096,Gemm_Hipblaslt_TN_88165,0.342376
GemmTunableOp_Half_TN,tn_32000_215_4096,Gemm_Hipblaslt_TN_88244,0.296265
GemmTunableOp_Half_TN,tn_32000_197_4096,Gemm_Hipblaslt_TN_88223,0.312992
GemmTunableOp_Half_TN,tn_6144_2110_4096,Gemm_Hipblaslt_TN_74446,0.455546
GemmTunableOp_Half_TN,tn_32000_181_4096,Gemm_Hipblaslt_TN_88142,0.262282
GemmTunableOp_Half_TN,tn_32000_173_4096,Gemm_Hipblaslt_TN_73573,0.247584
GemmTunableOp_Half_TN,tn_32000_165_4096,Gemm_Hipblaslt_TN_9238,0.238896
GemmTunableOp_Half_TN,tn_8_6147_4096,Gemm_Hipblaslt_TN_73690,0.0271567
GemmTunableOp_Half_TN,tn_32000_189_4096,Gemm_Hipblaslt_TN_88278,0.274764
GemmTunableOp_Half_TN,tn_32000_247_4096,Gemm_Hipblaslt_TN_107366,0.323215
GemmTunableOp_Half_TN,tn_32000_103_4096,Gemm_Hipblaslt_TN_87995,0.178956
GemmTunableOp_Half_TN,tn_32000_56_4096,Gemm_Rocblas_621288850,0.123899
GemmTunableOp_Half_TN,tn_6144_4098_4096,Gemm_Hipblaslt_TN_107367,0.75937
GemmTunableOp_Half_TN,tn_32000_63_4096,Gemm_Rocblas_621282641,0.122207
GemmTunableOp_Half_TN,tn_4096_2400_4096,Gemm_Hipblaslt_TN_74492,0.341403
GemmTunableOp_Half_TN,tn_32000_70_4096,Gemm_Hipblaslt_TN_72273,0.161549
GemmTunableOp_Half_TN,tn_32000_77_4096,Gemm_Hipblaslt_TN_72273,0.164767
GemmTunableOp_Half_TN,tn_32000_205_4096,Gemm_Hipblaslt_TN_88223,0.297837
GemmTunableOp_Half_TN,tn_32000_93_4096,Gemm_Hipblaslt_TN_74297,0.177687
GemmTunableOp_Half_TN,tn_6144_30390_4096,Gemm_Rocblas_621282559,5.47102
GemmTunableOp_Half_TN,tn_32000_84_4096,Gemm_Hipblaslt_TN_74299,0.177868
GemmTunableOp_Half_TN,tn_4096_112_4096,Gemm_Rocblas_621288850,0.0316486
GemmTunableOp_Half_TN,tn_4096_24_4096,Gemm_Rocblas_621288658,0.0172715
GemmTunableOp_Half_TN,tn_4096_30950_4096,Gemm_Hipblaslt_TN_107347,4.03791
GemmTunableOp_Half_TN,tn_6144_160_4096,Gemm_Hipblaslt_TN_72127,0.0504563
GemmTunableOp_Half_TN,tn_4096_32560_4096,Gemm_Hipblaslt_TN_107347,4.23358
GemmTunableOp_Half_TN,tn_32000_160_4096,Gemm_Hipblaslt_TN_87948,0.201674
GemmTunableOp_Half_TN,tn_6144_112_4096,Gemm_Rocblas_621282642,0.0442534
GemmTunableOp_Half_TN,tn_6144_248_4096,Gemm_Rocblas_621289019,0.0696831
GemmTunableOp_Half_TN,tn_8_32000_4096,Default,0.085927
GemmTunableOp_Half_TN,tn_6144_6147_4096,Gemm_Rocblas_621282450,1.18507
GemmTunableOp_Half_TN,tn_6144_56_4096,Gemm_Rocblas_621282632,0.0311474
GemmTunableOp_Half_TN,tn_8_56_4096,Gemm_Rocblas_621288706,0.0104216
GemmTunableOp_Half_TN,tn_6144_32000_4096,Gemm_Rocblas_621282559,6.16281
GemmTunableOp_Half_TN,tn_32000_248_4096,Gemm_Hipblaslt_TN_107366,0.328736
GemmTunableOp_Half_TN,tn_32000_209_4096,Gemm_Hipblaslt_TN_88215,0.297134
GemmTunableOp_Half_TN,tn_32000_225_4096,Gemm_Hipblaslt_TN_107366,0.333513
GemmTunableOp_Half_TN,tn_32000_256_4096,Gemm_Hipblaslt_TN_88049,0.319302
GemmTunableOp_Half_TN,tn_32000_241_4096,Gemm_Hipblaslt_TN_107366,0.333921
GemmTunableOp_Half_TN,tn_8_88_4096,Gemm_Rocblas_621282458,0.0104777
GemmTunableOp_Half_TN,tn_6144_32_4096,Gemm_Hipblaslt_TN_86084,0.0251989
GemmTunableOp_Half_TN,tn_32000_191_4096,Gemm_Hipblaslt_TN_74829,0.276902
GemmTunableOp_Half_TN,tn_32000_183_4096,Gemm_Hipblaslt_TN_88278,0.264902
GemmTunableOp_Half_TN,tn_32000_199_4096,Gemm_Hipblaslt_TN_88137,0.310856
GemmTunableOp_Half_TN,tn_32000_9_4096,Gemm_Rocblas_621288685,0.0792223
GemmTunableOp_Half_TN,tn_32000_167_4096,Gemm_Hipblaslt_TN_9238,0.244377
GemmTunableOp_Half_TN,tn_6144_144_4096,Gemm_Hipblaslt_TN_72127,0.051199
GemmTunableOp_Half_TN,tn_32000_175_4096,Gemm_Hipblaslt_TN_73573,0.24915
GemmTunableOp_Half_TN,tn_6144_192_4096,Gemm_Hipblaslt_TN_72500,0.0576551
GemmTunableOp_Half_TN,tn_6144_30735_4096,Gemm_Rocblas_621282559,5.56479
GemmTunableOp_Half_TN,tn_32000_157_4096,Gemm_Hipblaslt_TN_88124,0.209679
GemmTunableOp_Half_TN,tn_32000_217_4096,Gemm_Hipblaslt_TN_88215,0.305426
GemmTunableOp_Half_TN,tn_32000_81_4096,Gemm_Hipblaslt_TN_74297,0.172554
GemmTunableOp_Half_TN,tn_32000_73_4096,Gemm_Hipblaslt_TN_72273,0.163343
GemmTunableOp_Half_TN,tn_32000_98_4096,Gemm_Hipblaslt_TN_87995,0.196907
GemmTunableOp_Half_TN,tn_32000_105_4096,Gemm_Hipblaslt_TN_87995,0.178535
GemmTunableOp_Half_TN,tn_4096_176_4096,Gemm_Rocblas_621282943,0.0435036
GemmTunableOp_Half_TN,tn_32000_233_4096,Gemm_Hipblaslt_TN_107366,0.326418
GemmTunableOp_Half_TN,tn_4096_192_4096,Gemm_Hipblaslt_TN_71916,0.0434287
GemmTunableOp_Half_TN,tn_4096_2160_4096,Gemm_Rocblas_621282746,0.307413
GemmTunableOp_Half_TN,tn_4096_30970_4096,Gemm_Rocblas_621282559,4.1017
GemmTunableOp_Half_TN,tn_4096_2520_4096,Gemm_Hipblaslt_TN_73828,0.351509
GemmTunableOp_Half_TN,tn_4096_32700_4096,Gemm_Rocblas_621282559,4.28631
GemmTunableOp_Half_TN,tn_6144_2240_4096,Gemm_Rocblas_621282440,0.460777
GemmTunableOp_Half_TN,tn_6144_256_4096,Gemm_Rocblas_621289019,0.0682217
GemmTunableOp_Half_TN,tn_8_8_4096,Gemm_Rocblas_621288645,0.00865255
GemmTunableOp_Half_TN,tn_8_32560_4096,Default,0.0870815
GemmTunableOp_Half_TN,tn_8_24_4096,Gemm_Hipblaslt_TN_107357,0.0175006
GemmTunableOp_Half_TN,tn_6144_4430_4096,Gemm_Rocblas_621282559,0.917222
GemmTunableOp_Half_TN,tn_32000_252_4096,Gemm_Hipblaslt_TN_107366,0.340169
GemmTunableOp_Half_TN,tn_32000_244_4096,Gemm_Hipblaslt_TN_107366,0.330118
GemmTunableOp_Half_TN,tn_32000_236_4096,Gemm_Hipblaslt_TN_107366,0.330852
GemmTunableOp_Half_TN,tn_32000_227_4096,Gemm_Hipblaslt_TN_107366,0.334404
GemmTunableOp_Half_TN,tn_32000_170_4096,Gemm_Hipblaslt_TN_9238,0.243824
GemmTunableOp_Half_TN,tn_32000_100_4096,Gemm_Hipblaslt_TN_87995,0.178629
GemmTunableOp_Half_TN,tn_8_30735_4096,Default,0.0773081
GemmTunableOp_Half_TN,tn_6144_176_4096,Gemm_Hipblaslt_TN_72500,0.0581186
GemmTunableOp_Half_TN,tn_32000_60_4096,Gemm_Rocblas_621282641,0.124299
GemmTunableOp_Half_TN,tn_32000_201_4096,Gemm_Hipblaslt_TN_88223,0.302821
GemmTunableOp_Half_TN,tn_32000_211_4096,Gemm_Hipblaslt_TN_88239,0.299405
GemmTunableOp_Half_TN,tn_32000_177_4096,Gemm_Hipblaslt_TN_73573,0.251958
GemmTunableOp_Half_TN,tn_32000_162_4096,Gemm_Hipblaslt_TN_87893,0.2371
GemmTunableOp_Half_TN,tn_4096_2590_4096,Gemm_Hipblaslt_TN_72996,0.354602
GemmTunableOp_Half_TN,tn_32000_68_4096,Gemm_Hipblaslt_TN_72273,0.160237
GemmTunableOp_Half_TN,tn_6144_16_4096,Gemm_Rocblas_621282473,0.0223547
GemmTunableOp_Half_TN,tn_32000_75_4096,Gemm_Hipblaslt_TN_72273,0.163672
GemmTunableOp_Half_TN,tn_32000_219_4096,Gemm_Hipblaslt_TN_88223,0.310109
GemmTunableOp_Half_TN,tn_32000_83_4096,Gemm_Hipblaslt_TN_74297,0.177192
GemmTunableOp_Half_TN,tn_4096_32768_4096,Gemm_Hipblaslt_TN_107347,4.19214
GemmTunableOp_Half_TN,tn_32000_193_4096,Gemm_Hipblaslt_TN_88223,0.311696
GemmTunableOp_Half_TN,tn_32000_91_4096,Gemm_Hipblaslt_TN_74297,0.177684
GemmTunableOp_Half_TN,tn_8_31080_4096,Gemm_Hipblaslt_TN_74271,0.0783196
GemmTunableOp_Half_TN,tn_6144_31940_4096,Gemm_Rocblas_621282559,6.10764
GemmTunableOp_Half_TN,tn_32000_185_4096,Gemm_Hipblaslt_TN_88277,0.267811
GemmTunableOp_Half_TN,tn_4096_104_4096,Gemm_Rocblas_621282641,0.0318405
GemmTunableOp_Half_TN,tn_4096_2240_4096,Gemm_Rocblas_621282746,0.298764
GemmTunableOp_Half_TN,tn_6144_2330_4096,Gemm_Rocblas_621282746,0.5021
GemmTunableOp_Half_TN,tn_4096_31080_4096,Gemm_Rocblas_621282559,4.02826
GemmTunableOp_Half_TN,tn_6144_216_4096,Gemm_Hipblaslt_TN_74158,0.0640699
GemmTunableOp_Half_TN,tn_6144_30580_4096,Gemm_Hipblaslt_TN_88152,5.5392
GemmTunableOp_Half_TN,tn_8_256_4096,Gemm_Rocblas_621282594,0.0168861
GemmTunableOp_Half_TN,tn_8_32768_4096,Gemm_Hipblaslt_TN_74271,0.0790235
GemmTunableOp_Half_TN,tn_6144_96_4096,Gemm_Rocblas_621282893,0.0367706
GemmTunableOp_Half_TN,tn_6144_40_4096,Gemm_Rocblas_621288850,0.03156
GemmTunableOp_Half_TN,tn_6144_2280_4096,Gemm_Rocblas_621282440,0.458944
GemmTunableOp_Half_TN,tn_6144_208_4096,Gemm_Hipblaslt_TN_74158,0.0637551
GemmTunableOp_Half_TN,tn_6144_184_4096,Gemm_Hipblaslt_TN_74057,0.0589711
GemmTunableOp_Half_TN,tn_6144_136_4096,Gemm_Hipblaslt_TN_72127,0.0505685
GemmTunableOp_Half_TN,tn_6144_128_4096,Gemm_Hipblaslt_TN_73460,0.0429399
GemmTunableOp_Half_TN,tn_4096_96_4096,Gemm_Hipblaslt_TN_74605,0.0291228
GemmTunableOp_Half_TN,tn_4096_8_4096,Gemm_Rocblas_621282455,0.0165564
GemmTunableOp_Half_TN,tn_4096_72_4096,Gemm_Hipblaslt_TN_87820,0.0284065
GemmTunableOp_Half_TN,tn_4096_64_4096,Gemm_Rocblas_621288809,0.0235833
GemmTunableOp_Half_TN,tn_4096_56_4096,Gemm_Rocblas_621288840,0.0239394
GemmTunableOp_Half_TN,tn_4096_48_4096,Gemm_Hipblaslt_TN_71830,0.0219533
GemmTunableOp_Half_TN,tn_8_144_4096,Gemm_Hipblaslt_TN_107348,0.0137298
GemmTunableOp_Half_TN,tn_32000_222_4096,Gemm_Hipblaslt_TN_9237,0.272354
GemmTunableOp_Half_TN,tn_32000_214_4096,Gemm_Hipblaslt_TN_9240,0.271389
GemmTunableOp_Half_TN,tn_6144_26637_4096,Gemm_Hipblaslt_TN_73656,5.01764
GemmTunableOp_Half_TN,tn_32000_156_4096,Gemm_Hipblaslt_TN_87982,0.212585
GemmTunableOp_Half_TN,tn_32000_207_4096,Gemm_Hipblaslt_TN_74447,0.271465
GemmTunableOp_Half_TN,tn_8_200_4096,Gemm_Rocblas_621288812,0.0169894
GemmTunableOp_Half_TN,tn_4096_80_4096,Gemm_Hipblaslt_TN_87793,0.0279671
GemmTunableOp_Half_TN,tn_32000_11_4096,Gemm_Rocblas_621282473,0.0743589
GemmTunableOp_Half_TN,tn_32000_15_4096,Gemm_Rocblas_621282473,0.0793914
GemmTunableOp_Half_TN,tn_6144_31166_4096,Gemm_Hipblaslt_TN_88152,5.67917
GemmTunableOp_Half_TN,tn_32000_171_4096,Gemm_Hipblaslt_TN_9238,0.234238
GemmTunableOp_Half_TN,tn_6144_104_4096,Gemm_Rocblas_621282647,0.0444526
GemmTunableOp_Half_TN,tn_4096_31940_4096,Gemm_Hipblaslt_TN_107347,4.18451
GemmTunableOp_Half_TN,tn_32000_71_4096,Gemm_Hipblaslt_TN_72273,0.157507
GemmTunableOp_Half_TN,tn_8_2280_4096,Gemm_Rocblas_621288873,0.0171857
GemmTunableOp_Half_TN,tn_32000_12_4096,Gemm_Rocblas_621288651,0.0804345
GemmTunableOp_Half_TN,tn_4096_216_4096,Gemm_Hipblaslt_TN_85710,0.0514014
GemmTunableOp_Half_TN,tn_8_30950_4096,Gemm_Hipblaslt_TN_73690,0.0783581
GemmTunableOp_Half_TN,tn_32000_164_4096,Gemm_Hipblaslt_TN_9238,0.233736
GemmTunableOp_Half_TN,tn_6144_72_4096,Gemm_Rocblas_621282893,0.0374597
GemmTunableOp_Half_TN,tn_32000_230_4096,Gemm_Hipblaslt_TN_107366,0.290562
GemmTunableOp_Half_TN,tn_4096_30735_4096,Gemm_Hipblaslt_TN_88152,3.9724
GemmTunableOp_Half_TN,tn_32000_202_4096,Gemm_Hipblaslt_TN_9240,0.271512
GemmTunableOp_Half_TN,tn_32000_187_4096,Gemm_Hipblaslt_TN_9238,0.235785
GemmTunableOp_Half_TN,tn_32000_246_4096,Gemm_Hipblaslt_TN_107366,0.292995
GemmTunableOp_Half_TN,tn_32000_62_4096,Gemm_Rocblas_621282633,0.120813
GemmTunableOp_Half_TN,tn_6144_48_4096,Gemm_Rocblas_621288850,0.0317283
GemmTunableOp_Half_TN,tn_32000_255_4096,Gemm_Hipblaslt_TN_107366,0.294539
GemmTunableOp_Half_TN,tn_32000_80_4096,Gemm_Hipblaslt_TN_72273,0.154652
GemmTunableOp_Half_TN,tn_32000_8_4096,Gemm_Rocblas_621288685,0.0804361
GemmTunableOp_Half_TN,tn_32000_238_4096,Gemm_Hipblaslt_TN_107366,0.291556
GemmTunableOp_Half_TN,tn_32000_89_4096,Gemm_Hipblaslt_TN_71929,0.168838
GemmTunableOp_Half_TN,tn_32000_97_4096,Gemm_Hipblaslt_TN_74555,0.176853
GemmTunableOp_Half_TN,tn_32000_179_4096,Gemm_Hipblaslt_TN_9238,0.234771
GemmTunableOp_Half_TN,tn_4096_2330_4096,Gemm_Hipblaslt_TN_74446,0.332794
GemmTunableOp_Half_TN,tn_4096_152_4096,Gemm_Hipblaslt_TN_72370,0.0399178
GemmTunableOp_Half_TN,tn_32000_195_4096,Gemm_Hipblaslt_TN_74447,0.271181
GemmTunableOp_Half_TN,tn_4096_160_4096,Gemm_Hipblaslt_TN_72370,0.0393814
GemmTunableOp_Half_TN,tn_4096_184_4096,Gemm_Hipblaslt_TN_72889,0.0445944
GemmTunableOp_Half_TN,tn_8_30390_4096,Gemm_Hipblaslt_TN_73690,0.0762185
GemmTunableOp_Half_TN,tn_8_2340_4096,Gemm_Hipblaslt_TN_71744,0.0142934
GemmTunableOp_Half_TN,tn_8_2110_4096,Gemm_Hipblaslt_TN_72160,0.0140166
GemmTunableOp_Half_TN,tn_8_2_4096,Gemm_Rocblas_621282452,0.0137285
GemmTunableOp_Half_TN,tn_6144_32700_4096,Gemm_Rocblas_621282559,6.3487
GemmTunableOp_Half_TN,tn_8_112_4096,Gemm_Rocblas_621288654,0.0140711
GemmTunableOp_Half_TN,tn_6144_30970_4096,Gemm_Hipblaslt_TN_88152,5.60624
GemmTunableOp_Half_TN,tn_32000_232_4096,Gemm_Hipblaslt_TN_107366,0.328566
GemmTunableOp_Half_TN,tn_32000_174_4096,Gemm_Hipblaslt_TN_73573,0.249065
GemmTunableOp_Half_TN,tn_32000_249_4096,Gemm_Hipblaslt_TN_107366,0.331934
GemmTunableOp_Half_TN,tn_32000_79_4096,Gemm_Hipblaslt_TN_72273,0.165903
GemmTunableOp_Half_TN,tn_8_2520_4096,Gemm_Rocblas_621288873,0.0144496
GemmTunableOp_Half_TN,tn_4096_32000_4096,Gemm_Hipblaslt_TN_107347,4.20676
GemmTunableOp_Half_TN,tn_32000_190_4096,Gemm_Hipblaslt_TN_88278,0.275871
GemmTunableOp_Half_TN,tn_4096_240_4096,Gemm_Hipblaslt_TN_72641,0.0550929
GemmTunableOp_Half_TN,tn_8_2160_4096,Gemm_Hipblaslt_TN_72160,0.0140911
GemmTunableOp_Half_TN,tn_32000_182_4096,Gemm_Hipblaslt_TN_88278,0.264041
GemmTunableOp_Half_TN,tn_32000_95_4096,Gemm_Hipblaslt_TN_74297,0.178729
GemmTunableOp_Half_TN,tn_8_32130_4096,Gemm_Hipblaslt_TN_74271,0.080305
GemmTunableOp_Half_TN,tn_6144_2520_4096,Gemm_Rocblas_621282746,0.495363
GemmTunableOp_Half_TN,tn_32000_216_4096,Gemm_Hipblaslt_TN_88223,0.294687
GemmTunableOp_Half_TN,tn_8_168_4096,Gemm_Rocblas_621288812,0.0131413
GemmTunableOp_Half_TN,tn_32000_208_4096,Gemm_Rocblas_621296657,0.294756
GemmTunableOp_Half_TN,tn_32000_102_4096,Gemm_Hipblaslt_TN_87995,0.179374
GemmTunableOp_Half_TN,tn_32000_158_4096,Gemm_Hipblaslt_TN_72429,0.209817
GemmTunableOp_Half_TN,tn_8_96_4096,Gemm_Rocblas_621288655,0.0129414
GemmTunableOp_Half_TN,tn_6144_2160_4096,Gemm_Hipblaslt_TN_9238,0.437867
GemmTunableOp_Half_TN,tn_32000_198_4096,Gemm_Hipblaslt_TN_88223,0.315159
GemmTunableOp_Half_TN,tn_32000_224_4096,Gemm_Rocblas_621296657,0.30875
GemmTunableOp_Half_TN,tn_32000_166_4096,Gemm_Hipblaslt_TN_9238,0.242197
GemmTunableOp_Half_TN,tn_32000_57_4096,Gemm_Rocblas_621288850,0.123668
GemmTunableOp_Half_TN,tn_32000_240_4096,Gemm_Hipblaslt_TN_107366,0.338037
GemmTunableOp_Half_TN,tn_32000_64_4096,Gemm_Rocblas_621288842,0.120294
GemmTunableOp_Half_TN,tn_4096_136_4096,Gemm_Hipblaslt_TN_72881,0.0398124
GemmTunableOp_Half_TN,tn_4096_256_4096,Gemm_Rocblas_621282947,0.0536688
GemmTunableOp_Half_TN,tn_4096_2049_4096,Gemm_Rocblas_621282746,0.30277
GemmTunableOp_Half_TN,tn_4096_30580_4096,Gemm_Hipblaslt_TN_107347,3.98361
GemmTunableOp_Half_TN,tn_4096_32_4096,Gemm_Rocblas_621288866,0.0184721
GemmTunableOp_Half_TN,tn_32000_72_4096,Gemm_Hipblaslt_TN_72273,0.163148
GemmTunableOp_Half_TN,tn_32000_86_4096,Gemm_Hipblaslt_TN_87833,0.176791
GemmTunableOp_Half_TN,tn_4096_6147_4096,Gemm_Rocblas_621282852,0.801127
GemmTunableOp_Half_TN,tn_8_80_4096,Gemm_Rocblas_621282458,0.0105129
GemmTunableOp_Half_TN,tn_8_48_4096,Gemm_Rocblas_621282577,0.0103671
GemmTunableOp_Half_TN,tn_8_4098_4096,Gemm_Hipblaslt_TN_72732,0.0178111
GemmTunableOp_Half_TN,tn_8_4_4096,Gemm_Rocblas_621288645,0.00871745
GemmTunableOp_Half_TN,tn_8_31470_4096,Gemm_Hipblaslt_TN_74271,0.0782888
GemmTunableOp_Half_TN,tn_8_30867_4096,Default,0.0779098
GemmTunableOp_Half_TN,tn_8_248_4096,Gemm_Rocblas_621282594,0.0125492
GemmTunableOp_Half_TN,tn_8_2330_4096,Gemm_Rocblas_621282666,0.0144084
GemmTunableOp_Half_TN,tn_32000_235_4096,Gemm_Hipblaslt_TN_107366,0.336325
GemmTunableOp_Half_TN,tn_32000_82_4096,Gemm_Hipblaslt_TN_74297,0.176398
GemmTunableOp_Half_TN,tn_32000_228_4096,Gemm_Hipblaslt_TN_107366,0.327671
GemmTunableOp_Half_TN,tn_32000_220_4096,Gemm_Hipblaslt_TN_88223,0.312324
GemmTunableOp_Half_TN,tn_32000_194_4096,Gemm_Hipblaslt_TN_88223,0.313991
GemmTunableOp_Half_TN,tn_32000_161_4096,Gemm_Hipblaslt_TN_87893,0.236448
GemmTunableOp_Half_TN,tn_4096_208_4096,Gemm_Hipblaslt_TN_85710,0.0504408
GemmTunableOp_Half_TN,tn_6144_2590_4096,Gemm_Hipblaslt_TN_107365,0.527887
GemmTunableOp_Half_TN,tn_32000_243_4096,Gemm_Hipblaslt_TN_107366,0.329401
GemmTunableOp_Half_TN,tn_32000_169_4096,Gemm_Hipblaslt_TN_9238,0.245597
GemmTunableOp_Half_TN,tn_8_4430_4096,Gemm_Hipblaslt_TN_72732,0.0180034
GemmTunableOp_Half_TN,tn_32000_90_4096,Gemm_Hipblaslt_TN_74297,0.17774
GemmTunableOp_Half_TN,tn_32000_251_4096,Gemm_Hipblaslt_TN_107366,0.336766
GemmTunableOp_Half_TN,tn_32000_212_4096,Gemm_Hipblaslt_TN_9240,0.300656
GemmTunableOp_Half_TN,tn_4096_4430_4096,Gemm_Hipblaslt_TN_74446,0.618248
GemmTunableOp_Half_TN,tn_6144_2049_4096,Gemm_Hipblaslt_TN_73548,0.45556
GemmTunableOp_Half_TN,tn_32000_59_4096,Gemm_Rocblas_621288850,0.124591
GemmTunableOp_Half_TN,tn_32000_178_4096,Gemm_Hipblaslt_TN_73573,0.255029
GemmTunableOp_Half_TN,tn_6144_240_4096,Gemm_Hipblaslt_TN_74062,0.0721043
GemmTunableOp_Half_TN,tn_32000_104_4096,Gemm_Hipblaslt_TN_87995,0.179177
GemmTunableOp_Half_TN,tn_32000_65_4096,Gemm_Hipblaslt_TN_71860,0.159766
GemmTunableOp_Half_TN,tn_32000_186_4096,Gemm_Hipblaslt_TN_88182,0.269328
GemmTunableOp_Half_TN,tn_32000_74_4096,Gemm_Hipblaslt_TN_73975,0.165456
GemmTunableOp_Half_TN,tn_32000_99_4096,Gemm_Hipblaslt_TN_88023,0.197885
GemmTunableOp_Half_TN,tn_4096_2280_4096,Gemm_Rocblas_621282968,0.323358
GemmTunableOp_Half_TN,tn_32000_204_4096,Gemm_Hipblaslt_TN_88223,0.304644
GemmTunableOp_Half_TN,tn_4096_30390_4096,Gemm_Hipblaslt_TN_107347,3.96437
GemmTunableOp_Half_TN,tn_4096_31470_4096,Gemm_Hipblaslt_TN_107347,4.11794
GemmTunableOp_Half_TN,tn_6144_31080_4096,Gemm_Rocblas_621282559,5.61517
GemmTunableOp_Half_TN,tn_6144_32768_4096,Gemm_Rocblas_621282559,6.33006
GemmTunableOp_Half_TN,tn_4096_32768_2048,Gemm_Hipblaslt_TN_88152,2.14998
GemmTunableOp_Half_TN,tn_3072_2049_4096,Gemm_Hipblaslt_TN_74469,0.229184
GemmTunableOp_Half_TN,tn_4096_32_2048,Gemm_Rocblas_621288657,0.01307
GemmTunableOp_Half_TN,tn_4096_248_2048,Gemm_Rocblas_621289140,0.0324836
GemmTunableOp_Half_TN,tn_4096_24_2048,Gemm_Rocblas_621288723,0.0131341
GemmTunableOp_Half_TN,tn_3072_152_4096,Gemm_Rocblas_621282665,0.0317284
GemmTunableOp_Half_TN,tn_3072_128_4096,Gemm_Hipblaslt_TN_72977,0.029421
GemmTunableOp_Half_TN,tn_8_96_4096,Gemm_Rocblas_621288655,0.0107085
GemmTunableOp_Half_TN,tn_8_32768_4096,Gemm_Hipblaslt_TN_74271,0.0795358
GemmTunableOp_Half_TN,tn_8_2049_4096,Gemm_Rocblas_621282666,0.0141572
GemmTunableOp_Half_TN,tn_8_184_4096,Gemm_Rocblas_621282594,0.0125332
GemmTunableOp_Half_TN,tn_8_160_4096,Gemm_Rocblas_621282594,0.0125544
GemmTunableOp_Half_TN,tn_8_136_4096,Gemm_Rocblas_621288812,0.0125452
GemmTunableOp_Half_TN,tn_3072_8196_4096,Gemm_Hipblaslt_TN_74638,0.788245
GemmTunableOp_Half_TN,tn_16000_256_4096,Gemm_Rocblas_621282723,0.137178
GemmTunableOp_Half_TN,tn_8_8196_4096,Gemm_Hipblaslt_TN_73339,0.0258488
GemmTunableOp_Half_TN,tn_8_8_4096,Gemm_Rocblas_621282563,0.00918779
GemmTunableOp_Half_TN,tn_8_72_4096,Gemm_Rocblas_621288655,0.0104641
GemmTunableOp_Half_TN,tn_3072_32768_4096,Gemm_Hipblaslt_TN_74854,2.99411
GemmTunableOp_Half_TN,tn_3072_32_4096,Gemm_Rocblas_621282493,0.01629
GemmTunableOp_Half_TN,tn_3072_232_4096,Gemm_Hipblaslt_TN_74372,0.0422178
GemmTunableOp_Half_TN,tn_3072_192_4096,Gemm_Rocblas_621282641,0.0313042
GemmTunableOp_Half_TN,tn_3072_144_4096,Gemm_Hipblaslt_TN_74821,0.0302514
GemmTunableOp_Half_TN,tn_8_56_4096,Gemm_Rocblas_621282577,0.0103844
GemmTunableOp_Half_TN,tn_3072_136_4096,Gemm_Hipblaslt_TN_74349,0.0305739
GemmTunableOp_Half_TN,tn_8_64_4096,Gemm_Rocblas_621288796,0.0103311
GemmTunableOp_Half_TN,tn_8_40_4096,Gemm_Rocblas_621282577,0.010416
GemmTunableOp_Half_TN,tn_8_80_4096,Gemm_Rocblas_621282458,0.0104753
GemmTunableOp_Half_TN,tn_8_4_4096,Gemm_Rocblas_621288678,0.0087908
GemmTunableOp_Half_TN,tn_8_240_4096,Gemm_Rocblas_621282594,0.0125096
GemmTunableOp_Half_TN,tn_3072_30735_4096,Gemm_Hipblaslt_TN_88152,2.77446
GemmTunableOp_Half_TN,tn_3072_24_4096,Gemm_Rocblas_621282493,0.0164026
GemmTunableOp_Half_TN,tn_3072_168_4096,Gemm_Rocblas_621288850,0.0316079
GemmTunableOp_Half_TN,tn_3072_200_4096,Gemm_Hipblaslt_TN_72275,0.0403438
GemmTunableOp_Half_TN,tn_3072_112_4096,Gemm_Hipblaslt_TN_72977,0.0302302
GemmTunableOp_Half_TN,tn_4096_184_2048,Gemm_Hipblaslt_TN_71916,0.0280148
GemmTunableOp_Half_TN,tn_4096_136_2048,Gemm_Hipblaslt_TN_74372,0.0269729
GemmTunableOp_Half_TN,tn_3072_72_4096,Gemm_Hipblaslt_TN_71838,0.0245985
GemmTunableOp_Half_TN,tn_4096_30735_2048,Gemm_Hipblaslt_TN_88152,2.00301
GemmTunableOp_Half_TN,tn_3072_48_4096,Gemm_Hipblaslt_TN_71716,0.0198734
GemmTunableOp_Half_TN,tn_3072_248_4096,Gemm_Hipblaslt_TN_71916,0.0435157
GemmTunableOp_Half_TN,tn_4096_224_2048,Gemm_Hipblaslt_TN_87681,0.0323978
GemmTunableOp_Half_TN,tn_4096_104_2048,Gemm_Rocblas_621288850,0.0202997
GemmTunableOp_Half_TN,tn_3072_208_4096,Gemm_Hipblaslt_TN_72274,0.0409086
GemmTunableOp_Half_TN,tn_3072_160_4096,Gemm_Rocblas_621288850,0.0317881
GemmTunableOp_Half_TN,tn_3072_104_4096,Gemm_Hipblaslt_TN_72869,0.0299025
GemmTunableOp_Half_TN,tn_8_48_4096,Gemm_Rocblas_621288796,0.0103587
GemmTunableOp_Half_TN,tn_8_32_4096,Gemm_Rocblas_621288650,0.00871187
GemmTunableOp_Half_TN,tn_8_256_4096,Gemm_Rocblas_621282594,0.0124855
GemmTunableOp_Half_TN,tn_8_232_4096,Gemm_Rocblas_621288812,0.012494
GemmTunableOp_Half_TN,tn_8_152_4096,Gemm_Rocblas_621282594,0.0124711
GemmTunableOp_Half_TN,tn_3072_176_4096,Gemm_Rocblas_621288850,0.0320161
GemmTunableOp_Half_TN,tn_16000_15_4096,Gemm_Rocblas_621282484,0.0433567
GemmTunableOp_Half_TN,tn_4096_176_2048,Gemm_Hipblaslt_TN_73380,0.027978
GemmTunableOp_Half_TN,tn_8_192_4096,Gemm_Hipblaslt_TN_74267,0.0135788
GemmTunableOp_Half_TN,tn_3072_240_4096,Gemm_Hipblaslt_TN_74372,0.0418176
GemmTunableOp_Half_TN,tn_4096_112_2048,Gemm_Rocblas_621288850,0.0203878
GemmTunableOp_Half_TN,tn_8_88_4096,Gemm_Rocblas_621288655,0.0104966
GemmTunableOp_Half_TN,tn_3072_216_4096,Gemm_Hipblaslt_TN_72274,0.0416461
GemmTunableOp_Half_TN,tn_3072_40_4096,Gemm_Hipblaslt_TN_86387,0.0204066
GemmTunableOp_Half_TN,tn_4096_144_2048,Gemm_Hipblaslt_TN_72273,0.0271616
GemmTunableOp_Half_TN,tn_8_128_4096,Gemm_Rocblas_621288655,0.0104929
GemmTunableOp_Half_TN,tn_8_216_4096,Gemm_Rocblas_621288812,0.0125336
GemmTunableOp_Half_TN,tn_3072_64_4096,Gemm_Hipblaslt_TN_71769,0.0220932
GemmTunableOp_Half_TN,tn_3072_80_4096,Gemm_Hipblaslt_TN_71839,0.0247728
GemmTunableOp_Half_TN,tn_8_176_4096,Gemm_Rocblas_621282594,0.01251
GemmTunableOp_Half_TN,tn_8_112_4096,Gemm_Rocblas_621288655,0.0104813
GemmTunableOp_Half_TN,tn_4096_2049_2048,Gemm_Hipblaslt_TN_88014,0.16594
GemmTunableOp_Half_TN,tn_4096_72_2048,Gemm_Hipblaslt_TN_74370,0.0198089
GemmTunableOp_Half_TN,tn_4096_40_2048,Gemm_Rocblas_621282600,0.0160301
GemmTunableOp_Half_TN,tn_4096_240_2048,Gemm_Hipblaslt_TN_87681,0.0325781
GemmTunableOp_Half_TN,tn_4096_216_2048,Gemm_Hipblaslt_TN_87681,0.0324323
GemmTunableOp_Half_TN,tn_4096_200_2048,Gemm_Hipblaslt_TN_107336,0.0322083
GemmTunableOp_Half_TN,tn_4096_8196_2048,Gemm_Hipblaslt_TN_74469,0.545194
GemmTunableOp_Half_TN,tn_4096_64_2048,Gemm_Rocblas_621289191,0.0152389
GemmTunableOp_Half_TN,tn_4096_168_2048,Gemm_Hipblaslt_TN_73380,0.0279239
GemmTunableOp_Half_TN,tn_4096_120_2048,Gemm_Rocblas_621288850,0.0204395
GemmTunableOp_Half_TN,tn_4096_152_2048,Gemm_Hipblaslt_TN_74372,0.0271359
GemmTunableOp_Half_TN,tn_3072_96_4096,Gemm_Hipblaslt_TN_71897,0.0255475
GemmTunableOp_Half_TN,tn_16000_244_4096,Gemm_Rocblas_621282853,0.139938
GemmTunableOp_Half_TN,tn_8_30735_4096,Gemm_Hipblaslt_TN_73690,0.0762793
GemmTunableOp_Half_TN,tn_8_24_4096,Gemm_Rocblas_621282452,0.00869184
GemmTunableOp_Half_TN,tn_8_224_4096,Gemm_Rocblas_621282594,0.0125188
GemmTunableOp_Half_TN,tn_4096_192_2048,Gemm_Hipblaslt_TN_71916,0.0270342
GemmTunableOp_Half_TN,tn_4096_160_2048,Gemm_Hipblaslt_TN_74372,0.0260359
GemmTunableOp_Half_TN,tn_4096_16_2048,Gemm_Rocblas_621282576,0.0123622
GemmTunableOp_Half_TN,tn_8_144_4096,Gemm_Rocblas_621282595,0.0127828
GemmTunableOp_Half_TN,tn_4096_128_2048,Gemm_Rocblas_621288850,0.0201679
GemmTunableOp_Half_TN,tn_4096_56_2048,Gemm_Rocblas_621288818,0.0162672
GemmTunableOp_Half_TN,tn_3072_184_4096,Gemm_Rocblas_621288850,0.0317977
GemmTunableOp_Half_TN,tn_8_120_4096,Gemm_Rocblas_621282458,0.0105114
GemmTunableOp_Half_TN,tn_3072_8_4096,Gemm_Rocblas_621288648,0.0154832
GemmTunableOp_Half_TN,tn_4096_88_2048,Gemm_Rocblas_621288850,0.0202171
GemmTunableOp_Half_TN,tn_8_2_4096,Gemm_Rocblas_621282452,0.00864217
GemmTunableOp_Half_TN,tn_8_208_4096,Gemm_Rocblas_621282594,0.0125052
GemmTunableOp_Half_TN,tn_3072_56_4096,Gemm_Hipblaslt_TN_71769,0.0223247
GemmTunableOp_Half_TN,tn_3072_256_4096,Gemm_Rocblas_621282647,0.0426809
GemmTunableOp_Half_TN,tn_4096_208_2048,Gemm_Hipblaslt_TN_87681,0.03249
GemmTunableOp_Half_TN,tn_3072_16_4096,Gemm_Rocblas_621288651,0.0149372
GemmTunableOp_Half_TN,tn_3072_120_4096,Gemm_Hipblaslt_TN_73219,0.0299786
GemmTunableOp_Half_TN,tn_4096_232_2048,Gemm_Hipblaslt_TN_87681,0.0326065
GemmTunableOp_Half_TN,tn_3072_88_4096,Gemm_Hipblaslt_TN_71897,0.0255988
GemmTunableOp_Half_TN,tn_4096_256_2048,Gemm_Rocblas_621289148,0.030882
GemmTunableOp_Half_TN,tn_4096_8_2048,Gemm_Rocblas_621288651,0.0125476
GemmTunableOp_Half_TN,tn_4096_48_2048,Gemm_Rocblas_621288818,0.016141
GemmTunableOp_Half_TN,tn_4096_80_2048,Gemm_Hipblaslt_TN_87793,0.0192333
GemmTunableOp_Half_TN,tn_4096_96_2048,Gemm_Rocblas_621282641,0.0202051
GemmTunableOp_Half_TN,tn_8_168_4096,Gemm_Rocblas_621288812,0.0125016
GemmTunableOp_Half_TN,tn_3072_224_4096,Gemm_Hipblaslt_TN_72275,0.0408946
GemmTunableOp_Half_TN,tn_8_104_4096,Gemm_Rocblas_621288655,0.0104829
GemmTunableOp_Half_TN,tn_8_16_4096,Gemm_Rocblas_621282452,0.00860211
GemmTunableOp_Half_TN,tn_8_248_4096,Gemm_Rocblas_621282594,0.012498
GemmTunableOp_Half_TN,tn_8_200_4096,Gemm_Rocblas_621288812,0.0125156
GemmTunableOp_Half_TN,tn_8_8192_6144,Gemm_Hipblaslt_TN_87742,0.0343346
GemmTunableOp_Half_TN,tn_8_7417_6144,Gemm_Hipblaslt_TN_74271,0.0261384
GemmTunableOp_Half_TN,tn_8_6185_6144,Gemm_Hipblaslt_TN_74271,0.025634
GemmTunableOp_Half_TN,tn_8_56_6144,Gemm_Rocblas_621288706,0.0127038
GemmTunableOp_Half_TN,tn_8_40_6144,Gemm_Rocblas_621288706,0.012647
GemmTunableOp_Half_TN,tn_8_3199_6144,Default,0.0190946
GemmTunableOp_Half_TN,tn_8_3120_6144,Gemm_Hipblaslt_TN_73691,0.0219753
GemmTunableOp_Half_TN,tn_8_3049_6144,Default,0.019617
GemmTunableOp_Half_TN,tn_4096_2512_6144,Gemm_Hipblaslt_TN_73548,0.519498
GemmTunableOp_Half_TN,tn_6144_104_3072,Gemm_Rocblas_621288851,0.036286
GemmTunableOp_Half_TN,tn_4096_3470_6144,Gemm_Hipblaslt_TN_73548,0.704215
GemmTunableOp_Half_TN,tn_4096_2610_6144,Gemm_Hipblaslt_TN_73548,0.529829
GemmTunableOp_Half_TN,tn_6144_2570_3072,Gemm_Rocblas_621289125,0.417105
GemmTunableOp_Half_TN,tn_6144_128_3072,Gemm_Rocblas_621288856,0.0350068
GemmTunableOp_Half_TN,tn_6144_2970_3072,Gemm_Hipblaslt_TN_73548,0.466126
GemmTunableOp_Half_TN,tn_6144_3090_3072,Gemm_Rocblas_621282921,0.49906
GemmTunableOp_Half_TN,tn_8_2440_6144,Gemm_Hipblaslt_TN_74222,0.0159932
GemmTunableOp_Half_TN,tn_8_2529_6144,Gemm_Hipblaslt_TN_71643,0.0165416
GemmTunableOp_Half_TN,tn_8_63633_6144,Gemm_Hipblaslt_TN_74273,0.2751
GemmTunableOp_Half_TN,tn_4096_2349_6144,Gemm_Hipblaslt_TN_73548,0.515826
GemmTunableOp_Half_TN,tn_4096_2219_6144,Gemm_Rocblas_621288952,0.457409
GemmTunableOp_Half_TN,tn_16384_119_6144,Gemm_Hipblaslt_TN_107363,0.133566
GemmTunableOp_Half_TN,tn_16384_110_6144,Gemm_Hipblaslt_TN_107363,0.133803
GemmTunableOp_Half_TN,tn_16384_63_6144,Gemm_Rocblas_621282641,0.0838448
GemmTunableOp_Half_TN,tn_4096_2911_6144,Gemm_Hipblaslt_TN_107367,0.60257
GemmTunableOp_Half_TN,tn_4096_2749_6144,Gemm_Rocblas_621283009,0.586247
GemmTunableOp_Half_TN,tn_4096_216_6144,Gemm_Hipblaslt_TN_72774,0.0645743
GemmTunableOp_Half_TN,tn_4096_3130_6144,Gemm_Hipblaslt_TN_87509,0.604469
GemmTunableOp_Half_TN,tn_16384_70_6144,Gemm_Hipblaslt_TN_74093,0.113858
GemmTunableOp_Half_TN,tn_4096_3030_6144,Gemm_Hipblaslt_TN_87509,0.611099
GemmTunableOp_Half_TN,tn_4096_88_6144,Gemm_Hipblaslt_TN_72614,0.0402904
GemmTunableOp_Half_TN,tn_16384_58_6144,Gemm_Rocblas_621288850,0.0839105
GemmTunableOp_Half_TN,tn_16384_23_6144,Gemm_Rocblas_621288838,0.0698286
GemmTunableOp_Half_TN,tn_16384_86_6144,Gemm_Hipblaslt_TN_74124,0.115512
GemmTunableOp_Half_TN,tn_8_2651_6144,Gemm_Hipblaslt_TN_72723,0.018182
GemmTunableOp_Half_TN,tn_4096_63488_6144,Gemm_Rocblas_621282901,12.1573
GemmTunableOp_Half_TN,tn_8_2402_6144,Gemm_Hipblaslt_TN_74222,0.0159547
GemmTunableOp_Half_TN,tn_4096_5818_6144,Gemm_Hipblaslt_TN_107367,1.19841
GemmTunableOp_Half_TN,tn_16384_78_6144,Gemm_Hipblaslt_TN_87382,0.114353
GemmTunableOp_Half_TN,tn_8_3241_6144,Gemm_Hipblaslt_TN_73691,0.0219909
GemmTunableOp_Half_TN,tn_4096_11506_6144,Gemm_Hipblaslt_TN_73548,2.16605
GemmTunableOp_Half_TN,tn_6144_136_3072,Gemm_Hipblaslt_TN_72127,0.0432456
GemmTunableOp_Half_TN,tn_8_2959_6144,Gemm_Hipblaslt_TN_74224,0.0182662
GemmTunableOp_Half_TN,tn_6144_16_3072,Gemm_Rocblas_621282487,0.018682
GemmTunableOp_Half_TN,tn_6144_160_3072,Gemm_Hipblaslt_TN_72127,0.0430773
GemmTunableOp_Half_TN,tn_6144_6907_3072,Gemm_Hipblaslt_TN_107367,1.05599
GemmTunableOp_Half_TN,tn_6144_2859_3072,Gemm_Hipblaslt_TN_73548,0.460719
GemmTunableOp_Half_TN,tn_6144_2260_3072,Gemm_Rocblas_621282738,0.366361
GemmTunableOp_Half_TN,tn_6144_2399_3072,Gemm_Rocblas_621288952,0.394847
GemmTunableOp_Half_TN,tn_8_2880_6144,Gemm_Hipblaslt_TN_74224,0.0182437
GemmTunableOp_Half_TN,tn_6144_2471_3072,Gemm_Hipblaslt_TN_72928,0.400964
GemmTunableOp_Half_TN,tn_16384_95_6144,Gemm_Hipblaslt_TN_87383,0.1159
GemmTunableOp_Half_TN,tn_6144_2666_3072,Gemm_Rocblas_621289125,0.420108
GemmTunableOp_Half_TN,tn_6144_3169_3072,Gemm_Hipblaslt_TN_107367,0.5203
GemmTunableOp_Half_TN,tn_16384_32_6144,Gemm_Rocblas_621282499,0.0695786
GemmTunableOp_Half_TN,tn_6144_48_3072,Gemm_Hipblaslt_TN_74349,0.0255651
GemmTunableOp_Half_TN,tn_6144_3329_3072,Gemm_Hipblaslt_TN_107367,0.522512
GemmTunableOp_Half_TN,tn_6144_5249_3072,Gemm_Hipblaslt_TN_107367,0.824663
GemmTunableOp_Half_TN,tn_6144_6286_3072,Gemm_Hipblaslt_TN_9238,1.00036
GemmTunableOp_Half_TN,tn_8_2589_6144,Gemm_Hipblaslt_TN_74224,0.0181416
GemmTunableOp_Half_TN,tn_6144_6517_3072,Gemm_Hipblaslt_TN_74192,1.01652
GemmTunableOp_Half_TN,tn_4096_2419_6144,Gemm_Hipblaslt_TN_73548,0.51755
GemmTunableOp_Half_TN,tn_6144_19283_3072,Gemm_Rocblas_621282559,2.93362
GemmTunableOp_Half_TN,tn_6144_8_3072,Gemm_Rocblas_621288680,0.017485
GemmTunableOp_Half_TN,tn_4096_3230_6144,Gemm_Hipblaslt_TN_73548,0.676949
GemmTunableOp_Half_TN,tn_16384_103_6144,Gemm_Hipblaslt_TN_107363,0.132466
GemmTunableOp_Half_TN,tn_6144_80_3072,Gemm_Rocblas_621289097,0.0303258
GemmTunableOp_Half_TN,tn_6144_8192_3072,Gemm_Hipblaslt_TN_107367,1.24575
GemmTunableOp_Half_TN,tn_8_2719_6144,Gemm_Hipblaslt_TN_74200,0.0191595
GemmTunableOp_Half_TN,tn_8_96_6144,Gemm_Rocblas_621288655,0.0127111
GemmTunableOp_Half_TN,tn_8_64_6144,Gemm_Rocblas_621282488,0.0126854
GemmTunableOp_Half_TN,tn_8_6144_6144,Default,0.0306095
GemmTunableOp_Half_TN,tn_8_4298_6144,Gemm_Hipblaslt_TN_73691,0.0221528
GemmTunableOp_Half_TN,tn_8_3419_6144,Gemm_Hipblaslt_TN_87742,0.019742
GemmTunableOp_Half_TN,tn_8_3051_6144,Default,0.0195745
GemmTunableOp_Half_TN,tn_8_2649_6144,Gemm_Hipblaslt_TN_74224,0.0181764
GemmTunableOp_Half_TN,tn_8_2553_6144,Gemm_Hipblaslt_TN_72573,0.0159647
GemmTunableOp_Half_TN,tn_8_248_6144,Gemm_Hipblaslt_TN_71563,0.0135066
GemmTunableOp_Half_TN,tn_8_2409_6144,Gemm_Hipblaslt_TN_72573,0.0156879
GemmTunableOp_Half_TN,tn_8_3190_6144,Gemm_Hipblaslt_TN_73691,0.0219825
GemmTunableOp_Half_TN,tn_8_2369_6144,Default,0.0173031
GemmTunableOp_Half_TN,tn_4096_3329_6144,Gemm_Hipblaslt_TN_74725,0.699286
GemmTunableOp_Half_TN,tn_4096_2651_6144,Gemm_Hipblaslt_TN_73548,0.528349
GemmTunableOp_Half_TN,tn_6144_2419_3072,Gemm_Rocblas_621282746,0.396422
GemmTunableOp_Half_TN,tn_8_2059_6144,Gemm_Hipblaslt_TN_72573,0.0152092
GemmTunableOp_Half_TN,tn_4096_49152_6144,Gemm_Rocblas_621296659,9.89495
GemmTunableOp_Half_TN,tn_16384_109_6144,Gemm_Hipblaslt_TN_107363,0.133097
GemmTunableOp_Half_TN,tn_8_65296_6144,Gemm_Hipblaslt_TN_74273,0.280483
GemmTunableOp_Half_TN,tn_4096_2449_6144,Gemm_Hipblaslt_TN_74192,0.51944
GemmTunableOp_Half_TN,tn_6144_2929_3072,Gemm_Hipblaslt_TN_9238,0.482599
GemmTunableOp_Half_TN,tn_4096_2960_6144,Gemm_Hipblaslt_TN_72932,0.60651
GemmTunableOp_Half_TN,tn_6144_3130_3072,Gemm_Rocblas_621282921,0.501361
GemmTunableOp_Half_TN,tn_4096_232_6144,Gemm_Hipblaslt_TN_73368,0.0728211
GemmTunableOp_Half_TN,tn_8_176_6144,Gemm_Hipblaslt_TN_74177,0.0134277
GemmTunableOp_Half_TN,tn_4096_2180_6144,Gemm_Rocblas_621282746,0.455897
GemmTunableOp_Half_TN,tn_4096_144_6144,Gemm_Hipblaslt_TN_72881,0.0510128
GemmTunableOp_Half_TN,tn_4096_2553_6144,Gemm_Hipblaslt_TN_73548,0.526139
GemmTunableOp_Half_TN,tn_16384_84_6144,Gemm_Hipblaslt_TN_87382,0.114556
GemmTunableOp_Half_TN,tn_4096_30720_6144,Gemm_Rocblas_621282440,6.181
GemmTunableOp_Half_TN,tn_6144_2279_3072,Gemm_Rocblas_621282738,0.365663
GemmTunableOp_Half_TN,tn_4096_2059_6144,Gemm_Rocblas_621288952,0.445838
GemmTunableOp_Half_TN,tn_8_2749_6144,Default,0.0194455
GemmTunableOp_Half_TN,tn_16384_118_6144,Gemm_Hipblaslt_TN_107363,0.133601
GemmTunableOp_Half_TN,tn_8_3130_6144,Default,0.0191154
GemmTunableOp_Half_TN,tn_16384_105_6144,Gemm_Hipblaslt_TN_107363,0.132754
GemmTunableOp_Half_TN,tn_16384_31_6144,Gemm_Rocblas_621282629,0.0699059
GemmTunableOp_Half_TN,tn_16384_56_6144,Gemm_Rocblas_621288850,0.0836821
GemmTunableOp_Half_TN,tn_8_2159_6144,Default,0.0173087
GemmTunableOp_Half_TN,tn_4096_2849_6144,Gemm_Hipblaslt_TN_107367,0.600836
GemmTunableOp_Half_TN,tn_4096_184_6144,Gemm_Hipblaslt_TN_72889,0.0558929
GemmTunableOp_Half_TN,tn_16384_60_6144,Gemm_Rocblas_621288872,0.0840851
GemmTunableOp_Half_TN,tn_8_136_6144,Gemm_Hipblaslt_TN_71563,0.013338
GemmTunableOp_Half_TN,tn_4096_65536_6144,Gemm_Rocblas_621296659,13.1446
GemmTunableOp_Half_TN,tn_16384_76_6144,Gemm_Hipblaslt_TN_74093,0.113965
GemmTunableOp_Half_TN,tn_6144_2512_3072,Gemm_Rocblas_621288952,0.412124
GemmTunableOp_Half_TN,tn_16384_93_6144,Gemm_Hipblaslt_TN_87383,0.115742
GemmTunableOp_Half_TN,tn_4096_104_6144,Gemm_Rocblas_621282641,0.0440888
GemmTunableOp_Half_TN,tn_6144_224_3072,Gemm_Hipblaslt_TN_74158,0.0537245
GemmTunableOp_Half_TN,tn_6144_2120_3072,Gemm_Hipblaslt_TN_73548,0.362802
GemmTunableOp_Half_TN,tn_6144_2779_3072,Gemm_Hipblaslt_TN_74192,0.474285
GemmTunableOp_Half_TN,tn_8_2930_6144,Default,0.019514
GemmTunableOp_Half_TN,tn_6144_96_3072,Gemm_Rocblas_621282893,0.029781
GemmTunableOp_Half_TN,tn_6144_24_3072,Gemm_Rocblas_621282498,0.0208104
GemmTunableOp_Half_TN,tn_16384_68_6144,Gemm_Hipblaslt_TN_74093,0.113758
GemmTunableOp_Half_TN,tn_8_16_6144,Gemm_Rocblas_621282452,0.0103868
GemmTunableOp_Half_TN,tn_6144_240_3072,Gemm_Rocblas_621289019,0.0560211
GemmTunableOp_Half_TN,tn_6144_3049_3072,Gemm_Hipblaslt_TN_73548,0.485754
GemmTunableOp_Half_TN,tn_6144_2619_3072,Gemm_Hipblaslt_TN_107347,0.430427
GemmTunableOp_Half_TN,tn_8_224_6144,Gemm_Hipblaslt_TN_74177,0.0135747
GemmTunableOp_Half_TN,tn_6144_3230_3072,Gemm_Hipblaslt_TN_107367,0.521151
GemmTunableOp_Half_TN,tn_6144_3470_3072,Gemm_Hipblaslt_TN_9240,0.530687
GemmTunableOp_Half_TN,tn_6144_59392_3072,Gemm_Rocblas_621282559,9.00287
GemmTunableOp_Half_TN,tn_6144_72_3072,Gemm_Rocblas_621289097,0.0303359
GemmTunableOp_Half_TN,tn_4096_120_6144,Gemm_Rocblas_621288850,0.0443716
GemmTunableOp_Half_TN,tn_8_2_6144,Gemm_Rocblas_621288644,0.0103323
GemmTunableOp_Half_TN,tn_6144_7417_3072,Gemm_Rocblas_621282559,1.17387
GemmTunableOp_Half_TN,tn_8_104_6144,Gemm_Rocblas_621282458,0.0127479
GemmTunableOp_Half_TN,tn_8_2859_6144,Gemm_Hipblaslt_TN_74200,0.0192176
GemmTunableOp_Half_TN,tn_4096_2369_6144,Gemm_Hipblaslt_TN_74192,0.516134
GemmTunableOp_Half_TN,tn_8_11506_6144,Gemm_Hipblaslt_TN_73447,0.0414004
GemmTunableOp_Half_TN,tn_16384_15_6144,Gemm_Rocblas_621282455,0.0559081
GemmTunableOp_Half_TN,tn_8_2089_6144,Default,0.0177899
GemmTunableOp_Half_TN,tn_8_2279_6144,Default,0.0172218
GemmTunableOp_Half_TN,tn_8_2349_6144,Gemm_Hipblaslt_TN_87732,0.0156238
GemmTunableOp_Half_TN,tn_8_2180_6144,Gemm_Hipblaslt_TN_74222,0.0158169
GemmTunableOp_Half_TN,tn_8_64257_6144,Gemm_Hipblaslt_TN_74273,0.260549
GemmTunableOp_Half_TN,tn_8_5900_6144,Gemm_Hipblaslt_TN_74271,0.0254894
GemmTunableOp_Half_TN,tn_8_48_6144,Gemm_Rocblas_621282488,0.0126622
GemmTunableOp_Half_TN,tn_8_3511_6144,Gemm_Hipblaslt_TN_72723,0.0183475
GemmTunableOp_Half_TN,tn_8_3279_6144,Gemm_Hipblaslt_TN_74224,0.0182381
GemmTunableOp_Half_TN,tn_8_2960_6144,Default,0.0199014
GemmTunableOp_Half_TN,tn_8_2849_6144,Default,0.0199795
GemmTunableOp_Half_TN,tn_6144_65536_3072,Gemm_Rocblas_621282462,9.80729
GemmTunableOp_Half_TN,tn_6144_49152_3072,Gemm_Rocblas_621282440,7.3518
GemmTunableOp_Half_TN,tn_6144_3241_3072,Gemm_Hipblaslt_TN_107367,0.517246
GemmTunableOp_Half_TN,tn_6144_3149_3072,Gemm_Hipblaslt_TN_88152,0.512697
GemmTunableOp_Half_TN,tn_8_8_6144,Gemm_Rocblas_621282452,0.0101981
GemmTunableOp_Half_TN,tn_6144_2780_3072,Gemm_Hipblaslt_TN_72938,0.465803
GemmTunableOp_Half_TN,tn_6144_2625_3072,Gemm_Rocblas_621289125,0.424052
GemmTunableOp_Half_TN,tn_6144_2361_3072,Gemm_Rocblas_621282746,0.388275
GemmTunableOp_Half_TN,tn_6144_232_3072,Gemm_Rocblas_621282814,0.0562527
GemmTunableOp_Half_TN,tn_4096_152_6144,Gemm_Hipblaslt_TN_72881,0.0504355
GemmTunableOp_Half_TN,tn_4096_112_6144,Gemm_Rocblas_621288850,0.0443456
GemmTunableOp_Half_TN,tn_4096_2666_6144,Gemm_Hipblaslt_TN_74192,0.524357
GemmTunableOp_Half_TN,tn_8_6297_6144,Default,0.0255479
GemmTunableOp_Half_TN,tn_16384_87_6144,Gemm_Hipblaslt_TN_87383,0.114723
GemmTunableOp_Half_TN,tn_6144_168_3072,Gemm_Rocblas_621282641,0.0471198
GemmTunableOp_Half_TN,tn_6144_3051_3072,Gemm_Hipblaslt_TN_74192,0.473605
GemmTunableOp_Half_TN,tn_16384_71_6144,Gemm_Hipblaslt_TN_74093,0.11393
GemmTunableOp_Half_TN,tn_6144_2440_3072,Gemm_Rocblas_621288952,0.39303
GemmTunableOp_Half_TN,tn_4096_2260_6144,Gemm_Rocblas_621283091,0.49959
GemmTunableOp_Half_TN,tn_8_2549_6144,Gemm_Rocblas_621288873,0.0179533
GemmTunableOp_Half_TN,tn_16384_64_6144,Gemm_Rocblas_621288850,0.0832903
GemmTunableOp_Half_TN,tn_16384_124_6144,Gemm_Hipblaslt_TN_107363,0.132818
GemmTunableOp_Half_TN,tn_6144_2180_3072,Gemm_Rocblas_621282738,0.360868
GemmTunableOp_Half_TN,tn_16384_108_6144,Gemm_Hipblaslt_TN_107363,0.132538
GemmTunableOp_Half_TN,tn_16384_94_6144,Gemm_Hipblaslt_TN_87382,0.11564
GemmTunableOp_Half_TN,tn_16384_107_6144,Gemm_Hipblaslt_TN_107363,0.131918
GemmTunableOp_Half_TN,tn_4096_65296_6144,Gemm_Rocblas_621289105,12.4043
GemmTunableOp_Half_TN,tn_8_2625_6144,Gemm_Hipblaslt_TN_87742,0.0195785
GemmTunableOp_Half_TN,tn_6144_40_3072,Gemm_Hipblaslt_TN_74349,0.0258127
GemmTunableOp_Half_TN,tn_4096_2570_6144,Gemm_Hipblaslt_TN_73548,0.520435
GemmTunableOp_Half_TN,tn_4096_2471_6144,Gemm_Hipblaslt_TN_73548,0.513033
GemmTunableOp_Half_TN,tn_4096_2859_6144,Gemm_Hipblaslt_TN_107367,0.592263
GemmTunableOp_Half_TN,tn_4096_2970_6144,Gemm_Rocblas_621282746,0.599341
GemmTunableOp_Half_TN,tn_4096_48_6144,Gemm_Hipblaslt_TN_87799,0.0303026
GemmTunableOp_Half_TN,tn_8_3160_6144,Gemm_Hipblaslt_TN_74245,0.0190217
GemmTunableOp_Half_TN,tn_6144_2539_3072,Gemm_Rocblas_621288952,0.405728
GemmTunableOp_Half_TN,tn_16384_79_6144,Gemm_Hipblaslt_TN_87383,0.114221
GemmTunableOp_Half_TN,tn_4096_3090_6144,Gemm_Hipblaslt_TN_87516,0.598729
GemmTunableOp_Half_TN,tn_8_3090_6144,Gemm_Hipblaslt_TN_72723,0.0182333
GemmTunableOp_Half_TN,tn_4096_19283_6144,Gemm_Hipblaslt_TN_88152,3.90154
GemmTunableOp_Half_TN,tn_16384_116_6144,Gemm_Hipblaslt_TN_107363,0.133412
GemmTunableOp_Half_TN,tn_4096_3169_6144,Gemm_Hipblaslt_TN_74387,0.666292
GemmTunableOp_Half_TN,tn_4096_2399_6144,Gemm_Hipblaslt_TN_74469,0.512213
GemmTunableOp_Half_TN,tn_6144_2048_3072,Gemm_Rocblas_621289036,0.319429
GemmTunableOp_Half_TN,tn_4096_3280_6144,Gemm_Hipblaslt_TN_73548,0.682198
GemmTunableOp_Half_TN,tn_8_2470_6144,Gemm_Rocblas_621288873,0.0179689
GemmTunableOp_Half_TN,tn_4096_5408_6144,Gemm_Rocblas_621283009,1.13311
GemmTunableOp_Half_TN,tn_6144_2930_3072,Gemm_Hipblaslt_TN_73548,0.473072
GemmTunableOp_Half_TN,tn_4096_6297_6144,Gemm_Hipblaslt_TN_73548,1.21812
GemmTunableOp_Half_TN,tn_8_64542_6144,Gemm_Hipblaslt_TN_74273,0.276187
GemmTunableOp_Half_TN,tn_8_5818_6144,Gemm_Hipblaslt_TN_73325,0.0303166
GemmTunableOp_Half_TN,tn_8_2970_6144,Default,0.0194828
GemmTunableOp_Half_TN,tn_8_2779_6144,Gemm_Hipblaslt_TN_73691,0.021906
GemmTunableOp_Half_TN,tn_8_2610_6144,Gemm_Hipblaslt_TN_72723,0.0180911
GemmTunableOp_Half_TN,tn_8_2449_6144,Gemm_Hipblaslt_TN_72573,0.015923
GemmTunableOp_Half_TN,tn_6144_6297_3072,Gemm_Hipblaslt_TN_74192,1.02755
GemmTunableOp_Half_TN,tn_6144_5408_3072,Gemm_Rocblas_621282462,0.854954
GemmTunableOp_Half_TN,tn_6144_3370_3072,Gemm_Hipblaslt_TN_9240,0.53272
GemmTunableOp_Half_TN,tn_6144_3190_3072,Gemm_Hipblaslt_TN_88152,0.522975
GemmTunableOp_Half_TN,tn_6144_3099_3072,Gemm_Rocblas_621289125,0.504235
GemmTunableOp_Half_TN,tn_6144_2707_3072,Gemm_Rocblas_621289068,0.476016
GemmTunableOp_Half_TN,tn_6144_2589_3072,Gemm_Rocblas_621282921,0.42958
GemmTunableOp_Half_TN,tn_8_30720_6144,Gemm_Hipblaslt_TN_74273,0.148827
GemmTunableOp_Half_TN,tn_6144_256_3072,Gemm_Rocblas_621288890,0.057045
GemmTunableOp_Half_TN,tn_6144_2470_3072,Gemm_Rocblas_621282748,0.418239
GemmTunableOp_Half_TN,tn_6144_2259_3072,Gemm_Rocblas_621282738,0.366184
GemmTunableOp_Half_TN,tn_6144_144_3072,Gemm_Hipblaslt_TN_72127,0.0439635
GemmTunableOp_Half_TN,tn_6144_120_3072,Gemm_Rocblas_621282642,0.0366801
GemmTunableOp_Half_TN,tn_6144_112_3072,Gemm_Rocblas_621288851,0.0363641
GemmTunableOp_Half_TN,tn_4096_168_6144,Gemm_Hipblaslt_TN_72890,0.0557711
GemmTunableOp_Half_TN,tn_4096_2959_6144,Gemm_Hipblaslt_TN_107365,0.606962
GemmTunableOp_Half_TN,tn_16384_90_6144,Gemm_Hipblaslt_TN_87383,0.115299
GemmTunableOp_Half_TN,tn_16384_73_6144,Gemm_Hipblaslt_TN_74093,0.113623
GemmTunableOp_Half_TN,tn_6144_176_3072,Gemm_Rocblas_621288872,0.0477295
GemmTunableOp_Half_TN,tn_16384_98_6144,Gemm_Hipblaslt_TN_107363,0.131122
GemmTunableOp_Half_TN,tn_16384_82_6144,Gemm_Hipblaslt_TN_87383,0.114032
GemmTunableOp_Half_TN,tn_4096_3279_6144,Gemm_Hipblaslt_TN_74492,0.691177
GemmTunableOp_Half_TN,tn_4096_16_6144,Gemm_Rocblas_621282482,0.0193065
GemmTunableOp_Half_TN,tn_8_2539_6144,Gemm_Hipblaslt_TN_72573,0.016149
GemmTunableOp_Half_TN,tn_16384_65_6144,Gemm_Hipblaslt_TN_74093,0.113336
GemmTunableOp_Half_TN,tn_16384_54_6144,Gemm_Rocblas_621282641,0.0842045
GemmTunableOp_Half_TN,tn_6144_65296_3072,Gemm_Rocblas_621282559,9.61601
GemmTunableOp_Half_TN,tn_16384_121_6144,Gemm_Hipblaslt_TN_107363,0.133473
GemmTunableOp_Half_TN,tn_16384_112_6144,Gemm_Hipblaslt_TN_107363,0.133335
GemmTunableOp_Half_TN,tn_6144_2979_3072,Gemm_Hipblaslt_TN_107361,0.481871
GemmTunableOp_Half_TN,tn_16384_24_6144,Gemm_Rocblas_621282629,0.0696126
GemmTunableOp_Half_TN,tn_16384_59_6144,Gemm_Rocblas_621282641,0.0838956
GemmTunableOp_Half_TN,tn_16384_104_6144,Gemm_Hipblaslt_TN_107363,0.132506
GemmTunableOp_Half_TN,tn_4096_2048_6144,Gemm_Rocblas_621282723,0.40494
GemmTunableOp_Half_TN,tn_6144_200_3072,Gemm_Hipblaslt_TN_74158,0.0534533
GemmTunableOp_Half_TN,tn_4096_2289_6144,Gemm_Rocblas_621283091,0.505714
GemmTunableOp_Half_TN,tn_4096_64257_6144,Gemm_Rocblas_621289105,12.3564
GemmTunableOp_Half_TN,tn_6144_2159_3072,Gemm_Rocblas_621282738,0.361218
GemmTunableOp_Half_TN,tn_4096_2829_6144,Gemm_Rocblas_621282746,0.598938
GemmTunableOp_Half_TN,tn_4096_2402_6144,Gemm_Hipblaslt_TN_73548,0.515203
GemmTunableOp_Half_TN,tn_4096_2539_6144,Gemm_Hipblaslt_TN_74192,0.524283
GemmTunableOp_Half_TN,tn_8_80_6144,Gemm_Rocblas_621288655,0.0127279
GemmTunableOp_Half_TN,tn_6144_2880_3072,Gemm_Hipblaslt_TN_74192,0.473932
GemmTunableOp_Half_TN,tn_4096_2169_6144,Gemm_Rocblas_621282746,0.454713
GemmTunableOp_Half_TN,tn_4096_6144_6144,Gemm_Rocblas_621296657,1.20874
GemmTunableOp_Half_TN,tn_8_240_6144,Gemm_Hipblaslt_TN_87611,0.0143327
GemmTunableOp_Half_TN,tn_4096_64_6144,Gemm_Rocblas_621288821,0.0314139
GemmTunableOp_Half_TN,tn_6144_2369_3072,Gemm_Rocblas_621282746,0.39647
GemmTunableOp_Half_TN,tn_4096_3069_6144,Gemm_Hipblaslt_TN_87509,0.610808
GemmTunableOp_Half_TN,tn_4096_248_6144,Gemm_Hipblaslt_TN_73138,0.0737769
GemmTunableOp_Half_TN,tn_4096_2649_6144,Gemm_Hipblaslt_TN_73828,0.527999
GemmTunableOp_Half_TN,tn_4096_3160_6144,Gemm_Hipblaslt_TN_73548,0.672505
GemmTunableOp_Half_TN,tn_4096_4096_6144,Gemm_Hipblaslt_TN_73656,0.815688
GemmTunableOp_Half_TN,tn_8_88_6144,Gemm_Rocblas_621288655,0.0127034
GemmTunableOp_Half_TN,tn_8_72_6144,Gemm_Rocblas_621288655,0.0127896
GemmTunableOp_Half_TN,tn_8_63488_6144,Gemm_Hipblaslt_TN_74273,0.274165
GemmTunableOp_Half_TN,tn_8_5408_6144,Default,0.0306471
GemmTunableOp_Half_TN,tn_8_3370_6144,Gemm_Hipblaslt_TN_74224,0.0182622
GemmTunableOp_Half_TN,tn_8_3230_6144,Gemm_Hipblaslt_TN_72723,0.0181905
GemmTunableOp_Half_TN,tn_8_3099_6144,Default,0.0191218
GemmTunableOp_Half_TN,tn_8_2889_6144,Default,0.019498
GemmTunableOp_Half_TN,tn_8_2780_6144,Gemm_Hipblaslt_TN_74224,0.0180699
GemmTunableOp_Half_TN,tn_8_2666_6144,Default,0.0193257
GemmTunableOp_Half_TN,tn_8_2509_6144,Gemm_Hipblaslt_TN_74222,0.0161085
GemmTunableOp_Half_TN,tn_8_2419_6144,Gemm_Hipblaslt_TN_74199,0.0158918
GemmTunableOp_Half_TN,tn_6144_2959_3072,Gemm_Hipblaslt_TN_72938,0.458312
GemmTunableOp_Half_TN,tn_16384_92_6144,Gemm_Hipblaslt_TN_87382,0.115706
GemmTunableOp_Half_TN,tn_6144_2549_3072,Gemm_Rocblas_621282746,0.392633
GemmTunableOp_Half_TN,tn_4096_5249_6144,Gemm_Hipblaslt_TN_87509,0.978317
GemmTunableOp_Half_TN,tn_8_3000_6144,Gemm_Hipblaslt_TN_74224,0.0181256
GemmTunableOp_Half_TN,tn_4096_3370_6144,Gemm_Hipblaslt_TN_74192,0.689368
GemmTunableOp_Half_TN,tn_6144_3160_3072,Gemm_Hipblaslt_TN_107367,0.51276
GemmTunableOp_Half_TN,tn_4096_3190_6144,Gemm_Hipblaslt_TN_74492,0.672038
GemmTunableOp_Half_TN,tn_4096_2589_6144,Gemm_Hipblaslt_TN_74192,0.518784
GemmTunableOp_Half_TN,tn_6144_248_3072,Gemm_Rocblas_621282814,0.056344
GemmTunableOp_Half_TN,tn_6144_6185_3072,Gemm_Hipblaslt_TN_107347,0.951132
GemmTunableOp_Half_TN,tn_4096_6286_6144,Gemm_Hipblaslt_TN_74192,1.21313
GemmTunableOp_Half_TN,tn_16384_85_6144,Gemm_Hipblaslt_TN_87383,0.114424
GemmTunableOp_Half_TN,tn_8_256_6144,Gemm_Hipblaslt_TN_74177,0.0137827
GemmTunableOp_Half_TN,tn_4096_2707_6144,Gemm_Rocblas_621289214,0.576985
GemmTunableOp_Half_TN,tn_6144_64257_3072,Gemm_Hipblaslt_TN_88152,9.23209
GemmTunableOp_Half_TN,tn_4096_8_6144,Gemm_Rocblas_621282482,0.0193025
GemmTunableOp_Half_TN,tn_4096_256_6144,Gemm_Hipblaslt_TN_73138,0.0724962
GemmTunableOp_Half_TN,tn_4096_2979_6144,Gemm_Rocblas_621282746,0.598532
GemmTunableOp_Half_TN,tn_4096_2470_6144,Gemm_Hipblaslt_TN_73548,0.512561
GemmTunableOp_Half_TN,tn_4096_8192_6144,Gemm_Hipblaslt_TN_74192,1.56441
GemmTunableOp_Half_TN,tn_8_168_6144,Gemm_Hipblaslt_TN_74154,0.0140438
GemmTunableOp_Half_TN,tn_4096_2389_6144,Gemm_Hipblaslt_TN_73548,0.510732
GemmTunableOp_Half_TN,tn_4096_2259_6144,Gemm_Rocblas_621283046,0.502828
GemmTunableOp_Half_TN,tn_8_4_6144,Gemm_Rocblas_621282452,0.0103002
GemmTunableOp_Half_TN,tn_4096_2159_6144,Gemm_Hipblaslt_TN_72928,0.447587
GemmTunableOp_Half_TN,tn_16384_120_6144,Gemm_Hipblaslt_TN_73951,0.13427
GemmTunableOp_Half_TN,tn_16384_113_6144,Gemm_Hipblaslt_TN_107363,0.133273
GemmTunableOp_Half_TN,tn_16384_57_6144,Gemm_Rocblas_621288850,0.0836637
GemmTunableOp_Half_TN,tn_16384_18_6144,Gemm_Rocblas_621282629,0.0700036
GemmTunableOp_Half_TN,tn_4096_6907_6144,Gemm_Hipblaslt_TN_74192,1.37115
GemmTunableOp_Half_TN,tn_8_2320_6144,Gemm_Hipblaslt_TN_74199,0.0157544
GemmTunableOp_Half_TN,tn_16384_5_6144,Gemm_Rocblas_621282565,0.0546767
GemmTunableOp_Half_TN,tn_16384_77_6144,Gemm_Hipblaslt_TN_74093,0.113875
GemmTunableOp_Half_TN,tn_6144_2649_3072,Gemm_Rocblas_621282921,0.412135
GemmTunableOp_Half_TN,tn_16384_69_6144,Gemm_Hipblaslt_TN_74093,0.113842
GemmTunableOp_Half_TN,tn_16384_61_6144,Gemm_Rocblas_621282641,0.0836677
GemmTunableOp_Half_TN,tn_4096_2880_6144,Gemm_Rocblas_621282746,0.587866
GemmTunableOp_Half_TN,tn_6144_4298_3072,Gemm_Rocblas_621288952,0.715403
GemmTunableOp_Half_TN,tn_16384_100_6144,Gemm_Hipblaslt_TN_107363,0.131377
GemmTunableOp_Half_TN,tn_4096_3099_6144,Gemm_Hipblaslt_TN_107365,0.599213
GemmTunableOp_Half_TN,tn_4096_10240_6144,Gemm_Rocblas_621296657,2.00786
GemmTunableOp_Half_TN,tn_8_152_6144,Gemm_Hipblaslt_TN_74336,0.0149957
GemmTunableOp_Half_TN,tn_4096_6517_6144,Gemm_Rocblas_621288952,1.32005
GemmTunableOp_Half_TN,tn_4096_80_6144,Gemm_Hipblaslt_TN_87793,0.0380049
GemmTunableOp_Half_TN,tn_6144_152_3072,Gemm_Hipblaslt_TN_72127,0.0442896
GemmTunableOp_Half_TN,tn_6144_216_3072,Gemm_Hipblaslt_TN_74158,0.0540293
GemmTunableOp_Half_TN,tn_6144_3069_3072,Gemm_Hipblaslt_TN_73548,0.457618
GemmTunableOp_Half_TN,tn_8_2048_6144,Gemm_Hipblaslt_TN_74199,0.0153422
GemmTunableOp_Half_TN,tn_6144_192_3072,Gemm_Rocblas_621282641,0.047365
GemmTunableOp_Half_TN,tn_6144_208_3072,Gemm_Hipblaslt_TN_72508,0.0554603
GemmTunableOp_Half_TN,tn_8_2239_6144,Gemm_Hipblaslt_TN_74199,0.0156791
GemmTunableOp_Half_TN,tn_6144_2289_3072,Gemm_Rocblas_621282738,0.362207
GemmTunableOp_Half_TN,tn_8_192_6144,Gemm_Hipblaslt_TN_73966,0.0139465
GemmTunableOp_Half_TN,tn_8_3149_6144,Gemm_Hipblaslt_TN_74224,0.0181917
GemmTunableOp_Half_TN,tn_6144_2169_3072,Gemm_Rocblas_621288944,0.359402
GemmTunableOp_Half_TN,tn_6144_2402_3072,Gemm_Rocblas_621282746,0.391121
GemmTunableOp_Half_TN,tn_6144_2829_3072,Gemm_Hipblaslt_TN_73548,0.452993
GemmTunableOp_Half_TN,tn_6144_3280_3072,Gemm_Hipblaslt_TN_88152,0.519974
GemmTunableOp_Half_TN,tn_8_208_6144,Gemm_Hipblaslt_TN_87721,0.0137446
GemmTunableOp_Half_TN,tn_8_2169_6144,Gemm_Hipblaslt_TN_87709,0.0167924
GemmTunableOp_Half_TN,tn_8_2260_6144,Gemm_Hipblaslt_TN_72573,0.0157356
GemmTunableOp_Half_TN,tn_8_2389_6144,Gemm_Rocblas_621282666,0.0179233
GemmTunableOp_Half_TN,tn_8_59392_6144,Gemm_Hipblaslt_TN_74271,0.273609
GemmTunableOp_Half_TN,tn_8_3280_6144,Gemm_Hipblaslt_TN_72723,0.0183363
GemmTunableOp_Half_TN,tn_8_32_6144,Gemm_Rocblas_621288645,0.0102333
GemmTunableOp_Half_TN,tn_8_3069_6144,Gemm_Hipblaslt_TN_73691,0.0219757
GemmTunableOp_Half_TN,tn_8_2979_6144,Default,0.0194824
GemmTunableOp_Half_TN,tn_6144_8428_3072,Gemm_Hipblaslt_TN_107367,1.20345
GemmTunableOp_Half_TN,tn_6144_56_3072,Gemm_Rocblas_621282632,0.0258699
GemmTunableOp_Half_TN,tn_6144_3419_3072,Gemm_Hipblaslt_TN_9240,0.535318
GemmTunableOp_Half_TN,tn_8_5249_6144,Gemm_Hipblaslt_TN_74271,0.0253179
GemmTunableOp_Half_TN,tn_6144_3199_3072,Gemm_Hipblaslt_TN_107367,0.516503
GemmTunableOp_Half_TN,tn_6144_3110_3072,Gemm_Rocblas_621282921,0.494792
GemmTunableOp_Half_TN,tn_6144_2889_3072,Gemm_Hipblaslt_TN_9238,0.469084
GemmTunableOp_Half_TN,tn_8_8428_6144,Gemm_Hipblaslt_TN_87742,0.0348226
GemmTunableOp_Half_TN,tn_6144_2594_3072,Gemm_Rocblas_621282921,0.422304
GemmTunableOp_Half_TN,tn_6144_2320_3072,Gemm_Rocblas_621288952,0.389022
GemmTunableOp_Half_TN,tn_6144_2059_3072,Gemm_Rocblas_621282738,0.357372
GemmTunableOp_Half_TN,tn_6144_10240_3072,Gemm_Rocblas_621282440,1.53687
GemmTunableOp_Half_TN,tn_4096_96_6144,Gemm_Hipblaslt_TN_74593,0.0404149
GemmTunableOp_Half_TN,tn_4096_3511_6144,Gemm_Hipblaslt_TN_73548,0.696943
GemmTunableOp_Half_TN,tn_6144_5900_3072,Gemm_Rocblas_621289105,0.891305
GemmTunableOp_Half_TN,tn_4096_160_6144,Gemm_Hipblaslt_TN_74668,0.0496976
GemmTunableOp_Half_TN,tn_16384_97_6144,Gemm_Hipblaslt_TN_107363,0.131276
GemmTunableOp_Half_TN,tn_4096_7417_6144,Gemm_Rocblas_621282746,1.48454
GemmTunableOp_Half_TN,tn_4096_2929_6144,Gemm_Hipblaslt_TN_107365,0.598119
GemmTunableOp_Half_TN,tn_4096_200_6144,Gemm_Hipblaslt_TN_72774,0.0637995
GemmTunableOp_Half_TN,tn_4096_3120_6144,Gemm_Hipblaslt_TN_87509,0.601863
GemmTunableOp_Half_TN,tn_6144_3000_3072,Gemm_Hipblaslt_TN_72938,0.474148
GemmTunableOp_Half_TN,tn_16384_74_6144,Gemm_Hipblaslt_TN_87381,0.114273
GemmTunableOp_Half_TN,tn_4096_2619_6144,Gemm_Hipblaslt_TN_73548,0.522329
GemmTunableOp_Half_TN,tn_6144_2409_3072,Gemm_Rocblas_621282746,0.394707
GemmTunableOp_Half_TN,tn_4096_59392_6144,Gemm_Rocblas_621282901,11.2948
GemmTunableOp_Half_TN,tn_16384_89_6144,Gemm_Hipblaslt_TN_87383,0.115495
GemmTunableOp_Half_TN,tn_16384_81_6144,Gemm_Hipblaslt_TN_87383,0.114349
GemmTunableOp_Half_TN,tn_8_3470_6144,Gemm_Hipblaslt_TN_72723,0.0184328
GemmTunableOp_Half_TN,tn_16384_111_6144,Gemm_Hipblaslt_TN_107363,0.13301
GemmTunableOp_Half_TN,tn_16384_125_6144,Gemm_Hipblaslt_TN_107363,0.133393
GemmTunableOp_Half_TN,tn_4096_224_6144,Gemm_Hipblaslt_TN_85710,0.0645022
GemmTunableOp_Half_TN,tn_4096_24_6144,Gemm_Rocblas_621288715,0.0213071
GemmTunableOp_Half_TN,tn_16384_117_6144,Gemm_Hipblaslt_TN_107363,0.132598
GemmTunableOp_Half_TN,tn_8_2829_6144,Gemm_Hipblaslt_TN_87742,0.0198273
GemmTunableOp_Half_TN,tn_16384_106_6144,Gemm_Hipblaslt_TN_107363,0.131846
GemmTunableOp_Half_TN,tn_4096_208_6144,Gemm_Hipblaslt_TN_85710,0.0648784
GemmTunableOp_Half_TN,tn_6144_2509_3072,Gemm_Rocblas_621282746,0.405355
GemmTunableOp_Half_TN,tn_4096_2279_6144,Gemm_Rocblas_621283091,0.502692
GemmTunableOp_Half_TN,tn_4096_2779_6144,Gemm_Rocblas_621283009,0.58093
GemmTunableOp_Half_TN,tn_6144_63633_3072,Gemm_Rocblas_621282559,9.43293
GemmTunableOp_Half_TN,tn_6144_2210_3072,Gemm_Rocblas_621282738,0.362527
GemmTunableOp_Half_TN,tn_4096_72_6144,Gemm_Hipblaslt_TN_74370,0.0386599
GemmTunableOp_Half_TN,tn_4096_240_6144,Gemm_Hipblaslt_TN_73138,0.0728207
GemmTunableOp_Half_TN,tn_8_2594_6144,Gemm_Hipblaslt_TN_73758,0.0249939
GemmTunableOp_Half_TN,tn_4096_3049_6144,Gemm_Hipblaslt_TN_107365,0.606887
GemmTunableOp_Half_TN,tn_4096_2120_6144,Gemm_Rocblas_621282746,0.448009
GemmTunableOp_Half_TN,tn_4096_3239_6144,Gemm_Hipblaslt_TN_74387,0.676735
GemmTunableOp_Half_TN,tn_16384_66_6144,Gemm_Hipblaslt_TN_74093,0.1136
GemmTunableOp_Half_TN,tn_4096_2429_6144,Gemm_Hipblaslt_TN_73548,0.513303
GemmTunableOp_Half_TN,tn_6144_2719_3072,Gemm_Hipblaslt_TN_72938,0.463263
GemmTunableOp_Half_TN,tn_4096_2529_6144,Gemm_Hipblaslt_TN_73548,0.520029
GemmTunableOp_Half_TN,tn_4096_32_6144,Gemm_Rocblas_621288715,0.0211605
GemmTunableOp_Half_TN,tn_8_65536_6144,Gemm_Hipblaslt_TN_74273,0.284992
GemmTunableOp_Half_TN,tn_8_6517_6144,Default,0.0256741
GemmTunableOp_Half_TN,tn_8_3329_6144,Default,0.0206101
GemmTunableOp_Half_TN,tn_8_3239_6144,Default,0.019204
GemmTunableOp_Half_TN,tn_8_3110_6144,Gemm_Hipblaslt_TN_73691,0.0220298
GemmTunableOp_Half_TN,tn_8_2707_6144,Gemm_Hipblaslt_TN_72723,0.0180559
GemmTunableOp_Half_TN,tn_8_2570_6144,Gemm_Hipblaslt_TN_73691,0.0219761
GemmTunableOp_Half_TN,tn_8_2429_6144,Gemm_Hipblaslt_TN_74222,0.0162183
GemmTunableOp_Half_TN,tn_8_2361_6144,Gemm_Hipblaslt_TN_72573,0.0161077
GemmTunableOp_Half_TN,tn_8_2289_6144,Gemm_Hipblaslt_TN_74199,0.0153991
GemmTunableOp_Half_TN,tn_8_2259_6144,Gemm_Rocblas_621288873,0.0178932
GemmTunableOp_Half_TN,tn_8_2210_6144,Gemm_Hipblaslt_TN_72573,0.0152829
GemmTunableOp_Half_TN,tn_8_216_6144,Gemm_Hipblaslt_TN_74177,0.0140418
GemmTunableOp_Half_TN,tn_4096_2509_6144,Gemm_Hipblaslt_TN_73548,0.522222
GemmTunableOp_Half_TN,tn_4096_3000_6144,Gemm_Rocblas_621282746,0.604864
GemmTunableOp_Half_TN,tn_4096_136_6144,Gemm_Hipblaslt_TN_72881,0.0501367
GemmTunableOp_Half_TN,tn_16384_8_6144,Gemm_Rocblas_621288685,0.0554466
GemmTunableOp_Half_TN,tn_4096_2320_6144,Gemm_Hipblaslt_TN_73548,0.511391
GemmTunableOp_Half_TN,tn_8_144_6144,Gemm_Hipblaslt_TN_74177,0.0141244
GemmTunableOp_Half_TN,tn_4096_3419_6144,Gemm_Hipblaslt_TN_73548,0.693592
GemmTunableOp_Half_TN,tn_4096_8428_6144,Gemm_Hipblaslt_TN_107365,1.62999
GemmTunableOp_Half_TN,tn_8_24_6144,Gemm_Rocblas_621282452,0.0102241
GemmTunableOp_Half_TN,tn_6144_2610_3072,Gemm_Hipblaslt_TN_9240,0.432302
GemmTunableOp_Half_TN,tn_4096_2069_6144,Gemm_Rocblas_621282746,0.444602
GemmTunableOp_Half_TN,tn_16384_29_6144,Gemm_Rocblas_621282499,0.0706166
GemmTunableOp_Half_TN,tn_4096_3110_6144,Gemm_Hipblaslt_TN_107365,0.60435
GemmTunableOp_Half_TN,tn_4096_176_6144,Gemm_Hipblaslt_TN_72890,0.055963
GemmTunableOp_Half_TN,tn_16384_6_6144,Gemm_Rocblas_621288685,0.0549074
GemmTunableOp_Half_TN,tn_4096_2210_6144,Gemm_Rocblas_621288952,0.454561
GemmTunableOp_Half_TN,tn_8_3030_6144,Default,0.0194916
GemmTunableOp_Half_TN,tn_8_160_6144,Gemm_Hipblaslt_TN_74177,0.0140723
GemmTunableOp_Half_TN,tn_4096_2409_6144,Gemm_Hipblaslt_TN_74387,0.516754
GemmTunableOp_Half_TN,tn_6144_184_3072,Gemm_Rocblas_621282641,0.0479907
GemmTunableOp_Half_TN,tn_6144_2429_3072,Gemm_Rocblas_621282746,0.398288
GemmTunableOp_Half_TN,tn_16384_55_6144,Gemm_Rocblas_621288850,0.0840587
GemmTunableOp_Half_TN,tn_4096_56_6144,Gemm_Hipblaslt_TN_71772,0.0314583
GemmTunableOp_Half_TN,tn_8_10240_6144,Gemm_Hipblaslt_TN_73332,0.0361209
GemmTunableOp_Half_TN,tn_6144_2749_3072,Gemm_Hipblaslt_TN_107361,0.472843
GemmTunableOp_Half_TN,tn_16384_62_6144,Gemm_Rocblas_621282665,0.0841945
GemmTunableOp_Half_TN,tn_4096_2719_6144,Gemm_Rocblas_621282772,0.585608
GemmTunableOp_Half_TN,tn_16384_72_6144,Gemm_Hipblaslt_TN_74093,0.11399
GemmTunableOp_Half_TN,tn_8_6286_6144,Gemm_Hipblaslt_TN_74271,0.0254958
GemmTunableOp_Half_TN,tn_4096_2889_6144,Gemm_Rocblas_621282746,0.602884
GemmTunableOp_Half_TN,tn_16384_80_6144,Gemm_Hipblaslt_TN_73975,0.112914
GemmTunableOp_Half_TN,tn_6144_3239_3072,Gemm_Hipblaslt_TN_107367,0.519855
GemmTunableOp_Half_TN,tn_8_4096_6144,Gemm_Hipblaslt_TN_73691,0.0221956
GemmTunableOp_Half_TN,tn_16384_7_6144,Gemm_Rocblas_621288685,0.0552007
GemmTunableOp_Half_TN,tn_16384_96_6144,Gemm_Hipblaslt_TN_87383,0.113443
GemmTunableOp_Half_TN,tn_4096_63633_6144,Gemm_Rocblas_621289105,12.045
GemmTunableOp_Half_TN,tn_4096_5900_6144,Gemm_Rocblas_621288952,1.19252
GemmTunableOp_Half_TN,tn_6144_2069_3072,Gemm_Rocblas_621282738,0.358541
GemmTunableOp_Half_TN,tn_6144_3120_3072,Gemm_Rocblas_621289125,0.500065
GemmTunableOp_Half_TN,tn_6144_2911_3072,Gemm_Hipblaslt_TN_72805,0.480833
GemmTunableOp_Half_TN,tn_6144_5818_3072,Gemm_Hipblaslt_TN_9238,0.865729
GemmTunableOp_Half_TN,tn_6144_2219_3072,Gemm_Hipblaslt_TN_73548,0.365009
GemmTunableOp_Half_TN,tn_8_2911_6144,Gemm_Hipblaslt_TN_72723,0.0181019
GemmTunableOp_Half_TN,tn_4096_2594_6144,Gemm_Hipblaslt_TN_73548,0.527053
GemmTunableOp_Half_TN,tn_16384_123_6144,Gemm_Hipblaslt_TN_107363,0.133873
GemmTunableOp_Half_TN,tn_6144_2529_3072,Gemm_Rocblas_621288952,0.414632
GemmTunableOp_Half_TN,tn_6144_2349_3072,Gemm_Rocblas_621282746,0.393853
GemmTunableOp_Half_TN,tn_8_128_6144,Gemm_Rocblas_621288655,0.0127407
GemmTunableOp_Half_TN,tn_8_2512_6144,Gemm_Hipblaslt_TN_74199,0.015625
GemmTunableOp_Half_TN,tn_6144_32_3072,Gemm_Hipblaslt_TN_86084,0.021088
GemmTunableOp_Half_TN,tn_16384_115_6144,Gemm_Hipblaslt_TN_107363,0.133668
GemmTunableOp_Half_TN,tn_6144_3511_3072,Gemm_Hipblaslt_TN_107365,0.541261
GemmTunableOp_Half_TN,tn_6144_63488_3072,Gemm_Rocblas_621282462,9.60166
GemmTunableOp_Half_TN,tn_4096_3199_6144,Gemm_Hipblaslt_TN_74387,0.670708
GemmTunableOp_Half_TN,tn_4096_128_6144,Gemm_Rocblas_621288850,0.0440752
GemmTunableOp_Half_TN,tn_6144_3030_3072,Gemm_Hipblaslt_TN_72805,0.485525
GemmTunableOp_Half_TN,tn_6144_88_3072,Gemm_Rocblas_621289097,0.0306119
GemmTunableOp_Half_TN,tn_8_112_6144,Gemm_Rocblas_621282458,0.0127155
GemmTunableOp_Half_TN,tn_16384_102_6144,Gemm_Hipblaslt_TN_107363,0.132726
GemmTunableOp_Half_TN,tn_16384_88_6144,Gemm_Hipblaslt_TN_87382,0.115437
GemmTunableOp_Half_TN,tn_8_120_6144,Gemm_Hipblaslt_TN_74154,0.0140619
GemmTunableOp_Half_TN,tn_8_184_6144,Gemm_Hipblaslt_TN_73966,0.0141123
GemmTunableOp_Half_TN,tn_8_200_6144,Gemm_Hipblaslt_TN_87724,0.0139589
GemmTunableOp_Half_TN,tn_8_2069_6144,Gemm_Hipblaslt_TN_74267,0.0176112
GemmTunableOp_Half_TN,tn_8_2120_6144,Gemm_Hipblaslt_TN_74199,0.0152961
GemmTunableOp_Half_TN,tn_8_49152_6144,Gemm_Hipblaslt_TN_74273,0.200397
GemmTunableOp_Half_TN,tn_8_2929_6144,Gemm_Hipblaslt_TN_73691,0.0220234
GemmTunableOp_Half_TN,tn_8_2219_6144,Gemm_Rocblas_621282666,0.0179749
GemmTunableOp_Half_TN,tn_6144_64542_3072,Gemm_Rocblas_621282559,9.72895
GemmTunableOp_Half_TN,tn_6144_64_3072,Gemm_Rocblas_621288841,0.0249794
GemmTunableOp_Half_TN,tn_6144_2960_3072,Gemm_Hipblaslt_TN_9238,0.482716
GemmTunableOp_Half_TN,tn_6144_2849_3072,Gemm_Hipblaslt_TN_72938,0.475425
GemmTunableOp_Half_TN,tn_6144_2449_3072,Gemm_Rocblas_621288952,0.397407
GemmTunableOp_Half_TN,tn_4096_2089_6144,Gemm_Rocblas_621282746,0.447459
GemmTunableOp_Half_TN,tn_8_2399_6144,Gemm_Hipblaslt_TN_71744,0.0162624
GemmTunableOp_Half_TN,tn_16384_99_6144,Gemm_Hipblaslt_TN_74163,0.13321
GemmTunableOp_Half_TN,tn_16384_75_6144,Gemm_Hipblaslt_TN_87383,0.114261
GemmTunableOp_Half_TN,tn_16384_67_6144,Gemm_Hipblaslt_TN_74093,0.113773
GemmTunableOp_Half_TN,tn_6144_2553_3072,Gemm_Rocblas_621282746,0.411604
GemmTunableOp_Half_TN,tn_16384_91_6144,Gemm_Hipblaslt_TN_74093,0.116102
GemmTunableOp_Half_TN,tn_16384_256_6144,Gemm_Rocblas_621282868,0.195003
GemmTunableOp_Half_TN,tn_6144_30720_3072,Gemm_Hipblaslt_TN_88152,4.40636
GemmTunableOp_Half_TN,tn_4096_6185_6144,Gemm_Hipblaslt_TN_107347,1.21151
GemmTunableOp_Half_TN,tn_6144_2651_3072,Gemm_Hipblaslt_TN_9240,0.432235
GemmTunableOp_Half_TN,tn_16384_83_6144,Gemm_Hipblaslt_TN_74093,0.114406
GemmTunableOp_Half_TN,tn_6144_2239_3072,Gemm_Rocblas_621282738,0.363956
GemmTunableOp_Half_TN,tn_4096_4298_6144,Gemm_Hipblaslt_TN_74192,0.871088
GemmTunableOp_Half_TN,tn_16384_122_6144,Gemm_Hipblaslt_TN_107363,0.133627
GemmTunableOp_Half_TN,tn_16384_101_6144,Gemm_Hipblaslt_TN_107363,0.132476
GemmTunableOp_Half_TN,tn_4096_2780_6144,Gemm_Rocblas_621289214,0.583244
GemmTunableOp_Half_TN,tn_6144_3279_3072,Gemm_Hipblaslt_TN_107367,0.522425
GemmTunableOp_Half_TN,tn_4096_2239_6144,Gemm_Hipblaslt_TN_72796,0.455326
GemmTunableOp_Half_TN,tn_8_6907_6144,Gemm_Hipblaslt_TN_74271,0.0309007
GemmTunableOp_Half_TN,tn_16384_114_6144,Gemm_Hipblaslt_TN_107363,0.133839
GemmTunableOp_Half_TN,tn_4096_2440_6144,Gemm_Hipblaslt_TN_73548,0.515763
GemmTunableOp_Half_TN,tn_8_232_6144,Gemm_Hipblaslt_TN_74810,0.0151199
GemmTunableOp_Half_TN,tn_4096_2549_6144,Gemm_Hipblaslt_TN_74192,0.523954
GemmTunableOp_Half_TN,tn_8_19283_6144,Gemm_Hipblaslt_TN_73339,0.0647662
GemmTunableOp_Half_TN,tn_6144_6144_3072,Gemm_Rocblas_621282462,0.919934
GemmTunableOp_Half_TN,tn_4096_3241_6144,Gemm_Hipblaslt_TN_74714,0.675328
GemmTunableOp_Half_TN,tn_4096_2625_6144,Gemm_Hipblaslt_TN_74192,0.518558
GemmTunableOp_Half_TN,tn_4096_2361_6144,Gemm_Hipblaslt_TN_74192,0.515105
GemmTunableOp_Half_TN,tn_4096_2930_6144,Gemm_Hipblaslt_TN_107365,0.602744
GemmTunableOp_Half_TN,tn_8_2619_6144,Gemm_Hipblaslt_TN_87742,0.0195645
GemmTunableOp_Half_TN,tn_4096_3051_6144,Gemm_Hipblaslt_TN_107365,0.61004
GemmTunableOp_Half_TN,tn_6144_11506_3072,Gemm_Hipblaslt_TN_74192,1.74568
GemmTunableOp_Half_TN,tn_4096_3149_6144,Gemm_Hipblaslt_TN_74387,0.66885
GemmTunableOp_Half_TN,tn_8_3169_6144,Gemm_Hipblaslt_TN_74224,0.0182557
GemmTunableOp_Half_TN,tn_8_2471_6144,Gemm_Hipblaslt_TN_71751,0.0177149
GemmTunableOp_Half_TN,tn_4096_40_6144,Default,0.0306755
GemmTunableOp_Half_TN,tn_6144_4096_3072,Gemm_Rocblas_621282462,0.628444
GemmTunableOp_Half_TN,tn_4096_64542_6144,Gemm_Rocblas_621289105,12.3953
GemmTunableOp_Half_TN,tn_6144_2089_3072,Gemm_Rocblas_621282738,0.359385
GemmTunableOp_Half_TN,tn_4096_192_6144,Gemm_Hipblaslt_TN_74670,0.0555179
GemmTunableOp_Half_TN,tn_6144_2389_3072,Gemm_Rocblas_621288952,0.394243
GemmTunableOp_Half_TN,tn_6144_224_1536,Gemm_Rocblas_621289019,0.0335026
GemmTunableOp_Half_TN,tn_6144_176_1536,Gemm_Rocblas_621288850,0.0291513
GemmTunableOp_Half_TN,tn_6144_40960_1536,Gemm_Rocblas_621282559,3.24267
GemmTunableOp_Half_TN,tn_2048_96_6144,Gemm_Hipblaslt_TN_87224,0.0267993
GemmTunableOp_Half_TN,tn_2048_64_6144,Gemm_Rocblas_621288715,0.021128
GemmTunableOp_Half_TN,tn_2048_40_6144,Gemm_Hipblaslt_TN_87765,0.0209145
GemmTunableOp_Half_TN,tn_6144_32_1536,Gemm_Rocblas_621288711,0.0140515
GemmTunableOp_Half_TN,tn_6144_16_1536,Gemm_Rocblas_621288680,0.0120128
GemmTunableOp_Half_TN,tn_2048_216_6144,Gemm_Hipblaslt_TN_72484,0.0407262
GemmTunableOp_Half_TN,tn_2048_136_6144,Gemm_Hipblaslt_TN_85556,0.0340154
GemmTunableOp_Half_TN,tn_2048_65536_6144,Gemm_Hipblaslt_TN_74534,6.6203
GemmTunableOp_Half_TN,tn_2048_48_6144,Gemm_Hipblaslt_TN_87765,0.0206582
GemmTunableOp_Half_TN,tn_2048_224_6144,Gemm_Hipblaslt_TN_72484,0.0407586
GemmTunableOp_Half_TN,tn_2048_160_6144,Gemm_Hipblaslt_TN_87420,0.0339565
GemmTunableOp_Half_TN,tn_2048_16_6144,Gemm_Rocblas_621288646,0.0136296
GemmTunableOp_Half_TN,tn_8_65536_6144,Gemm_Hipblaslt_TN_74273,0.28003
GemmTunableOp_Half_TN,tn_8_224_6144,Gemm_Hipblaslt_TN_87708,0.0139533
GemmTunableOp_Half_TN,tn_2048_128_6144,Gemm_Hipblaslt_TN_72037,0.029894
GemmTunableOp_Half_TN,tn_8_4_6144,Gemm_Rocblas_621288645,0.010289
GemmTunableOp_Half_TN,tn_6144_40_1536,Gemm_Rocblas_621288841,0.0167939
GemmTunableOp_Half_TN,tn_8_56_6144,Gemm_Rocblas_621282577,0.0125804
GemmTunableOp_Half_TN,tn_2048_168_6144,Gemm_Hipblaslt_TN_85907,0.0368023
GemmTunableOp_Half_TN,tn_8_248_6144,Gemm_Hipblaslt_TN_87709,0.013987
GemmTunableOp_Half_TN,tn_8_120_6144,Gemm_Rocblas_621288655,0.0126958
GemmTunableOp_Half_TN,tn_8_208_6144,Gemm_Hipblaslt_TN_87724,0.0138596
GemmTunableOp_Half_TN,tn_2048_232_6144,Gemm_Hipblaslt_TN_74349,0.0418443
GemmTunableOp_Half_TN,tn_2048_72_6144,Gemm_Hipblaslt_TN_71831,0.0237103
GemmTunableOp_Half_TN,tn_6144_120_1536,Gemm_Rocblas_621288851,0.0230117
GemmTunableOp_Half_TN,tn_6144_72_1536,Gemm_Rocblas_621289097,0.0198173
GemmTunableOp_Half_TN,tn_6144_168_1536,Gemm_Rocblas_621282641,0.0288588
GemmTunableOp_Half_TN,tn_6144_216_1536,Gemm_Rocblas_621282814,0.0335386
GemmTunableOp_Half_TN,tn_6144_48_1536,Gemm_Rocblas_621282632,0.0167503
GemmTunableOp_Half_TN,tn_8_152_6144,Gemm_Hipblaslt_TN_87708,0.0139669
GemmTunableOp_Half_TN,tn_8_176_6144,Gemm_Hipblaslt_TN_74336,0.0141276
GemmTunableOp_Half_TN,tn_2048_40960_6144,Gemm_Hipblaslt_TN_74210,4.01896
GemmTunableOp_Half_TN,tn_2048_24_6144,Gemm_Rocblas_621282572,0.0161959
GemmTunableOp_Half_TN,tn_2048_192_6144,Gemm_Hipblaslt_TN_85907,0.0368885
GemmTunableOp_Half_TN,tn_2048_112_6144,Gemm_Hipblaslt_TN_72974,0.0299481
GemmTunableOp_Half_TN,tn_8192_20_6144,Gemm_Rocblas_621288838,0.0372927
GemmTunableOp_Half_TN,tn_8_88_6144,Gemm_Rocblas_621288655,0.0127387
GemmTunableOp_Half_TN,tn_8_8_6144,Gemm_Rocblas_621288645,0.0101564
GemmTunableOp_Half_TN,tn_8_64_6144,Gemm_Rocblas_621282488,0.012677
GemmTunableOp_Half_TN,tn_8_40_6144,Gemm_Rocblas_621288796,0.0126037
GemmTunableOp_Half_TN,tn_8_216_6144,Gemm_Hipblaslt_TN_73966,0.0139585
GemmTunableOp_Half_TN,tn_8_192_6144,Gemm_Hipblaslt_TN_71584,0.0139257
GemmTunableOp_Half_TN,tn_6144_256_1536,Gemm_Rocblas_621289019,0.0322371
GemmTunableOp_Half_TN,tn_6144_8_1536,Gemm_Rocblas_621282473,0.011774
GemmTunableOp_Half_TN,tn_6144_160_1536,Gemm_Rocblas_621288850,0.0287731
GemmTunableOp_Half_TN,tn_2048_240_6144,Gemm_Hipblaslt_TN_74377,0.0416748
GemmTunableOp_Half_TN,tn_8_232_6144,Gemm_Hipblaslt_TN_71620,0.0139613
GemmTunableOp_Half_TN,tn_8_168_6144,Gemm_Hipblaslt_TN_87728,0.014049
GemmTunableOp_Half_TN,tn_2048_80_6144,Gemm_Hipblaslt_TN_71833,0.0240328
GemmTunableOp_Half_TN,tn_6144_64_1536,Gemm_Rocblas_621288841,0.0159122
GemmTunableOp_Half_TN,tn_2048_184_6144,Gemm_Hipblaslt_TN_85907,0.0371092
GemmTunableOp_Half_TN,tn_6144_96_1536,Gemm_Rocblas_621289097,0.0188182
GemmTunableOp_Half_TN,tn_8192_256_6144,Gemm_Hipblaslt_TN_74098,0.118797
GemmTunableOp_Half_TN,tn_8_144_6144,Gemm_Hipblaslt_TN_71563,0.0139813
GemmTunableOp_Half_TN,tn_8_256_6144,Gemm_Hipblaslt_TN_71563,0.0140182
GemmTunableOp_Half_TN,tn_2048_104_6144,Gemm_Hipblaslt_TN_72974,0.0296644
GemmTunableOp_Half_TN,tn_6144_128_1536,Gemm_Rocblas_621282647,0.0215631
GemmTunableOp_Half_TN,tn_6144_208_1536,Gemm_Rocblas_621289019,0.0336512
GemmTunableOp_Half_TN,tn_8_112_6144,Gemm_Rocblas_621282458,0.0127263
GemmTunableOp_Half_TN,tn_8192_244_6144,Gemm_Hipblaslt_TN_74098,0.119585
GemmTunableOp_Half_TN,tn_8_96_6144,Gemm_Rocblas_621288655,0.0127804
GemmTunableOp_Half_TN,tn_8_80_6144,Gemm_Rocblas_621288655,0.0127335
GemmTunableOp_Half_TN,tn_8_72_6144,Gemm_Rocblas_621282458,0.0127235
GemmTunableOp_Half_TN,tn_8_48_6144,Gemm_Rocblas_621282458,0.0127403
GemmTunableOp_Half_TN,tn_2048_208_6144,Gemm_Hipblaslt_TN_73135,0.0405427
GemmTunableOp_Half_TN,tn_8_136_6144,Gemm_Hipblaslt_TN_71580,0.013906
GemmTunableOp_Half_TN,tn_8_184_6144,Gemm_Hipblaslt_TN_71563,0.013995
GemmTunableOp_Half_TN,tn_8_160_6144,Gemm_Hipblaslt_TN_73966,0.014017
GemmTunableOp_Half_TN,tn_8_24_6144,Gemm_Rocblas_621282452,0.0103303
GemmTunableOp_Half_TN,tn_6144_104_1536,Gemm_Rocblas_621288851,0.0229311
GemmTunableOp_Half_TN,tn_6144_136_1536,Gemm_Rocblas_621282641,0.0288464
GemmTunableOp_Half_TN,tn_6144_184_1536,Gemm_Rocblas_621282641,0.0292102
GemmTunableOp_Half_TN,tn_6144_80_1536,Gemm_Hipblaslt_TN_74372,0.0214029
GemmTunableOp_Half_TN,tn_6144_232_1536,Gemm_Rocblas_621282653,0.0343302
GemmTunableOp_Half_TN,tn_2048_144_6144,Gemm_Hipblaslt_TN_85556,0.0341964
GemmTunableOp_Half_TN,tn_2048_256_6144,Gemm_Rocblas_621288850,0.043766
GemmTunableOp_Half_TN,tn_8_200_6144,Gemm_Hipblaslt_TN_71584,0.0140062
GemmTunableOp_Half_TN,tn_6144_65536_1536,Gemm_Rocblas_621282559,5.16305
GemmTunableOp_Half_TN,tn_6144_248_1536,Gemm_Rocblas_621282814,0.0338431
GemmTunableOp_Half_TN,tn_6144_192_1536,Gemm_Rocblas_621288850,0.0290303
GemmTunableOp_Half_TN,tn_6144_144_1536,Gemm_Rocblas_621282641,0.0287122
GemmTunableOp_Half_TN,tn_2048_88_6144,Gemm_Hipblaslt_TN_72860,0.0253392
GemmTunableOp_Half_TN,tn_2048_248_6144,Gemm_Rocblas_621282641,0.0438909
GemmTunableOp_Half_TN,tn_2048_176_6144,Gemm_Hipblaslt_TN_85907,0.0370295
GemmTunableOp_Half_TN,tn_6144_24_1536,Gemm_Rocblas_621288713,0.0136993
GemmTunableOp_Half_TN,tn_2048_120_6144,Gemm_Hipblaslt_TN_72974,0.0303899
GemmTunableOp_Half_TN,tn_8192_32_6144,Gemm_Rocblas_621282499,0.0370928
GemmTunableOp_Half_TN,tn_8_32_6144,Gemm_Rocblas_621288645,0.0102241
GemmTunableOp_Half_TN,tn_8_2_6144,Gemm_Rocblas_621282451,0.0103691
GemmTunableOp_Half_TN,tn_8_16_6144,Gemm_Rocblas_621288645,0.0103223
GemmTunableOp_Half_TN,tn_2048_152_6144,Gemm_Hipblaslt_TN_85556,0.0340871
GemmTunableOp_Half_TN,tn_2048_200_6144,Gemm_Hipblaslt_TN_73135,0.0404049
GemmTunableOp_Half_TN,tn_6144_200_1536,Gemm_Rocblas_621282814,0.0335603
GemmTunableOp_Half_TN,tn_2048_32_6144,Gemm_Rocblas_621288712,0.0161734
GemmTunableOp_Half_TN,tn_6144_112_1536,Gemm_Rocblas_621282642,0.022944
GemmTunableOp_Half_TN,tn_2048_56_6144,Gemm_Rocblas_621288715,0.0211761
GemmTunableOp_Half_TN,tn_2048_8_6144,Gemm_Rocblas_621288646,0.0135763
GemmTunableOp_Half_TN,tn_6144_152_1536,Gemm_Rocblas_621288850,0.0287783
GemmTunableOp_Half_TN,tn_6144_240_1536,Gemm_Rocblas_621282814,0.0337009
GemmTunableOp_Half_TN,tn_6144_56_1536,Gemm_Rocblas_621288841,0.0167855
GemmTunableOp_Half_TN,tn_8_40960_6144,Gemm_Hipblaslt_TN_74273,0.182418
GemmTunableOp_Half_TN,tn_6144_88_1536,Gemm_Rocblas_621289097,0.0201422
GemmTunableOp_Half_TN,tn_8_240_6144,Gemm_Hipblaslt_TN_74154,0.0138455
GemmTunableOp_Half_TN,tn_8_104_6144,Gemm_Rocblas_621282458,0.0127503
GemmTunableOp_Half_TN,tn_8_128_6144,Gemm_Rocblas_621282458,0.0127439
GemmTunableOp_Half_TN,tn_8_88_6144,Gemm_Rocblas_621282458,0.0126914
GemmTunableOp_Half_TN,tn_8_8_6144,Gemm_Rocblas_621288645,0.0102041
GemmTunableOp_Half_TN,tn_8_72_6144,Gemm_Rocblas_621288655,0.0127102
GemmTunableOp_Half_TN,tn_1024_144_6144,Gemm_Rocblas_621282609,0.0227377
GemmTunableOp_Half_TN,tn_1024_40_6144,Gemm_Rocblas_621282490,0.0158425
GemmTunableOp_Half_TN,tn_4096_244_6144,Gemm_Hipblaslt_TN_73368,0.0728171
GemmTunableOp_Half_TN,tn_6144_224_768,Gemm_Rocblas_621288862,0.0216068
GemmTunableOp_Half_TN,tn_1024_200_6144,Gemm_Hipblaslt_TN_71830,0.0277111
GemmTunableOp_Half_TN,tn_6144_48_768,Gemm_Rocblas_621282632,0.0116899
GemmTunableOp_Half_TN,tn_8_160_6144,Gemm_Hipblaslt_TN_74154,0.0143771
GemmTunableOp_Half_TN,tn_6144_72_768,Gemm_Rocblas_621289097,0.0138507
GemmTunableOp_Half_TN,tn_8_200_6144,Gemm_Hipblaslt_TN_74154,0.0141015
GemmTunableOp_Half_TN,tn_8_128_6144,Gemm_Rocblas_621288655,0.0127199
GemmTunableOp_Half_TN,tn_8_32_6144,Gemm_Rocblas_621288644,0.010293
GemmTunableOp_Half_TN,tn_8_48_6144,Gemm_Rocblas_621282577,0.0125869
GemmTunableOp_Half_TN,tn_1024_64_6144,Gemm_Rocblas_621288710,0.0158429
GemmTunableOp_Half_TN,tn_8_232_6144,Gemm_Hipblaslt_TN_87709,0.013854
GemmTunableOp_Half_TN,tn_8_4_6144,Gemm_Rocblas_621288645,0.0102882
GemmTunableOp_Half_TN,tn_8_24_6144,Gemm_Rocblas_621288645,0.0102193
GemmTunableOp_Half_TN,tn_8_64_6144,Gemm_Rocblas_621288655,0.0127118
GemmTunableOp_Half_TN,tn_8_2_6144,Gemm_Rocblas_621288650,0.0103006
GemmTunableOp_Half_TN,tn_1024_136_6144,Gemm_Rocblas_621282609,0.0227641
GemmTunableOp_Half_TN,tn_8_80_6144,Gemm_Rocblas_621282458,0.0127399
GemmTunableOp_Half_TN,tn_8_208_6144,Gemm_Hipblaslt_TN_87728,0.0133993
GemmTunableOp_Half_TN,tn_1024_248_6144,Gemm_Hipblaslt_TN_72974,0.0300763
GemmTunableOp_Half_TN,tn_6144_176_768,Gemm_Rocblas_621288850,0.0196727
GemmTunableOp_Half_TN,tn_8_16_6144,Gemm_Rocblas_621282452,0.0103251
GemmTunableOp_Half_TN,tn_6144_208_768,Gemm_Rocblas_621282653,0.0215399
GemmTunableOp_Half_TN,tn_1024_216_6144,Gemm_Hipblaslt_TN_71715,0.0277392
GemmTunableOp_Half_TN,tn_6144_104_768,Gemm_Rocblas_621288851,0.0155609
GemmTunableOp_Half_TN,tn_1024_88_6144,Gemm_Hipblaslt_TN_74656,0.0190425
GemmTunableOp_Half_TN,tn_6144_88_768,Gemm_Rocblas_621289097,0.0140727
GemmTunableOp_Half_TN,tn_8_256_6144,Gemm_Hipblaslt_TN_71693,0.0134906
GemmTunableOp_Half_TN,tn_8_112_6144,Gemm_Rocblas_621282458,0.0127611
GemmTunableOp_Half_TN,tn_6144_136_768,Gemm_Rocblas_621283136,0.018446
GemmTunableOp_Half_TN,tn_6144_64_768,Gemm_Rocblas_621288841,0.0111034
GemmTunableOp_Half_TN,tn_8_168_6144,Gemm_Hipblaslt_TN_71584,0.0134197
GemmTunableOp_Half_TN,tn_6144_256_768,Gemm_Rocblas_621289042,0.020282
GemmTunableOp_Half_TN,tn_8_136_6144,Gemm_Hipblaslt_TN_87731,0.0138516
GemmTunableOp_Half_TN,tn_1024_40960_6144,Gemm_Rocblas_621282559,2.21013
GemmTunableOp_Half_TN,tn_1024_224_6144,Gemm_Hipblaslt_TN_71830,0.0276891
GemmTunableOp_Half_TN,tn_1024_160_6144,Gemm_Rocblas_621282609,0.0225899
GemmTunableOp_Half_TN,tn_1024_16_6144,Gemm_Rocblas_621282452,0.010964
GemmTunableOp_Half_TN,tn_8_96_6144,Gemm_Rocblas_621288655,0.0127827
GemmTunableOp_Half_TN,tn_8_40960_6144,Gemm_Hipblaslt_TN_74273,0.182358
GemmTunableOp_Half_TN,tn_8_248_6144,Gemm_Hipblaslt_TN_87706,0.0140623
GemmTunableOp_Half_TN,tn_1024_72_6144,Gemm_Hipblaslt_TN_74650,0.0199463
GemmTunableOp_Half_TN,tn_6144_8_768,Gemm_Rocblas_621288680,0.00873109
GemmTunableOp_Half_TN,tn_1024_240_6144,Gemm_Hipblaslt_TN_71830,0.0273097
GemmTunableOp_Half_TN,tn_4096_256_6144,Gemm_Hipblaslt_TN_73138,0.071538
GemmTunableOp_Half_TN,tn_6144_248_768,Gemm_Rocblas_621282653,0.0215583
GemmTunableOp_Half_TN,tn_1024_176_6144,Gemm_Hipblaslt_TN_72860,0.0270193
GemmTunableOp_Half_TN,tn_8_104_6144,Gemm_Rocblas_621288655,0.0127058
GemmTunableOp_Half_TN,tn_8_184_6144,Gemm_Hipblaslt_TN_87730,0.014039
GemmTunableOp_Half_TN,tn_1024_112_6144,Gemm_Rocblas_621282663,0.0202648
GemmTunableOp_Half_TN,tn_8_224_6144,Gemm_Hipblaslt_TN_87729,0.014015
GemmTunableOp_Half_TN,tn_6144_24_768,Gemm_Rocblas_621288711,0.00991085
GemmTunableOp_Half_TN,tn_8_152_6144,Gemm_Hipblaslt_TN_71693,0.0139838
GemmTunableOp_Half_TN,tn_6144_96_768,Gemm_Rocblas_621289097,0.0129995
GemmTunableOp_Half_TN,tn_8_65536_6144,Gemm_Hipblaslt_TN_74273,0.27679
GemmTunableOp_Half_TN,tn_8_56_6144,Gemm_Rocblas_621288796,0.0125909
GemmTunableOp_Half_TN,tn_8_192_6144,Gemm_Hipblaslt_TN_87731,0.0139822
GemmTunableOp_Half_TN,tn_8_176_6144,Gemm_Hipblaslt_TN_74177,0.0139525
GemmTunableOp_Half_TN,tn_8_144_6144,Gemm_Hipblaslt_TN_87732,0.0140354
GemmTunableOp_Half_TN,tn_8_120_6144,Gemm_Rocblas_621282458,0.0127679
GemmTunableOp_Half_TN,tn_1024_128_6144,Gemm_Rocblas_621282663,0.0202095
GemmTunableOp_Half_TN,tn_8_240_6144,Gemm_Hipblaslt_TN_87719,0.013989
GemmTunableOp_Half_TN,tn_1024_168_6144,Gemm_Hipblaslt_TN_72860,0.0263094
GemmTunableOp_Half_TN,tn_6144_80_768,Gemm_Rocblas_621282893,0.0140543
GemmTunableOp_Half_TN,tn_1024_48_6144,Gemm_Rocblas_621288710,0.0158373
GemmTunableOp_Half_TN,tn_6144_160_768,Gemm_Hipblaslt_TN_74156,0.0186644
GemmTunableOp_Half_TN,tn_1024_8_6144,Gemm_Rocblas_621282562,0.0109384
GemmTunableOp_Half_TN,tn_6144_192_768,Gemm_Rocblas_621289201,0.0190574
GemmTunableOp_Half_TN,tn_8_216_6144,Gemm_Hipblaslt_TN_72573,0.0140202
GemmTunableOp_Half_TN,tn_1024_24_6144,Gemm_Rocblas_621282569,0.013213
GemmTunableOp_Half_TN,tn_6144_232_768,Gemm_Rocblas_621282653,0.0215535
GemmTunableOp_Half_TN,tn_8_40_6144,Gemm_Rocblas_621288796,0.0125648
GemmTunableOp_Half_TN,tn_4096_32_6144,Gemm_Rocblas_621288715,0.0211665
GemmTunableOp_Half_TN,tn_4096_20_6144,Gemm_Rocblas_621282493,0.0213047
GemmTunableOp_Half_TN,tn_6144_144_768,Gemm_Rocblas_621283136,0.0178099
GemmTunableOp_Half_TN,tn_6144_40_768,Gemm_Rocblas_621282632,0.0117123
GemmTunableOp_Half_TN,tn_6144_56_768,Gemm_Rocblas_621288841,0.0117929
GemmTunableOp_Half_TN,tn_6144_32_768,Gemm_Rocblas_621288723,0.0101408
GemmTunableOp_Half_TN,tn_6144_216_768,Gemm_Hipblaslt_TN_74357,0.0220042
GemmTunableOp_Half_TN,tn_6144_184_768,Gemm_Rocblas_621288850,0.0199106
GemmTunableOp_Half_TN,tn_6144_40960_768,Gemm_Rocblas_621282798,1.66785
GemmTunableOp_Half_TN,tn_6144_120_768,Gemm_Rocblas_621282642,0.0157296
GemmTunableOp_Half_TN,tn_1024_96_6144,Gemm_Hipblaslt_TN_86189,0.0194455
GemmTunableOp_Half_TN,tn_1024_256_6144,Gemm_Hipblaslt_TN_72037,0.0298912
GemmTunableOp_Half_TN,tn_1024_208_6144,Gemm_Hipblaslt_TN_71715,0.0278938
GemmTunableOp_Half_TN,tn_6144_152_768,Gemm_Rocblas_621282641,0.019621
GemmTunableOp_Half_TN,tn_1024_152_6144,Gemm_Rocblas_621288827,0.0226756
GemmTunableOp_Half_TN,tn_1024_65536_6144,Gemm_Hipblaslt_TN_74518,3.43383
GemmTunableOp_Half_TN,tn_1024_232_6144,Gemm_Hipblaslt_TN_71715,0.0277496
GemmTunableOp_Half_TN,tn_1024_184_6144,Gemm_Hipblaslt_TN_72860,0.0254021
GemmTunableOp_Half_TN,tn_1024_120_6144,Gemm_Rocblas_621282663,0.0206866
GemmTunableOp_Half_TN,tn_6144_200_768,Gemm_Rocblas_621282653,0.0215944
GemmTunableOp_Half_TN,tn_6144_16_768,Gemm_Rocblas_621288702,0.00906078
GemmTunableOp_Half_TN,tn_6144_128_768,Gemm_Rocblas_621282677,0.0143731
GemmTunableOp_Half_TN,tn_6144_112_768,Gemm_Rocblas_621282642,0.0155313
GemmTunableOp_Half_TN,tn_6144_240_768,Gemm_Rocblas_621288862,0.021596
GemmTunableOp_Half_TN,tn_1024_80_6144,Gemm_Rocblas_621282663,0.0200048
GemmTunableOp_Half_TN,tn_1024_56_6144,Gemm_Rocblas_621282490,0.0158021
GemmTunableOp_Half_TN,tn_6144_168_768,Gemm_Rocblas_621288850,0.0195841
GemmTunableOp_Half_TN,tn_1024_32_6144,Gemm_Rocblas_621282577,0.0131297
GemmTunableOp_Half_TN,tn_1024_192_6144,Gemm_Hipblaslt_TN_72860,0.0254581
GemmTunableOp_Half_TN,tn_6144_65536_768,Gemm_Rocblas_621282798,2.68548
GemmTunableOp_Half_TN,tn_1024_104_6144,Gemm_Rocblas_621282663,0.0203084
ScaledGemmTunableOp_Float8_e4m3fnuz_Float8_e4m3fnuz_Half_TN,tn_37888_72_3584,Gemm_Hipblaslt_TN_20300,0.0837053
ScaledGemmTunableOp_Float8_e4m3fnuz_Float8_e4m3fnuz_Half_TN,tn_37888_232_3584,Gemm_Hipblaslt_TN_20652,0.180589
ScaledGemmTunableOp_Float8_e4m3fnuz_Float8_e4m3fnuz_Half_TN,tn_3584_248_18944,Gemm_Hipblaslt_TN_20174,0.0967527
ScaledGemmTunableOp_Float8_e4m3fnuz_Float8_e4m3fnuz_Half_TN,tn_3584_152_3584,Gemm_Hipblaslt_TN_20682,0.0237305
ScaledGemmTunableOp_Float8_e4m3fnuz_Float8_e4m3fnuz_Half_TN,tn_3584_168_18944,Gemm_Hipblaslt_TN_19741,0.0708058
ScaledGemmTunableOp_Float8_e4m3fnuz_Float8_e4m3fnuz_Half_TN,tn_3584_72_3584,Gemm_Hipblaslt_TN_112698,0.0187732
ScaledGemmTunableOp_Float8_e4m3fnuz_Float8_e4m3fnuz_Half_TN,tn_3584_104_18944,Gemm_Hipblaslt_TN_19949,0.0551644
ScaledGemmTunableOp_Float8_e4m3fnuz_Float8_e4m3fnuz_Half_TN,tn_3584_200_3584,Gemm_Hipblaslt_TN_19542,0.0278457
ScaledGemmTunableOp_Float8_e4m3fnuz_Float8_e4m3fnuz_Half_TN,tn_3584_88_3584,Gemm_Hipblaslt_TN_112698,0.0189318
ScaledGemmTunableOp_Float8_e4m3fnuz_Float8_e4m3fnuz_Half_TN,tn_37888_144_3584,Gemm_Hipblaslt_TN_20709,0.109398
ScaledGemmTunableOp_Float8_e4m3fnuz_Float8_e4m3fnuz_Half_TN,tn_3584_208_3584,Gemm_Hipblaslt_TN_20167,0.0278668
ScaledGemmTunableOp_Float8_e4m3fnuz_Float8_e4m3fnuz_Half_TN,tn_3584_224_3584,Gemm_Hipblaslt_TN_19542,0.0279303
ScaledGemmTunableOp_Float8_e4m3fnuz_Float8_e4m3fnuz_Half_TN,tn_3584_24_18944,Gemm_Hipblaslt_TN_19506,0.0333985
ScaledGemmTunableOp_Float8_e4m3fnuz_Float8_e4m3fnuz_Half_TN,tn_37888_104_3584,Gemm_Hipblaslt_TN_20739,0.0958169
ScaledGemmTunableOp_Float8_e4m3fnuz_Float8_e4m3fnuz_Half_TN,tn_37888_192_3584,Gemm_Hipblaslt_TN_20320,0.119026
ScaledGemmTunableOp_Float8_e4m3fnuz_Float8_e4m3fnuz_Half_TN,tn_37888_88_3584,Gemm_Hipblaslt_TN_19607,0.0857506
ScaledGemmTunableOp_Float8_e4m3fnuz_Float8_e4m3fnuz_Half_TN,tn_37888_160_3584,Gemm_Hipblaslt_TN_20709,0.106501
ScaledGemmTunableOp_Float8_e4m3fnuz_Float8_e4m3fnuz_Half_TN,tn_3584_104_3584,Gemm_Hipblaslt_TN_20104,0.0205949
ScaledGemmTunableOp_Float8_e4m3fnuz_Float8_e4m3fnuz_Half_TN,tn_3584_136_3584,Gemm_Hipblaslt_TN_20682,0.0234383
ScaledGemmTunableOp_Float8_e4m3fnuz_Float8_e4m3fnuz_Half_TN,tn_3584_144_18944,Gemm_Hipblaslt_TN_19822,0.0622788
ScaledGemmTunableOp_Float8_e4m3fnuz_Float8_e4m3fnuz_Half_TN,tn_37888_240_3584,Gemm_Hipblaslt_TN_20652,0.181166
ScaledGemmTunableOp_Float8_e4m3fnuz_Float8_e4m3fnuz_Half_TN,tn_3584_240_3584,Gemm_Hipblaslt_TN_20173,0.0279832
ScaledGemmTunableOp_Float8_e4m3fnuz_Float8_e4m3fnuz_Half_TN,tn_37888_200_3584,Gemm_Hipblaslt_TN_20745,0.13799
ScaledGemmTunableOp_Float8_e4m3fnuz_Float8_e4m3fnuz_Half_TN,tn_3584_256_18944,Gemm_Hipblaslt_TN_20174,0.095823
ScaledGemmTunableOp_Float8_e4m3fnuz_Float8_e4m3fnuz_Half_TN,tn_3584_17_3584,Gemm_Hipblaslt_TN_19433,0.0143684
ScaledGemmTunableOp_Float8_e4m3fnuz_Float8_e4m3fnuz_Half_TN,tn_3584_208_18944,Gemm_Hipblaslt_TN_19707,0.0802955
ScaledGemmTunableOp_Float8_e4m3fnuz_Float8_e4m3fnuz_Half_TN,tn_3584_176_3584,Gemm_Hipblaslt_TN_20682,0.0238331
ScaledGemmTunableOp_Float8_e4m3fnuz_Float8_e4m3fnuz_Half_TN,tn_3584_80_3584,Gemm_Hipblaslt_TN_20124,0.0188469
ScaledGemmTunableOp_Float8_e4m3fnuz_Float8_e4m3fnuz_Half_TN,tn_3584_24_3584,Gemm_Hipblaslt_TN_20431,0.0143219
ScaledGemmTunableOp_Float8_e4m3fnuz_Float8_e4m3fnuz_Half_TN,tn_3584_96_3584,Gemm_Hipblaslt_TN_19387,0.018547
ScaledGemmTunableOp_Float8_e4m3fnuz_Float8_e4m3fnuz_Half_TN,tn_3584_192_3584,Gemm_Hipblaslt_TN_20172,0.0228891
ScaledGemmTunableOp_Float8_e4m3fnuz_Float8_e4m3fnuz_Half_TN,tn_37888_120_3584,Gemm_Hipblaslt_TN_20696,0.0959184
ScaledGemmTunableOp_Float8_e4m3fnuz_Float8_e4m3fnuz_Half_TN,tn_37888_256_3584,Gemm_Hipblaslt_TN_20652,0.17845
ScaledGemmTunableOp_Float8_e4m3fnuz_Float8_e4m3fnuz_Half_TN,tn_3584_120_18944,Gemm_Hipblaslt_TN_19762,0.0560315
ScaledGemmTunableOp_Float8_e4m3fnuz_Float8_e4m3fnuz_Half_TN,tn_3584_152_18944,Gemm_Hipblaslt_TN_19822,0.0621807
ScaledGemmTunableOp_Float8_e4m3fnuz_Float8_e4m3fnuz_Half_TN,tn_3584_192_18944,Gemm_Hipblaslt_TN_19741,0.0725471
ScaledGemmTunableOp_Float8_e4m3fnuz_Float8_e4m3fnuz_Half_TN,tn_3584_32_3584,Gemm_Hipblaslt_TN_20431,0.0147142
ScaledGemmTunableOp_Float8_e4m3fnuz_Float8_e4m3fnuz_Half_TN,tn_3584_40_18944,Gemm_Hipblaslt_TN_19717,0.0385613
ScaledGemmTunableOp_Float8_e4m3fnuz_Float8_e4m3fnuz_Half_TN,tn_3584_56_3584,Gemm_Hipblaslt_TN_20154,0.0159669
ScaledGemmTunableOp_Float8_e4m3fnuz_Float8_e4m3fnuz_Half_TN,tn_3584_80_18944,Gemm_Hipblaslt_TN_19826,0.0476237
ScaledGemmTunableOp_Float8_e4m3fnuz_Float8_e4m3fnuz_Half_TN,tn_3584_256_3584,Gemm_Hipblaslt_TN_20430,0.0272183
ScaledGemmTunableOp_Float8_e4m3fnuz_Float8_e4m3fnuz_Half_TN,tn_3584_64_3584,Gemm_Hipblaslt_TN_112687,0.0154107
ScaledGemmTunableOp_Float8_e4m3fnuz_Float8_e4m3fnuz_Half_TN,tn_3584_224_18944,Gemm_Hipblaslt_TN_19707,0.0813451
ScaledGemmTunableOp_Float8_e4m3fnuz_Float8_e4m3fnuz_Half_TN,tn_37888_128_3584,Gemm_Hipblaslt_TN_20706,0.0933933
ScaledGemmTunableOp_Float8_e4m3fnuz_Float8_e4m3fnuz_Half_TN,tn_37888_96_3584,Gemm_Hipblaslt_TN_19607,0.0842985
ScaledGemmTunableOp_Float8_e4m3fnuz_Float8_e4m3fnuz_Half_TN,tn_37888_168_3584,Gemm_Hipblaslt_TN_20701,0.120328
ScaledGemmTunableOp_Float8_e4m3fnuz_Float8_e4m3fnuz_Half_TN,tn_37888_208_3584,Gemm_Hipblaslt_TN_20745,0.137841
ScaledGemmTunableOp_Float8_e4m3fnuz_Float8_e4m3fnuz_Half_TN,tn_37888_64_3584,Gemm_Hipblaslt_TN_20404,0.0683393
ScaledGemmTunableOp_Float8_e4m3fnuz_Float8_e4m3fnuz_Half_TN,tn_37888_48_3584,Gemm_Hipblaslt_TN_112683,0.0621281
ScaledGemmTunableOp_Float8_e4m3fnuz_Float8_e4m3fnuz_Half_TN,tn_37888_32_3584,Gemm_Hipblaslt_TN_112677,0.0548705
ScaledGemmTunableOp_Float8_e4m3fnuz_Float8_e4m3fnuz_Half_TN,tn_37888_224_3584,Gemm_Hipblaslt_TN_20745,0.136359
ScaledGemmTunableOp_Float8_e4m3fnuz_Float8_e4m3fnuz_Half_TN,tn_3584_131072_3584,Gemm_Hipblaslt_TN_20749,7.51996
ScaledGemmTunableOp_Float8_e4m3fnuz_Float8_e4m3fnuz_Half_TN,tn_3584_120_3584,Gemm_Hipblaslt_TN_20104,0.0207075
ScaledGemmTunableOp_Float8_e4m3fnuz_Float8_e4m3fnuz_Half_TN,tn_3584_131072_18944,Gemm_Hipblaslt_TN_20747,36.3508
ScaledGemmTunableOp_Float8_e4m3fnuz_Float8_e4m3fnuz_Half_TN,tn_3584_128_3584,Gemm_Hipblaslt_TN_20171,0.020028
ScaledGemmTunableOp_Float8_e4m3fnuz_Float8_e4m3fnuz_Half_TN,tn_37888_248_3584,Gemm_Hipblaslt_TN_20652,0.180671
ScaledGemmTunableOp_Float8_e4m3fnuz_Float8_e4m3fnuz_Half_TN,tn_37888_24_3584,Gemm_Hipblaslt_TN_19418,0.0533736
ScaledGemmTunableOp_Float8_e4m3fnuz_Float8_e4m3fnuz_Half_TN,tn_3584_168_3584,Gemm_Hipblaslt_TN_20682,0.0238205
ScaledGemmTunableOp_Float8_e4m3fnuz_Float8_e4m3fnuz_Half_TN,tn_3584_40_3584,Gemm_Hipblaslt_TN_20113,0.0153745
ScaledGemmTunableOp_Float8_e4m3fnuz_Float8_e4m3fnuz_Half_TN,tn_3584_112_3584,Gemm_Hipblaslt_TN_20104,0.0206206
ScaledGemmTunableOp_Float8_e4m3fnuz_Float8_e4m3fnuz_Half_TN,tn_3584_48_18944,Gemm_Hipblaslt_TN_19717,0.0384665
ScaledGemmTunableOp_Float8_e4m3fnuz_Float8_e4m3fnuz_Half_TN,tn_3584_176_18944,Gemm_Hipblaslt_TN_19741,0.0720086
ScaledGemmTunableOp_Float8_e4m3fnuz_Float8_e4m3fnuz_Half_TN,tn_3584_136_18944,Gemm_Hipblaslt_TN_19822,0.0619311
ScaledGemmTunableOp_Float8_e4m3fnuz_Float8_e4m3fnuz_Half_TN,tn_37888_112_3584,Gemm_Hipblaslt_TN_20739,0.094735
ScaledGemmTunableOp_Float8_e4m3fnuz_Float8_e4m3fnuz_Half_TN,tn_3584_216_18944,Gemm_Hipblaslt_TN_19707,0.0805388
ScaledGemmTunableOp_Float8_e4m3fnuz_Float8_e4m3fnuz_Half_TN,tn_3584_248_3584,Gemm_Hipblaslt_TN_20173,0.0282324
ScaledGemmTunableOp_Float8_e4m3fnuz_Float8_e4m3fnuz_Half_TN,tn_3584_32_18944,Gemm_Hipblaslt_TN_19506,0.0333823
ScaledGemmTunableOp_Float8_e4m3fnuz_Float8_e4m3fnuz_Half_TN,tn_3584_72_18944,Gemm_Hipblaslt_TN_19549,0.0458035
ScaledGemmTunableOp_Float8_e4m3fnuz_Float8_e4m3fnuz_Half_TN,tn_37888_80_3584,Gemm_Hipblaslt_TN_19632,0.0811715
ScaledGemmTunableOp_Float8_e4m3fnuz_Float8_e4m3fnuz_Half_TN,tn_37888_152_3584,Gemm_Hipblaslt_TN_20709,0.107999
ScaledGemmTunableOp_Float8_e4m3fnuz_Float8_e4m3fnuz_Half_TN,tn_37888_184_3584,Gemm_Hipblaslt_TN_20544,0.120462
ScaledGemmTunableOp_Float8_e4m3fnuz_Float8_e4m3fnuz_Half_TN,tn_37888_131072_3584,Gemm_Hipblaslt_TN_20745,78.9382
ScaledGemmTunableOp_Float8_e4m3fnuz_Float8_e4m3fnuz_Half_TN,tn_3584_88_18944,Gemm_Hipblaslt_TN_19549,0.0467596
ScaledGemmTunableOp_Float8_e4m3fnuz_Float8_e4m3fnuz_Half_TN,tn_3584_56_18944,Gemm_Hipblaslt_TN_19660,0.0409749
ScaledGemmTunableOp_Float8_e4m3fnuz_Float8_e4m3fnuz_Half_TN,tn_3584_232_18944,Gemm_Hipblaslt_TN_20174,0.0963821
ScaledGemmTunableOp_Float8_e4m3fnuz_Float8_e4m3fnuz_Half_TN,tn_3584_48_3584,Gemm_Hipblaslt_TN_20113,0.0149597
ScaledGemmTunableOp_Float8_e4m3fnuz_Float8_e4m3fnuz_Half_TN,tn_3584_200_18944,Gemm_Hipblaslt_TN_19707,0.0805992
ScaledGemmTunableOp_Float8_e4m3fnuz_Float8_e4m3fnuz_Half_TN,tn_3584_184_3584,Gemm_Hipblaslt_TN_20181,0.0242575
ScaledGemmTunableOp_Float8_e4m3fnuz_Float8_e4m3fnuz_Half_TN,tn_3584_160_18944,Gemm_Hipblaslt_TN_19822,0.0614387
ScaledGemmTunableOp_Float8_e4m3fnuz_Float8_e4m3fnuz_Half_TN,tn_3584_112_18944,Gemm_Hipblaslt_TN_19762,0.0556131
ScaledGemmTunableOp_Float8_e4m3fnuz_Float8_e4m3fnuz_Half_TN,tn_37888_56_3584,Gemm_Hipblaslt_TN_112692,0.0694867
ScaledGemmTunableOp_Float8_e4m3fnuz_Float8_e4m3fnuz_Half_TN,tn_37888_40_3584,Gemm_Hipblaslt_TN_112683,0.0630046
ScaledGemmTunableOp_Float8_e4m3fnuz_Float8_e4m3fnuz_Half_TN,tn_37888_216_3584,Gemm_Hipblaslt_TN_20745,0.138638
ScaledGemmTunableOp_Float8_e4m3fnuz_Float8_e4m3fnuz_Half_TN,tn_3584_128_18944,Gemm_Hipblaslt_TN_19762,0.0544684
ScaledGemmTunableOp_Float8_e4m3fnuz_Float8_e4m3fnuz_Half_TN,tn_3584_184_18944,Gemm_Hipblaslt_TN_19741,0.0723361
ScaledGemmTunableOp_Float8_e4m3fnuz_Float8_e4m3fnuz_Half_TN,tn_3584_144_3584,Gemm_Hipblaslt_TN_20682,0.0238642
ScaledGemmTunableOp_Float8_e4m3fnuz_Float8_e4m3fnuz_Half_TN,tn_37888_17_3584,Gemm_Hipblaslt_TN_19418,0.0533586
ScaledGemmTunableOp_Float8_e4m3fnuz_Float8_e4m3fnuz_Half_TN,tn_3584_17_18944,Gemm_Hipblaslt_TN_19506,0.0329702
ScaledGemmTunableOp_Float8_e4m3fnuz_Float8_e4m3fnuz_Half_TN,tn_3584_216_3584,Gemm_Hipblaslt_TN_19542,0.0278934
ScaledGemmTunableOp_Float8_e4m3fnuz_Float8_e4m3fnuz_Half_TN,tn_3584_232_3584,Gemm_Hipblaslt_TN_19542,0.0279645
ScaledGemmTunableOp_Float8_e4m3fnuz_Float8_e4m3fnuz_Half_TN,tn_3584_160_3584,Gemm_Hipblaslt_TN_20172,0.0237899
ScaledGemmTunableOp_Float8_e4m3fnuz_Float8_e4m3fnuz_Half_TN,tn_3584_64_18944,Gemm_Hipblaslt_TN_19660,0.0404181
ScaledGemmTunableOp_Float8_e4m3fnuz_Float8_e4m3fnuz_Half_TN,tn_3584_96_18944,Gemm_Hipblaslt_TN_19549,0.0463709
ScaledGemmTunableOp_Float8_e4m3fnuz_Float8_e4m3fnuz_Half_TN,tn_3584_240_18944,Gemm_Hipblaslt_TN_20174,0.0965478
ScaledGemmTunableOp_Float8_e4m3fnuz_Float8_e4m3fnuz_Half_TN,tn_37888_136_3584,Gemm_Hipblaslt_TN_20709,0.108193
ScaledGemmTunableOp_Float8_e4m3fnuz_Float8_e4m3fnuz_Half_TN,tn_37888_176_3584,Gemm_Hipblaslt_TN_20797,0.120593
ScaledGemmTunableOp_Float8_e4m3fnuz_Float8_e4m3fnuz_Half_TN,tn_3584_96_9472,Gemm_Hipblaslt_TN_19549,0.0284666
ScaledGemmTunableOp_Float8_e4m3fnuz_Float8_e4m3fnuz_Half_TN,tn_3584_64_9472,Gemm_Hipblaslt_TN_19660,0.0249762
ScaledGemmTunableOp_Float8_e4m3fnuz_Float8_e4m3fnuz_Half_TN,tn_3584_112_9472,Gemm_Hipblaslt_TN_19541,0.033257
ScaledGemmTunableOp_Float8_e4m3fnuz_Float8_e4m3fnuz_Half_TN,tn_3584_168_1792,Gemm_Hipblaslt_TN_20204,0.0163793
ScaledGemmTunableOp_Float8_e4m3fnuz_Float8_e4m3fnuz_Half_TN,tn_18944_48_3584,Gemm_Hipblaslt_TN_112683,0.0340858
ScaledGemmTunableOp_Float8_e4m3fnuz_Float8_e4m3fnuz_Half_TN,tn_18944_232_3584,Gemm_Hipblaslt_TN_20739,0.0930993
ScaledGemmTunableOp_Float8_e4m3fnuz_Float8_e4m3fnuz_Half_TN,tn_18944_192_3584,Gemm_Hipblaslt_TN_20320,0.0632855
ScaledGemmTunableOp_Float8_e4m3fnuz_Float8_e4m3fnuz_Half_TN,tn_3584_56_1792,Gemm_Hipblaslt_TN_112680,0.0147741
ScaledGemmTunableOp_Float8_e4m3fnuz_Float8_e4m3fnuz_Half_TN,tn_3584_136_9472,Gemm_Hipblaslt_TN_19982,0.0368355
ScaledGemmTunableOp_Float8_e4m3fnuz_Float8_e4m3fnuz_Half_TN,tn_18944_64_3584,Gemm_Hipblaslt_TN_19606,0.0377232
ScaledGemmTunableOp_Float8_e4m3fnuz_Float8_e4m3fnuz_Half_TN,tn_3584_224_1792,Gemm_Hipblaslt_TN_112601,0.0176889
ScaledGemmTunableOp_Float8_e4m3fnuz_Float8_e4m3fnuz_Half_TN,tn_18944_160_3584,Gemm_Hipblaslt_TN_20740,0.0567048
ScaledGemmTunableOp_Float8_e4m3fnuz_Float8_e4m3fnuz_Half_TN,tn_3584_192_9472,Gemm_Hipblaslt_TN_20682,0.0415313
ScaledGemmTunableOp_Float8_e4m3fnuz_Float8_e4m3fnuz_Half_TN,tn_3584_80_9472,Gemm_Hipblaslt_TN_19549,0.0282631
ScaledGemmTunableOp_Float8_e4m3fnuz_Float8_e4m3fnuz_Half_TN,tn_3584_131008_1792,Gemm_Hipblaslt_TN_20745,3.86127
ScaledGemmTunableOp_Float8_e4m3fnuz_Float8_e4m3fnuz_Half_TN,tn_18944_112_3584,Gemm_Hipblaslt_TN_20706,0.0504102
ScaledGemmTunableOp_Float8_e4m3fnuz_Float8_e4m3fnuz_Half_TN,tn_3584_152_9472,Gemm_Hipblaslt_TN_19982,0.0377525
ScaledGemmTunableOp_Float8_e4m3fnuz_Float8_e4m3fnuz_Half_TN,tn_18944_96_3584,Gemm_Hipblaslt_TN_20437,0.0455213
ScaledGemmTunableOp_Float8_e4m3fnuz_Float8_e4m3fnuz_Half_TN,tn_3584_168_9472,Gemm_Hipblaslt_TN_20181,0.0420112
ScaledGemmTunableOp_Float8_e4m3fnuz_Float8_e4m3fnuz_Half_TN,tn_3584_32_1792,Gemm_Hipblaslt_TN_20121,0.0149544
ScaledGemmTunableOp_Float8_e4m3fnuz_Float8_e4m3fnuz_Half_TN,tn_3584_176_9472,Gemm_Hipblaslt_TN_20181,0.0424579
ScaledGemmTunableOp_Float8_e4m3fnuz_Float8_e4m3fnuz_Half_TN,tn_3584_192_1792,Gemm_Hipblaslt_TN_20128,0.0159082
ScaledGemmTunableOp_Float8_e4m3fnuz_Float8_e4m3fnuz_Half_TN,tn_3584_224_9472,Gemm_Hipblaslt_TN_20430,0.0508889
ScaledGemmTunableOp_Float8_e4m3fnuz_Float8_e4m3fnuz_Half_TN,tn_3584_152_1792,Gemm_Hipblaslt_TN_20475,0.016733
ScaledGemmTunableOp_Float8_e4m3fnuz_Float8_e4m3fnuz_Half_TN,tn_3584_208_1792,Gemm_Hipblaslt_TN_20056,0.0177842
ScaledGemmTunableOp_Float8_e4m3fnuz_Float8_e4m3fnuz_Half_TN,tn_3584_24_1792,Gemm_Hipblaslt_TN_112568,0.0151162
ScaledGemmTunableOp_Float8_e4m3fnuz_Float8_e4m3fnuz_Half_TN,tn_3584_176_1792,Gemm_Hipblaslt_TN_20177,0.0162459
ScaledGemmTunableOp_Float8_e4m3fnuz_Float8_e4m3fnuz_Half_TN,tn_3584_208_9472,Gemm_Hipblaslt_TN_19516,0.0504198
ScaledGemmTunableOp_Float8_e4m3fnuz_Float8_e4m3fnuz_Half_TN,tn_3584_24_9472,Gemm_Hipblaslt_TN_19810,0.0232027
ScaledGemmTunableOp_Float8_e4m3fnuz_Float8_e4m3fnuz_Half_TN,tn_3584_40_9472,Gemm_Hipblaslt_TN_19660,0.0248047
ScaledGemmTunableOp_Float8_e4m3fnuz_Float8_e4m3fnuz_Half_TN,tn_3584_136_1792,Gemm_Hipblaslt_TN_20307,0.0169574
ScaledGemmTunableOp_Float8_e4m3fnuz_Float8_e4m3fnuz_Half_TN,tn_3584_240_9472,Gemm_Hipblaslt_TN_112601,0.0507872
ScaledGemmTunableOp_Float8_e4m3fnuz_Float8_e4m3fnuz_Half_TN,tn_3584_72_1792,Gemm_Hipblaslt_TN_20403,0.0154327
ScaledGemmTunableOp_Float8_e4m3fnuz_Float8_e4m3fnuz_Half_TN,tn_3584_32_9472,Gemm_Hipblaslt_TN_20031,0.0224856
ScaledGemmTunableOp_Float8_e4m3fnuz_Float8_e4m3fnuz_Half_TN,tn_18944_200_3584,Gemm_Hipblaslt_TN_20745,0.0726935
ScaledGemmTunableOp_Float8_e4m3fnuz_Float8_e4m3fnuz_Half_TN,tn_18944_128_3584,Gemm_Hipblaslt_TN_20696,0.0499744
ScaledGemmTunableOp_Float8_e4m3fnuz_Float8_e4m3fnuz_Half_TN,tn_18944_248_3584,Gemm_Hipblaslt_TN_20696,0.0931309
ScaledGemmTunableOp_Float8_e4m3fnuz_Float8_e4m3fnuz_Half_TN,tn_3584_88_9472,Gemm_Hipblaslt_TN_19826,0.0287598
ScaledGemmTunableOp_Float8_e4m3fnuz_Float8_e4m3fnuz_Half_TN,tn_3584_80_1792,Gemm_Hipblaslt_TN_20331,0.0158525
ScaledGemmTunableOp_Float8_e4m3fnuz_Float8_e4m3fnuz_Half_TN,tn_18944_80_3584,Gemm_Hipblaslt_TN_19632,0.0439794
ScaledGemmTunableOp_Float8_e4m3fnuz_Float8_e4m3fnuz_Half_TN,tn_3584_106444_9472,Gemm_Hipblaslt_TN_20750,14.2845
ScaledGemmTunableOp_Float8_e4m3fnuz_Float8_e4m3fnuz_Half_TN,tn_3584_48_1792,Gemm_Hipblaslt_TN_19309,0.0150681
ScaledGemmTunableOp_Float8_e4m3fnuz_Float8_e4m3fnuz_Half_TN,tn_3584_248_9472,Gemm_Hipblaslt_TN_112601,0.0511121
ScaledGemmTunableOp_Float8_e4m3fnuz_Float8_e4m3fnuz_Half_TN,tn_3584_40_1792,Gemm_Hipblaslt_TN_19418,0.0148975
ScaledGemmTunableOp_Float8_e4m3fnuz_Float8_e4m3fnuz_Half_TN,tn_3584_48_9472,Gemm_Hipblaslt_TN_19660,0.0249886
ScaledGemmTunableOp_Float8_e4m3fnuz_Float8_e4m3fnuz_Half_TN,tn_18944_144_3584,Gemm_Hipblaslt_TN_20709,0.0571948
ScaledGemmTunableOp_Float8_e4m3fnuz_Float8_e4m3fnuz_Half_TN,tn_18944_24_3584,Gemm_Hipblaslt_TN_19594,0.031389
ScaledGemmTunableOp_Float8_e4m3fnuz_Float8_e4m3fnuz_Half_TN,tn_3584_64_1792,Gemm_Hipblaslt_TN_20387,0.0152464
ScaledGemmTunableOp_Float8_e4m3fnuz_Float8_e4m3fnuz_Half_TN,tn_3584_120_9472,Gemm_Hipblaslt_TN_19541,0.0336628
ScaledGemmTunableOp_Float8_e4m3fnuz_Float8_e4m3fnuz_Half_TN,tn_3584_104_1792,Gemm_Hipblaslt_TN_19606,0.0150709
ScaledGemmTunableOp_Float8_e4m3fnuz_Float8_e4m3fnuz_Half_TN,tn_18944_216_3584,Gemm_Hipblaslt_TN_20745,0.0729375
ScaledGemmTunableOp_Float8_e4m3fnuz_Float8_e4m3fnuz_Half_TN,tn_18944_176_3584,Gemm_Hipblaslt_TN_20769,0.0639973
ScaledGemmTunableOp_Float8_e4m3fnuz_Float8_e4m3fnuz_Half_TN,tn_18944_17_3584,Gemm_Hipblaslt_TN_20418,0.0311839
ScaledGemmTunableOp_Float8_e4m3fnuz_Float8_e4m3fnuz_Half_TN,tn_3584_131008_9472,Gemm_Hipblaslt_TN_20749,17.1827
ScaledGemmTunableOp_Float8_e4m3fnuz_Float8_e4m3fnuz_Half_TN,tn_3584_104_9472,Gemm_Hipblaslt_TN_19541,0.0332842
ScaledGemmTunableOp_Float8_e4m3fnuz_Float8_e4m3fnuz_Half_TN,tn_18944_256_3584,Gemm_Hipblaslt_TN_20652,0.0926161
ScaledGemmTunableOp_Float8_e4m3fnuz_Float8_e4m3fnuz_Half_TN,tn_18944_136_3584,Gemm_Hipblaslt_TN_20709,0.0572913
ScaledGemmTunableOp_Float8_e4m3fnuz_Float8_e4m3fnuz_Half_TN,tn_3584_88_1792,Gemm_Hipblaslt_TN_20124,0.014549
ScaledGemmTunableOp_Float8_e4m3fnuz_Float8_e4m3fnuz_Half_TN,tn_3584_72_9472,Gemm_Hipblaslt_TN_19826,0.0282619
ScaledGemmTunableOp_Float8_e4m3fnuz_Float8_e4m3fnuz_Half_TN,tn_3584_96_1792,Gemm_Hipblaslt_TN_20146,0.0147124
ScaledGemmTunableOp_Float8_e4m3fnuz_Float8_e4m3fnuz_Half_TN,tn_3584_256_9472,Gemm_Hipblaslt_TN_112601,0.0512282
ScaledGemmTunableOp_Float8_e4m3fnuz_Float8_e4m3fnuz_Half_TN,tn_3584_232_1792,Gemm_Hipblaslt_TN_112601,0.0177005
ScaledGemmTunableOp_Float8_e4m3fnuz_Float8_e4m3fnuz_Half_TN,tn_18944_88_3584,Gemm_Hipblaslt_TN_20437,0.0460513
ScaledGemmTunableOp_Float8_e4m3fnuz_Float8_e4m3fnuz_Half_TN,tn_18944_40_3584,Gemm_Hipblaslt_TN_112683,0.0348349
ScaledGemmTunableOp_Float8_e4m3fnuz_Float8_e4m3fnuz_Half_TN,tn_3584_184_9472,Gemm_Hipblaslt_TN_20181,0.0420505
ScaledGemmTunableOp_Float8_e4m3fnuz_Float8_e4m3fnuz_Half_TN,tn_3584_128_9472,Gemm_Hipblaslt_TN_19762,0.0327562
ScaledGemmTunableOp_Float8_e4m3fnuz_Float8_e4m3fnuz_Half_TN,tn_18944_32_3584,Gemm_Hipblaslt_TN_19594,0.0308101
ScaledGemmTunableOp_Float8_e4m3fnuz_Float8_e4m3fnuz_Half_TN,tn_18944_224_3584,Gemm_Hipblaslt_TN_20745,0.0718972
ScaledGemmTunableOp_Float8_e4m3fnuz_Float8_e4m3fnuz_Half_TN,tn_3584_112_1792,Gemm_Hipblaslt_TN_19450,0.0146764
ScaledGemmTunableOp_Float8_e4m3fnuz_Float8_e4m3fnuz_Half_TN,tn_3584_144_9472,Gemm_Hipblaslt_TN_19982,0.0368944
ScaledGemmTunableOp_Float8_e4m3fnuz_Float8_e4m3fnuz_Half_TN,tn_3584_131072_1792,Default,3.84507
ScaledGemmTunableOp_Float8_e4m3fnuz_Float8_e4m3fnuz_Half_TN,tn_18944_184_3584,Gemm_Hipblaslt_TN_20797,0.064162
ScaledGemmTunableOp_Float8_e4m3fnuz_Float8_e4m3fnuz_Half_TN,tn_3584_256_1792,Gemm_Hipblaslt_TN_112601,0.0174197
ScaledGemmTunableOp_Float8_e4m3fnuz_Float8_e4m3fnuz_Half_TN,tn_3584_120_1792,Gemm_Hipblaslt_TN_19600,0.0147657
ScaledGemmTunableOp_Float8_e4m3fnuz_Float8_e4m3fnuz_Half_TN,tn_3584_160_1792,Gemm_Hipblaslt_TN_112559,0.0161546
ScaledGemmTunableOp_Float8_e4m3fnuz_Float8_e4m3fnuz_Half_TN,tn_18944_152_3584,Gemm_Hipblaslt_TN_20800,0.0571832
ScaledGemmTunableOp_Float8_e4m3fnuz_Float8_e4m3fnuz_Half_TN,tn_18944_120_3584,Gemm_Hipblaslt_TN_20706,0.0502684
ScaledGemmTunableOp_Float8_e4m3fnuz_Float8_e4m3fnuz_Half_TN,tn_3584_144_1792,Gemm_Hipblaslt_TN_19632,0.015933
ScaledGemmTunableOp_Float8_e4m3fnuz_Float8_e4m3fnuz_Half_TN,tn_18944_56_3584,Gemm_Hipblaslt_TN_112692,0.0379163
ScaledGemmTunableOp_Float8_e4m3fnuz_Float8_e4m3fnuz_Half_TN,tn_3584_160_9472,Gemm_Hipblaslt_TN_19822,0.0388702
ScaledGemmTunableOp_Float8_e4m3fnuz_Float8_e4m3fnuz_Half_TN,tn_3584_216_9472,Gemm_Hipblaslt_TN_20174,0.0502768
ScaledGemmTunableOp_Float8_e4m3fnuz_Float8_e4m3fnuz_Half_TN,tn_3584_17_1792,Gemm_Hipblaslt_TN_20044,0.0156166
ScaledGemmTunableOp_Float8_e4m3fnuz_Float8_e4m3fnuz_Half_TN,tn_3584_184_1792,Gemm_Hipblaslt_TN_20177,0.0160781
ScaledGemmTunableOp_Float8_e4m3fnuz_Float8_e4m3fnuz_Half_TN,tn_3584_232_9472,Gemm_Hipblaslt_TN_19516,0.0503209
ScaledGemmTunableOp_Float8_e4m3fnuz_Float8_e4m3fnuz_Half_TN,tn_3584_17_9472,Gemm_Hipblaslt_TN_20031,0.0219853
ScaledGemmTunableOp_Float8_e4m3fnuz_Float8_e4m3fnuz_Half_TN,tn_3584_200_1792,Gemm_Hipblaslt_TN_112601,0.017624
ScaledGemmTunableOp_Float8_e4m3fnuz_Float8_e4m3fnuz_Half_TN,tn_3584_200_9472,Gemm_Hipblaslt_TN_19516,0.0500104
ScaledGemmTunableOp_Float8_e4m3fnuz_Float8_e4m3fnuz_Half_TN,tn_3584_240_1792,Gemm_Hipblaslt_TN_112601,0.0178623
ScaledGemmTunableOp_Float8_e4m3fnuz_Float8_e4m3fnuz_Half_TN,tn_3584_56_9472,Gemm_Hipblaslt_TN_19660,0.0250943
ScaledGemmTunableOp_Float8_e4m3fnuz_Float8_e4m3fnuz_Half_TN,tn_3584_216_1792,Gemm_Hipblaslt_TN_112601,0.0176817
ScaledGemmTunableOp_Float8_e4m3fnuz_Float8_e4m3fnuz_Half_TN,tn_3584_128_1792,Gemm_Hipblaslt_TN_19540,0.0149504
ScaledGemmTunableOp_Float8_e4m3fnuz_Float8_e4m3fnuz_Half_TN,tn_3584_248_1792,Gemm_Hipblaslt_TN_112601,0.0177125
ScaledGemmTunableOp_Float8_e4m3fnuz_Float8_e4m3fnuz_Half_TN,tn_3584_131072_9472,Gemm_Hipblaslt_TN_20749,17.1479
ScaledGemmTunableOp_Float8_e4m3fnuz_Float8_e4m3fnuz_Half_TN,tn_3584_106444_1792,Gemm_Hipblaslt_TN_20321,3.0465
ScaledGemmTunableOp_Float8_e4m3fnuz_Float8_e4m3fnuz_Half_TN,tn_18944_72_3584,Gemm_Hipblaslt_TN_112591,0.0452441
ScaledGemmTunableOp_Float8_e4m3fnuz_Float8_e4m3fnuz_Half_TN,tn_18944_208_3584,Gemm_Hipblaslt_TN_20745,0.0728786
ScaledGemmTunableOp_Float8_e4m3fnuz_Float8_e4m3fnuz_Half_TN,tn_18944_168_3584,Gemm_Hipblaslt_TN_20766,0.0639613
ScaledGemmTunableOp_Float8_e4m3fnuz_Float8_e4m3fnuz_Half_TN,tn_18944_240_3584,Gemm_Hipblaslt_TN_20696,0.0932635
ScaledGemmTunableOp_Float8_e4m3fnuz_Float8_e4m3fnuz_Half_TN,tn_18944_104_3584,Gemm_Hipblaslt_TN_20706,0.0502259
ScaledGemmTunableOp_Float8_e4m3fnuz_Float8_e4m3fnuz_Half_TN,tn_18944_131072_3584,Gemm_Hipblaslt_TN_20749,38.2179
ScaledGemmTunableOp_Float8_e4m3fnuz_Float8_e4m3fnuz_Half_TN,tn_18944_131008_3584,Gemm_Hipblaslt_TN_20749,38.3993
ScaledGemmTunableOp_Float8_e4m3fnuz_Float8_e4m3fnuz_Half_TN,tn_18944_106444_3584,Gemm_Hipblaslt_TN_20749,31.1595
ScaledGemmTunableOp_Float8_e4m3fnuz_Float8_e4m3fnuz_Half_TN,tn_29568_32752_8192,Gemm_Hipblaslt_TN_20748,34.4441
ScaledGemmTunableOp_Float8_e4m3fnuz_Float8_e4m3fnuz_Half_TN,tn_29568_216_8192,Gemm_Hipblaslt_TN_20693,0.24028
ScaledGemmTunableOp_Float8_e4m3fnuz_Float8_e4m3fnuz_Half_TN,tn_29568_136_8192,Gemm_Hipblaslt_TN_20688,0.205751
ScaledGemmTunableOp_Float8_e4m3fnuz_Float8_e4m3fnuz_Half_TN,tn_8192_96_14784,Gemm_Hipblaslt_TN_19823,0.0790303
ScaledGemmTunableOp_Float8_e4m3fnuz_Float8_e4m3fnuz_Half_TN,tn_29568_200_8192,Gemm_Hipblaslt_TN_20265,0.231566
ScaledGemmTunableOp_Float8_e4m3fnuz_Float8_e4m3fnuz_Half_TN,tn_29568_88_8192,Gemm_Hipblaslt_TN_19607,0.12783
ScaledGemmTunableOp_Float8_e4m3fnuz_Float8_e4m3fnuz_Half_TN,tn_8192_120_4096,Gemm_Hipblaslt_TN_20731,0.0362218
